Unnamed: 0,play_name,genre,character,act,scene,sentence,text,sex
47985,"Henry IV, part 1",History,Prince Henry,3,2,339,"thy pocket but tavern-reckonings, memorandums of",male
47986,"Henry IV, part 1",History,Prince Henry,3,2,340,"bawdy-houses, and one poor penny-worth of",male
47987,"Henry IV, part 1",History,Prince Henry,3,2,341,"sugar-candy to make thee long-winded, if thy pocket",male
47988,"Henry IV, part 1",History,Prince Henry,3,2,342,"were enriched with any other injuries but these, I",male
47989,"Henry IV, part 1",History,Prince Henry,3,2,343,am a villain: and yet you will stand to if; you will,male
47990,"Henry IV, part 1",History,Prince Henry,3,2,344,not pocket up wrong: art thou not ashamed?,male
47991,"Henry IV, part 1",History,Falstaff,3,2,345,"Dost thou hear, Hal? thou knowest in the state of",male
47992,"Henry IV, part 1",History,Falstaff,3,2,346,innocency Adam fell; and what should poor Jack,male
47993,"Henry IV, part 1",History,Falstaff,3,2,347,Falstaff do in the days of villany? Thou seest I,male
47994,"Henry IV, part 1",History,Falstaff,3,2,348,"have more flesh than another man, and therefore more",male
47995,"Henry IV, part 1",History,Falstaff,3,2,349,"frailty. You confess then, you picked my pocket?",male
47996,"Henry IV, part 1",History,Prince Henry,3,2,350,It appears so by the story.,male
47997,"Henry IV, part 1",History,Falstaff,3,2,351,"Hostess, I forgive thee: go, make ready breakfast;",male
47998,"Henry IV, part 1",History,Falstaff,3,2,352,"love thy husband, look to thy servants, cherish thy",male
47999,"Henry IV, part 1",History,Falstaff,3,2,353,guests: thou shalt find me tractable to any honest,male
48000,"Henry IV, part 1",History,Falstaff,3,2,354,"reason: thou seest I am pacified still. Nay,",male
48001,"Henry IV, part 1",History,Falstaff,3,2,355,"prithee, be gone.",male
48002,"Henry IV, part 1",History,Falstaff,3,2,356,"Now Hal, to the news at court: for the robbery,",male
48003,"Henry IV, part 1",History,Falstaff,3,2,357,"lad, how is that answered?",male
48004,"Henry IV, part 1",History,Prince Henry,3,2,358,"O, my sweet beef, I must still be good angel to",male
48005,"Henry IV, part 1",History,Prince Henry,3,2,359,thee: the money is paid back again.,male
48006,"Henry IV, part 1",History,Falstaff,3,2,360,"O, I do not like that paying back; 'tis a double labour.",male
48007,"Henry IV, part 1",History,Prince Henry,3,2,361,I am good friends with my father and may do any thing.,male
48008,"Henry IV, part 1",History,Falstaff,3,2,362,"Rob me the exchequer the first thing thou doest, and",male
48009,"Henry IV, part 1",History,Falstaff,3,2,363,do it with unwashed hands too.,male
48010,"Henry IV, part 1",History,Bardolph,3,2,364,"Do, my lord.",male
48011,"Henry IV, part 1",History,Prince Henry,3,2,365,"I have procured thee, Jack, a charge of foot.",male
48012,"Henry IV, part 1",History,Falstaff,3,2,366,I would it had been of horse. Where shall I find,male
48013,"Henry IV, part 1",History,Falstaff,3,2,367,"one that can steal well? O for a fine thief, of the",male
48014,"Henry IV, part 1",History,Falstaff,3,2,368,age of two and twenty or thereabouts! I am,male
48015,"Henry IV, part 1",History,Falstaff,3,2,369,"heinously unprovided. Well, God be thanked for",male
48016,"Henry IV, part 1",History,Falstaff,3,2,370,"these rebels, they offend none but the virtuous: I",male
48017,"Henry IV, part 1",History,Falstaff,3,2,371,"laud them, I praise them.",male
48018,"Henry IV, part 1",History,Prince Henry,3,2,372,Bardolph!,male
48019,"Henry IV, part 1",History,Bardolph,3,2,373,My lord?,male
48020,"Henry IV, part 1",History,Prince Henry,3,2,374,"Go bear this letter to Lord John of Lancaster, to my",male
48021,"Henry IV, part 1",History,Prince Henry,3,2,375,brother John; this to my Lord of Westmoreland.,male
48022,"Henry IV, part 1",History,Prince Henry,3,2,376,"Go, Peto, to horse, to horse; for thou and I have",male
48023,"Henry IV, part 1",History,Prince Henry,3,2,377,thirty miles to ride yet ere dinner time.,male
48024,"Henry IV, part 1",History,Prince Henry,3,2,378,"Jack, meet me to-morrow in the temple hall at two",male
48025,"Henry IV, part 1",History,Prince Henry,3,2,379,o'clock in the afternoon.,male
48026,"Henry IV, part 1",History,Prince Henry,3,2,380,There shalt thou know thy charge; and there receive,male
48027,"Henry IV, part 1",History,Prince Henry,3,2,381,Money and order for their furniture.,male
48028,"Henry IV, part 1",History,Prince Henry,3,2,382,The land is burning; Percy stands on high;,male
48029,"Henry IV, part 1",History,Prince Henry,3,2,383,And either we or they must lower lie.,male
48030,"Henry IV, part 1",History,Falstaff,3,2,384,"Rare words! brave world! Hostess, my breakfast, come!",male
48031,"Henry IV, part 1",History,Falstaff,3,2,385,"O, I could wish this tavern were my drum!",male
48032,"Henry IV, part 1",History,Hotspur,4,1,1,"Well said, my noble Scot: if speaking truth",male
48033,"Henry IV, part 1",History,Hotspur,4,1,2,"In this fine age were not thought flattery,",male
48034,"Henry IV, part 1",History,Hotspur,4,1,3,"Such attribution should the Douglas have,",male
48035,"Henry IV, part 1",History,Hotspur,4,1,4,As not a soldier of this season's stamp,male
48036,"Henry IV, part 1",History,Hotspur,4,1,5,Should go so general current through the world.,male
48037,"Henry IV, part 1",History,Hotspur,4,1,6,"By God, I cannot flatter; I do defy",male
48038,"Henry IV, part 1",History,Hotspur,4,1,7,The tongues of soothers; but a braver place,male
48039,"Henry IV, part 1",History,Hotspur,4,1,8,In my heart's love hath no man than yourself:,male
48040,"Henry IV, part 1",History,Hotspur,4,1,9,"Nay, task me to my word; approve me, lord.",male
48041,"Henry IV, part 1",History,Earl Of Douglas,4,1,10,Thou art the king of honour:,male
48042,"Henry IV, part 1",History,Earl Of Douglas,4,1,11,No man so potent breathes upon the ground,male
48043,"Henry IV, part 1",History,Earl Of Douglas,4,1,12,But I will beard him.,male
48044,"Henry IV, part 1",History,Hotspur,4,1,13,"Do so, and 'tis well.",male
48045,"Henry IV, part 1",History,Hotspur,4,1,14,What letters hast thou there?--I can but thank you.,male
48046,"Henry IV, part 1",History,Messenger,4,1,15,These letters come from your father.,male
48047,"Henry IV, part 1",History,Hotspur,4,1,16,Letters from him! why comes he not himself?,male
48048,"Henry IV, part 1",History,Messenger,4,1,17,"He cannot come, my lord; he is grievous sick.",male
48049,"Henry IV, part 1",History,Hotspur,4,1,18,'Zounds! how has he the leisure to be sick,male
48050,"Henry IV, part 1",History,Hotspur,4,1,19,In such a rustling time? Who leads his power?,male
48051,"Henry IV, part 1",History,Hotspur,4,1,20,Under whose government come they along?,male
48052,"Henry IV, part 1",History,Messenger,4,1,21,"His letters bear his mind, not I, my lord.",male
48053,"Henry IV, part 1",History,Earl Of Worcester,4,1,22,"I prithee, tell me, doth he keep his bed?",male
48054,"Henry IV, part 1",History,Messenger,4,1,23,"He did, my lord, four days ere I set forth;",male
48055,"Henry IV, part 1",History,Messenger,4,1,24,And at the time of my departure thence,male
48056,"Henry IV, part 1",History,Messenger,4,1,25,He was much fear'd by his physicians.,male
48057,"Henry IV, part 1",History,Earl Of Worcester,4,1,26,I would the state of time had first been whole,male
48058,"Henry IV, part 1",History,Earl Of Worcester,4,1,27,Ere he by sickness had been visited:,male
48059,"Henry IV, part 1",History,Earl Of Worcester,4,1,28,His health was never better worth than now.,male
48060,"Henry IV, part 1",History,Hotspur,4,1,29,Sick now! droop now! this sickness doth infect,male
48061,"Henry IV, part 1",History,Hotspur,4,1,30,The very life-blood of our enterprise;,male
48062,"Henry IV, part 1",History,Hotspur,4,1,31,"'Tis catching hither, even to our camp.",male
48063,"Henry IV, part 1",History,Hotspur,4,1,32,"He writes me here, that inward sickness--",male
48064,"Henry IV, part 1",History,Hotspur,4,1,33,And that his friends by deputation could not,male
48065,"Henry IV, part 1",History,Hotspur,4,1,34,"So soon be drawn, nor did he think it meet",male
48066,"Henry IV, part 1",History,Hotspur,4,1,35,To lay so dangerous and dear a trust,male
48067,"Henry IV, part 1",History,Hotspur,4,1,36,On any soul removed but on his own.,male
48068,"Henry IV, part 1",History,Hotspur,4,1,37,"Yet doth he give us bold advertisement,",male
48069,"Henry IV, part 1",History,Hotspur,4,1,38,"That with our small conjunction we should on,",male
48070,"Henry IV, part 1",History,Hotspur,4,1,39,To see how fortune is disposed to us;,male
48071,"Henry IV, part 1",History,Hotspur,4,1,40,"For, as he writes, there is no quailing now.",male
48072,"Henry IV, part 1",History,Hotspur,4,1,41,Because the king is certainly possess'd,male
48073,"Henry IV, part 1",History,Hotspur,4,1,42,Of all our purposes. What say you to it?,male
48074,"Henry IV, part 1",History,Earl Of Worcester,4,1,43,Your father's sickness is a maim to us.,male
48075,"Henry IV, part 1",History,Hotspur,4,1,44,"A perilous gash, a very limb lopp'd off:",male
48076,"Henry IV, part 1",History,Hotspur,4,1,45,"And yet, in faith, it is not; his present want",male
48077,"Henry IV, part 1",History,Hotspur,4,1,46,Seems more than we shall find it: were it good,male
48078,"Henry IV, part 1",History,Hotspur,4,1,47,To set the exact wealth of all our states,male
48079,"Henry IV, part 1",History,Hotspur,4,1,48,All at one cast? to set so rich a main,male
48080,"Henry IV, part 1",History,Hotspur,4,1,49,On the nice hazard of one doubtful hour?,male
48081,"Henry IV, part 1",History,Hotspur,4,1,50,It were not good; for therein should we read,male
48082,"Henry IV, part 1",History,Hotspur,4,1,51,"The very bottom and the soul of hope,",male
48083,"Henry IV, part 1",History,Hotspur,4,1,52,"The very list, the very utmost bound",male
48084,"Henry IV, part 1",History,Hotspur,4,1,53,Of all our fortunes.,male
48085,"Henry IV, part 1",History,Earl Of Douglas,4,1,54,"'Faith, and so we should;",male
48086,"Henry IV, part 1",History,Earl Of Douglas,4,1,55,Where now remains a sweet reversion:,male
48087,"Henry IV, part 1",History,Earl Of Douglas,4,1,56,We may boldly spend upon the hope of what,male
48088,"Henry IV, part 1",History,Earl Of Douglas,4,1,57,Is to come in:,male
48089,"Henry IV, part 1",History,Earl Of Douglas,4,1,58,A comfort of retirement lives in this.,male
48090,"Henry IV, part 1",History,Hotspur,4,1,59,"A rendezvous, a home to fly unto.",male
48091,"Henry IV, part 1",History,Hotspur,4,1,60,If that the devil and mischance look big,male
48092,"Henry IV, part 1",History,Hotspur,4,1,61,Upon the maidenhead of our affairs.,male
48093,"Henry IV, part 1",History,Earl Of Worcester,4,1,62,But yet I would your father had been here.,male
48094,"Henry IV, part 1",History,Earl Of Worcester,4,1,63,The quality and hair of our attempt,male
48095,"Henry IV, part 1",History,Earl Of Worcester,4,1,64,Brooks no division: it will be thought,male
48096,"Henry IV, part 1",History,Earl Of Worcester,4,1,65,"By some, that know not why he is away,",male
48097,"Henry IV, part 1",History,Earl Of Worcester,4,1,66,"That wisdom, loyalty and mere dislike",male
48098,"Henry IV, part 1",History,Earl Of Worcester,4,1,67,Of our proceedings kept the earl from hence:,male
48099,"Henry IV, part 1",History,Earl Of Worcester,4,1,68,And think how such an apprehension,male
48100,"Henry IV, part 1",History,Earl Of Worcester,4,1,69,May turn the tide of fearful faction,male
48101,"Henry IV, part 1",History,Earl Of Worcester,4,1,70,And breed a kind of question in our cause;,male
48102,"Henry IV, part 1",History,Earl Of Worcester,4,1,71,For well you know we of the offering side,male
48103,"Henry IV, part 1",History,Earl Of Worcester,4,1,72,"Must keep aloof from strict arbitrement,",male
48104,"Henry IV, part 1",History,Earl Of Worcester,4,1,73,"And stop all sight-holes, every loop from whence",male
48105,"Henry IV, part 1",History,Earl Of Worcester,4,1,74,The eye of reason may pry in upon us:,male
48106,"Henry IV, part 1",History,Earl Of Worcester,4,1,75,"This absence of your father's draws a curtain,",male
48107,"Henry IV, part 1",History,Earl Of Worcester,4,1,76,That shows the ignorant a kind of fear,male
48108,"Henry IV, part 1",History,Earl Of Worcester,4,1,77,Before not dreamt of.,male
48109,"Henry IV, part 1",History,Hotspur,4,1,78,You strain too far.,male
48110,"Henry IV, part 1",History,Hotspur,4,1,79,I rather of his absence make this use:,male
48111,"Henry IV, part 1",History,Hotspur,4,1,80,"It lends a lustre and more great opinion,",male
48112,"Henry IV, part 1",History,Hotspur,4,1,81,"A larger dare to our great enterprise,",male
48113,"Henry IV, part 1",History,Hotspur,4,1,82,"Than if the earl were here; for men must think,",male
48114,"Henry IV, part 1",History,Hotspur,4,1,83,If we without his help can make a head,male
48115,"Henry IV, part 1",History,Hotspur,4,1,84,"To push against a kingdom, with his help",male
48116,"Henry IV, part 1",History,Hotspur,4,1,85,We shall o'erturn it topsy-turvy down.,male
48117,"Henry IV, part 1",History,Hotspur,4,1,86,"Yet all goes well, yet all our joints are whole.",male
48118,"Henry IV, part 1",History,Earl Of Douglas,4,1,87,As heart can think: there is not such a word,male
48119,"Henry IV, part 1",History,Earl Of Douglas,4,1,88,Spoke of in Scotland as this term of fear.,male
48120,"Henry IV, part 1",History,Hotspur,4,1,89,"My cousin Vernon, welcome, by my soul.",male
48121,"Henry IV, part 1",History,Vernon,4,1,90,"Pray God my news be worth a welcome, lord.",male
48122,"Henry IV, part 1",History,Vernon,4,1,91,"The Earl of Westmoreland, seven thousand strong,",male
48123,"Henry IV, part 1",History,Vernon,4,1,92,Is marching hitherwards; with him Prince John.,male
48124,"Henry IV, part 1",History,Hotspur,4,1,93,No harm: what more?,male
48125,"Henry IV, part 1",History,Vernon,4,1,94,"And further, I have learn'd,",male
48126,"Henry IV, part 1",History,Vernon,4,1,95,"The king himself in person is set forth,",male
48127,"Henry IV, part 1",History,Vernon,4,1,96,"Or hitherwards intended speedily,",male
48128,"Henry IV, part 1",History,Vernon,4,1,97,With strong and mighty preparation.,male
48129,"Henry IV, part 1",History,Hotspur,4,1,98,"He shall be welcome too. Where is his son,",male
48130,"Henry IV, part 1",History,Hotspur,4,1,99,"The nimble-footed madcap Prince of Wales,",male
48131,"Henry IV, part 1",History,Hotspur,4,1,100,"And his comrades, that daff'd the world aside,",male
48132,"Henry IV, part 1",History,Hotspur,4,1,101,And bid it pass?,male
48133,"Henry IV, part 1",History,Vernon,4,1,102,"All furnish'd, all in arms;",male
48134,"Henry IV, part 1",History,Vernon,4,1,103,All plumed like estridges that with the wind,male
48135,"Henry IV, part 1",History,Vernon,4,1,104,Baited like eagles having lately bathed;,male
48136,"Henry IV, part 1",History,Vernon,4,1,105,"Glittering in golden coats, like images;",male
48137,"Henry IV, part 1",History,Vernon,4,1,106,"As full of spirit as the month of May,",male
48138,"Henry IV, part 1",History,Vernon,4,1,107,And gorgeous as the sun at midsummer;,male
48139,"Henry IV, part 1",History,Vernon,4,1,108,"Wanton as youthful goats, wild as young bulls.",male
48140,"Henry IV, part 1",History,Vernon,4,1,109,"I saw young Harry, with his beaver on,",male
48141,"Henry IV, part 1",History,Vernon,4,1,110,"His cuisses on his thighs, gallantly arm'd",male
48142,"Henry IV, part 1",History,Vernon,4,1,111,"Rise from the ground like feather'd Mercury,",male
48143,"Henry IV, part 1",History,Vernon,4,1,112,"And vaulted with such ease into his seat,",male
48144,"Henry IV, part 1",History,Vernon,4,1,113,"As if an angel dropp'd down from the clouds,",male
48145,"Henry IV, part 1",History,Vernon,4,1,114,To turn and wind a fiery Pegasus,male
48146,"Henry IV, part 1",History,Vernon,4,1,115,And witch the world with noble horsemanship.,male
48147,"Henry IV, part 1",History,Hotspur,4,1,116,"No more, no more: worse than the sun in March,",male
48148,"Henry IV, part 1",History,Hotspur,4,1,117,This praise doth nourish agues. Let them come:,male
48149,"Henry IV, part 1",History,Hotspur,4,1,118,"They come like sacrifices in their trim,",male
48150,"Henry IV, part 1",History,Hotspur,4,1,119,And to the fire-eyed maid of smoky war,male
48151,"Henry IV, part 1",History,Hotspur,4,1,120,All hot and bleeding will we offer them:,male
48152,"Henry IV, part 1",History,Hotspur,4,1,121,The mailed Mars shall on his altar sit,male
48153,"Henry IV, part 1",History,Hotspur,4,1,122,Up to the ears in blood. I am on fire,male
48154,"Henry IV, part 1",History,Hotspur,4,1,123,To hear this rich reprisal is so nigh,male
48155,"Henry IV, part 1",History,Hotspur,4,1,124,"And yet not ours. Come, let me taste my horse,",male
48156,"Henry IV, part 1",History,Hotspur,4,1,125,Who is to bear me like a thunderbolt,male
48157,"Henry IV, part 1",History,Hotspur,4,1,126,Against the bosom of the Prince of Wales:,male
48158,"Henry IV, part 1",History,Hotspur,4,1,127,"Harry to Harry shall, hot horse to horse,",male
48159,"Henry IV, part 1",History,Hotspur,4,1,128,Meet and ne'er part till one drop down a corse.,male
48160,"Henry IV, part 1",History,Hotspur,4,1,129,O that Glendower were come!,male
48161,"Henry IV, part 1",History,Vernon,4,1,130,There is more news:,male
48162,"Henry IV, part 1",History,Vernon,4,1,131,"I learn'd in Worcester, as I rode along,",male
48163,"Henry IV, part 1",History,Vernon,4,1,132,He cannot draw his power this fourteen days.,male
48164,"Henry IV, part 1",History,Earl Of Douglas,4,1,133,That's the worst tidings that I hear of yet.,male
48165,"Henry IV, part 1",History,Worcester,4,1,134,"Ay, by my faith, that bears a frosty sound.",male
48166,"Henry IV, part 1",History,Hotspur,4,1,135,What may the king's whole battle reach unto?,male
48167,"Henry IV, part 1",History,Vernon,4,1,136,To thirty thousand.,male
48168,"Henry IV, part 1",History,Hotspur,4,1,137,Forty let it be:,male
48169,"Henry IV, part 1",History,Hotspur,4,1,138,"My father and Glendower being both away,",male
48170,"Henry IV, part 1",History,Hotspur,4,1,139,The powers of us may serve so great a day,male
48171,"Henry IV, part 1",History,Hotspur,4,1,140,"Come, let us take a muster speedily:",male
48172,"Henry IV, part 1",History,Hotspur,4,1,141,"Doomsday is near; die all, die merrily.",male
48173,"Henry IV, part 1",History,Earl Of Douglas,4,1,142,Talk not of dying: I am out of fear,male
48174,"Henry IV, part 1",History,Earl Of Douglas,4,1,143,Of death or death's hand for this one-half year.,male
48175,"Henry IV, part 1",History,Falstaff,4,2,1,"Bardolph, get thee before to Coventry; fill me a",male
48176,"Henry IV, part 1",History,Falstaff,4,2,2,bottle of sack: our soldiers shall march through;,male
48177,"Henry IV, part 1",History,Falstaff,4,2,3,we'll to Sutton Co'fil' tonight.,male
48178,"Henry IV, part 1",History,Bardolph,4,2,4,"Will you give me money, captain?",male
48179,"Henry IV, part 1",History,Falstaff,4,2,5,"Lay out, lay out.",male
48180,"Henry IV, part 1",History,Bardolph,4,2,6,This bottle makes an angel.,male
48181,"Henry IV, part 1",History,Falstaff,4,2,7,"An if it do, take it for thy labour; and if it make",male
48182,"Henry IV, part 1",History,Falstaff,4,2,8,"twenty, take them all; I'll answer the coinage. Bid",male
48183,"Henry IV, part 1",History,Falstaff,4,2,9,my lieutenant Peto meet me at town's end.,male
48184,"Henry IV, part 1",History,Bardolph,4,2,10,"I will, captain: farewell.",male
48185,"Henry IV, part 1",History,Falstaff,4,2,11,"If I be not ashamed of my soldiers, I am a soused",male
48186,"Henry IV, part 1",History,Falstaff,4,2,12,gurnet. I have misused the king's press damnably.,male
48187,"Henry IV, part 1",History,Falstaff,4,2,13,"I have got, in exchange of a hundred and fifty",male
48188,"Henry IV, part 1",History,Falstaff,4,2,14,"soldiers, three hundred and odd pounds. I press me",male
48189,"Henry IV, part 1",History,Falstaff,4,2,15,"none but good house-holders, yeoman's sons; inquire",male
48190,"Henry IV, part 1",History,Falstaff,4,2,16,"me out contracted bachelors, such as had been asked",male
48191,"Henry IV, part 1",History,Falstaff,4,2,17,"twice on the banns; such a commodity of warm slaves,",male
48192,"Henry IV, part 1",History,Falstaff,4,2,18,as had as lieve hear the devil as a drum; such as,male
48193,"Henry IV, part 1",History,Falstaff,4,2,19,fear the report of a caliver worse than a struck,male
48194,"Henry IV, part 1",History,Falstaff,4,2,20,fowl or a hurt wild-duck. I pressed me none but such,male
48195,"Henry IV, part 1",History,Falstaff,4,2,21,"toasts-and-butter, with hearts in their bellies no",male
48196,"Henry IV, part 1",History,Falstaff,4,2,22,"bigger than pins' heads, and they have bought out",male
48197,"Henry IV, part 1",History,Falstaff,4,2,23,their services; and now my whole charge consists of,male
48198,"Henry IV, part 1",History,Falstaff,4,2,24,"ancients, corporals, lieutenants, gentlemen of",male
48199,"Henry IV, part 1",History,Falstaff,4,2,25,"companies, slaves as ragged as Lazarus in the",male
48200,"Henry IV, part 1",History,Falstaff,4,2,26,"painted cloth, where the glutton's dogs licked his",male
48201,"Henry IV, part 1",History,Falstaff,4,2,27,"sores; and such as indeed were never soldiers, but",male
48202,"Henry IV, part 1",History,Falstaff,4,2,28,"discarded unjust serving-men, younger sons to",male
48203,"Henry IV, part 1",History,Falstaff,4,2,29,"younger brothers, revolted tapsters and ostlers",male
48204,"Henry IV, part 1",History,Falstaff,4,2,30,"trade-fallen, the cankers of a calm world and a",male
48205,"Henry IV, part 1",History,Falstaff,4,2,31,"long peace, ten times more dishonourable ragged than",male
48206,"Henry IV, part 1",History,Falstaff,4,2,32,"an old faced ancient: and such have I, to fill up",male
48207,"Henry IV, part 1",History,Falstaff,4,2,33,the rooms of them that have bought out their,male
48208,"Henry IV, part 1",History,Falstaff,4,2,34,"services, that you would think that I had a hundred",male
48209,"Henry IV, part 1",History,Falstaff,4,2,35,and fifty tattered prodigals lately come from,male
48210,"Henry IV, part 1",History,Falstaff,4,2,36,"swine-keeping, from eating draff and husks. A mad",male
48211,"Henry IV, part 1",History,Falstaff,4,2,37,fellow met me on the way and told me I had unloaded,male
48212,"Henry IV, part 1",History,Falstaff,4,2,38,all the gibbets and pressed the dead bodies. No eye,male
48213,"Henry IV, part 1",History,Falstaff,4,2,39,hath seen such scarecrows. I'll not march through,male
48214,"Henry IV, part 1",History,Falstaff,4,2,40,"Coventry with them, that's flat: nay, and the",male
48215,"Henry IV, part 1",History,Falstaff,4,2,41,"villains march wide betwixt the legs, as if they had",male
48216,"Henry IV, part 1",History,Falstaff,4,2,42,gyves on; for indeed I had the most of them out of,male
48217,"Henry IV, part 1",History,Falstaff,4,2,43,prison. There's but a shirt and a half in all my,male
48218,"Henry IV, part 1",History,Falstaff,4,2,44,company; and the half shirt is two napkins tacked,male
48219,"Henry IV, part 1",History,Falstaff,4,2,45,together and thrown over the shoulders like an,male
48220,"Henry IV, part 1",History,Falstaff,4,2,46,"herald's coat without sleeves; and the shirt, to say",male
48221,"Henry IV, part 1",History,Falstaff,4,2,47,"the truth, stolen from my host at Saint Alban's, or",male
48222,"Henry IV, part 1",History,Falstaff,4,2,48,the red-nose innkeeper of Daventry. But that's all,male
48223,"Henry IV, part 1",History,Falstaff,4,2,49,one; they'll find linen enough on every hedge.,male
48224,"Henry IV, part 1",History,Prince Henry,4,2,50,"How now, blown Jack! how now, quilt!",male
48225,"Henry IV, part 1",History,Falstaff,4,2,51,"What, Hal! how now, mad wag! what a devil dost thou",male
48226,"Henry IV, part 1",History,Falstaff,4,2,52,"in Warwickshire? My good Lord of Westmoreland, I",male
48227,"Henry IV, part 1",History,Falstaff,4,2,53,cry you mercy: I thought your honour had already been,male
48228,"Henry IV, part 1",History,Falstaff,4,2,54,at Shrewsbury.,male
48229,"Henry IV, part 1",History,Westmoreland,4,2,55,"Faith, Sir John,'tis more than time that I were",male
48230,"Henry IV, part 1",History,Westmoreland,4,2,56,"there, and you too; but my powers are there already.",male
48231,"Henry IV, part 1",History,Westmoreland,4,2,57,"The king, I can tell you, looks for us all: we must",male
48232,"Henry IV, part 1",History,Westmoreland,4,2,58,away all night.,male
48233,"Henry IV, part 1",History,Falstaff,4,2,59,"Tut, never fear me: I am as vigilant as a cat to",male
48234,"Henry IV, part 1",History,Falstaff,4,2,60,steal cream.,male
48235,"Henry IV, part 1",History,Prince Henry,4,2,61,"I think, to steal cream indeed, for thy theft hath",male
48236,"Henry IV, part 1",History,Prince Henry,4,2,62,"already made thee butter. But tell me, Jack, whose",male
48237,"Henry IV, part 1",History,Prince Henry,4,2,63,fellows are these that come after?,male
48238,"Henry IV, part 1",History,Falstaff,4,2,64,"Mine, Hal, mine.",male
48239,"Henry IV, part 1",History,Prince Henry,4,2,65,I did never see such pitiful rascals.,male
48240,"Henry IV, part 1",History,Falstaff,4,2,66,"Tut, tut; good enough to toss; food for powder, food",male
48241,"Henry IV, part 1",History,Falstaff,4,2,67,for powder; they'll fill a pit as well as better:,male
48242,"Henry IV, part 1",History,Falstaff,4,2,68,"tush, man, mortal men, mortal men.",male
48243,"Henry IV, part 1",History,Westmoreland,4,2,69,"Ay, but, Sir John, methinks they are exceeding poor",male
48244,"Henry IV, part 1",History,Westmoreland,4,2,70,"and bare, too beggarly.",male
48245,"Henry IV, part 1",History,Falstaff,4,2,71,"'Faith, for their poverty, I know not where they had",male
48246,"Henry IV, part 1",History,Falstaff,4,2,72,"that; and for their bareness, I am sure they never",male
48247,"Henry IV, part 1",History,Falstaff,4,2,73,learned that of me.,male
48248,"Henry IV, part 1",History,Prince Henry,4,2,74,No I'll be sworn; unless you call three fingers on,male
