Unnamed: 0,play_name,genre,character,act,scene,sentence,text,sex,sentiment
87969,Julius Caesar,Tragedy,Flavius,1,1,1,"Hence! home, you idle creatures get you home:",male,0.0
87970,Julius Caesar,Tragedy,Flavius,1,1,2,"Is this a holiday? what! know you not,",male,0.0
87971,Julius Caesar,Tragedy,Flavius,1,1,3,"Being mechanical, you ought not walk",male,0.0
87972,Julius Caesar,Tragedy,Flavius,1,1,4,Upon a labouring day without the sign,male,0.0
87973,Julius Caesar,Tragedy,Flavius,1,1,5,"Of your profession? Speak, what trade art thou?",male,0.0
87974,Julius Caesar,Tragedy,First Commoner,1,1,6,"Why, sir, a carpenter.",male,0.0
87975,Julius Caesar,Tragedy,Marullus,1,1,7,Where is thy leather apron and thy rule?,male,0.0
87976,Julius Caesar,Tragedy,Marullus,1,1,8,What dost thou with thy best apparel on?,male,1.0
87977,Julius Caesar,Tragedy,Marullus,1,1,9,"You, sir, what trade are you?",male,0.0
87978,Julius Caesar,Tragedy,Second Commoner,1,1,10,"Truly, sir, in respect of a fine workman, I am but,",male,0.42
87979,Julius Caesar,Tragedy,Second Commoner,1,1,11,"as you would say, a cobbler.",male,0.0
87980,Julius Caesar,Tragedy,Marullus,1,1,12,But what trade art thou? answer me directly.,male,0.1
87981,Julius Caesar,Tragedy,Second Commoner,1,1,13,"A trade, sir, that, I hope, I may use with a safe",male,0.5
87982,Julius Caesar,Tragedy,Second Commoner,1,1,14,"conscience; which is, indeed, sir, a mender of bad soles.",male,-0.7
87983,Julius Caesar,Tragedy,Marullus,1,1,15,"What trade, thou knave? thou naughty knave, what trade?",male,-0.15
87984,Julius Caesar,Tragedy,Second Commoner,1,1,16,"Nay, I beseech you, sir, be not out with me: yet,",male,0.0
87985,Julius Caesar,Tragedy,Second Commoner,1,1,17,"if you be out, sir, I can mend you.",male,0.0
87986,Julius Caesar,Tragedy,Marullus,1,1,18,"What meanest thou by that? mend me, thou saucy fellow!",male,0.0
87987,Julius Caesar,Tragedy,Second Commoner,1,1,19,"Why, sir, cobble you.",male,0.0
87988,Julius Caesar,Tragedy,Flavius,1,1,20,"Thou art a cobbler, art thou?",male,0.0
87989,Julius Caesar,Tragedy,Second Commoner,1,1,21,"Truly, sir, all that I live by is with the awl: I",male,0.14
87990,Julius Caesar,Tragedy,Second Commoner,1,1,22,"meddle with no tradesman's matters, nor women's",male,0.0
87991,Julius Caesar,Tragedy,Second Commoner,1,1,23,"matters, but with awl. I am, indeed, sir, a surgeon",male,0.0
87992,Julius Caesar,Tragedy,Second Commoner,1,1,24,"to old shoes; when they are in great danger, I",male,0.45
87993,Julius Caesar,Tragedy,Second Commoner,1,1,25,recover them. As proper men as ever trod upon,male,0.0
87994,Julius Caesar,Tragedy,Second Commoner,1,1,26,neat's leather have gone upon my handiwork.,male,0.0
87995,Julius Caesar,Tragedy,Flavius,1,1,27,But wherefore art not in thy shop today?,male,0.0
87996,Julius Caesar,Tragedy,Flavius,1,1,28,Why dost thou lead these men about the streets?,male,0.0
87997,Julius Caesar,Tragedy,Second Commoner,1,1,29,"Truly, sir, to wear out their shoes, to get myself",male,0.0
87998,Julius Caesar,Tragedy,Second Commoner,1,1,30,"into more work. But, indeed, sir, we make holiday,",male,0.5
87999,Julius Caesar,Tragedy,Second Commoner,1,1,31,to see Caesar and to rejoice in his triumph.,male,0.0
88000,Julius Caesar,Tragedy,Marullus,1,1,32,Wherefore rejoice? What conquest brings he home?,male,0.0
88001,Julius Caesar,Tragedy,Marullus,1,1,33,"What tributaries follow him to Rome,",male,0.0
88002,Julius Caesar,Tragedy,Marullus,1,1,34,To grace in captive bonds his chariot-wheels?,male,0.2
88003,Julius Caesar,Tragedy,Marullus,1,1,35,"You blocks, you stones, you worse than senseless things!",male,-0.5
88004,Julius Caesar,Tragedy,Marullus,1,1,36,"O you hard hearts, you cruel men of Rome,",male,-0.65
88005,Julius Caesar,Tragedy,Marullus,1,1,37,Knew you not Pompey? Many a time and oft,male,0.5
88006,Julius Caesar,Tragedy,Marullus,1,1,38,"Have you climb'd up to walls and battlements,",male,0.0
88007,Julius Caesar,Tragedy,Marullus,1,1,39,"To towers and windows, yea, to chimney-tops,",male,0.0
88008,Julius Caesar,Tragedy,Marullus,1,1,40,"Your infants in your arms, and there have sat",male,0.0
88009,Julius Caesar,Tragedy,Marullus,1,1,41,"The livelong day, with patient expectation,",male,0.0
88010,Julius Caesar,Tragedy,Marullus,1,1,42,To see great Pompey pass the streets of Rome:,male,0.8
88011,Julius Caesar,Tragedy,Marullus,1,1,43,"And when you saw his chariot but appear,",male,0.0
88012,Julius Caesar,Tragedy,Marullus,1,1,44,"Have you not made an universal shout,",male,0.0
88013,Julius Caesar,Tragedy,Marullus,1,1,45,"That Tiber trembled underneath her banks,",male,0.0
88014,Julius Caesar,Tragedy,Marullus,1,1,46,To hear the replication of your sounds,male,0.0
88015,Julius Caesar,Tragedy,Marullus,1,1,47,Made in her concave shores?,male,0.0
88016,Julius Caesar,Tragedy,Marullus,1,1,48,And do you now put on your best attire?,male,1.0
88017,Julius Caesar,Tragedy,Marullus,1,1,49,And do you now cull out a holiday?,male,0.0
88018,Julius Caesar,Tragedy,Marullus,1,1,50,And do you now strew flowers in his way,male,0.0
88019,Julius Caesar,Tragedy,Marullus,1,1,51,That comes in triumph over Pompey's blood? Be gone!,male,0.0
88020,Julius Caesar,Tragedy,Marullus,1,1,52,"Run to your houses, fall upon your knees,",male,0.0
88021,Julius Caesar,Tragedy,Marullus,1,1,53,Pray to the gods to intermit the plague,male,0.0
88022,Julius Caesar,Tragedy,Marullus,1,1,54,That needs must light on this ingratitude.,male,0.4
88023,Julius Caesar,Tragedy,Flavius,1,1,55,"Go, go, good countrymen, and, for this fault,",male,0.7
88024,Julius Caesar,Tragedy,Flavius,1,1,56,Assemble all the poor men of your sort;,male,-0.4
88025,Julius Caesar,Tragedy,Flavius,1,1,57,"Draw them to Tiber banks, and weep your tears",male,0.0
88026,Julius Caesar,Tragedy,Flavius,1,1,58,"Into the channel, till the lowest stream",male,0.0
88027,Julius Caesar,Tragedy,Flavius,1,1,59,Do kiss the most exalted shores of all.,male,0.5
88028,Julius Caesar,Tragedy,Flavius,1,1,60,See whether their basest metal be not moved;,male,0.0
88029,Julius Caesar,Tragedy,Flavius,1,1,61,They vanish tongue-tied in their guiltiness.,male,0.0
88030,Julius Caesar,Tragedy,Flavius,1,1,62,Go you down that way towards the Capitol;,male,-0.16
88031,Julius Caesar,Tragedy,This Way Will I,1,1,63,"disrobe the images,",male,0.0
88032,Julius Caesar,Tragedy,This Way Will I,1,1,64,If you do find them deck'd with ceremonies.,male,0.0
88033,Julius Caesar,Tragedy,Marullus,1,1,65,May we do so?,male,0.0
88034,Julius Caesar,Tragedy,Marullus,1,1,66,You know it is the feast of Lupercal.,male,0.0
88035,Julius Caesar,Tragedy,Flavius,1,1,67,It is no matter; let no images,male,0.0
88036,Julius Caesar,Tragedy,Flavius,1,1,68,"Be hung with Caesar's trophies. I'll about,",male,0.0
88037,Julius Caesar,Tragedy,Flavius,1,1,69,And drive away the vulgar from the streets:,male,-0.7
88038,Julius Caesar,Tragedy,Flavius,1,1,70,"So do you too, where you perceive them thick.",male,-0.3
88039,Julius Caesar,Tragedy,Flavius,1,1,71,These growing feathers pluck'd from Caesar's wing,male,0.0
88040,Julius Caesar,Tragedy,Flavius,1,1,72,"Will make him fly an ordinary pitch,",male,0.28
88041,Julius Caesar,Tragedy,Flavius,1,1,73,Who else would soar above the view of men,male,0.0
88042,Julius Caesar,Tragedy,Flavius,1,1,74,And keep us all in servile fearfulness.,male,0.0
88043,Julius Caesar,Tragedy,Caesar,1,2,1,Calpurnia!,male,0.0
88044,Julius Caesar,Tragedy,Casca,1,2,2,"Peace, ho! Caesar speaks.",male,0.0
88045,Julius Caesar,Tragedy,Caesar,1,2,3,Calpurnia!,male,0.0
88046,Julius Caesar,Tragedy,Calpurnia,1,2,4,"Here, my lord.",female,0.0
88047,Julius Caesar,Tragedy,Caesar,1,2,5,"Stand you directly in Antonius' way,",male,0.1
88048,Julius Caesar,Tragedy,Caesar,1,2,6,When he doth run his course. Antonius!,male,0.0
88049,Julius Caesar,Tragedy,Antony,1,2,7,"Caesar, my lord?",male,0.0
88050,Julius Caesar,Tragedy,Caesar,1,2,8,"Forget not, in your speed, Antonius,",male,0.0
88051,Julius Caesar,Tragedy,Caesar,1,2,9,"To touch Calpurnia; for our elders say,",male,0.0
88052,Julius Caesar,Tragedy,Caesar,1,2,10,"The barren, touched in this holy chase,",male,0.0
88053,Julius Caesar,Tragedy,Caesar,1,2,11,Shake off their sterile curse.,male,0.0
88054,Julius Caesar,Tragedy,Antony,1,2,12,I shall remember:,male,0.0
88055,Julius Caesar,Tragedy,Antony,1,2,13,"When Caesar says 'do this,' it is perform'd.",male,0.0
88056,Julius Caesar,Tragedy,Caesar,1,2,14,Set on; and leave no ceremony out.,male,0.0
88057,Julius Caesar,Tragedy,Soothsayer,1,2,15,Caesar!,male,0.0
88058,Julius Caesar,Tragedy,Caesar,1,2,16,Ha! who calls?,male,0.0
88059,Julius Caesar,Tragedy,Casca,1,2,17,Bid every noise be still: peace yet again!,male,0.0
88060,Julius Caesar,Tragedy,Caesar,1,2,18,Who is it in the press that calls on me?,male,0.0
88061,Julius Caesar,Tragedy,Caesar,1,2,19,"I hear a tongue, shriller than all the music,",male,0.0
88062,Julius Caesar,Tragedy,Caesar,1,2,20,Cry 'Caesar!' Speak; Caesar is turn'd to hear.,male,0.0
88063,Julius Caesar,Tragedy,Soothsayer,1,2,21,Beware the ides of March.,male,0.0
88064,Julius Caesar,Tragedy,Caesar,1,2,22,What man is that?,male,0.0
88065,Julius Caesar,Tragedy,Brutus,1,2,23,A soothsayer bids you beware the ides of March.,male,0.0
88066,Julius Caesar,Tragedy,Caesar,1,2,24,Set him before me; let me see his face.,male,0.0
88067,Julius Caesar,Tragedy,Cassius,1,2,25,"Fellow, come from the throng; look upon Caesar.",male,0.0
88068,Julius Caesar,Tragedy,Caesar,1,2,26,What say'st thou to me now? speak once again.,male,0.0
88069,Julius Caesar,Tragedy,Soothsayer,1,2,27,Beware the ides of March.,male,0.0
88070,Julius Caesar,Tragedy,Caesar,1,2,28,He is a dreamer; let us leave him: pass.,male,0.0
88071,Julius Caesar,Tragedy,Cassius,1,2,29,Will you go see the order of the course?,male,0.0
88072,Julius Caesar,Tragedy,Brutus,1,2,30,Not I.,male,0.0
88073,Julius Caesar,Tragedy,Cassius,1,2,31,"I pray you, do.",male,0.0
88074,Julius Caesar,Tragedy,Brutus,1,2,32,I am not gamesome: I do lack some part,male,0.0
88075,Julius Caesar,Tragedy,Brutus,1,2,33,Of that quick spirit that is in Antony.,male,0.33
88076,Julius Caesar,Tragedy,Brutus,1,2,34,"Let me not hinder, Cassius, your desires;",male,0.0
88077,Julius Caesar,Tragedy,Brutus,1,2,35,I'll leave you.,male,0.0
88078,Julius Caesar,Tragedy,Cassius,1,2,36,"Brutus, I do observe you now of late:",male,-0.3
88079,Julius Caesar,Tragedy,Cassius,1,2,37,I have not from your eyes that gentleness,male,0.0
88080,Julius Caesar,Tragedy,Cassius,1,2,38,And show of love as I was wont to have:,male,0.5
88081,Julius Caesar,Tragedy,Cassius,1,2,39,You bear too stubborn and too strange a hand,male,-0.05
88082,Julius Caesar,Tragedy,Cassius,1,2,40,Over your friend that loves you.,male,0.0
88083,Julius Caesar,Tragedy,Brutus,1,2,41,"Cassius,",male,0.0
88084,Julius Caesar,Tragedy,Brutus,1,2,42,"Be not deceived: if I have veil'd my look,",male,0.0
88085,Julius Caesar,Tragedy,Brutus,1,2,43,I turn the trouble of my countenance,male,-0.2
88086,Julius Caesar,Tragedy,Brutus,1,2,44,Merely upon myself. Vexed I am,male,-0.5
88087,Julius Caesar,Tragedy,Brutus,1,2,45,"Of late with passions of some difference,",male,-0.3
88088,Julius Caesar,Tragedy,Brutus,1,2,46,"Conceptions only proper to myself,",male,0.0
88089,Julius Caesar,Tragedy,Brutus,1,2,47,Which give some soil perhaps to my behaviors;,male,0.0
88090,Julius Caesar,Tragedy,Brutus,1,2,48,But let not therefore my good friends be grieved--,male,0.7
88091,Julius Caesar,Tragedy,Brutus,1,2,49,"Among which number, Cassius, be you one--",male,0.0
88092,Julius Caesar,Tragedy,Brutus,1,2,50,"Nor construe any further my neglect,",male,0.0
88093,Julius Caesar,Tragedy,Brutus,1,2,51,"Than that poor Brutus, with himself at war,",male,-0.4
88094,Julius Caesar,Tragedy,Brutus,1,2,52,Forgets the shows of love to other men.,male,0.19
88095,Julius Caesar,Tragedy,Cassius,1,2,53,"Then, Brutus, I have much mistook your passion;",male,0.2
88096,Julius Caesar,Tragedy,Cassius,1,2,54,By means whereof this breast of mine hath buried,male,0.0
88097,Julius Caesar,Tragedy,Cassius,1,2,55,"Thoughts of great value, worthy cogitations.",male,0.57
88098,Julius Caesar,Tragedy,Cassius,1,2,56,"Tell me, good Brutus, can you see your face?",male,0.7
88099,Julius Caesar,Tragedy,Brutus,1,2,57,"No, Cassius; for the eye sees not itself,",male,0.0
88100,Julius Caesar,Tragedy,Brutus,1,2,58,"But by reflection, by some other things.",male,-0.12
88101,Julius Caesar,Tragedy,Cassius,1,2,59,'Tis just:,male,0.0
88102,Julius Caesar,Tragedy,Cassius,1,2,60,"And it is very much lamented, Brutus,",male,0.26
88103,Julius Caesar,Tragedy,Cassius,1,2,61,That you have no such mirrors as will turn,male,0.0
88104,Julius Caesar,Tragedy,Cassius,1,2,62,"Your hidden worthiness into your eye,",male,-0.17
88105,Julius Caesar,Tragedy,Cassius,1,2,63,"That you might see your shadow. I have heard,",male,0.0
88106,Julius Caesar,Tragedy,Cassius,1,2,64,"Where many of the best respect in Rome,",male,0.75
88107,Julius Caesar,Tragedy,Cassius,1,2,65,"Except immortal Caesar, speaking of Brutus",male,0.0
88108,Julius Caesar,Tragedy,Cassius,1,2,66,"And groaning underneath this age's yoke,",male,0.0
88109,Julius Caesar,Tragedy,Cassius,1,2,67,Have wish'd that noble Brutus had his eyes.,male,0.6
88110,Julius Caesar,Tragedy,Brutus,1,2,68,"Into what dangers would you lead me, Cassius,",male,0.0
88111,Julius Caesar,Tragedy,Brutus,1,2,69,That you would have me seek into myself,male,0.0
88112,Julius Caesar,Tragedy,Brutus,1,2,70,For that which is not in me?,male,0.0
88113,Julius Caesar,Tragedy,Cassius,1,2,71,"Therefore, good Brutus, be prepared to hear:",male,0.7
88114,Julius Caesar,Tragedy,Cassius,1,2,72,And since you know you cannot see yourself,male,0.0
88115,Julius Caesar,Tragedy,Cassius,1,2,73,"So well as by reflection, I, your glass,",male,0.0
88116,Julius Caesar,Tragedy,Cassius,1,2,74,Will modestly discover to yourself,male,0.1
88117,Julius Caesar,Tragedy,Cassius,1,2,75,That of yourself which you yet know not of.,male,0.0
88118,Julius Caesar,Tragedy,Cassius,1,2,76,"And be not jealous on me, gentle Brutus:",male,0.2
88119,Julius Caesar,Tragedy,Cassius,1,2,77,"Were I a common laugher, or did use",male,-0.3
88120,Julius Caesar,Tragedy,Cassius,1,2,78,To stale with ordinary oaths my love,male,-0.08
88121,Julius Caesar,Tragedy,Cassius,1,2,79,To every new protester; if you know,male,0.14
88122,Julius Caesar,Tragedy,Cassius,1,2,80,That I do fawn on men and hug them hard,male,-0.29
88123,Julius Caesar,Tragedy,Cassius,1,2,81,"And after scandal them, or if you know",male,0.0
88124,Julius Caesar,Tragedy,Cassius,1,2,82,That I profess myself in banqueting,male,0.0
88125,Julius Caesar,Tragedy,Cassius,1,2,83,"To all the rout, then hold me dangerous.",male,-0.6
88126,Julius Caesar,Tragedy,Brutus,1,2,84,"What means this shouting? I do fear, the people",male,0.0
88127,Julius Caesar,Tragedy,Brutus,1,2,85,Choose Caesar for their king.,male,0.0
88128,Julius Caesar,Tragedy,Cassius,1,2,86,"Ay, do you fear it?",male,0.0
88129,Julius Caesar,Tragedy,Cassius,1,2,87,Then must I think you would not have it so.,male,0.0
88130,Julius Caesar,Tragedy,Brutus,1,2,88,"I would not, Cassius; yet I love him well.",male,0.5
88131,Julius Caesar,Tragedy,Brutus,1,2,89,But wherefore do you hold me here so long?,male,-0.05
88132,Julius Caesar,Tragedy,Brutus,1,2,90,What is it that you would impart to me?,male,0.0
88133,Julius Caesar,Tragedy,Brutus,1,2,91,"If it be aught toward the general good,",male,0.38
88134,Julius Caesar,Tragedy,Brutus,1,2,92,"Set honour in one eye and death i' the other,",male,-0.12
88135,Julius Caesar,Tragedy,Brutus,1,2,93,"And I will look on both indifferently,",male,0.0
88136,Julius Caesar,Tragedy,Brutus,1,2,94,For let the gods so speed me as I love,male,0.5
88137,Julius Caesar,Tragedy,Brutus,1,2,95,The name of honour more than I fear death.,male,0.5
88138,Julius Caesar,Tragedy,Cassius,1,2,96,"I know that virtue to be in you, Brutus,",male,0.0
88139,Julius Caesar,Tragedy,Cassius,1,2,97,As well as I do know your outward favour.,male,0.0
88140,Julius Caesar,Tragedy,Cassius,1,2,98,"Well, honour is the subject of my story.",male,-0.17
88141,Julius Caesar,Tragedy,Cassius,1,2,99,I cannot tell what you and other men,male,-0.12
88142,Julius Caesar,Tragedy,Cassius,1,2,100,"Think of this life; but, for my single self,",male,-0.07
88143,Julius Caesar,Tragedy,Cassius,1,2,101,I had as lief not be as live to be,male,0.14
88144,Julius Caesar,Tragedy,Cassius,1,2,102,In awe of such a thing as I myself.,male,0.0
88145,Julius Caesar,Tragedy,Cassius,1,2,103,I was born free as Caesar; so were you:,male,0.4
88146,Julius Caesar,Tragedy,Cassius,1,2,104,"We both have fed as well, and we can both",male,0.0
88147,Julius Caesar,Tragedy,Cassius,1,2,105,Endure the winter's cold as well as he:,male,-0.6
88148,Julius Caesar,Tragedy,Cassius,1,2,106,"For once, upon a raw and gusty day,",male,-0.23
88149,Julius Caesar,Tragedy,Cassius,1,2,107,"The troubled Tiber chafing with her shores,",male,-0.5
88150,Julius Caesar,Tragedy,Cassius,1,2,108,"Caesar said to me 'Darest thou, Cassius, now",male,0.0
88151,Julius Caesar,Tragedy,Cassius,1,2,109,"Leap in with me into this angry flood,",male,-0.5
88152,Julius Caesar,Tragedy,Cassius,1,2,110,"And swim to yonder point?' Upon the word,",male,0.0
88153,Julius Caesar,Tragedy,Cassius,1,2,111,"Accoutred as I was, I plunged in",male,0.0
88154,Julius Caesar,Tragedy,Cassius,1,2,112,And bade him follow; so indeed he did.,male,0.0
88155,Julius Caesar,Tragedy,Cassius,1,2,113,"The torrent roar'd, and we did buffet it",male,0.0
88156,Julius Caesar,Tragedy,Cassius,1,2,114,"With lusty sinews, throwing it aside",male,0.0
88157,Julius Caesar,Tragedy,Cassius,1,2,115,And stemming it with hearts of controversy;,male,0.0
88158,Julius Caesar,Tragedy,Cassius,1,2,116,"But ere we could arrive the point proposed,",male,0.0
88159,Julius Caesar,Tragedy,Cassius,1,2,117,"Caesar cried 'Help me, Cassius, or I sink!'",male,0.0
88160,Julius Caesar,Tragedy,Cassius,1,2,118,"I, as Aeneas, our great ancestor,",male,0.8
88161,Julius Caesar,Tragedy,Cassius,1,2,119,Did from the flames of Troy upon his shoulder,male,0.0
88162,Julius Caesar,Tragedy,Cassius,1,2,120,"The old Anchises bear, so from the waves of Tiber",male,0.1
88163,Julius Caesar,Tragedy,Cassius,1,2,121,Did I the tired Caesar. And this man,male,-0.4
88164,Julius Caesar,Tragedy,Cassius,1,2,122,"Is now become a god, and Cassius is",male,0.0
88165,Julius Caesar,Tragedy,Cassius,1,2,123,"A wretched creature and must bend his body,",male,0.0
88166,Julius Caesar,Tragedy,Cassius,1,2,124,If Caesar carelessly but nod on him.,male,-0.5
88167,Julius Caesar,Tragedy,Cassius,1,2,125,"He had a fever when he was in Spain,",male,0.0
88168,Julius Caesar,Tragedy,Cassius,1,2,126,"And when the fit was on him, I did mark",male,0.4
88169,Julius Caesar,Tragedy,Cassius,1,2,127,"How he did shake: 'tis true, this god did shake;",male,0.35
88170,Julius Caesar,Tragedy,Cassius,1,2,128,"His coward lips did from their colour fly,",male,0.8
88171,Julius Caesar,Tragedy,Cassius,1,2,129,And that same eye whose bend doth awe the world,male,0.0
88172,Julius Caesar,Tragedy,Cassius,1,2,130,Did lose his lustre: I did hear him groan:,male,0.0
88173,Julius Caesar,Tragedy,Cassius,1,2,131,"Ay, and that tongue of his that bade the Romans",male,0.0
88174,Julius Caesar,Tragedy,Cassius,1,2,132,"Mark him and write his speeches in their books,",male,0.0
88175,Julius Caesar,Tragedy,Cassius,1,2,133,"Alas, it cried 'Give me some drink, Titinius,'",male,-0.4
88176,Julius Caesar,Tragedy,Cassius,1,2,134,"As a sick girl. Ye gods, it doth amaze me",male,-0.71
88177,Julius Caesar,Tragedy,Cassius,1,2,135,A man of such a feeble temper should,male,-0.25
88178,Julius Caesar,Tragedy,Cassius,1,2,136,So get the start of the majestic world,male,0.0
88179,Julius Caesar,Tragedy,Cassius,1,2,137,And bear the palm alone.,male,0.0
88180,Julius Caesar,Tragedy,Brutus,1,2,138,Another general shout!,male,0.06
88181,Julius Caesar,Tragedy,Brutus,1,2,139,I do believe that these applauses are,male,0.0
88182,Julius Caesar,Tragedy,Brutus,1,2,140,For some new honours that are heap'd on Caesar.,male,0.14
88183,Julius Caesar,Tragedy,Cassius,1,2,141,"Why, man, he doth bestride the narrow world",male,-0.2
88184,Julius Caesar,Tragedy,Cassius,1,2,142,"Like a Colossus, and we petty men",male,0.0
88185,Julius Caesar,Tragedy,Cassius,1,2,143,Walk under his huge legs and peep about,male,0.4
88186,Julius Caesar,Tragedy,Cassius,1,2,144,To find ourselves dishonourable graves.,male,0.0
88187,Julius Caesar,Tragedy,Cassius,1,2,145,Men at some time are masters of their fates:,male,0.0
88188,Julius Caesar,Tragedy,Cassius,1,2,146,"The fault, dear Brutus, is not in our stars,",male,0.0
88189,Julius Caesar,Tragedy,Cassius,1,2,147,"But in ourselves, that we are underlings.",male,0.0
88190,Julius Caesar,Tragedy,Cassius,1,2,148,Brutus and Caesar: what should be in that 'Caesar'?,male,0.0
88191,Julius Caesar,Tragedy,Cassius,1,2,149,Why should that name be sounded more than yours?,male,0.5
88192,Julius Caesar,Tragedy,Cassius,1,2,150,"Write them together, yours is as fair a name;",male,0.7
88193,Julius Caesar,Tragedy,Cassius,1,2,151,"Sound them, it doth become the mouth as well;",male,0.4
88194,Julius Caesar,Tragedy,Cassius,1,2,152,"Weigh them, it is as heavy; conjure with 'em,",male,-0.2
88195,Julius Caesar,Tragedy,Cassius,1,2,153,Brutus will start a spirit as soon as Caesar.,male,0.0
88196,Julius Caesar,Tragedy,Cassius,1,2,154,"Now, in the names of all the gods at once,",male,0.0
88197,Julius Caesar,Tragedy,Cassius,1,2,155,"Upon what meat doth this our Caesar feed,",male,0.0
88198,Julius Caesar,Tragedy,Cassius,1,2,156,"That he is grown so great? Age, thou art shamed!",male,1.0
88199,Julius Caesar,Tragedy,Cassius,1,2,157,"Rome, thou hast lost the breed of noble bloods!",male,0.75
88200,Julius Caesar,Tragedy,Cassius,1,2,158,"When went there by an age, since the great flood,",male,0.8
88201,Julius Caesar,Tragedy,Cassius,1,2,159,But it was famed with more than with one man?,male,0.5
88202,Julius Caesar,Tragedy,Cassius,1,2,160,"When could they say till now, that talk'd of Rome,",male,0.0
88203,Julius Caesar,Tragedy,Cassius,1,2,161,That her wide walls encompass'd but one man?,male,-0.1
88204,Julius Caesar,Tragedy,Cassius,1,2,162,"Now is it Rome indeed and room enough,",male,0.0
88205,Julius Caesar,Tragedy,Cassius,1,2,163,When there is in it but one only man.,male,0.0
88206,Julius Caesar,Tragedy,Cassius,1,2,164,"O, you and I have heard our fathers say,",male,0.0
88207,Julius Caesar,Tragedy,Cassius,1,2,165,There was a Brutus once that would have brook'd,male,0.0
88208,Julius Caesar,Tragedy,Cassius,1,2,166,The eternal devil to keep his state in Rome,male,0.0
88209,Julius Caesar,Tragedy,Cassius,1,2,167,As easily as a king.,male,0.43
88210,Julius Caesar,Tragedy,Brutus,1,2,168,"That you do love me, I am nothing jealous;",male,0.5
88211,Julius Caesar,Tragedy,Brutus,1,2,169,"What you would work me to, I have some aim:",male,0.0
88212,Julius Caesar,Tragedy,Brutus,1,2,170,"How I have thought of this and of these times,",male,0.0
88213,Julius Caesar,Tragedy,Brutus,1,2,171,"I shall recount hereafter; for this present,",male,0.0
88214,Julius Caesar,Tragedy,Brutus,1,2,172,"I would not, so with love I might entreat you,",male,0.5
88215,Julius Caesar,Tragedy,Brutus,1,2,173,Be any further moved. What you have said,male,0.0
88216,Julius Caesar,Tragedy,Brutus,1,2,174,I will consider; what you have to say,male,0.0
88217,Julius Caesar,Tragedy,Brutus,1,2,175,"I will with patience hear, and find a time",male,0.0
88218,Julius Caesar,Tragedy,Brutus,1,2,176,Both meet to hear and answer such high things.,male,0.08
88219,Julius Caesar,Tragedy,Brutus,1,2,177,"Till then, my noble friend, chew upon this:",male,0.6
88220,Julius Caesar,Tragedy,Brutus,1,2,178,Brutus had rather be a villager,male,0.0
88221,Julius Caesar,Tragedy,Brutus,1,2,179,Than to repute himself a son of Rome,male,0.0
88222,Julius Caesar,Tragedy,Brutus,1,2,180,Under these hard conditions as this time,male,-0.29
88223,Julius Caesar,Tragedy,Brutus,1,2,181,Is like to lay upon us.,male,0.0
88224,Julius Caesar,Tragedy,Cassius,1,2,182,I am glad that my weak words,male,0.06
88225,Julius Caesar,Tragedy,Cassius,1,2,183,Have struck but thus much show of fire from Brutus.,male,0.2
88226,Julius Caesar,Tragedy,Brutus,1,2,184,The games are done and Caesar is returning.,male,0.0
88227,Julius Caesar,Tragedy,Cassius,1,2,185,"As they pass by, pluck Casca by the sleeve;",male,0.0
88228,Julius Caesar,Tragedy,Cassius,1,2,186,"And he will, after his sour fashion, tell you",male,-0.15
88229,Julius Caesar,Tragedy,Cassius,1,2,187,What hath proceeded worthy note to-day.,male,0.33
88230,Julius Caesar,Tragedy,Brutus,1,2,188,"I will do so. But, look you, Cassius,",male,0.0
88231,Julius Caesar,Tragedy,Brutus,1,2,189,"The angry spot doth glow on Caesar's brow,",male,-0.5
88232,Julius Caesar,Tragedy,Brutus,1,2,190,And all the rest look like a chidden train:,male,0.0
88233,Julius Caesar,Tragedy,Brutus,1,2,191,Calpurnia's cheek is pale; and Cicero,male,-0.21
88234,Julius Caesar,Tragedy,Brutus,1,2,192,Looks with such ferret and such fiery eyes,male,0.0
88235,Julius Caesar,Tragedy,Brutus,1,2,193,"As we have seen him in the Capitol,",male,0.0
88236,Julius Caesar,Tragedy,Brutus,1,2,194,Being cross'd in conference by some senators.,male,0.0
88237,Julius Caesar,Tragedy,Cassius,1,2,195,Casca will tell us what the matter is.,male,0.0
88238,Julius Caesar,Tragedy,Caesar,1,2,196,Antonius!,male,0.0
88239,Julius Caesar,Tragedy,Antony,1,2,197,Caesar?,male,0.0
88240,Julius Caesar,Tragedy,Caesar,1,2,198,Let me have men about me that are fat;,male,0.0
88241,Julius Caesar,Tragedy,Caesar,1,2,199,Sleek-headed men and such as sleep o' nights:,male,0.0
88242,Julius Caesar,Tragedy,Caesar,1,2,200,Yond Cassius has a lean and hungry look;,male,0.0
88243,Julius Caesar,Tragedy,Caesar,1,2,201,He thinks too much: such men are dangerous.,male,-0.3
88244,Julius Caesar,Tragedy,Antony,1,2,202,"Fear him not, Caesar; he's not dangerous;",male,0.3
