Unnamed: 0,play_name,genre,character,act,scene,sentence,text,sex,sentiment
89073,Julius Caesar,Tragedy,Soothsayer,2,4,29,"Madam, not yet: I go to take my stand,",male,0.0
89074,Julius Caesar,Tragedy,Soothsayer,2,4,30,To see him pass on to the Capitol.,male,0.0
89075,Julius Caesar,Tragedy,Portia,2,4,31,"Thou hast some suit to Caesar, hast thou not?",female,0.0
89076,Julius Caesar,Tragedy,Soothsayer,2,4,32,"That I have, lady: if it will please Caesar",male,0.0
89077,Julius Caesar,Tragedy,Soothsayer,2,4,33,"To be so good to Caesar as to hear me,",male,0.7
89078,Julius Caesar,Tragedy,Soothsayer,2,4,34,I shall beseech him to befriend himself.,male,0.0
89079,Julius Caesar,Tragedy,Portia,2,4,35,"Why, know'st thou any harm's intended towards him?",female,0.0
89080,Julius Caesar,Tragedy,Soothsayer,2,4,36,"None that I know will be, much that I fear may chance.",male,0.2
89081,Julius Caesar,Tragedy,Soothsayer,2,4,37,Good morrow to you. Here the street is narrow:,male,0.25
89082,Julius Caesar,Tragedy,Soothsayer,2,4,38,"The throng that follows Caesar at the heels,",male,0.0
89083,Julius Caesar,Tragedy,Soothsayer,2,4,39,"Of senators, of praetors, common suitors,",male,-0.3
89084,Julius Caesar,Tragedy,Soothsayer,2,4,40,Will crowd a feeble man almost to death:,male,-0.5
89085,Julius Caesar,Tragedy,Soothsayer,2,4,41,"I'll get me to a place more void, and there",male,0.5
89086,Julius Caesar,Tragedy,Soothsayer,2,4,42,Speak to great Caesar as he comes along.,male,0.8
89087,Julius Caesar,Tragedy,Portia,2,4,43,"I must go in. Ay me, how weak a thing",female,-0.38
89088,Julius Caesar,Tragedy,Portia,2,4,44,"The heart of woman is! O Brutus,",female,0.0
89089,Julius Caesar,Tragedy,Portia,2,4,45,The heavens speed thee in thine enterprise!,female,0.0
89090,Julius Caesar,Tragedy,Portia,2,4,46,"Sure, the boy heard me: Brutus hath a suit",female,0.5
89091,Julius Caesar,Tragedy,Portia,2,4,47,"That Caesar will not grant. O, I grow faint.",female,-0.5
89092,Julius Caesar,Tragedy,Portia,2,4,48,"Run, Lucius, and commend me to my lord;",female,0.0
89093,Julius Caesar,Tragedy,Portia,2,4,49,"Say I am merry: come to me again,",female,0.0
89094,Julius Caesar,Tragedy,Portia,2,4,50,And bring me word what he doth say to thee.,female,0.0
89095,Julius Caesar,Tragedy,Caesar,3,1,1,[To the Soothsayer]  The ides of March are come.,male,0.0
89096,Julius Caesar,Tragedy,Soothsayer,3,1,2,"Ay, Caesar; but not gone.",male,0.0
89097,Julius Caesar,Tragedy,Artemidorus,3,1,3,"Hail, Caesar! read this schedule.",male,0.0
89098,Julius Caesar,Tragedy,Decius Brutus,3,1,4,"Trebonius doth desire you to o'erread,",male,0.0
89099,Julius Caesar,Tragedy,Decius Brutus,3,1,5,"At your best leisure, this his humble suit.",male,0.4
89100,Julius Caesar,Tragedy,Artemidorus,3,1,6,"O Caesar, read mine first; for mine's a suit",male,0.25
89101,Julius Caesar,Tragedy,Artemidorus,3,1,7,"That touches Caesar nearer: read it, great Caesar.",male,0.8
89102,Julius Caesar,Tragedy,Caesar,3,1,8,What touches us ourself shall be last served.,male,0.0
89103,Julius Caesar,Tragedy,Artemidorus,3,1,9,"Delay not, Caesar; read it instantly.",male,0.0
89104,Julius Caesar,Tragedy,Caesar,3,1,10,"What, is the fellow mad?",male,-0.62
89105,Julius Caesar,Tragedy,Publius,3,1,11,"Sirrah, give place.",male,0.0
89106,Julius Caesar,Tragedy,Cassius,3,1,12,"What, urge you your petitions in the street?",male,0.0
89107,Julius Caesar,Tragedy,Cassius,3,1,13,Come to the Capitol.,male,0.0
89108,Julius Caesar,Tragedy,Popilius,3,1,14,I wish your enterprise to-day may thrive.,male,0.0
89109,Julius Caesar,Tragedy,Cassius,3,1,15,"What enterprise, Popilius?",male,0.0
89110,Julius Caesar,Tragedy,Popilius,3,1,16,Fare you well.,male,0.0
89111,Julius Caesar,Tragedy,Brutus,3,1,17,What said Popilius Lena?,male,0.0
89112,Julius Caesar,Tragedy,Cassius,3,1,18,He wish'd to-day our enterprise might thrive.,male,0.0
89113,Julius Caesar,Tragedy,Cassius,3,1,19,I fear our purpose is discovered.,male,0.0
89114,Julius Caesar,Tragedy,Brutus,3,1,20,"Look, how he makes to Caesar; mark him.",male,0.0
89115,Julius Caesar,Tragedy,Cassius,3,1,21,"Casca, be sudden, for we fear prevention.",male,0.0
89116,Julius Caesar,Tragedy,Cassius,3,1,22,"Brutus, what shall be done? If this be known,",male,0.0
89117,Julius Caesar,Tragedy,Cassius,3,1,23,"Cassius or Caesar never shall turn back,",male,0.0
89118,Julius Caesar,Tragedy,Cassius,3,1,24,For I will slay myself.,male,0.0
89119,Julius Caesar,Tragedy,Brutus,3,1,25,"Cassius, be constant:",male,0.0
89120,Julius Caesar,Tragedy,Brutus,3,1,26,Popilius Lena speaks not of our purposes;,male,0.0
89121,Julius Caesar,Tragedy,Brutus,3,1,27,"For, look, he smiles, and Caesar doth not change.",male,0.0
89122,Julius Caesar,Tragedy,Cassius,3,1,28,"Trebonius knows his time; for, look you, Brutus.",male,0.0
89123,Julius Caesar,Tragedy,Cassius,3,1,29,He draws Mark Antony out of the way.,male,0.0
89124,Julius Caesar,Tragedy,Decius Brutus,3,1,30,"Where is Metellus Cimber? Let him go,",male,0.0
89125,Julius Caesar,Tragedy,Decius Brutus,3,1,31,And presently prefer his suit to Caesar.,male,0.0
89126,Julius Caesar,Tragedy,Brutus,3,1,32,He is address'd: press near and second him.,male,0.05
89127,Julius Caesar,Tragedy,Cinna,3,1,33,"Casca, you are the first that rears your hand.",male,0.25
89128,Julius Caesar,Tragedy,Caesar,3,1,34,Are we all ready? What is now amiss,male,0.2
89129,Julius Caesar,Tragedy,Caesar,3,1,35,That Caesar and his senate must redress?,male,0.0
89130,Julius Caesar,Tragedy,Metellus Cimber,3,1,36,"Most high, most mighty, and most puissant Caesar,",male,0.41
89131,Julius Caesar,Tragedy,Metellus Cimber,3,1,37,Metellus Cimber throws before thy seat,male,0.0
89132,Julius Caesar,Tragedy,Metellus Cimber,3,1,38,"An humble heart,--",male,-0.2
89133,Julius Caesar,Tragedy,Caesar,3,1,39,"I must prevent thee, Cimber.",male,0.0
89134,Julius Caesar,Tragedy,Caesar,3,1,40,These couchings and these lowly courtesies,male,0.0
89135,Julius Caesar,Tragedy,Caesar,3,1,41,"Might fire the blood of ordinary men,",male,-0.25
89136,Julius Caesar,Tragedy,Caesar,3,1,42,And turn pre-ordinance and first decree,male,0.25
89137,Julius Caesar,Tragedy,Caesar,3,1,43,"Into the law of children. Be not fond,",male,0.0
89138,Julius Caesar,Tragedy,Caesar,3,1,44,To think that Caesar bears such rebel blood,male,0.0
89139,Julius Caesar,Tragedy,Caesar,3,1,45,That will be thaw'd from the true quality,male,0.35
89140,Julius Caesar,Tragedy,Caesar,3,1,46,"With that which melteth fools; I mean, sweet words,",male,0.02
89141,Julius Caesar,Tragedy,Caesar,3,1,47,Low-crooked court'sies and base spaniel-fawning.,male,-0.8
89142,Julius Caesar,Tragedy,Caesar,3,1,48,Thy brother by decree is banished:,male,0.0
89143,Julius Caesar,Tragedy,Caesar,3,1,49,"If thou dost bend and pray and fawn for him,",male,0.0
89144,Julius Caesar,Tragedy,Caesar,3,1,50,I spurn thee like a cur out of my way.,male,0.0
89145,Julius Caesar,Tragedy,Caesar,3,1,51,"Know, Caesar doth not wrong, nor without cause",male,0.25
89146,Julius Caesar,Tragedy,Caesar,3,1,52,Will he be satisfied.,male,0.5
89147,Julius Caesar,Tragedy,Metellus Cimber,3,1,53,Is there no voice more worthy than my own,male,0.48
89148,Julius Caesar,Tragedy,Metellus Cimber,3,1,54,To sound more sweetly in great Caesar's ear,male,0.57
89149,Julius Caesar,Tragedy,Metellus Cimber,3,1,55,For the repealing of my banish'd brother?,male,0.0
89150,Julius Caesar,Tragedy,Brutus,3,1,56,"I kiss thy hand, but not in flattery, Caesar;",male,0.0
89151,Julius Caesar,Tragedy,Brutus,3,1,57,Desiring thee that Publius Cimber may,male,0.0
89152,Julius Caesar,Tragedy,Brutus,3,1,58,Have an immediate freedom of repeal.,male,0.0
89153,Julius Caesar,Tragedy,Caesar,3,1,59,"What, Brutus!",male,0.0
89154,Julius Caesar,Tragedy,Cassius,3,1,60,"Pardon, Caesar; Caesar, pardon:",male,0.0
89155,Julius Caesar,Tragedy,Cassius,3,1,61,"As low as to thy foot doth Cassius fall,",male,0.0
89156,Julius Caesar,Tragedy,Cassius,3,1,62,To beg enfranchisement for Publius Cimber.,male,0.0
89157,Julius Caesar,Tragedy,Cassius,3,1,63,"I could be well moved, if I were as you:",male,0.0
89158,Julius Caesar,Tragedy,Cassius,3,1,64,"If I could pray to move, prayers would move me:",male,0.0
89159,Julius Caesar,Tragedy,Cassius,3,1,65,"But I am constant as the northern star,",male,0.0
89160,Julius Caesar,Tragedy,Cassius,3,1,66,Of whose true-fix'd and resting quality,male,0.0
89161,Julius Caesar,Tragedy,Cassius,3,1,67,There is no fellow in the firmament.,male,0.0
89162,Julius Caesar,Tragedy,Cassius,3,1,68,"The skies are painted with unnumber'd sparks,",male,0.0
89163,Julius Caesar,Tragedy,Cassius,3,1,69,"They are all fire and every one doth shine,",male,0.0
89164,Julius Caesar,Tragedy,Cassius,3,1,70,But there's but one in all doth hold his place:,male,0.0
89165,Julius Caesar,Tragedy,Cassius,3,1,71,"So in the world; 'tis furnish'd well with men,",male,0.0
89166,Julius Caesar,Tragedy,Cassius,3,1,72,"And men are flesh and blood, and apprehensive;",male,0.0
89167,Julius Caesar,Tragedy,Cassius,3,1,73,Yet in the number I do know but one,male,0.0
89168,Julius Caesar,Tragedy,Cassius,3,1,74,"That unassailable holds on his rank,",male,-0.8
89169,Julius Caesar,Tragedy,Cassius,3,1,75,"Unshaked of motion: and that I am he,",male,0.0
89170,Julius Caesar,Tragedy,Cassius,3,1,76,"Let me a little show it, even in this;",male,-0.19
89171,Julius Caesar,Tragedy,Cassius,3,1,77,"That I was constant Cimber should be banish'd,",male,0.0
89172,Julius Caesar,Tragedy,Cassius,3,1,78,And constant do remain to keep him so.,male,0.0
89173,Julius Caesar,Tragedy,Cinna,3,1,79,"O Caesar,--",male,0.0
89174,Julius Caesar,Tragedy,Caesar,3,1,80,Hence! wilt thou lift up Olympus?,male,0.0
89175,Julius Caesar,Tragedy,Decius Brutus,3,1,81,"Great Caesar,--",male,0.8
89176,Julius Caesar,Tragedy,Caesar,3,1,82,Doth not Brutus bootless kneel?,male,0.0
89177,Julius Caesar,Tragedy,Casca,3,1,83,"Speak, hands for me!",male,0.0
89178,Julius Caesar,Tragedy,Caesar,3,1,84,"Et tu, Brute! Then fall, Caesar.",male,0.0
89179,Julius Caesar,Tragedy,Cinna,3,1,85,Liberty! Freedom! Tyranny is dead!,male,-0.25
89180,Julius Caesar,Tragedy,Cinna,3,1,86,"Run hence, proclaim, cry it about the streets.",male,0.0
89181,Julius Caesar,Tragedy,Cassius,3,1,87,"Some to the common pulpits, and cry out",male,-0.3
89182,Julius Caesar,Tragedy,Cassius,3,1,88,"'Liberty, freedom, and enfranchisement!'",male,0.0
89183,Julius Caesar,Tragedy,Brutus,3,1,89,"People and senators, be not affrighted;",male,0.0
89184,Julius Caesar,Tragedy,Brutus,3,1,90,Fly not; stand stiff: ambition's debt is paid.,male,0.29
89185,Julius Caesar,Tragedy,Casca,3,1,91,"Go to the pulpit, Brutus.",male,0.0
89186,Julius Caesar,Tragedy,Decius Brutus,3,1,92,And Cassius too.,male,0.0
89187,Julius Caesar,Tragedy,Brutus,3,1,93,Where's Publius?,male,0.0
89188,Julius Caesar,Tragedy,Cinna,3,1,94,"Here, quite confounded with this mutiny.",male,0.0
89189,Julius Caesar,Tragedy,Metellus Cimber,3,1,95,"Stand fast together, lest some friend of Caesar's",male,0.2
89190,Julius Caesar,Tragedy,Metellus Cimber,3,1,96,Should chance--,male,0.0
89191,Julius Caesar,Tragedy,Brutus,3,1,97,"Talk not of standing. Publius, good cheer;",male,0.7
89192,Julius Caesar,Tragedy,Brutus,3,1,98,"There is no harm intended to your person,",male,0.0
89193,Julius Caesar,Tragedy,Brutus,3,1,99,"Nor to no Roman else: so tell them, Publius.",male,0.0
89194,Julius Caesar,Tragedy,Cassius,3,1,100,"And leave us, Publius; lest that the people,",male,0.0
89195,Julius Caesar,Tragedy,Cassius,3,1,101,"Rushing on us, should do your age some mischief.",male,0.0
89196,Julius Caesar,Tragedy,Brutus,3,1,102,"Do so: and let no man abide this deed,",male,0.0
89197,Julius Caesar,Tragedy,Brutus,3,1,103,But we the doers.,male,0.0
89198,Julius Caesar,Tragedy,Cassius,3,1,104,Where is Antony?,male,0.0
89199,Julius Caesar,Tragedy,Trebonius,3,1,105,Fled to his house amazed:,male,0.0
89200,Julius Caesar,Tragedy,Trebonius,3,1,106,"Men, wives and children stare, cry out and run",male,0.0
89201,Julius Caesar,Tragedy,Trebonius,3,1,107,As it were doomsday.,male,0.0
89202,Julius Caesar,Tragedy,Brutus,3,1,108,"Fates, we will know your pleasures:",male,0.0
89203,Julius Caesar,Tragedy,Brutus,3,1,109,"That we shall die, we know; 'tis but the time",male,0.0
89204,Julius Caesar,Tragedy,Brutus,3,1,110,"And drawing days out, that men stand upon.",male,0.0
89205,Julius Caesar,Tragedy,Cassius,3,1,111,"Why, he that cuts off twenty years of life",male,0.0
89206,Julius Caesar,Tragedy,Cassius,3,1,112,Cuts off so many years of fearing death.,male,0.5
89207,Julius Caesar,Tragedy,Brutus,3,1,113,"Grant that, and then is death a benefit:",male,0.0
89208,Julius Caesar,Tragedy,Brutus,3,1,114,"So are we Caesar's friends, that have abridged",male,0.1
89209,Julius Caesar,Tragedy,Brutus,3,1,115,"His time of fearing death. Stoop, Romans, stoop,",male,0.0
89210,Julius Caesar,Tragedy,Brutus,3,1,116,And let us bathe our hands in Caesar's blood,male,0.0
89211,Julius Caesar,Tragedy,Brutus,3,1,117,"Up to the elbows, and besmear our swords:",male,0.0
89212,Julius Caesar,Tragedy,Brutus,3,1,118,"Then walk we forth, even to the market-place,",male,0.0
89213,Julius Caesar,Tragedy,Brutus,3,1,119,"And, waving our red weapons o'er our heads,",male,0.0
89214,Julius Caesar,Tragedy,Brutus,3,1,120,"Let's all cry 'Peace, freedom and liberty!'",male,0.0
89215,Julius Caesar,Tragedy,Cassius,3,1,121,"Stoop, then, and wash. How many ages hence",male,0.5
89216,Julius Caesar,Tragedy,Cassius,3,1,122,Shall this our lofty scene be acted over,male,0.0
89217,Julius Caesar,Tragedy,Cassius,3,1,123,In states unborn and accents yet unknown!,male,-0.12
89218,Julius Caesar,Tragedy,Brutus,3,1,124,"How many times shall Caesar bleed in sport,",male,0.5
89219,Julius Caesar,Tragedy,Brutus,3,1,125,That now on Pompey's basis lies along,male,0.0
89220,Julius Caesar,Tragedy,Brutus,3,1,126,No worthier than the dust!,male,0.0
89221,Julius Caesar,Tragedy,Cassius,3,1,127,"So oft as that shall be,",male,0.0
89222,Julius Caesar,Tragedy,Cassius,3,1,128,So often shall the knot of us be call'd,male,0.0
89223,Julius Caesar,Tragedy,Cassius,3,1,129,The men that gave their country liberty.,male,0.0
89224,Julius Caesar,Tragedy,Decius Brutus,3,1,130,"What, shall we forth?",male,0.0
89225,Julius Caesar,Tragedy,Cassius,3,1,131,"Ay, every man away:",male,0.0
89226,Julius Caesar,Tragedy,Cassius,3,1,132,Brutus shall lead; and we will grace his heels,male,0.0
89227,Julius Caesar,Tragedy,Cassius,3,1,133,With the most boldest and best hearts of Rome.,male,0.75
89228,Julius Caesar,Tragedy,Brutus,3,1,134,Soft! who comes here? A friend of Antony's.,male,0.12
89229,Julius Caesar,Tragedy,Servant,3,1,135,"Thus, Brutus, did my master bid me kneel:",male,0.0
89230,Julius Caesar,Tragedy,Servant,3,1,136,Thus did Mark Antony bid me fall down;,male,-0.16
89231,Julius Caesar,Tragedy,Servant,3,1,137,"And, being prostrate, thus he bade me say:",male,0.0
89232,Julius Caesar,Tragedy,Servant,3,1,138,"Brutus is noble, wise, valiant, and honest;",male,0.63
89233,Julius Caesar,Tragedy,Servant,3,1,139,"Caesar was mighty, bold, royal, and loving:",male,0.44
89234,Julius Caesar,Tragedy,Servant,3,1,140,"Say I love Brutus, and I honour him;",male,0.5
89235,Julius Caesar,Tragedy,Servant,3,1,141,"Say I fear'd Caesar, honour'd him and loved him.",male,0.7
89236,Julius Caesar,Tragedy,Servant,3,1,142,If Brutus will vouchsafe that Antony,male,0.0
89237,Julius Caesar,Tragedy,Servant,3,1,143,"May safely come to him, and be resolved",male,0.5
89238,Julius Caesar,Tragedy,Servant,3,1,144,"How Caesar hath deserved to lie in death,",male,0.0
89239,Julius Caesar,Tragedy,Servant,3,1,145,Mark Antony shall not love Caesar dead,male,-0.23
89240,Julius Caesar,Tragedy,Servant,3,1,146,So well as Brutus living; but will follow,male,0.0
89241,Julius Caesar,Tragedy,Servant,3,1,147,The fortunes and affairs of noble Brutus,male,0.6
89242,Julius Caesar,Tragedy,Servant,3,1,148,Thorough the hazards of this untrod state,male,0.0
89243,Julius Caesar,Tragedy,Servant,3,1,149,With all true faith. So says my master Antony.,male,0.35
89244,Julius Caesar,Tragedy,Brutus,3,1,150,Thy master is a wise and valiant Roman;,male,0.7
89245,Julius Caesar,Tragedy,Brutus,3,1,151,I never thought him worse.,male,-0.4
89246,Julius Caesar,Tragedy,Brutus,3,1,152,"Tell him, so please him come unto this place,",male,0.0
89247,Julius Caesar,Tragedy,Brutus,3,1,153,"He shall be satisfied; and, by my honour,",male,0.5
89248,Julius Caesar,Tragedy,Brutus,3,1,154,Depart untouch'd.,male,0.0
89249,Julius Caesar,Tragedy,Servant,3,1,155,I'll fetch him presently.,male,0.0
89250,Julius Caesar,Tragedy,Brutus,3,1,156,I know that we shall have him well to friend.,male,0.0
89251,Julius Caesar,Tragedy,Cassius,3,1,157,I wish we may: but yet have I a mind,male,0.0
89252,Julius Caesar,Tragedy,Cassius,3,1,158,That fears him much; and my misgiving still,male,0.2
89253,Julius Caesar,Tragedy,Cassius,3,1,159,Falls shrewdly to the purpose.,male,0.0
89254,Julius Caesar,Tragedy,Brutus,3,1,160,But here comes Antony.,male,0.0
89255,Julius Caesar,Tragedy,Brutus,3,1,161,"Welcome, Mark Antony.",male,0.8
89256,Julius Caesar,Tragedy,Antony,3,1,162,O mighty Caesar! dost thou lie so low?,male,0.25
89257,Julius Caesar,Tragedy,Antony,3,1,163,"Are all thy conquests, glories, triumphs, spoils,",male,0.0
89258,Julius Caesar,Tragedy,Antony,3,1,164,Shrunk to this little measure? Fare thee well.,male,-0.19
89259,Julius Caesar,Tragedy,Antony,3,1,165,"I know not, gentlemen, what you intend,",male,0.0
89260,Julius Caesar,Tragedy,Antony,3,1,166,"Who else must be let blood, who else is rank:",male,-0.8
89261,Julius Caesar,Tragedy,Antony,3,1,167,"If I myself, there is no hour so fit",male,0.4
89262,Julius Caesar,Tragedy,Antony,3,1,168,"As Caesar's death hour, nor no instrument",male,0.0
89263,Julius Caesar,Tragedy,Antony,3,1,169,"Of half that worth as those your swords, made rich",male,0.17
89264,Julius Caesar,Tragedy,Antony,3,1,170,With the most noble blood of all this world.,male,0.55
89265,Julius Caesar,Tragedy,Antony,3,1,171,"I do beseech ye, if you bear me hard,",male,-0.29
89266,Julius Caesar,Tragedy,Antony,3,1,172,"Now, whilst your purpled hands do reek and smoke,",male,0.0
89267,Julius Caesar,Tragedy,Antony,3,1,173,"Fulfil your pleasure. Live a thousand years,",male,0.14
89268,Julius Caesar,Tragedy,Antony,3,1,174,I shall not find myself so apt to die:,male,0.6
89269,Julius Caesar,Tragedy,Antony,3,1,175,"No place will please me so, no mean of death,",male,0.16
89270,Julius Caesar,Tragedy,Antony,3,1,176,"As here by Caesar, and by you cut off,",male,0.0
89271,Julius Caesar,Tragedy,Antony,3,1,177,The choice and master spirits of this age.,male,0.0
89272,Julius Caesar,Tragedy,Brutus,3,1,178,"O Antony, beg not your death of us.",male,0.0
89273,Julius Caesar,Tragedy,Brutus,3,1,179,"Though now we must appear bloody and cruel,",male,-0.9
89274,Julius Caesar,Tragedy,Brutus,3,1,180,"As, by our hands and this our present act,",male,0.0
89275,Julius Caesar,Tragedy,Brutus,3,1,181,"You see we do, yet see you but our hands",male,0.0
89276,Julius Caesar,Tragedy,Brutus,3,1,182,And this the bleeding business they have done:,male,0.0
89277,Julius Caesar,Tragedy,Brutus,3,1,183,Our hearts you see not; they are pitiful;,male,0.0
89278,Julius Caesar,Tragedy,Brutus,3,1,184,And pity to the general wrong of Rome--,male,-0.18
89279,Julius Caesar,Tragedy,Brutus,3,1,185,"As fire drives out fire, so pity pity--",male,-0.1
89280,Julius Caesar,Tragedy,Brutus,3,1,186,"Hath done this deed on Caesar. For your part,",male,0.0
89281,Julius Caesar,Tragedy,Brutus,3,1,187,"To you our swords have leaden points, Mark Antony:",male,-0.2
89282,Julius Caesar,Tragedy,Brutus,3,1,188,"Our arms, in strength of malice, and our hearts",male,0.0
89283,Julius Caesar,Tragedy,Brutus,3,1,189,"Of brothers' temper, do receive you in",male,0.0
89284,Julius Caesar,Tragedy,Brutus,3,1,190,"With all kind love, good thoughts, and reverence.",male,0.6
89285,Julius Caesar,Tragedy,Cassius,3,1,191,Your voice shall be as strong as any man's,male,0.43
89286,Julius Caesar,Tragedy,Cassius,3,1,192,In the disposing of new dignities.,male,0.14
89287,Julius Caesar,Tragedy,Brutus,3,1,193,Only be patient till we have appeased,male,0.0
89288,Julius Caesar,Tragedy,Brutus,3,1,194,"The multitude, beside themselves with fear,",male,0.0
89289,Julius Caesar,Tragedy,Brutus,3,1,195,"And then we will deliver you the cause,",male,0.0
89290,Julius Caesar,Tragedy,Brutus,3,1,196,"Why I, that did love Caesar when I struck him,",male,0.5
89291,Julius Caesar,Tragedy,Brutus,3,1,197,Have thus proceeded.,male,0.0
89292,Julius Caesar,Tragedy,Antony,3,1,198,I doubt not of your wisdom.,male,0.0
89293,Julius Caesar,Tragedy,Antony,3,1,199,Let each man render me his bloody hand:,male,-0.8
89294,Julius Caesar,Tragedy,Antony,3,1,200,"First, Marcus Brutus, will I shake with you;",male,0.25
89295,Julius Caesar,Tragedy,Antony,3,1,201,"Next, Caius Cassius, do I take your hand;",male,0.0
89296,Julius Caesar,Tragedy,Antony,3,1,202,"Now, Decius Brutus, yours: now yours, Metellus;",male,0.0
89297,Julius Caesar,Tragedy,Antony,3,1,203,"Yours, Cinna; and, my valiant Casca, yours;",male,0.0
89298,Julius Caesar,Tragedy,Antony,3,1,204,"Though last, not last in love, yours, good Trebonius.",male,0.3
89299,Julius Caesar,Tragedy,Antony,3,1,205,"Gentlemen all,--alas, what shall I say?",male,0.0
89300,Julius Caesar,Tragedy,Antony,3,1,206,"My credit now stands on such slippery ground,",male,0.0
89301,Julius Caesar,Tragedy,Antony,3,1,207,"That one of two bad ways you must conceit me,",male,-0.7
89302,Julius Caesar,Tragedy,Antony,3,1,208,Either a coward or a flatterer.,male,0.0
89303,Julius Caesar,Tragedy,Antony,3,1,209,"That I did love thee, Caesar, O, 'tis true:",male,0.42
89304,Julius Caesar,Tragedy,Antony,3,1,210,"If then thy spirit look upon us now,",male,0.0
89305,Julius Caesar,Tragedy,Antony,3,1,211,"Shall it not grieve thee dearer than thy death,",male,0.0
89306,Julius Caesar,Tragedy,Antony,3,1,212,"To see thy thy Anthony making his peace,",male,0.0
89307,Julius Caesar,Tragedy,Antony,3,1,213,"Shaking the bloody fingers of thy foes,",male,-0.8
89308,Julius Caesar,Tragedy,Antony,3,1,214,Most noble! in the presence of thy corse?,male,0.62
89309,Julius Caesar,Tragedy,Antony,3,1,215,"Had I as many eyes as thou hast wounds,",male,0.5
89310,Julius Caesar,Tragedy,Antony,3,1,216,"Weeping as fast as they stream forth thy blood,",male,0.2
89311,Julius Caesar,Tragedy,Antony,3,1,217,It would become me better than to close,male,0.5
89312,Julius Caesar,Tragedy,Antony,3,1,218,In terms of friendship with thine enemies.,male,0.0
89313,Julius Caesar,Tragedy,Antony,3,1,219,"Pardon me, Julius! Here wast thou bay'd, brave hart;",male,0.8
89314,Julius Caesar,Tragedy,Antony,3,1,220,"Here didst thou fall; and here thy hunters stand,",male,0.0
89315,Julius Caesar,Tragedy,Antony,3,1,221,"Sign'd in thy spoil, and crimson'd in thy lethe.",male,0.0
89316,Julius Caesar,Tragedy,Antony,3,1,222,"O world, thou wast the forest to this hart;",male,0.0
89317,Julius Caesar,Tragedy,Antony,3,1,223,"And this, indeed, O world, the heart of thee.",male,0.0
89318,Julius Caesar,Tragedy,Antony,3,1,224,"How like a deer, strucken by many princes,",male,0.5
89319,Julius Caesar,Tragedy,Antony,3,1,225,Dost thou here lie!,male,0.0
89320,Julius Caesar,Tragedy,Cassius,3,1,226,"Mark Antony,--",male,0.0
89321,Julius Caesar,Tragedy,Antony,3,1,227,"Pardon me, Caius Cassius:",male,0.0
89322,Julius Caesar,Tragedy,Antony,3,1,228,The enemies of Caesar shall say this;,male,0.0
89323,Julius Caesar,Tragedy,Antony,3,1,229,"Then, in a friend, it is cold modesty.",male,-0.6
89324,Julius Caesar,Tragedy,Cassius,3,1,230,I blame you not for praising Caesar so;,male,0.0
89325,Julius Caesar,Tragedy,Cassius,3,1,231,But what compact mean you to have with us?,male,-0.31
89326,Julius Caesar,Tragedy,Cassius,3,1,232,Will you be prick'd in number of our friends;,male,0.0
89327,Julius Caesar,Tragedy,Cassius,3,1,233,"Or shall we on, and not depend on you?",male,0.0
89328,Julius Caesar,Tragedy,Antony,3,1,234,"Therefore I took your hands, but was, indeed,",male,0.0
89329,Julius Caesar,Tragedy,Antony,3,1,235,"Sway'd from the point, by looking down on Caesar.",male,-0.16
89330,Julius Caesar,Tragedy,Antony,3,1,236,"Friends am I with you all and love you all,",male,0.5
89331,Julius Caesar,Tragedy,Antony,3,1,237,"Upon this hope, that you shall give me reasons",male,0.0
89332,Julius Caesar,Tragedy,Antony,3,1,238,Why and wherein Caesar was dangerous.,male,-0.6
89333,Julius Caesar,Tragedy,Brutus,3,1,239,Or else were this a savage spectacle:,male,0.0
89334,Julius Caesar,Tragedy,Brutus,3,1,240,Our reasons are so full of good regard,male,0.52
89335,Julius Caesar,Tragedy,Brutus,3,1,241,"That were you, Antony, the son of Caesar,",male,0.0
89336,Julius Caesar,Tragedy,Brutus,3,1,242,You should be satisfied.,male,0.5
89337,Julius Caesar,Tragedy,Antony,3,1,243,That's all I seek:,male,0.0
89338,Julius Caesar,Tragedy,Antony,3,1,244,And am moreover suitor that I may,male,0.0
89339,Julius Caesar,Tragedy,Antony,3,1,245,Produce his body to the market-place;,male,0.0
89340,Julius Caesar,Tragedy,Antony,3,1,246,"And in the pulpit, as becomes a friend,",male,0.0
89341,Julius Caesar,Tragedy,Antony,3,1,247,Speak in the order of his funeral.,male,0.0
89342,Julius Caesar,Tragedy,Brutus,3,1,248,"You shall, Mark Antony.",male,0.0
89343,Julius Caesar,Tragedy,Cassius,3,1,249,"Brutus, a word with you.",male,0.0
89344,Julius Caesar,Tragedy,Cassius,3,1,250,You know not what you do: do not consent,male,0.0
89345,Julius Caesar,Tragedy,Cassius,3,1,251,That Antony speak in his funeral:,male,0.0
89346,Julius Caesar,Tragedy,Cassius,3,1,252,Know you how much the people may be moved,male,0.2
89347,Julius Caesar,Tragedy,Cassius,3,1,253,By that which he will utter?,male,0.0
89348,Julius Caesar,Tragedy,Brutus,3,1,254,By your pardon;,male,0.0
89349,Julius Caesar,Tragedy,Brutus,3,1,255,"I will myself into the pulpit first,",male,0.25
89350,Julius Caesar,Tragedy,Brutus,3,1,256,And show the reason of our Caesar's death:,male,0.0
