Unnamed: 0,play_name,genre,character,act,scene,sentence,text,sex
91469,King Lear,Tragedy,Goneril,1,4,351,"Nay, then--",female
91470,King Lear,Tragedy,Albany,1,4,352,"Well, well; the event.",male
91471,King Lear,Tragedy,King Lear,1,5,1,Go you before to Gloucester with these letters.,male
91472,King Lear,Tragedy,King Lear,1,5,2,Acquaint my daughter no further with any thing you,male
91473,King Lear,Tragedy,King Lear,1,5,3,know than comes from her demand out of the letter.,male
91474,King Lear,Tragedy,King Lear,1,5,4,"If your diligence be not speedy, I shall be there afore you.",male
91475,King Lear,Tragedy,Kent,1,5,5,"I will not sleep, my lord, till I have delivered",male
91476,King Lear,Tragedy,Kent,1,5,6,your letter.,male
91477,King Lear,Tragedy,Fool,1,5,7,"If a man's brains were in's heels, were't not in",male
91478,King Lear,Tragedy,Fool,1,5,8,danger of kibes?,male
91479,King Lear,Tragedy,King Lear,1,5,9,"Ay, boy.",male
91480,King Lear,Tragedy,Fool,1,5,10,"Then, I prithee, be merry; thy wit shall ne'er go",male
91481,King Lear,Tragedy,Fool,1,5,11,slip-shod.,male
91482,King Lear,Tragedy,King Lear,1,5,12,"Ha, ha, ha!",male
91483,King Lear,Tragedy,Fool,1,5,13,Shalt see thy other daughter will use thee kindly;,male
91484,King Lear,Tragedy,Fool,1,5,14,for though she's as like this as a crab's like an,male
91485,King Lear,Tragedy,Fool,1,5,15,"apple, yet I can tell what I can tell.",male
91486,King Lear,Tragedy,King Lear,1,5,16,"Why, what canst thou tell, my boy?",male
91487,King Lear,Tragedy,Fool,1,5,17,She will taste as like this as a crab does to a,male
91488,King Lear,Tragedy,Fool,1,5,18,crab. Thou canst tell why one's nose stands i',male
91489,King Lear,Tragedy,Fool,1,5,19,the middle on's face?,male
91490,King Lear,Tragedy,King Lear,1,5,20,No.,male
91491,King Lear,Tragedy,Fool,1,5,21,"Why, to keep one's eyes of either side's nose; that",male
91492,King Lear,Tragedy,Fool,1,5,22,"what a man cannot smell out, he may spy into.",male
91493,King Lear,Tragedy,King Lear,1,5,23,I did her wrong--,male
91494,King Lear,Tragedy,Fool,1,5,24,Canst tell how an oyster makes his shell?,male
91495,King Lear,Tragedy,King Lear,1,5,25,No.,male
91496,King Lear,Tragedy,Fool,1,5,26,Nor I neither; but I can tell why a snail has a house.,male
91497,King Lear,Tragedy,King Lear,1,5,27,Why?,male
91498,King Lear,Tragedy,Fool,1,5,28,"Why, to put his head in; not to give it away to his",male
91499,King Lear,Tragedy,Fool,1,5,29,"daughters, and leave his horns without a case.",male
91500,King Lear,Tragedy,King Lear,1,5,30,I will forget my nature. So kind a father! Be my,male
91501,King Lear,Tragedy,King Lear,1,5,31,horses ready?,male
91502,King Lear,Tragedy,Fool,1,5,32,Thy asses are gone about 'em. The reason why the,male
91503,King Lear,Tragedy,Fool,1,5,33,seven stars are no more than seven is a pretty reason.,male
91504,King Lear,Tragedy,King Lear,1,5,34,Because they are not eight?,male
91505,King Lear,Tragedy,Fool,1,5,35,"Yes, indeed: thou wouldst make a good fool.",male
91506,King Lear,Tragedy,King Lear,1,5,36,To take 't again perforce! Monster ingratitude!,male
91507,King Lear,Tragedy,Fool,1,5,37,"If thou wert my fool, nuncle, I'ld have thee beaten",male
91508,King Lear,Tragedy,Fool,1,5,38,for being old before thy time.,male
91509,King Lear,Tragedy,King Lear,1,5,39,How's that?,male
91510,King Lear,Tragedy,Fool,1,5,40,Thou shouldst not have been old till thou hadst,male
91511,King Lear,Tragedy,Fool,1,5,41,been wise.,male
91512,King Lear,Tragedy,King Lear,1,5,42,"O, let me not be mad, not mad, sweet heaven",male
91513,King Lear,Tragedy,King Lear,1,5,43,Keep me in temper: I would not be mad!,male
91514,King Lear,Tragedy,King Lear,1,5,44,How now! are the horses ready?,male
91515,King Lear,Tragedy,Gentleman,1,5,45,"Ready, my lord.",male
91516,King Lear,Tragedy,King Lear,1,5,46,"Come, boy.",male
91517,King Lear,Tragedy,Fool,1,5,47,"She that's a maid now, and laughs at my departure,",male
91518,King Lear,Tragedy,Fool,1,5,48,"Shall not be a maid long, unless things be cut shorter.",male
91519,King Lear,Tragedy,Edmund,2,1,1,"Save thee, Curan.",male
91520,King Lear,Tragedy,Curan,2,1,2,"And you, sir. I have been with your father, and",male
91521,King Lear,Tragedy,Curan,2,1,3,given him notice that the Duke of Cornwall and Regan,male
91522,King Lear,Tragedy,Curan,2,1,4,his duchess will be here with him this night.,male
91523,King Lear,Tragedy,Edmund,2,1,5,How comes that?,male
91524,King Lear,Tragedy,Curan,2,1,6,"Nay, I know not. You have heard of the news abroad;",male
91525,King Lear,Tragedy,Curan,2,1,7,"I mean the whispered ones, for they are yet but",male
91526,King Lear,Tragedy,Curan,2,1,8,ear-kissing arguments?,male
91527,King Lear,Tragedy,Edmund,2,1,9,"Not I	pray you, what are they?",male
91528,King Lear,Tragedy,Curan,2,1,10,"Have you heard of no likely wars toward, 'twixt the",male
91529,King Lear,Tragedy,Curan,2,1,11,Dukes of Cornwall and Albany?,male
91530,King Lear,Tragedy,Edmund,2,1,12,Not a word.,male
91531,King Lear,Tragedy,Curan,2,1,13,"You may do, then, in time. Fare you well, sir.",male
91532,King Lear,Tragedy,Edmund,2,1,14,The duke be here to-night? The better! best!,male
91533,King Lear,Tragedy,Edmund,2,1,15,This weaves itself perforce into my business.,male
91534,King Lear,Tragedy,Edmund,2,1,16,My father hath set guard to take my brother;,male
91535,King Lear,Tragedy,Edmund,2,1,17,"And I have one thing, of a queasy question,",male
91536,King Lear,Tragedy,Edmund,2,1,18,"Which I must act: briefness and fortune, work!",male
91537,King Lear,Tragedy,Edmund,2,1,19,"Brother, a word; descend: brother, I say!",male
91538,King Lear,Tragedy,Edmund,2,1,20,"My father watches: O sir, fly this place;",male
91539,King Lear,Tragedy,Edmund,2,1,21,Intelligence is given where you are hid;,male
91540,King Lear,Tragedy,Edmund,2,1,22,You have now the good advantage of the night:,male
91541,King Lear,Tragedy,Edmund,2,1,23,Have you not spoken 'gainst the Duke of Cornwall?,male
91542,King Lear,Tragedy,Edmund,2,1,24,"He's coming hither: now, i' the night, i' the haste,",male
91543,King Lear,Tragedy,Edmund,2,1,25,And Regan with him: have you nothing said,male
91544,King Lear,Tragedy,Edmund,2,1,26,Upon his party 'gainst the Duke of Albany?,male
91545,King Lear,Tragedy,Edmund,2,1,27,Advise yourself.,male
91546,King Lear,Tragedy,Edgar,2,1,28,"I am sure on't, not a word.",male
91547,King Lear,Tragedy,Edmund,2,1,29,I hear my father coming: pardon me:,male
91548,King Lear,Tragedy,Edmund,2,1,30,In cunning I must draw my sword upon you,male
91549,King Lear,Tragedy,Edmund,2,1,31,Draw; seem to defend yourself; now quit you well.,male
91550,King Lear,Tragedy,Edmund,2,1,32,"Yield: come before my father. Light, ho, here!",male
91551,King Lear,Tragedy,Edmund,2,1,33,"Fly, brother. Torches, torches! So, farewell.",male
91552,King Lear,Tragedy,Edmund,2,1,34,Some blood drawn on me would beget opinion.,male
91553,King Lear,Tragedy,Edmund,2,1,35,Of my more fierce endeavour: I have seen drunkards,male
91554,King Lear,Tragedy,Edmund,2,1,36,"Do more than this in sport. Father, father!",male
91555,King Lear,Tragedy,Edmund,2,1,37,"Stop, stop! No help?",male
91556,King Lear,Tragedy,Gloucester,2,1,38,"Now, Edmund, where's the villain?",male
91557,King Lear,Tragedy,Edmund,2,1,39,"Here stood he in the dark, his sharp sword out,",male
91558,King Lear,Tragedy,Edmund,2,1,40,"Mumbling of wicked charms, conjuring the moon",male
91559,King Lear,Tragedy,Edmund,2,1,41,"To stand auspicious mistress,--",male
91560,King Lear,Tragedy,Gloucester,2,1,42,But where is he?,male
91561,King Lear,Tragedy,Edmund,2,1,43,"Look, sir, I bleed.",male
91562,King Lear,Tragedy,Gloucester,2,1,44,"Where is the villain, Edmund?",male
91563,King Lear,Tragedy,Edmund,2,1,45,"Fled this way, sir. When by no means he could--",male
91564,King Lear,Tragedy,Gloucester,2,1,46,"Pursue him, ho! Go after.",male
91565,King Lear,Tragedy,Gloucester,2,1,47,By no means what?,male
91566,King Lear,Tragedy,Edmund,2,1,48,Persuade me to the murder of your lordship;,male
91567,King Lear,Tragedy,Edmund,2,1,49,"But that I told him, the revenging gods",male
91568,King Lear,Tragedy,Edmund,2,1,50,'Gainst parricides did all their thunders bend;,male
91569,King Lear,Tragedy,Edmund,2,1,51,"Spoke, with how manifold and strong a bond",male
91570,King Lear,Tragedy,Edmund,2,1,52,"The child was bound to the father; sir, in fine,",male
91571,King Lear,Tragedy,Edmund,2,1,53,Seeing how loathly opposite I stood,male
91572,King Lear,Tragedy,Edmund,2,1,54,"To his unnatural purpose, in fell motion,",male
91573,King Lear,Tragedy,Edmund,2,1,55,"With his prepared sword, he charges home",male
91574,King Lear,Tragedy,Edmund,2,1,56,"My unprovided body, lanced mine arm:",male
91575,King Lear,Tragedy,Edmund,2,1,57,"But when he saw my best alarum'd spirits,",male
91576,King Lear,Tragedy,Edmund,2,1,58,"Bold in the quarrel's right, roused to the encounter,",male
91577,King Lear,Tragedy,Edmund,2,1,59,"Or whether gasted by the noise I made,",male
91578,King Lear,Tragedy,Edmund,2,1,60,Full suddenly he fled.,male
91579,King Lear,Tragedy,Gloucester,2,1,61,Let him fly far:,male
91580,King Lear,Tragedy,Gloucester,2,1,62,Not in this land shall he remain uncaught;,male
91581,King Lear,Tragedy,Gloucester,2,1,63,"And found--dispatch. The noble duke my master,",male
91582,King Lear,Tragedy,Gloucester,2,1,64,"My worthy arch and patron, comes to-night:",male
91583,King Lear,Tragedy,Gloucester,2,1,65,"By his authority I will proclaim it,",male
91584,King Lear,Tragedy,Gloucester,2,1,66,"That he which finds him shall deserve our thanks,",male
91585,King Lear,Tragedy,Gloucester,2,1,67,Bringing the murderous coward to the stake;,male
91586,King Lear,Tragedy,Gloucester,2,1,68,"He that conceals him, death.",male
91587,King Lear,Tragedy,Edmund,2,1,69,"When I dissuaded him from his intent,",male
91588,King Lear,Tragedy,Edmund,2,1,70,"And found him pight to do it, with curst speech",male
91589,King Lear,Tragedy,Edmund,2,1,71,"I threaten'd to discover him: he replied,",male
91590,King Lear,Tragedy,Edmund,2,1,72,"'Thou unpossessing bastard! dost thou think,",male
91591,King Lear,Tragedy,Edmund,2,1,73,"If I would stand against thee, would the reposal",male
91592,King Lear,Tragedy,Edmund,2,1,74,"Of any trust, virtue, or worth in thee",male
91593,King Lear,Tragedy,Edmund,2,1,75,"Make thy words faith'd? No: what I should deny,--",male
91594,King Lear,Tragedy,Edmund,2,1,76,"As this I would: ay, though thou didst produce",male
91595,King Lear,Tragedy,Edmund,2,1,77,"My very character,--I'ld turn it all",male
91596,King Lear,Tragedy,Edmund,2,1,78,"To thy suggestion, plot, and damned practise:",male
91597,King Lear,Tragedy,Edmund,2,1,79,"And thou must make a dullard of the world,",male
91598,King Lear,Tragedy,Edmund,2,1,80,If they not thought the profits of my death,male
91599,King Lear,Tragedy,Edmund,2,1,81,Were very pregnant and potential spurs,male
91600,King Lear,Tragedy,Edmund,2,1,82,To make thee seek it.',male
91601,King Lear,Tragedy,Gloucester,2,1,83,Strong and fasten'd villain,male
91602,King Lear,Tragedy,Gloucester,2,1,84,Would he deny his letter? I never got him.,male
91603,King Lear,Tragedy,Gloucester,2,1,85,"Hark, the duke's trumpets! I know not why he comes.",male
91604,King Lear,Tragedy,Gloucester,2,1,86,All ports I'll bar; the villain shall not 'scape;,male
91605,King Lear,Tragedy,Gloucester,2,1,87,"The duke must grant me that: besides, his picture",male
91606,King Lear,Tragedy,Gloucester,2,1,88,"I will send far and near, that all the kingdom",male
91607,King Lear,Tragedy,Gloucester,2,1,89,"May have the due note of him; and of my land,",male
91608,King Lear,Tragedy,Gloucester,2,1,90,"Loyal and natural boy, I'll work the means",male
91609,King Lear,Tragedy,Gloucester,2,1,91,To make thee capable.,male
91610,King Lear,Tragedy,Cornwall,2,1,92,"How now, my noble friend! since I came hither,",male
91611,King Lear,Tragedy,Cornwall,2,1,93,"Which I can call but now, I have heard strange news.",male
91612,King Lear,Tragedy,Regan,2,1,94,"If it be true, all vengeance comes too short",female
91613,King Lear,Tragedy,Regan,2,1,95,"Which can pursue the offender. How dost, my lord?",female
91614,King Lear,Tragedy,Gloucester,2,1,96,"O, madam, my old heart is crack'd, it's crack'd!",male
91615,King Lear,Tragedy,Regan,2,1,97,"What, did my father's godson seek your life?",female
91616,King Lear,Tragedy,Regan,2,1,98,He whom my father named? your Edgar?,female
91617,King Lear,Tragedy,Gloucester,2,1,99,"O, lady, lady, shame would have it hid!",male
91618,King Lear,Tragedy,Regan,2,1,100,Was he not companion with the riotous knights,female
91619,King Lear,Tragedy,Regan,2,1,101,That tend upon my father?,female
91620,King Lear,Tragedy,Gloucester,2,1,102,"I know not, madam: 'tis too bad, too bad.",male
91621,King Lear,Tragedy,Edmund,2,1,103,"Yes, madam, he was of that consort.",male
91622,King Lear,Tragedy,Regan,2,1,104,"No marvel, then, though he were ill affected:",female
91623,King Lear,Tragedy,Regan,2,1,105,"'Tis they have put him on the old man's death,",female
91624,King Lear,Tragedy,Regan,2,1,106,To have the expense and waste of his revenues.,female
91625,King Lear,Tragedy,Regan,2,1,107,I have this present evening from my sister,female
91626,King Lear,Tragedy,Regan,2,1,108,"Been well inform'd of them; and with such cautions,",female
91627,King Lear,Tragedy,Regan,2,1,109,"That if they come to sojourn at my house,",female
91628,King Lear,Tragedy,Regan,2,1,110,I'll not be there.,female
91629,King Lear,Tragedy,Cornwall,2,1,111,"Nor I, assure thee, Regan.",male
91630,King Lear,Tragedy,Cornwall,2,1,112,"Edmund, I hear that you have shown your father",male
91631,King Lear,Tragedy,Cornwall,2,1,113,A child-like office.,male
91632,King Lear,Tragedy,Edmund,2,1,114,"'Twas my duty, sir.",male
91633,King Lear,Tragedy,Gloucester,2,1,115,He did bewray his practise; and received,male
91634,King Lear,Tragedy,Gloucester,2,1,116,"This hurt you see, striving to apprehend him.",male
91635,King Lear,Tragedy,Cornwall,2,1,117,Is he pursued?,male
91636,King Lear,Tragedy,Gloucester,2,1,118,"Ay, my good lord.",male
91637,King Lear,Tragedy,Cornwall,2,1,119,"If he be taken, he shall never more",male
91638,King Lear,Tragedy,Cornwall,2,1,120,"Be fear'd of doing harm: make your own purpose,",male
91639,King Lear,Tragedy,Cornwall,2,1,121,"How in my strength you please. For you, Edmund,",male
91640,King Lear,Tragedy,Cornwall,2,1,122,Whose virtue and obedience doth this instant,male
91641,King Lear,Tragedy,Cornwall,2,1,123,"So much commend itself, you shall be ours:",male
91642,King Lear,Tragedy,Cornwall,2,1,124,Natures of such deep trust we shall much need;,male
91643,King Lear,Tragedy,Cornwall,2,1,125,You we first seize on.,male
91644,King Lear,Tragedy,Edmund,2,1,126,"I shall serve you, sir,",male
91645,King Lear,Tragedy,Edmund,2,1,127,"Truly, however else.",male
91646,King Lear,Tragedy,Gloucester,2,1,128,For him I thank your grace.,male
91647,King Lear,Tragedy,Cornwall,2,1,129,"You know not why we came to visit you,--",male
91648,King Lear,Tragedy,Regan,2,1,130,"Thus out of season, threading dark-eyed night:",female
91649,King Lear,Tragedy,Regan,2,1,131,"Occasions, noble Gloucester, of some poise,",female
91650,King Lear,Tragedy,Regan,2,1,132,Wherein we must have use of your advice:,female
91651,King Lear,Tragedy,Regan,2,1,133,"Our father he hath writ, so hath our sister,",female
91652,King Lear,Tragedy,Regan,2,1,134,"Of differences, which I least thought it fit",female
91653,King Lear,Tragedy,Regan,2,1,135,To answer from our home; the several messengers,female
91654,King Lear,Tragedy,Regan,2,1,136,"From hence attend dispatch. Our good old friend,",female
91655,King Lear,Tragedy,Regan,2,1,137,Lay comforts to your bosom; and bestow,female
91656,King Lear,Tragedy,Regan,2,1,138,"Your needful counsel to our business,",female
91657,King Lear,Tragedy,Regan,2,1,139,Which craves the instant use.,female
91658,King Lear,Tragedy,Gloucester,2,1,140,"I serve you, madam:",male
91659,King Lear,Tragedy,Gloucester,2,1,141,Your graces are right welcome.,male
91660,King Lear,Tragedy,Oswald,2,2,1,"Good dawning to thee, friend: art of this house?",male
91661,King Lear,Tragedy,Kent,2,2,2,Ay.,male
91662,King Lear,Tragedy,Oswald,2,2,3,Where may we set our horses?,male
91663,King Lear,Tragedy,Kent,2,2,4,I' the mire.,male
91664,King Lear,Tragedy,Oswald,2,2,5,"Prithee, if thou lovest me, tell me.",male
91665,King Lear,Tragedy,Kent,2,2,6,I love thee not.,male
91666,King Lear,Tragedy,Oswald,2,2,7,"Why, then, I care not for thee.",male
91667,King Lear,Tragedy,Kent,2,2,8,"If I had thee in Lipsbury pinfold, I would make thee",male
91668,King Lear,Tragedy,Kent,2,2,9,care for me.,male
91669,King Lear,Tragedy,Oswald,2,2,10,Why dost thou use me thus? I know thee not.,male
91670,King Lear,Tragedy,Kent,2,2,11,"Fellow, I know thee.",male
91671,King Lear,Tragedy,Oswald,2,2,12,What dost thou know me for?,male
91672,King Lear,Tragedy,Kent,2,2,13,A knave; a rascal; an eater of broken meats; a,male
91673,King Lear,Tragedy,Kent,2,2,14,"base, proud, shallow, beggarly, three-suited,",male
91674,King Lear,Tragedy,Kent,2,2,15,"hundred-pound, filthy, worsted-stocking knave; a",male
91675,King Lear,Tragedy,Kent,2,2,16,"lily-livered, action-taking knave, a whoreson,",male
91676,King Lear,Tragedy,Kent,2,2,17,"glass-gazing, super-serviceable finical rogue;",male
91677,King Lear,Tragedy,Kent,2,2,18,one-trunk-inheriting slave; one that wouldst be a,male
91678,King Lear,Tragedy,Kent,2,2,19,"bawd, in way of good service, and art nothing but",male
91679,King Lear,Tragedy,Kent,2,2,20,"the composition of a knave, beggar, coward, pandar,",male
91680,King Lear,Tragedy,Kent,2,2,21,and the son and heir of a mongrel bitch: one whom I,male
91681,King Lear,Tragedy,Kent,2,2,22,"will beat into clamorous whining, if thou deniest",male
91682,King Lear,Tragedy,Kent,2,2,23,the least syllable of thy addition.,male
91683,King Lear,Tragedy,Oswald,2,2,24,"Why, what a monstrous fellow art thou, thus to rail",male
91684,King Lear,Tragedy,Oswald,2,2,25,on one that is neither known of thee nor knows thee!,male
91685,King Lear,Tragedy,Kent,2,2,26,"What a brazen-faced varlet art thou, to deny thou",male
91686,King Lear,Tragedy,Kent,2,2,27,knowest me! Is it two days ago since I tripped up,male
91687,King Lear,Tragedy,Kent,2,2,28,"thy heels, and beat thee before the king? Draw, you",male
91688,King Lear,Tragedy,Kent,2,2,29,"rogue: for, though it be night, yet the moon",male
91689,King Lear,Tragedy,Kent,2,2,30,shines; I'll make a sop o' the moonshine of you:,male
91690,King Lear,Tragedy,Kent,2,2,31,"draw, you whoreson cullionly barber-monger, draw.",male
91691,King Lear,Tragedy,Oswald,2,2,32,Away! I have nothing to do with thee.,male
91692,King Lear,Tragedy,Kent,2,2,33,"Draw, you rascal: you come with letters against the",male
91693,King Lear,Tragedy,Kent,2,2,34,king; and take vanity the puppet's part against the,male
91694,King Lear,Tragedy,Kent,2,2,35,"royalty of her father: draw, you rogue, or I'll so",male
91695,King Lear,Tragedy,Kent,2,2,36,"carbonado your shanks: draw, you rascal; come your ways.",male
91696,King Lear,Tragedy,Oswald,2,2,37,"Help, ho! murder! help!",male
91697,King Lear,Tragedy,Kent,2,2,38,"Strike, you slave; stand, rogue, stand; you neat",male
91698,King Lear,Tragedy,Kent,2,2,39,"slave, strike.",male
91699,King Lear,Tragedy,Oswald,2,2,40,"Help, ho! murder! murder!",male
91700,King Lear,Tragedy,Edmund,2,2,41,How now! What's the matter?,male
91701,King Lear,Tragedy,Kent,2,2,42,"With you, goodman boy, an you please: come, I'll",male
91702,King Lear,Tragedy,Kent,2,2,43,"flesh ye; come on, young master.",male
91703,King Lear,Tragedy,Gloucester,2,2,44,Weapons! arms! What 's the matter here?,male
91704,King Lear,Tragedy,Cornwall,2,2,45,"Keep peace, upon your lives:",male
91705,King Lear,Tragedy,Cornwall,2,2,46,He dies that strikes again. What is the matter?,male
91706,King Lear,Tragedy,Regan,2,2,47,The messengers from our sister and the king.,female
91707,King Lear,Tragedy,Cornwall,2,2,48,What is your difference? speak.,male
91708,King Lear,Tragedy,Oswald,2,2,49,"I am scarce in breath, my lord.",male
91709,King Lear,Tragedy,Kent,2,2,50,"No marvel, you have so bestirred your valour. You",male
91710,King Lear,Tragedy,Kent,2,2,51,"cowardly rascal, nature disclaims in thee: a",male
91711,King Lear,Tragedy,Kent,2,2,52,tailor made thee.,male
91712,King Lear,Tragedy,Cornwall,2,2,53,Thou art a strange fellow: a tailor make a man?,male
91713,King Lear,Tragedy,Kent,2,2,54,"Ay, a tailor, sir: a stone-cutter or painter could",male
91714,King Lear,Tragedy,Kent,2,2,55,"not have made him so ill, though he had been but two",male
91715,King Lear,Tragedy,Kent,2,2,56,hours at the trade.,male
91716,King Lear,Tragedy,Cornwall,2,2,57,"Speak yet, how grew your quarrel?",male
91717,King Lear,Tragedy,Oswald,2,2,58,"This ancient ruffian, sir, whose life I have spared",male
91718,King Lear,Tragedy,Oswald,2,2,59,"at suit of his gray beard,--",male
91719,King Lear,Tragedy,Kent,2,2,60,Thou whoreson zed! thou unnecessary letter! My,male
91720,King Lear,Tragedy,Kent,2,2,61,"lord, if you will give me leave, I will tread this",male
91721,King Lear,Tragedy,Kent,2,2,62,"unbolted villain into mortar, and daub the wall of",male
91722,King Lear,Tragedy,Kent,2,2,63,"a jakes with him. Spare my gray beard, you wagtail?",male
91723,King Lear,Tragedy,Cornwall,2,2,64,"Peace, sirrah!",male
91724,King Lear,Tragedy,Cornwall,2,2,65,"You beastly knave, know you no reverence?",male
91725,King Lear,Tragedy,Kent,2,2,66,"Yes, sir; but anger hath a privilege.",male
91726,King Lear,Tragedy,Cornwall,2,2,67,Why art thou angry?,male
91727,King Lear,Tragedy,Kent,2,2,68,"That such a slave as this should wear a sword,",male
91728,King Lear,Tragedy,Kent,2,2,69,"Who wears no honesty. Such smiling rogues as these,",male
91729,King Lear,Tragedy,Kent,2,2,70,"Like rats, oft bite the holy cords a-twain",male
91730,King Lear,Tragedy,Kent,2,2,71,Which are too intrinse t' unloose; smooth every passion,male
91731,King Lear,Tragedy,Kent,2,2,72,That in the natures of their lords rebel;,male
91732,King Lear,Tragedy,Kent,2,2,73,"Bring oil to fire, snow to their colder moods;",male
91733,King Lear,Tragedy,Kent,2,2,74,"Renege, affirm, and turn their halcyon beaks",male
91734,King Lear,Tragedy,Kent,2,2,75,"With every gale and vary of their masters,",male
91735,King Lear,Tragedy,Kent,2,2,76,"Knowing nought, like dogs, but following.",male
91736,King Lear,Tragedy,Kent,2,2,77,A plague upon your epileptic visage!,male
91737,King Lear,Tragedy,Kent,2,2,78,"Smile you my speeches, as I were a fool?",male
91738,King Lear,Tragedy,Kent,2,2,79,"Goose, if I had you upon Sarum plain,",male
91739,King Lear,Tragedy,Kent,2,2,80,I'ld drive ye cackling home to Camelot.,male
91740,King Lear,Tragedy,Cornwall,2,2,81,"Why, art thou mad, old fellow?",male
91741,King Lear,Tragedy,Gloucester,2,2,82,How fell you out? say that.,male
91742,King Lear,Tragedy,Kent,2,2,83,No contraries hold more antipathy,male
91743,King Lear,Tragedy,Kent,2,2,84,Than I and such a knave.,male
91744,King Lear,Tragedy,Cornwall,2,2,85,Why dost thou call him a knave?  What's his offence?,male
91745,King Lear,Tragedy,Kent,2,2,86,His countenance likes me not.,male
91746,King Lear,Tragedy,Cornwall,2,2,87,"No more, perchance, does mine, nor his, nor hers.",male
91747,King Lear,Tragedy,Kent,2,2,88,"Sir, 'tis my occupation to be plain:",male
91748,King Lear,Tragedy,Kent,2,2,89,I have seen better faces in my time,male
91749,King Lear,Tragedy,Kent,2,2,90,Than stands on any shoulder that I see,male
91750,King Lear,Tragedy,Kent,2,2,91,Before me at this instant.,male
91751,King Lear,Tragedy,Cornwall,2,2,92,"This is some fellow,",male
91752,King Lear,Tragedy,Cornwall,2,2,93,"Who, having been praised for bluntness, doth affect",male
91753,King Lear,Tragedy,Cornwall,2,2,94,"A saucy roughness, and constrains the garb",male
91754,King Lear,Tragedy,Cornwall,2,2,95,"Quite from his nature: he cannot flatter, he,",male
91755,King Lear,Tragedy,Cornwall,2,2,96,"An honest mind and plain, he must speak truth!",male
91756,King Lear,Tragedy,Cornwall,2,2,97,"An they will take it, so; if not, he's plain.",male
91757,King Lear,Tragedy,Cornwall,2,2,98,"These kind of knaves I know, which in this plainness",male
91758,King Lear,Tragedy,Cornwall,2,2,99,Harbour more craft and more corrupter ends,male
91759,King Lear,Tragedy,Cornwall,2,2,100,Than twenty silly ducking observants,male
91760,King Lear,Tragedy,Cornwall,2,2,101,That stretch their duties nicely.,male
91761,King Lear,Tragedy,Kent,2,2,102,"Sir, in good sooth, in sincere verity,",male
91762,King Lear,Tragedy,Kent,2,2,103,"Under the allowance of your great aspect,",male
91763,King Lear,Tragedy,Kent,2,2,104,"Whose influence, like the wreath of radiant fire",male
91764,King Lear,Tragedy,Kent,2,2,105,"On flickering Phoebus' front,--",male
91765,King Lear,Tragedy,Cornwall,2,2,106,What mean'st by this?,male
91766,King Lear,Tragedy,Kent,2,2,107,"To go out of my dialect, which you",male
91767,King Lear,Tragedy,Kent,2,2,108,"discommend so much. I know, sir, I am no",male
91768,King Lear,Tragedy,Kent,2,2,109,flatterer: he that beguiled you in a plain,male
91769,King Lear,Tragedy,Kent,2,2,110,accent was a plain knave; which for my part,male
91770,King Lear,Tragedy,Kent,2,2,111,"I will not be, though I should win your displeasure",male
91771,King Lear,Tragedy,Kent,2,2,112,to entreat me to 't.,male
91772,King Lear,Tragedy,Cornwall,2,2,113,What was the offence you gave him?,male
91773,King Lear,Tragedy,Oswald,2,2,114,I never gave him any:,male
91774,King Lear,Tragedy,Oswald,2,2,115,It pleased the king his master very late,male
91775,King Lear,Tragedy,Oswald,2,2,116,"To strike at me, upon his misconstruction;",male
91776,King Lear,Tragedy,Oswald,2,2,117,"When he, conjunct and flattering his displeasure,",male
91777,King Lear,Tragedy,Oswald,2,2,118,"Tripp'd me behind; being down, insulted, rail'd,",male
91778,King Lear,Tragedy,Oswald,2,2,119,"And put upon him such a deal of man,",male
