Unnamed: 0,play_name,genre,character,act,scene,sentence,text,sex
92390,King Lear,Tragedy,King Lear,3,4,11,The lesser is scarce felt. Thou'ldst shun a bear;,male
92391,King Lear,Tragedy,King Lear,3,4,12,"But if thy flight lay toward the raging sea,",male
92392,King Lear,Tragedy,King Lear,3,4,13,Thou'ldst meet the bear i' the mouth. When the,male
92393,King Lear,Tragedy,King Lear,3,4,14,"mind's free,",male
92394,King Lear,Tragedy,King Lear,3,4,15,The body's delicate: the tempest in my mind,male
92395,King Lear,Tragedy,King Lear,3,4,16,Doth from my senses take all feeling else,male
92396,King Lear,Tragedy,King Lear,3,4,17,Save what beats there. Filial ingratitude!,male
92397,King Lear,Tragedy,King Lear,3,4,18,Is it not as this mouth should tear this hand,male
92398,King Lear,Tragedy,King Lear,3,4,19,For lifting food to't? But I will punish home:,male
92399,King Lear,Tragedy,King Lear,3,4,20,"No, I will weep no more. In such a night",male
92400,King Lear,Tragedy,King Lear,3,4,21,To shut me out! Pour on; I will endure.,male
92401,King Lear,Tragedy,King Lear,3,4,22,"In such a night as this! O Regan, Goneril!",male
92402,King Lear,Tragedy,King Lear,3,4,23,"Your old kind father, whose frank heart gave all,--",male
92403,King Lear,Tragedy,King Lear,3,4,24,"O, that way madness lies; let me shun that;",male
92404,King Lear,Tragedy,King Lear,3,4,25,No more of that.,male
92405,King Lear,Tragedy,Kent,3,4,26,"Good my lord, enter here.",male
92406,King Lear,Tragedy,King Lear,3,4,27,"Prithee, go in thyself: seek thine own ease:",male
92407,King Lear,Tragedy,King Lear,3,4,28,This tempest will not give me leave to ponder,male
92408,King Lear,Tragedy,King Lear,3,4,29,On things would hurt me more. But I'll go in.,male
92409,King Lear,Tragedy,King Lear,3,4,30,"In, boy; go first. You houseless poverty,--",male
92410,King Lear,Tragedy,King Lear,3,4,31,"Nay, get thee in. I'll pray, and then I'll sleep.",male
92411,King Lear,Tragedy,King Lear,3,4,32,"Poor naked wretches, whereso'er you are,",male
92412,King Lear,Tragedy,King Lear,3,4,33,"That bide the pelting of this pitiless storm,",male
92413,King Lear,Tragedy,King Lear,3,4,34,"How shall your houseless heads and unfed sides,",male
92414,King Lear,Tragedy,King Lear,3,4,35,"Your loop'd and window'd raggedness, defend you",male
92415,King Lear,Tragedy,King Lear,3,4,36,"From seasons such as these? O, I have ta'en",male
92416,King Lear,Tragedy,King Lear,3,4,37,"Too little care of this! Take physic, pomp;",male
92417,King Lear,Tragedy,King Lear,3,4,38,"Expose thyself to feel what wretches feel,",male
92418,King Lear,Tragedy,King Lear,3,4,39,"That thou mayst shake the superflux to them,",male
92419,King Lear,Tragedy,King Lear,3,4,40,And show the heavens more just.,male
92420,King Lear,Tragedy,Edgar,3,4,41,"[Within]  Fathom and half, fathom and half! Poor Tom!",male
92421,King Lear,Tragedy,Fool,3,4,42,"Come not in here, nuncle, here's a spirit",male
92422,King Lear,Tragedy,Fool,3,4,43,"Help me, help me!",male
92423,King Lear,Tragedy,Kent,3,4,44,Give me thy hand. Who's there?,male
92424,King Lear,Tragedy,Fool,3,4,45,"A spirit, a spirit: he says his name's poor Tom.",male
92425,King Lear,Tragedy,Kent,3,4,46,What art thou that dost grumble there i' the straw?,male
92426,King Lear,Tragedy,Kent,3,4,47,Come forth.,male
92427,King Lear,Tragedy,Edgar,3,4,48,Away! the foul fiend follows me!,male
92428,King Lear,Tragedy,Edgar,3,4,49,Through the sharp hawthorn blows the cold wind.,male
92429,King Lear,Tragedy,Edgar,3,4,50,"Hum! go to thy cold bed, and warm thee.",male
92430,King Lear,Tragedy,King Lear,3,4,51,Hast thou given all to thy two daughters?,male
92431,King Lear,Tragedy,King Lear,3,4,52,And art thou come to this?,male
92432,King Lear,Tragedy,Edgar,3,4,53,Who gives any thing to poor Tom? whom the foul,male
92433,King Lear,Tragedy,Edgar,3,4,54,"fiend hath led through fire and through flame, and",male
92434,King Lear,Tragedy,Edgar,3,4,55,through ford and whirlipool e'er bog and quagmire;,male
92435,King Lear,Tragedy,Edgar,3,4,56,"that hath laid knives under his pillow, and halters",male
92436,King Lear,Tragedy,Edgar,3,4,57,in his pew; set ratsbane by his porridge; made film,male
92437,King Lear,Tragedy,Edgar,3,4,58,"proud of heart, to ride on a bay trotting-horse over",male
92438,King Lear,Tragedy,Edgar,3,4,59,"four-inched bridges, to course his own shadow for a",male
92439,King Lear,Tragedy,Edgar,3,4,60,"traitor. Bless thy five wits! Tom's a-cold,--O, do",male
92440,King Lear,Tragedy,Edgar,3,4,61,"de, do de, do de. Bless thee from whirlwinds,",male
92441,King Lear,Tragedy,Edgar,3,4,62,"star-blasting, and taking! Do poor Tom some",male
92442,King Lear,Tragedy,Edgar,3,4,63,"charity, whom the foul fiend vexes: there could I",male
92443,King Lear,Tragedy,Edgar,3,4,64,"have him now,--and there,--and there again, and there.",male
92444,King Lear,Tragedy,King Lear,3,4,65,"What, have his daughters brought him to this pass?",male
92445,King Lear,Tragedy,King Lear,3,4,66,Couldst thou save nothing? Didst thou give them all?,male
92446,King Lear,Tragedy,Fool,3,4,67,"Nay, he reserved a blanket, else we had been all shamed.",male
92447,King Lear,Tragedy,King Lear,3,4,68,"Now, all the plagues that in the pendulous air",male
92448,King Lear,Tragedy,King Lear,3,4,69,Hang fated o'er men's faults light on thy daughters!,male
92449,King Lear,Tragedy,Kent,3,4,70,"He hath no daughters, sir.",male
92450,King Lear,Tragedy,King Lear,3,4,71,"Death, traitor! nothing could have subdued nature",male
92451,King Lear,Tragedy,King Lear,3,4,72,To such a lowness but his unkind daughters.,male
92452,King Lear,Tragedy,King Lear,3,4,73,"Is it the fashion, that discarded fathers",male
92453,King Lear,Tragedy,King Lear,3,4,74,Should have thus little mercy on their flesh?,male
92454,King Lear,Tragedy,King Lear,3,4,75,Judicious punishment! 'twas this flesh begot,male
92455,King Lear,Tragedy,King Lear,3,4,76,Those pelican daughters.,male
92456,King Lear,Tragedy,Edgar,3,4,77,Pillicock sat on Pillicock-hill:,male
92457,King Lear,Tragedy,Edgar,3,4,78,"Halloo, halloo, loo, loo!",male
92458,King Lear,Tragedy,Fool,3,4,79,This cold night will turn us all to fools and madmen.,male
92459,King Lear,Tragedy,Edgar,3,4,80,Take heed o' the foul fiend: obey thy parents;,male
92460,King Lear,Tragedy,Edgar,3,4,81,keep thy word justly; swear not; commit not with,male
92461,King Lear,Tragedy,Edgar,3,4,82,man's sworn spouse; set not thy sweet heart on proud,male
92462,King Lear,Tragedy,Edgar,3,4,83,array. Tom's a-cold.,male
92463,King Lear,Tragedy,King Lear,3,4,84,What hast thou been?,male
92464,King Lear,Tragedy,Edgar,3,4,85,"A serving-man, proud in heart and mind; that curled",male
92465,King Lear,Tragedy,Edgar,3,4,86,my hair; wore gloves in my cap; served the lust of,male
92466,King Lear,Tragedy,Edgar,3,4,87,"my mistress' heart, and did the act of darkness with",male
92467,King Lear,Tragedy,Edgar,3,4,88,"her; swore as many oaths as I spake words, and",male
92468,King Lear,Tragedy,Edgar,3,4,89,broke them in the sweet face of heaven: one that,male
92469,King Lear,Tragedy,Edgar,3,4,90,"slept in the contriving of lust, and waked to do it:",male
92470,King Lear,Tragedy,Edgar,3,4,91,"wine loved I deeply, dice dearly: and in woman",male
92471,King Lear,Tragedy,Edgar,3,4,92,"out-paramoured the Turk: false of heart, light of",male
92472,King Lear,Tragedy,Edgar,3,4,93,"ear, bloody of hand; hog in sloth, fox in stealth,",male
92473,King Lear,Tragedy,Edgar,3,4,94,"wolf in greediness, dog in madness, lion in prey.",male
92474,King Lear,Tragedy,Edgar,3,4,95,Let not the creaking of shoes nor the rustling of,male
92475,King Lear,Tragedy,Edgar,3,4,96,silks betray thy poor heart to woman: keep thy foot,male
92476,King Lear,Tragedy,Edgar,3,4,97,"out of brothels, thy hand out of plackets, thy pen",male
92477,King Lear,Tragedy,Edgar,3,4,98,"from lenders' books, and defy the foul fiend.",male
92478,King Lear,Tragedy,Edgar,3,4,99,Still through the hawthorn blows the cold wind:,male
92479,King Lear,Tragedy,Edgar,3,4,100,"Says suum, mun, ha, no, nonny.",male
92480,King Lear,Tragedy,Edgar,3,4,101,"Dolphin my boy, my boy, sessa! let him trot by.",male
92481,King Lear,Tragedy,King Lear,3,4,102,"Why, thou wert better in thy grave than to answer",male
92482,King Lear,Tragedy,King Lear,3,4,103,with thy uncovered body this extremity of the skies.,male
92483,King Lear,Tragedy,King Lear,3,4,104,Is man no more than this? Consider him well. Thou,male
92484,King Lear,Tragedy,King Lear,3,4,105,"owest the worm no silk, the beast no hide, the sheep",male
92485,King Lear,Tragedy,King Lear,3,4,106,"no wool, the cat no perfume. Ha! here's three on",male
92486,King Lear,Tragedy,King Lear,3,4,107,'s are sophisticated! Thou art the thing itself:,male
92487,King Lear,Tragedy,King Lear,3,4,108,"unaccommodated man is no more but such a poor bare,",male
92488,King Lear,Tragedy,King Lear,3,4,109,"forked animal as thou art. Off, off, you lendings!",male
92489,King Lear,Tragedy,King Lear,3,4,110,come unbutton here.,male
92490,King Lear,Tragedy,Fool,3,4,111,"Prithee, nuncle, be contented; 'tis a naughty night",male
92491,King Lear,Tragedy,Fool,3,4,112,to swim in. Now a little fire in a wild field were,male
92492,King Lear,Tragedy,Fool,3,4,113,"like an old lecher's heart; a small spark, all the",male
92493,King Lear,Tragedy,Fool,3,4,114,"rest on's body cold. Look, here comes a walking fire.",male
92494,King Lear,Tragedy,Edgar,3,4,115,This is the foul fiend Flibbertigibbet: he begins,male
92495,King Lear,Tragedy,Edgar,3,4,116,"at curfew, and walks till the first cock; he gives",male
92496,King Lear,Tragedy,Edgar,3,4,117,"the web and the pin, squints the eye, and makes the",male
92497,King Lear,Tragedy,Edgar,3,4,118,"hare-lip; mildews the white wheat, and hurts the",male
92498,King Lear,Tragedy,Edgar,3,4,119,poor creature of earth.,male
92499,King Lear,Tragedy,Edgar,3,4,120,S. Withold footed thrice the old;,male
92500,King Lear,Tragedy,Edgar,3,4,121,"He met the night-mare, and her nine-fold;",male
92501,King Lear,Tragedy,Edgar,3,4,122,"Bid her alight,",male
92502,King Lear,Tragedy,Edgar,3,4,123,"And her troth plight,",male
92503,King Lear,Tragedy,Edgar,3,4,124,"And, aroint thee, witch, aroint thee!",male
92504,King Lear,Tragedy,Kent,3,4,125,How fares your grace?,male
92505,King Lear,Tragedy,King Lear,3,4,126,What's he?,male
92506,King Lear,Tragedy,Kent,3,4,127,Who's there? What is't you seek?,male
92507,King Lear,Tragedy,Gloucester,3,4,128,What are you there? Your names?,male
92508,King Lear,Tragedy,Edgar,3,4,129,"Poor Tom; that eats the swimming frog, the toad,",male
92509,King Lear,Tragedy,Edgar,3,4,130,"the tadpole, the wall-newt and the water; that in",male
92510,King Lear,Tragedy,Edgar,3,4,131,"the fury of his heart, when the foul fiend rages,",male
92511,King Lear,Tragedy,Edgar,3,4,132,eats cow-dung for sallets; swallows the old rat and,male
92512,King Lear,Tragedy,Edgar,3,4,133,the ditch-dog; drinks the green mantle of the,male
92513,King Lear,Tragedy,Edgar,3,4,134,standing pool; who is whipped from tithing to,male
92514,King Lear,Tragedy,Edgar,3,4,135,"tithing, and stock- punished, and imprisoned; who",male
92515,King Lear,Tragedy,Edgar,3,4,136,"hath had three suits to his back, six shirts to his",male
92516,King Lear,Tragedy,Edgar,3,4,137,"body, horse to ride, and weapon to wear;",male
92517,King Lear,Tragedy,Edgar,3,4,138,"But mice and rats, and such small deer,",male
92518,King Lear,Tragedy,Edgar,3,4,139,Have been Tom's food for seven long year.,male
92519,King Lear,Tragedy,Edgar,3,4,140,"Beware my follower. Peace, Smulkin; peace, thou fiend!",male
92520,King Lear,Tragedy,Gloucester,3,4,141,"What, hath your grace no better company?",male
92521,King Lear,Tragedy,Edgar,3,4,142,The prince of darkness is a gentleman:,male
92522,King Lear,Tragedy,Edgar,3,4,143,"Modo he's call'd, and Mahu.",male
92523,King Lear,Tragedy,Gloucester,3,4,144,"Our flesh and blood is grown so vile, my lord,",male
92524,King Lear,Tragedy,Gloucester,3,4,145,That it doth hate what gets it.,male
92525,King Lear,Tragedy,Edgar,3,4,146,Poor Tom's a-cold.,male
92526,King Lear,Tragedy,Gloucester,3,4,147,Go in with me: my duty cannot suffer,male
92527,King Lear,Tragedy,Gloucester,3,4,148,To obey in all your daughters' hard commands:,male
92528,King Lear,Tragedy,Gloucester,3,4,149,"Though their injunction be to bar my doors,",male
92529,King Lear,Tragedy,Gloucester,3,4,150,"And let this tyrannous night take hold upon you,",male
92530,King Lear,Tragedy,Gloucester,3,4,151,"Yet have I ventured to come seek you out,",male
92531,King Lear,Tragedy,Gloucester,3,4,152,And bring you where both fire and food is ready.,male
92532,King Lear,Tragedy,King Lear,3,4,153,First let me talk with this philosopher.,male
92533,King Lear,Tragedy,King Lear,3,4,154,What is the cause of thunder?,male
92534,King Lear,Tragedy,Kent,3,4,155,"Good my lord, take his offer; go into the house.",male
92535,King Lear,Tragedy,King Lear,3,4,156,I'll talk a word with this same learned Theban.,male
92536,King Lear,Tragedy,King Lear,3,4,157,What is your study?,male
92537,King Lear,Tragedy,Edgar,3,4,158,"How to prevent the fiend, and to kill vermin.",male
92538,King Lear,Tragedy,King Lear,3,4,159,Let me ask you one word in private.,male
92539,King Lear,Tragedy,Kent,3,4,160,"Importune him once more to go, my lord;",male
92540,King Lear,Tragedy,Kent,3,4,161,His wits begin to unsettle.,male
92541,King Lear,Tragedy,Gloucester,3,4,162,Canst thou blame him?,male
92542,King Lear,Tragedy,Gloucester,3,4,163,"His daughters seek his death: ah, that good Kent!",male
92543,King Lear,Tragedy,Gloucester,3,4,164,"He said it would be thus, poor banish'd man!",male
92544,King Lear,Tragedy,Gloucester,3,4,165,"Thou say'st the king grows mad; I'll tell thee, friend,",male
92545,King Lear,Tragedy,Gloucester,3,4,166,"I am almost mad myself: I had a son,",male
92546,King Lear,Tragedy,Gloucester,3,4,167,"Now outlaw'd from my blood; he sought my life,",male
92547,King Lear,Tragedy,Gloucester,3,4,168,"But lately, very late: I loved him, friend;",male
92548,King Lear,Tragedy,Gloucester,3,4,169,"No father his son dearer: truth to tell thee,",male
92549,King Lear,Tragedy,Gloucester,3,4,170,The grief hath crazed my wits. What a night's this!,male
92550,King Lear,Tragedy,Gloucester,3,4,171,"I do beseech your grace,--",male
92551,King Lear,Tragedy,King Lear,3,4,172,"O, cry your mercy, sir.",male
92552,King Lear,Tragedy,King Lear,3,4,173,"Noble philosopher, your company.",male
92553,King Lear,Tragedy,Edgar,3,4,174,Tom's a-cold.,male
92554,King Lear,Tragedy,Gloucester,3,4,175,"In, fellow, there, into the hovel: keep thee warm.",male
92555,King Lear,Tragedy,King Lear,3,4,176,Come let's in all.,male
92556,King Lear,Tragedy,Kent,3,4,177,"This way, my lord.",male
92557,King Lear,Tragedy,King Lear,3,4,178,With him;,male
92558,King Lear,Tragedy,King Lear,3,4,179,I will keep still with my philosopher.,male
92559,King Lear,Tragedy,Kent,3,4,180,"Good my lord, soothe him; let him take the fellow.",male
92560,King Lear,Tragedy,Gloucester,3,4,181,Take him you on.,male
92561,King Lear,Tragedy,Kent,3,4,182,"Sirrah, come on; go along with us.",male
92562,King Lear,Tragedy,King Lear,3,4,183,"Come, good Athenian.",male
92563,King Lear,Tragedy,Gloucester,3,4,184,"No words, no words: hush.",male
92564,King Lear,Tragedy,Edgar,3,4,185,"Child Rowland to the dark tower came,",male
92565,King Lear,Tragedy,Edgar,3,4,186,"His word was still,--Fie, foh, and fum,",male
92566,King Lear,Tragedy,Edgar,3,4,187,I smell the blood of a British man.,male
92567,King Lear,Tragedy,Cornwall,3,5,1,I will have my revenge ere I depart his house.,male
92568,King Lear,Tragedy,Edmund,3,5,2,"How, my lord, I may be censured, that nature thus",male
92569,King Lear,Tragedy,Edmund,3,5,3,"gives way to loyalty, something fears me to think",male
92570,King Lear,Tragedy,Edmund,3,5,4,of.,male
92571,King Lear,Tragedy,Cornwall,3,5,5,"I now perceive, it was not altogether your",male
92572,King Lear,Tragedy,Cornwall,3,5,6,brother's evil disposition made him seek his death;,male
92573,King Lear,Tragedy,Cornwall,3,5,7,"but a provoking merit, set a-work by a reprovable",male
92574,King Lear,Tragedy,Cornwall,3,5,8,badness in himself.,male
92575,King Lear,Tragedy,Edmund,3,5,9,"How malicious is my fortune, that I must repent to",male
92576,King Lear,Tragedy,Edmund,3,5,10,"be just! This is the letter he spoke of, which",male
92577,King Lear,Tragedy,Edmund,3,5,11,approves him an intelligent party to the advantages,male
92578,King Lear,Tragedy,Edmund,3,5,12,"of France: O heavens! that this treason were not,",male
92579,King Lear,Tragedy,Edmund,3,5,13,or not I the detector!,male
92580,King Lear,Tragedy,Cornwall,3,5,14,o with me to the duchess.,male
92581,King Lear,Tragedy,Edmund,3,5,15,"If the matter of this paper be certain, you have",male
92582,King Lear,Tragedy,Edmund,3,5,16,mighty business in hand.,male
92583,King Lear,Tragedy,Cornwall,3,5,17,"True or false, it hath made thee earl of",male
92584,King Lear,Tragedy,Cornwall,3,5,18,"Gloucester. Seek out where thy father is, that he",male
92585,King Lear,Tragedy,Cornwall,3,5,19,may be ready for our apprehension.,male
92586,King Lear,Tragedy,Edmund,3,5,20,"[Aside]  If I find him comforting the king, it will",male
92587,King Lear,Tragedy,Edmund,3,5,21,stuff his suspicion more fully.--I will persevere in,male
92588,King Lear,Tragedy,Edmund,3,5,22,"my course of loyalty, though the conflict be sore",male
92589,King Lear,Tragedy,Edmund,3,5,23,between that and my blood.,male
92590,King Lear,Tragedy,Cornwall,3,5,24,I will lay trust upon thee; and thou shalt find a,male
92591,King Lear,Tragedy,Cornwall,3,5,25,dearer father in my love.,male
92592,King Lear,Tragedy,Gloucester,3,6,1,Here is better than the open air; take it,male
92593,King Lear,Tragedy,Gloucester,3,6,2,thankfully. I will piece out the comfort with what,male
92594,King Lear,Tragedy,Gloucester,3,6,3,addition I can: I will not be long from you.,male
92595,King Lear,Tragedy,Kent,3,6,4,All the power of his wits have given way to his,male
92596,King Lear,Tragedy,Kent,3,6,5,impatience: the gods reward your kindness!,male
92597,King Lear,Tragedy,Edgar,3,6,6,Frateretto calls me; and tells me,male
92598,King Lear,Tragedy,Edgar,3,6,7,Nero is an angler in the lake of darkness.,male
92599,King Lear,Tragedy,Edgar,3,6,8,"Pray, innocent, and beware the foul fiend.",male
92600,King Lear,Tragedy,Fool,3,6,9,"Prithee, nuncle, tell me whether a madman be a",male
92601,King Lear,Tragedy,Fool,3,6,10,gentleman or a yeoman?,male
92602,King Lear,Tragedy,King Lear,3,6,11,"A king, a king!",male
92603,King Lear,Tragedy,Fool,3,6,12,"No, he's a yeoman that has a gentleman to his son;",male
92604,King Lear,Tragedy,Fool,3,6,13,for he's a mad yeoman that sees his son a gentleman,male
92605,King Lear,Tragedy,Fool,3,6,14,before him.,male
92606,King Lear,Tragedy,King Lear,3,6,15,To have a thousand with red burning spits,male
92607,King Lear,Tragedy,King Lear,3,6,16,"Come hissing in upon 'em,--",male
92608,King Lear,Tragedy,Edgar,3,6,17,The foul fiend bites my back.,male
92609,King Lear,Tragedy,Fool,3,6,18,"He's mad that trusts in the tameness of a wolf, a",male
92610,King Lear,Tragedy,Fool,3,6,19,"horse's health, a boy's love, or a whore's oath.",male
92611,King Lear,Tragedy,King Lear,3,6,20,It shall be done; I will arraign them straight.,male
92612,King Lear,Tragedy,King Lear,3,6,21,"Come, sit thou here, most learned justicer;",male
92613,King Lear,Tragedy,King Lear,3,6,22,"Thou, sapient sir, sit here. Now, you she foxes!",male
92614,King Lear,Tragedy,Edgar,3,6,23,"Look, where he stands and glares!",male
92615,King Lear,Tragedy,Edgar,3,6,24,"Wantest thou eyes at trial, madam?",male
92616,King Lear,Tragedy,Edgar,3,6,25,"Come o'er the bourn, Bessy, to me,--",male
92617,King Lear,Tragedy,Fool,3,6,26,"Her boat hath a leak,",male
92618,King Lear,Tragedy,Fool,3,6,27,And she must not speak,male
92619,King Lear,Tragedy,Fool,3,6,28,Why she dares not come over to thee.,male
92620,King Lear,Tragedy,Edgar,3,6,29,The foul fiend haunts poor Tom in the voice of a,male
92621,King Lear,Tragedy,Edgar,3,6,30,nightingale. Hopdance cries in Tom's belly for two,male
92622,King Lear,Tragedy,Edgar,3,6,31,"white herring. Croak not, black angel; I have no",male
92623,King Lear,Tragedy,Edgar,3,6,32,food for thee.,male
92624,King Lear,Tragedy,Kent,3,6,33,"How do you, sir? Stand you not so amazed:",male
92625,King Lear,Tragedy,Kent,3,6,34,Will you lie down and rest upon the cushions?,male
92626,King Lear,Tragedy,King Lear,3,6,35,I'll see their trial first. Bring in the evidence.,male
92627,King Lear,Tragedy,King Lear,3,6,36,"Thou robed man of justice, take thy place;",male
92628,King Lear,Tragedy,King Lear,3,6,37,"And thou, his yoke-fellow of equity,",male
92629,King Lear,Tragedy,King Lear,3,6,38,Bench by his side:,male
92630,King Lear,Tragedy,King Lear,3,6,39,"you are o' the commission,",male
92631,King Lear,Tragedy,King Lear,3,6,40,Sit you too.,male
92632,King Lear,Tragedy,Edgar,3,6,41,Let us deal justly.,male
92633,King Lear,Tragedy,Edgar,3,6,42,"Sleepest or wakest thou, jolly shepherd?",male
92634,King Lear,Tragedy,Edgar,3,6,43,Thy sheep be in the corn;,male
92635,King Lear,Tragedy,Edgar,3,6,44,"And for one blast of thy minikin mouth,",male
92636,King Lear,Tragedy,Edgar,3,6,45,Thy sheep shall take no harm.,male
92637,King Lear,Tragedy,Edgar,3,6,46,Pur! the cat is gray.,male
92638,King Lear,Tragedy,King Lear,3,6,47,Arraign her first; 'tis Goneril. I here take my,male
92639,King Lear,Tragedy,King Lear,3,6,48,"oath before this honourable assembly, she kicked the",male
92640,King Lear,Tragedy,King Lear,3,6,49,poor king her father.,male
92641,King Lear,Tragedy,Fool,3,6,50,"Come hither, mistress. Is your name Goneril?",male
92642,King Lear,Tragedy,King Lear,3,6,51,She cannot deny it.,male
92643,King Lear,Tragedy,Fool,3,6,52,"Cry you mercy, I took you for a joint-stool.",male
92644,King Lear,Tragedy,King Lear,3,6,53,"And here's another, whose warp'd looks proclaim",male
92645,King Lear,Tragedy,King Lear,3,6,54,What store her heart is made on. Stop her there!,male
92646,King Lear,Tragedy,King Lear,3,6,55,"Arms, arms, sword, fire! Corruption in the place!",male
92647,King Lear,Tragedy,King Lear,3,6,56,"False justicer, why hast thou let her 'scape?",male
92648,King Lear,Tragedy,Edgar,3,6,57,Bless thy five wits!,male
92649,King Lear,Tragedy,Kent,3,6,58,"O pity! Sir, where is the patience now,",male
92650,King Lear,Tragedy,Kent,3,6,59,That thou so oft have boasted to retain?,male
92651,King Lear,Tragedy,Edgar,3,6,60,"[Aside]  My tears begin to take his part so much,",male
92652,King Lear,Tragedy,Edgar,3,6,61,They'll mar my counterfeiting.,male
92653,King Lear,Tragedy,King Lear,3,6,62,"The little dogs and all, Tray, Blanch, and",male
92654,King Lear,Tragedy,King Lear,3,6,63,"Sweet-heart, see, they bark at me.",male
92655,King Lear,Tragedy,Edgar,3,6,64,"Tom will throw his head at them. Avaunt, you curs!",male
92656,King Lear,Tragedy,Edgar,3,6,65,"Be thy mouth or black or white,",male
92657,King Lear,Tragedy,Edgar,3,6,66,Tooth that poisons if it bite;,male
92658,King Lear,Tragedy,Edgar,3,6,67,"Mastiff, grey-hound, mongrel grim,",male
92659,King Lear,Tragedy,Edgar,3,6,68,"Hound or spaniel, brach or lym,",male
92660,King Lear,Tragedy,Edgar,3,6,69,"Or bobtail tike or trundle-tail,",male
92661,King Lear,Tragedy,Edgar,3,6,70,Tom will make them weep and wail:,male
92662,King Lear,Tragedy,Edgar,3,6,71,"For, with throwing thus my head,",male
92663,King Lear,Tragedy,Edgar,3,6,72,"Dogs leap the hatch, and all are fled.",male
92664,King Lear,Tragedy,Edgar,3,6,73,"Do de, de, de. Sessa! Come, march to wakes and",male
92665,King Lear,Tragedy,Edgar,3,6,74,"fairs and market-towns. Poor Tom, thy horn is dry.",male
92666,King Lear,Tragedy,King Lear,3,6,75,Then let them anatomize Regan; see what breeds,male
92667,King Lear,Tragedy,King Lear,3,6,76,about her heart. Is there any cause in nature that,male
92668,King Lear,Tragedy,King Lear,3,6,77,makes these hard hearts?,male
92669,King Lear,Tragedy,King Lear,3,6,78,"You, sir, I entertain for one of my hundred; only I",male
92670,King Lear,Tragedy,King Lear,3,6,79,do not like the fashion of your garments: you will,male
92671,King Lear,Tragedy,King Lear,3,6,80,say they are Persian attire: but let them be changed.,male
92672,King Lear,Tragedy,Kent,3,6,81,"Now, good my lord, lie here and rest awhile.",male
92673,King Lear,Tragedy,King Lear,3,6,82,"Make no noise, make no noise; draw the curtains:",male
92674,King Lear,Tragedy,King Lear,3,6,83,"so, so, so. We'll go to supper i' he morning. So, so, so.",male
92675,King Lear,Tragedy,Fool,3,6,84,And I'll go to bed at noon.,male
92676,King Lear,Tragedy,Gloucester,3,6,85,"Come hither, friend: where is the king my master?",male
92677,King Lear,Tragedy,Kent,3,6,86,"Here, sir; but trouble him not, his wits are gone.",male
92678,King Lear,Tragedy,Gloucester,3,6,87,"Good friend, I prithee, take him in thy arms;",male
92679,King Lear,Tragedy,Gloucester,3,6,88,I have o'erheard a plot of death upon him:,male
92680,King Lear,Tragedy,Gloucester,3,6,89,"There is a litter ready; lay him in 't,",male
92681,King Lear,Tragedy,Gloucester,3,6,90,"And drive towards Dover, friend, where thou shalt meet",male
92682,King Lear,Tragedy,Gloucester,3,6,91,Both welcome and protection. Take up thy master:,male
92683,King Lear,Tragedy,Gloucester,3,6,92,"If thou shouldst dally half an hour, his life,",male
92684,King Lear,Tragedy,Gloucester,3,6,93,"With thine, and all that offer to defend him,",male
92685,King Lear,Tragedy,Gloucester,3,6,94,"Stand in assured loss: take up, take up;",male
92686,King Lear,Tragedy,Gloucester,3,6,95,"And follow me, that will to some provision",male
92687,King Lear,Tragedy,Gloucester,3,6,96,Give thee quick conduct.,male
92688,King Lear,Tragedy,Kent,3,6,97,Oppressed nature sleeps:,male
92689,King Lear,Tragedy,Kent,3,6,98,"This rest might yet have balm'd thy broken senses,",male
92690,King Lear,Tragedy,Kent,3,6,99,"Which, if convenience will not allow,",male
