Unnamed: 0,play_name,genre,character,act,scene,sentence,text,sex
92997,King Lear,Tragedy,Albany,4,2,81,Gloucester's eye!,male
92998,King Lear,Tragedy,Messenger,4,2,82,"A servant that he bred, thrill'd with remorse,",male
92999,King Lear,Tragedy,Messenger,4,2,83,"Opposed against the act, bending his sword",male
93000,King Lear,Tragedy,Messenger,4,2,84,"To his great master; who, thereat enraged,",male
93001,King Lear,Tragedy,Messenger,4,2,85,"Flew on him, and amongst them fell'd him dead;",male
93002,King Lear,Tragedy,Messenger,4,2,86,"But not without that harmful stroke, which since",male
93003,King Lear,Tragedy,Messenger,4,2,87,Hath pluck'd him after.,male
93004,King Lear,Tragedy,Albany,4,2,88,"This shows you are above,",male
93005,King Lear,Tragedy,Albany,4,2,89,"You justicers, that these our nether crimes",male
93006,King Lear,Tragedy,Albany,4,2,90,"So speedily can venge! But, O poor Gloucester!",male
93007,King Lear,Tragedy,Albany,4,2,91,Lost he his other eye?,male
93008,King Lear,Tragedy,Messenger,4,2,92,"Both, both, my lord.",male
93009,King Lear,Tragedy,Messenger,4,2,93,"This letter, madam, craves a speedy answer;",male
93010,King Lear,Tragedy,Messenger,4,2,94,'Tis from your sister.,male
93011,King Lear,Tragedy,Goneril,4,2,95,[Aside]              One way I like this well;,female
93012,King Lear,Tragedy,Goneril,4,2,96,"But being widow, and my Gloucester with her,",female
93013,King Lear,Tragedy,Goneril,4,2,97,May all the building in my fancy pluck,female
93014,King Lear,Tragedy,Goneril,4,2,98,"Upon my hateful life: another way,",female
93015,King Lear,Tragedy,Goneril,4,2,99,"The news is not so tart.--I'll read, and answer.",female
93016,King Lear,Tragedy,Albany,4,2,100,Where was his son when they did take his eyes?,male
93017,King Lear,Tragedy,Messenger,4,2,101,Come with my lady hither.,male
93018,King Lear,Tragedy,Albany,4,2,102,He is not here.,male
93019,King Lear,Tragedy,Messenger,4,2,103,"No, my good lord; I met him back again.",male
93020,King Lear,Tragedy,Albany,4,2,104,Knows he the wickedness?,male
93021,King Lear,Tragedy,Messenger,4,2,105,"Ay, my good lord; 'twas he inform'd against him;",male
93022,King Lear,Tragedy,Messenger,4,2,106,"And quit the house on purpose, that their punishment",male
93023,King Lear,Tragedy,Messenger,4,2,107,Might have the freer course.,male
93024,King Lear,Tragedy,Albany,4,2,108,"Gloucester, I live",male
93025,King Lear,Tragedy,Albany,4,2,109,"To thank thee for the love thou show'dst the king,",male
93026,King Lear,Tragedy,Albany,4,2,110,"And to revenge thine eyes. Come hither, friend:",male
93027,King Lear,Tragedy,Albany,4,2,111,Tell me what more thou know'st.,male
93028,King Lear,Tragedy,Kent,4,3,1,Why the King of France is so suddenly gone back,male
93029,King Lear,Tragedy,Kent,4,3,2,know you the reason?,male
93030,King Lear,Tragedy,Gentleman,4,3,3,Something he left imperfect in the,male
93031,King Lear,Tragedy,Gentleman,4,3,4,"state, which since his coming forth is thought",male
93032,King Lear,Tragedy,Gentleman,4,3,5,of; which imports to the kingdom so much,male
93033,King Lear,Tragedy,Gentleman,4,3,6,"fear and danger, that his personal return was",male
93034,King Lear,Tragedy,Gentleman,4,3,7,most required and necessary.,male
93035,King Lear,Tragedy,Kent,4,3,8,Who hath he left behind him general?,male
93036,King Lear,Tragedy,Gentleman,4,3,9,"The Marshal of France, Monsieur La Far.",male
93037,King Lear,Tragedy,Kent,4,3,10,Did your letters pierce the queen to any,male
93038,King Lear,Tragedy,Kent,4,3,11,demonstration of grief?,male
93039,King Lear,Tragedy,Gentleman,4,3,12,"Ay, sir; she took them, read them in my presence;",male
93040,King Lear,Tragedy,Gentleman,4,3,13,And now and then an ample tear trill'd down,male
93041,King Lear,Tragedy,Gentleman,4,3,14,Her delicate cheek: it seem'd she was a queen,male
93042,King Lear,Tragedy,Gentleman,4,3,15,"Over her passion; who, most rebel-like,",male
93043,King Lear,Tragedy,Gentleman,4,3,16,Sought to be king o'er her.,male
93044,King Lear,Tragedy,Kent,4,3,17,"O, then it moved her.",male
93045,King Lear,Tragedy,Gentleman,4,3,18,Not to a rage: patience and sorrow strove,male
93046,King Lear,Tragedy,Gentleman,4,3,19,Who should express her goodliest. You have seen,male
93047,King Lear,Tragedy,Gentleman,4,3,20,Sunshine and rain at once: her smiles and tears,male
93048,King Lear,Tragedy,Gentleman,4,3,21,"Were like a better way: those happy smilets,",male
93049,King Lear,Tragedy,Gentleman,4,3,22,"That play'd on her ripe lip, seem'd not to know",male
93050,King Lear,Tragedy,Gentleman,4,3,23,"What guests were in her eyes; which parted thence,",male
93051,King Lear,Tragedy,Gentleman,4,3,24,"As pearls from diamonds dropp'd. In brief,",male
93052,King Lear,Tragedy,Gentleman,4,3,25,"Sorrow would be a rarity most beloved,",male
93053,King Lear,Tragedy,Gentleman,4,3,26,If all could so become it.,male
93054,King Lear,Tragedy,Kent,4,3,27,Made she no verbal question?,male
93055,King Lear,Tragedy,Gentleman,4,3,28,"'Faith, once or twice she heaved the name of 'father'",male
93056,King Lear,Tragedy,Gentleman,4,3,29,"Pantingly forth, as if it press'd her heart:",male
93057,King Lear,Tragedy,Gentleman,4,3,30,Cried 'Sisters! sisters! Shame of ladies! sisters!,male
93058,King Lear,Tragedy,Gentleman,4,3,31,"Kent! father! sisters! What, i' the storm? i' the night?",male
93059,King Lear,Tragedy,Gentleman,4,3,32,Let pity not be believed!' There she shook,male
93060,King Lear,Tragedy,Gentleman,4,3,33,"The holy water from her heavenly eyes,",male
93061,King Lear,Tragedy,Gentleman,4,3,34,And clamour moisten'd: then away she started,male
93062,King Lear,Tragedy,Gentleman,4,3,35,To deal with grief alone.,male
93063,King Lear,Tragedy,Kent,4,3,36,"It is the stars,",male
93064,King Lear,Tragedy,Kent,4,3,37,"The stars above us, govern our conditions;",male
93065,King Lear,Tragedy,Kent,4,3,38,Else one self mate and mate could not beget,male
93066,King Lear,Tragedy,Kent,4,3,39,Such different issues. You spoke not with her since?,male
93067,King Lear,Tragedy,Gentleman,4,3,40,No.,male
93068,King Lear,Tragedy,Kent,4,3,41,Was this before the king return'd?,male
93069,King Lear,Tragedy,Gentleman,4,3,42,"No, since.",male
93070,King Lear,Tragedy,Kent,4,3,43,"Well, sir, the poor distressed Lear's i' the town;",male
93071,King Lear,Tragedy,Kent,4,3,44,"Who sometime, in his better tune, remembers",male
93072,King Lear,Tragedy,Kent,4,3,45,"What we are come about, and by no means",male
93073,King Lear,Tragedy,Kent,4,3,46,Will yield to see his daughter.,male
93074,King Lear,Tragedy,Gentleman,4,3,47,"Why, good sir?",male
93075,King Lear,Tragedy,Kent,4,3,48,"A sovereign shame so elbows him: his own unkindness,",male
93076,King Lear,Tragedy,Kent,4,3,49,"That stripp'd her from his benediction, turn'd her",male
93077,King Lear,Tragedy,Kent,4,3,50,"To foreign casualties, gave her dear rights",male
93078,King Lear,Tragedy,Kent,4,3,51,"To his dog-hearted daughters, these things sting",male
93079,King Lear,Tragedy,Kent,4,3,52,"His mind so venomously, that burning shame",male
93080,King Lear,Tragedy,Kent,4,3,53,Detains him from Cordelia.,male
93081,King Lear,Tragedy,Gentleman,4,3,54,"Alack, poor gentleman!",male
93082,King Lear,Tragedy,Kent,4,3,55,Of Albany's and Cornwall's powers you heard not?,male
93083,King Lear,Tragedy,Gentleman,4,3,56,"'Tis so, they are afoot.",male
93084,King Lear,Tragedy,Kent,4,3,57,"Well, sir, I'll bring you to our master Lear,",male
93085,King Lear,Tragedy,Kent,4,3,58,And leave you to attend him: some dear cause,male
93086,King Lear,Tragedy,Kent,4,3,59,Will in concealment wrap me up awhile;,male
93087,King Lear,Tragedy,Kent,4,3,60,"When I am known aright, you shall not grieve",male
93088,King Lear,Tragedy,Kent,4,3,61,"Lending me this acquaintance. I pray you, go",male
93089,King Lear,Tragedy,Kent,4,3,62,Along with me.,male
93090,King Lear,Tragedy,Cordelia,4,4,1,"Alack, 'tis he: why, he was met even now",female
93091,King Lear,Tragedy,Cordelia,4,4,2,As mad as the vex'd sea; singing aloud;,female
93092,King Lear,Tragedy,Cordelia,4,4,3,"Crown'd with rank fumiter and furrow-weeds,",female
93093,King Lear,Tragedy,Cordelia,4,4,4,"With bur-docks, hemlock, nettles, cuckoo-flowers,",female
93094,King Lear,Tragedy,Cordelia,4,4,5,"Darnel, and all the idle weeds that grow",female
93095,King Lear,Tragedy,Cordelia,4,4,6,In our sustaining corn. A century send forth;,female
93096,King Lear,Tragedy,Cordelia,4,4,7,"Search every acre in the high-grown field,",female
93097,King Lear,Tragedy,Cordelia,4,4,8,And bring him to our eye.,female
93098,King Lear,Tragedy,Cordelia,4,4,9,What can man's wisdom,female
93099,King Lear,Tragedy,Cordelia,4,4,10,In the restoring his bereaved sense?,female
93100,King Lear,Tragedy,Cordelia,4,4,11,He that helps him take all my outward worth.,female
93101,King Lear,Tragedy,Doctor,4,4,12,"There is means, madam:",male
93102,King Lear,Tragedy,Doctor,4,4,13,"Our foster-nurse of nature is repose,",male
93103,King Lear,Tragedy,Doctor,4,4,14,"The which he lacks; that to provoke in him,",male
93104,King Lear,Tragedy,Doctor,4,4,15,"Are many simples operative, whose power",male
93105,King Lear,Tragedy,Doctor,4,4,16,Will close the eye of anguish.,male
93106,King Lear,Tragedy,Cordelia,4,4,17,"All blest secrets,",female
93107,King Lear,Tragedy,Cordelia,4,4,18,"All you unpublish'd virtues of the earth,",female
93108,King Lear,Tragedy,Cordelia,4,4,19,Spring with my tears! be aidant and remediate,female
93109,King Lear,Tragedy,Cordelia,4,4,20,"In the good man's distress! Seek, seek for him;",female
93110,King Lear,Tragedy,Cordelia,4,4,21,Lest his ungovern'd rage dissolve the life,female
93111,King Lear,Tragedy,Cordelia,4,4,22,That wants the means to lead it.,female
93112,King Lear,Tragedy,Messenger,4,4,23,"News, madam;",male
93113,King Lear,Tragedy,Messenger,4,4,24,The British powers are marching hitherward.,male
93114,King Lear,Tragedy,Cordelia,4,4,25,'Tis known before; our preparation stands,female
93115,King Lear,Tragedy,Cordelia,4,4,26,"In expectation of them. O dear father,",female
93116,King Lear,Tragedy,Cordelia,4,4,27,It is thy business that I go about;,female
93117,King Lear,Tragedy,Cordelia,4,4,28,Therefore great France,female
93118,King Lear,Tragedy,Cordelia,4,4,29,My mourning and important tears hath pitied.,female
93119,King Lear,Tragedy,Cordelia,4,4,30,"No blown ambition doth our arms incite,",female
93120,King Lear,Tragedy,Cordelia,4,4,31,"But love, dear love, and our aged father's right:",female
93121,King Lear,Tragedy,Cordelia,4,4,32,Soon may I hear and see him!,female
93122,King Lear,Tragedy,Regan,4,5,1,But are my brother's powers set forth?,female
93123,King Lear,Tragedy,Oswald,4,5,2,"Ay, madam.",male
93124,King Lear,Tragedy,Regan,4,5,3,Himself in person there?,female
93125,King Lear,Tragedy,Oswald,4,5,4,"Madam, with much ado:",male
93126,King Lear,Tragedy,Oswald,4,5,5,Your sister is the better soldier.,male
93127,King Lear,Tragedy,Regan,4,5,6,Lord Edmund spake not with your lord at home?,female
93128,King Lear,Tragedy,Oswald,4,5,7,"No, madam.",male
93129,King Lear,Tragedy,Regan,4,5,8,What might import my sister's letter to him?,female
93130,King Lear,Tragedy,Oswald,4,5,9,"I know not, lady.",male
93131,King Lear,Tragedy,Regan,4,5,10,"'Faith, he is posted hence on serious matter.",female
93132,King Lear,Tragedy,Regan,4,5,11,"It was great ignorance, Gloucester's eyes being out,",female
93133,King Lear,Tragedy,Regan,4,5,12,To let him live: where he arrives he moves,female
93134,King Lear,Tragedy,Regan,4,5,13,"All hearts against us: Edmund, I think, is gone,",female
93135,King Lear,Tragedy,Regan,4,5,14,"In pity of his misery, to dispatch",female
93136,King Lear,Tragedy,Regan,4,5,15,"His nighted life: moreover, to descry",female
93137,King Lear,Tragedy,Regan,4,5,16,The strength o' the enemy.,female
93138,King Lear,Tragedy,Oswald,4,5,17,"I must needs after him, madam, with my letter.",male
93139,King Lear,Tragedy,Regan,4,5,18,Our troops set forth to-morrow: stay with us;,female
93140,King Lear,Tragedy,Regan,4,5,19,The ways are dangerous.,female
93141,King Lear,Tragedy,Oswald,4,5,20,"I may not, madam:",male
93142,King Lear,Tragedy,Oswald,4,5,21,My lady charged my duty in this business.,male
93143,King Lear,Tragedy,Regan,4,5,22,Why should she write to Edmund? Might not you,female
93144,King Lear,Tragedy,Regan,4,5,23,"Transport her purposes by word? Belike,",female
93145,King Lear,Tragedy,Regan,4,5,24,"Something--I know not what: I'll love thee much,",female
93146,King Lear,Tragedy,Regan,4,5,25,Let me unseal the letter.,female
93147,King Lear,Tragedy,Oswald,4,5,26,"Madam, I had rather--",male
93148,King Lear,Tragedy,Regan,4,5,27,I know your lady does not love her husband;,female
93149,King Lear,Tragedy,Regan,4,5,28,I am sure of that: and at her late being here,female
93150,King Lear,Tragedy,Regan,4,5,29,She gave strange oeillades and most speaking looks,female
93151,King Lear,Tragedy,Regan,4,5,30,To noble Edmund. I know you are of her bosom.,female
93152,King Lear,Tragedy,Oswald,4,5,31,"I, madam?",male
93153,King Lear,Tragedy,Regan,4,5,32,I speak in understanding; you are; I know't:,female
93154,King Lear,Tragedy,Regan,4,5,33,"Therefore I do advise you, take this note:",female
93155,King Lear,Tragedy,Regan,4,5,34,My lord is dead; Edmund and I have talk'd;,female
93156,King Lear,Tragedy,Regan,4,5,35,And more convenient is he for my hand,female
93157,King Lear,Tragedy,Regan,4,5,36,Than for your lady's: you may gather more.,female
93158,King Lear,Tragedy,Regan,4,5,37,"If you do find him, pray you, give him this;",female
93159,King Lear,Tragedy,Regan,4,5,38,"And when your mistress hears thus much from you,",female
93160,King Lear,Tragedy,Regan,4,5,39,"I pray, desire her call her wisdom to her.",female
93161,King Lear,Tragedy,Regan,4,5,40,"So, fare you well.",female
93162,King Lear,Tragedy,Regan,4,5,41,"If you do chance to hear of that blind traitor,",female
93163,King Lear,Tragedy,Regan,4,5,42,Preferment falls on him that cuts him off.,female
93164,King Lear,Tragedy,Oswald,4,5,43,"Would I could meet him, madam! I should show",male
93165,King Lear,Tragedy,Oswald,4,5,44,What party I do follow.,male
93166,King Lear,Tragedy,Regan,4,5,45,Fare thee well.,female
93167,King Lear,Tragedy,Gloucester,4,6,1,When shall we come to the top of that same hill?,male
93168,King Lear,Tragedy,Edgar,4,6,2,"You do climb up it now: look, how we labour.",male
93169,King Lear,Tragedy,Gloucester,4,6,3,Methinks the ground is even.,male
93170,King Lear,Tragedy,Edgar,4,6,4,Horrible steep.,male
93171,King Lear,Tragedy,Edgar,4,6,5,"Hark, do you hear the sea?",male
93172,King Lear,Tragedy,Gloucester,4,6,6,"No, truly.",male
93173,King Lear,Tragedy,Edgar,4,6,7,"Why, then, your other senses grow imperfect",male
93174,King Lear,Tragedy,Edgar,4,6,8,By your eyes' anguish.,male
93175,King Lear,Tragedy,Gloucester,4,6,9,"So may it be, indeed:",male
93176,King Lear,Tragedy,Gloucester,4,6,10,Methinks thy voice is alter'd; and thou speak'st,male
93177,King Lear,Tragedy,Gloucester,4,6,11,In better phrase and matter than thou didst.,male
93178,King Lear,Tragedy,Edgar,4,6,12,You're much deceived: in nothing am I changed,male
93179,King Lear,Tragedy,Edgar,4,6,13,But in my garments.,male
93180,King Lear,Tragedy,Gloucester,4,6,14,Methinks you're better spoken.,male
93181,King Lear,Tragedy,Edgar,4,6,15,"Come on, sir; here's the place: stand still. How fearful",male
93182,King Lear,Tragedy,Edgar,4,6,16,"And dizzy 'tis, to cast one's eyes so low!",male
93183,King Lear,Tragedy,Edgar,4,6,17,The crows and choughs that wing the midway air,male
93184,King Lear,Tragedy,Edgar,4,6,18,Show scarce so gross as beetles: half way down,male
93185,King Lear,Tragedy,Edgar,4,6,19,"Hangs one that gathers samphire, dreadful trade!",male
93186,King Lear,Tragedy,Edgar,4,6,20,Methinks he seems no bigger than his head:,male
93187,King Lear,Tragedy,Edgar,4,6,21,"The fishermen, that walk upon the beach,",male
93188,King Lear,Tragedy,Edgar,4,6,22,"Appear like mice; and yond tall anchoring bark,",male
93189,King Lear,Tragedy,Edgar,4,6,23,"Diminish'd to her cock; her cock, a buoy",male
93190,King Lear,Tragedy,Edgar,4,6,24,"Almost too small for sight: the murmuring surge,",male
93191,King Lear,Tragedy,Edgar,4,6,25,"That on the unnumber'd idle pebbles chafes,",male
93192,King Lear,Tragedy,Edgar,4,6,26,Cannot be heard so high. I'll look no more;,male
93193,King Lear,Tragedy,Edgar,4,6,27,"Lest my brain turn, and the deficient sight",male
93194,King Lear,Tragedy,Edgar,4,6,28,Topple down headlong.,male
93195,King Lear,Tragedy,Gloucester,4,6,29,Set me where you stand.,male
93196,King Lear,Tragedy,Edgar,4,6,30,Give me your hand: you are now within a foot,male
93197,King Lear,Tragedy,Edgar,4,6,31,Of the extreme verge: for all beneath the moon,male
93198,King Lear,Tragedy,Edgar,4,6,32,Would I not leap upright.,male
93199,King Lear,Tragedy,Gloucester,4,6,33,Let go my hand.,male
93200,King Lear,Tragedy,Gloucester,4,6,34,"Here, friend, 's another purse; in it a jewel",male
93201,King Lear,Tragedy,Gloucester,4,6,35,Well worth a poor man's taking: fairies and gods,male
93202,King Lear,Tragedy,Gloucester,4,6,36,Prosper it with thee! Go thou farther off;,male
93203,King Lear,Tragedy,Gloucester,4,6,37,"Bid me farewell, and let me hear thee going.",male
93204,King Lear,Tragedy,Edgar,4,6,38,"Now fare you well, good sir.",male
93205,King Lear,Tragedy,Gloucester,4,6,39,With all my heart.,male
93206,King Lear,Tragedy,Edgar,4,6,40,Why I do trifle thus with his despair,male
93207,King Lear,Tragedy,Edgar,4,6,41,Is done to cure it.,male
93208,King Lear,Tragedy,Gloucester,4,6,42,[Kneeling]  O you mighty gods!,male
93209,King Lear,Tragedy,Gloucester,4,6,43,"This world I do renounce, and, in your sights,",male
93210,King Lear,Tragedy,Gloucester,4,6,44,Shake patiently my great affliction off:,male
93211,King Lear,Tragedy,Gloucester,4,6,45,"If I could bear it longer, and not fall",male
93212,King Lear,Tragedy,Gloucester,4,6,46,"To quarrel with your great opposeless wills,",male
93213,King Lear,Tragedy,Gloucester,4,6,47,My snuff and loathed part of nature should,male
93214,King Lear,Tragedy,Gloucester,4,6,48,"Burn itself out. If Edgar live, O, bless him!",male
93215,King Lear,Tragedy,Gloucester,4,6,49,"Now, fellow, fare thee well.",male
93216,King Lear,Tragedy,Edgar,4,6,50,"Gone, sir: farewell.",male
93217,King Lear,Tragedy,Edgar,4,6,51,And yet I know not how conceit may rob,male
93218,King Lear,Tragedy,Edgar,4,6,52,"The treasury of life, when life itself",male
93219,King Lear,Tragedy,Edgar,4,6,53,"Yields to the theft: had he been where he thought,",male
93220,King Lear,Tragedy,Edgar,4,6,54,"By this, had thought been past. Alive or dead?",male
93221,King Lear,Tragedy,Edgar,4,6,55,"Ho, you sir! friend! Hear you, sir! speak!",male
93222,King Lear,Tragedy,Edgar,4,6,56,Thus might he pass indeed: yet he revives.,male
93223,King Lear,Tragedy,Edgar,4,6,57,"What are you, sir?",male
93224,King Lear,Tragedy,Gloucester,4,6,58,"Away, and let me die.",male
93225,King Lear,Tragedy,Edgar,4,6,59,"Hadst thou been aught but gossamer, feathers, air,",male
93226,King Lear,Tragedy,Edgar,4,6,60,"So many fathom down precipitating,",male
93227,King Lear,Tragedy,Edgar,4,6,61,Thou'dst shiver'd like an egg: but thou dost breathe;,male
93228,King Lear,Tragedy,Edgar,4,6,62,Hast heavy substance; bleed'st not; speak'st; art sound.,male
93229,King Lear,Tragedy,Edgar,4,6,63,Ten masts at each make not the altitude,male
93230,King Lear,Tragedy,Edgar,4,6,64,Which thou hast perpendicularly fell:,male
93231,King Lear,Tragedy,Edgar,4,6,65,Thy life's a miracle. Speak yet again.,male
93232,King Lear,Tragedy,Gloucester,4,6,66,"But have I fall'n, or no?",male
93233,King Lear,Tragedy,Edgar,4,6,67,From the dread summit of this chalky bourn.,male
93234,King Lear,Tragedy,Edgar,4,6,68,Look up a-height; the shrill-gorged lark so far,male
93235,King Lear,Tragedy,Edgar,4,6,69,Cannot be seen or heard: do but look up.,male
93236,King Lear,Tragedy,Gloucester,4,6,70,"Alack, I have no eyes.",male
93237,King Lear,Tragedy,Gloucester,4,6,71,"Is wretchedness deprived that benefit,",male
93238,King Lear,Tragedy,Gloucester,4,6,72,"To end itself by death? 'Twas yet some comfort,",male
93239,King Lear,Tragedy,Gloucester,4,6,73,"When misery could beguile the tyrant's rage,",male
93240,King Lear,Tragedy,Gloucester,4,6,74,And frustrate his proud will.,male
93241,King Lear,Tragedy,Edgar,4,6,75,Give me your arm:,male
93242,King Lear,Tragedy,Edgar,4,6,76,Up: so. How is 't? Feel you your legs? You stand.,male
93243,King Lear,Tragedy,Gloucester,4,6,77,"Too well, too well.",male
93244,King Lear,Tragedy,Edgar,4,6,78,This is above all strangeness.,male
93245,King Lear,Tragedy,Edgar,4,6,79,"Upon the crown o' the cliff, what thing was that",male
93246,King Lear,Tragedy,Edgar,4,6,80,Which parted from you?,male
93247,King Lear,Tragedy,Gloucester,4,6,81,A poor unfortunate beggar.,male
93248,King Lear,Tragedy,Edgar,4,6,82,"As I stood here below, methought his eyes",male
93249,King Lear,Tragedy,Edgar,4,6,83,"Were two full moons; he had a thousand noses,",male
93250,King Lear,Tragedy,Edgar,4,6,84,Horns whelk'd and waved like the enridged sea:,male
93251,King Lear,Tragedy,Edgar,4,6,85,"It was some fiend; therefore, thou happy father,",male
93252,King Lear,Tragedy,Edgar,4,6,86,"Think that the clearest gods, who make them honours",male
93253,King Lear,Tragedy,Edgar,4,6,87,"Of men's impossibilities, have preserved thee.",male
93254,King Lear,Tragedy,Gloucester,4,6,88,I do remember now: henceforth I'll bear,male
93255,King Lear,Tragedy,Gloucester,4,6,89,Affliction till it do cry out itself,male
93256,King Lear,Tragedy,Gloucester,4,6,90,"'Enough, enough,' and die. That thing you speak of,",male
93257,King Lear,Tragedy,Gloucester,4,6,91,I took it for a man; often 'twould say,male
93258,King Lear,Tragedy,Gloucester,4,6,92,"'The fiend, the fiend:' he led me to that place.",male
93259,King Lear,Tragedy,Edgar,4,6,93,Bear free and patient thoughts. But who comes here?,male
93260,King Lear,Tragedy,Edgar,4,6,94,The safer sense will ne'er accommodate,male
93261,King Lear,Tragedy,Edgar,4,6,95,His master thus.,male
93262,King Lear,Tragedy,King Lear,4,6,96,"No, they cannot touch me for coining; I am the",male
93263,King Lear,Tragedy,King Lear,4,6,97,king himself.,male
93264,King Lear,Tragedy,Edgar,4,6,98,O thou side-piercing sight!,male
93265,King Lear,Tragedy,King Lear,4,6,99,Nature's above art in that respect. There's your,male
93266,King Lear,Tragedy,King Lear,4,6,100,press-money. That fellow handles his bow like a,male
93267,King Lear,Tragedy,King Lear,4,6,101,"crow-keeper: draw me a clothier's yard. Look,",male
93268,King Lear,Tragedy,King Lear,4,6,102,"look, a mouse! Peace, peace; this piece of toasted",male
93269,King Lear,Tragedy,King Lear,4,6,103,cheese will do 't. There's my gauntlet; I'll prove,male
93270,King Lear,Tragedy,King Lear,4,6,104,"it on a giant. Bring up the brown bills. O, well",male
93271,King Lear,Tragedy,King Lear,4,6,105,"flown, bird! i' the clout, i' the clout: hewgh!",male
93272,King Lear,Tragedy,King Lear,4,6,106,Give the word.,male
93273,King Lear,Tragedy,Edgar,4,6,107,Sweet marjoram.,male
93274,King Lear,Tragedy,King Lear,4,6,108,Pass.,male
93275,King Lear,Tragedy,Gloucester,4,6,109,I know that voice.,male
93276,King Lear,Tragedy,King Lear,4,6,110,"Ha! Goneril, with a white beard! They flattered",male
93277,King Lear,Tragedy,King Lear,4,6,111,me like a dog; and told me I had white hairs in my,male
93278,King Lear,Tragedy,King Lear,4,6,112,beard ere the black ones were there. To say 'ay',male
93279,King Lear,Tragedy,King Lear,4,6,113,and 'no' to every thing that I said!--'Ay' and 'no',male
93280,King Lear,Tragedy,King Lear,4,6,114,too was no good divinity. When the rain came to,male
93281,King Lear,Tragedy,King Lear,4,6,115,"wet me once, and the wind to make me chatter; when",male
93282,King Lear,Tragedy,King Lear,4,6,116,the thunder would not peace at my bidding; there I,male
93283,King Lear,Tragedy,King Lear,4,6,117,"found 'em, there I smelt 'em out. Go to, they are",male
93284,King Lear,Tragedy,King Lear,4,6,118,not men o' their words: they told me I was every,male
93285,King Lear,Tragedy,King Lear,4,6,119,"thing; 'tis a lie, I am not ague-proof.",male
93286,King Lear,Tragedy,Gloucester,4,6,120,The trick of that voice I do well remember:,male
93287,King Lear,Tragedy,Gloucester,4,6,121,Is 't not the king?,male
93288,King Lear,Tragedy,King Lear,4,6,122,"Ay, every inch a king:",male
93289,King Lear,Tragedy,King Lear,4,6,123,"When I do stare, see how the subject quakes.",male
93290,King Lear,Tragedy,King Lear,4,6,124,I pardon that man's life. What was thy cause? Adultery?,male
93291,King Lear,Tragedy,King Lear,4,6,125,Thou shalt not die: die for adultery! No:,male
93292,King Lear,Tragedy,King Lear,4,6,126,"The wren goes to 't, and the small gilded fly",male
93293,King Lear,Tragedy,King Lear,4,6,127,Does lecher in my sight.,male
93294,King Lear,Tragedy,King Lear,4,6,128,Let copulation thrive; for Gloucester's bastard son,male
93295,King Lear,Tragedy,King Lear,4,6,129,Was kinder to his father than my daughters,male
93296,King Lear,Tragedy,King Lear,4,6,130,Got 'tween the lawful sheets.,male
93297,King Lear,Tragedy,King Lear,4,6,131,"To 't, luxury, pell-mell! for I lack soldiers.",male
93298,King Lear,Tragedy,King Lear,4,6,132,"Behold yond simpering dame,",male
93299,King Lear,Tragedy,King Lear,4,6,133,Whose face between her forks presages snow;,male
93300,King Lear,Tragedy,King Lear,4,6,134,"That minces virtue, and does shake the head",male
93301,King Lear,Tragedy,King Lear,4,6,135,To hear of pleasure's name;,male
93302,King Lear,Tragedy,King Lear,4,6,136,"The fitchew, nor the soiled horse, goes to 't",male
93303,King Lear,Tragedy,King Lear,4,6,137,With a more riotous appetite.,male
93304,King Lear,Tragedy,King Lear,4,6,138,"Down from the waist they are Centaurs,",male
93305,King Lear,Tragedy,King Lear,4,6,139,Though women all above:,male
93306,King Lear,Tragedy,King Lear,4,6,140,"But to the girdle do the gods inherit,",male
