Unnamed: 0,play_name,genre,character,act,scene,sentence,text,sex,sentiment
73715,Richard III,History,First Murderer,1,3,356,"Fear not, my lord, we will not stand to prate;",male,0.0
73716,Richard III,History,First Murderer,1,3,357,Talkers are no good doers: be assured,male,-0.35
73717,Richard III,History,First Murderer,1,3,358,We come to use our hands and not our tongues.,male,0.0
73718,Richard III,History,Gloucester,1,3,359,"Your eyes drop millstones, when fools' eyes drop tears:",male,0.0
73719,Richard III,History,Gloucester,1,3,360,"I like you, lads; about your business straight;",male,0.2
73720,Richard III,History,Gloucester,1,3,361,"Go, go, dispatch.",male,0.0
73721,Richard III,History,First Murderer,1,3,362,"We will, my noble lord.",male,0.6
73722,Richard III,History,Brakenbury,1,4,1,Why looks your grace so heavily today?,male,-0.2
73723,Richard III,History,Clarence,1,4,2,"O, I have pass'd a miserable night,",male,-1.0
73724,Richard III,History,Clarence,1,4,3,"So full of ugly sights, of ghastly dreams,",male,-0.17
73725,Richard III,History,Clarence,1,4,4,"That, as I am a Christian faithful man,",male,0.0
73726,Richard III,History,Clarence,1,4,5,"I would not spend another such a night,",male,0.0
73727,Richard III,History,Clarence,1,4,6,"Though 'twere to buy a world of happy days,",male,0.8
73728,Richard III,History,Clarence,1,4,7,So full of dismal terror was the time!,male,0.44
73729,Richard III,History,Brakenbury,1,4,8,What was your dream? I long to hear you tell it.,male,-0.05
73730,Richard III,History,Clarence,1,4,9,"Methoughts that I had broken from the Tower,",male,-0.4
73731,Richard III,History,Clarence,1,4,10,And was embark'd to cross to Burgundy;,male,0.0
73732,Richard III,History,Clarence,1,4,11,"And, in my company, my brother Gloucester;",male,0.0
73733,Richard III,History,Clarence,1,4,12,Who from my cabin tempted me to walk,male,0.0
73734,Richard III,History,Clarence,1,4,13,"Upon the hatches: thence we looked toward England,",male,0.0
73735,Richard III,History,Clarence,1,4,14,"And cited up a thousand fearful times,",male,-0.9
73736,Richard III,History,Clarence,1,4,15,During the wars of York and Lancaster,male,0.0
73737,Richard III,History,Clarence,1,4,16,That had befall'n us. As we paced along,male,0.0
73738,Richard III,History,Clarence,1,4,17,"Upon the giddy footing of the hatches,",male,0.0
73739,Richard III,History,Clarence,1,4,18,"Methought that Gloucester stumbled; and, in falling,",male,0.0
73740,Richard III,History,Clarence,1,4,19,"Struck me, that thought to stay him, overboard,",male,-0.25
73741,Richard III,History,Clarence,1,4,20,Into the tumbling billows of the main.,male,0.17
73742,Richard III,History,Clarence,1,4,21,"Lord, Lord! methought, what pain it was to drown!",male,0.0
73743,Richard III,History,Clarence,1,4,22,What dreadful noise of waters in mine ears!,male,-1.0
73744,Richard III,History,Clarence,1,4,23,What ugly sights of death within mine eyes!,male,-0.88
73745,Richard III,History,Clarence,1,4,24,Methought I saw a thousand fearful wrecks;,male,-0.9
73746,Richard III,History,Clarence,1,4,25,Ten thousand men that fishes gnaw'd upon;,male,0.0
73747,Richard III,History,Clarence,1,4,26,"Wedges of gold, great anchors, heaps of pearl,",male,0.8
73748,Richard III,History,Clarence,1,4,27,"Inestimable stones, unvalued jewels,",male,0.0
73749,Richard III,History,Clarence,1,4,28,All scatter'd in the bottom of the sea:,male,0.0
73750,Richard III,History,Clarence,1,4,29,"Some lay in dead men's skulls; and, in those holes",male,-0.2
73751,Richard III,History,Clarence,1,4,30,"Where eyes did once inhabit, there were crept,",male,0.0
73752,Richard III,History,Clarence,1,4,31,"As 'twere in scorn of eyes, reflecting gems,",male,0.0
73753,Richard III,History,Clarence,1,4,32,"Which woo'd the slimy bottom of the deep,",male,0.0
73754,Richard III,History,Clarence,1,4,33,And mock'd the dead bones that lay scatter'd by.,male,-0.2
73755,Richard III,History,Brakenbury,1,4,34,Had you such leisure in the time of death,male,0.0
73756,Richard III,History,Brakenbury,1,4,35,To gaze upon the secrets of the deep?,male,0.0
73757,Richard III,History,Clarence,1,4,36,Methought I had; and often did I strive,male,0.0
73758,Richard III,History,Clarence,1,4,37,To yield the ghost: but still the envious flood,male,0.0
73759,Richard III,History,Clarence,1,4,38,"Kept in my soul, and would not let it forth",male,0.0
73760,Richard III,History,Clarence,1,4,39,"To seek the empty, vast and wandering air;",male,-0.05
73761,Richard III,History,Clarence,1,4,40,"But smother'd it within my panting bulk,",male,0.0
73762,Richard III,History,Clarence,1,4,41,Which almost burst to belch it in the sea.,male,0.0
73763,Richard III,History,Brakenbury,1,4,42,Awaked you not with this sore agony?,male,0.0
73764,Richard III,History,Clarence,1,4,43,"O, no, my dream was lengthen'd after life;",male,0.0
73765,Richard III,History,Clarence,1,4,44,"O, then began the tempest to my soul,",male,0.0
73766,Richard III,History,Clarence,1,4,45,"Who pass'd, methought, the melancholy flood,",male,0.0
73767,Richard III,History,Clarence,1,4,46,"With that grim ferryman which poets write of,",male,-1.0
73768,Richard III,History,Clarence,1,4,47,Unto the kingdom of perpetual night.,male,0.0
73769,Richard III,History,Clarence,1,4,48,"The first that there did greet my stranger soul,",male,0.25
73770,Richard III,History,Clarence,1,4,49,"Was my great father-in-law, renowned Warwick;",male,0.8
73771,Richard III,History,Clarence,1,4,50,"Who cried aloud, 'What scourge for perjury",male,0.0
73772,Richard III,History,Clarence,1,4,51,Can this dark monarchy afford false Clarence?',male,-0.28
73773,Richard III,History,Clarence,1,4,52,And so he vanish'd: then came wandering by,male,0.0
73774,Richard III,History,Clarence,1,4,53,"A shadow like an angel, with bright hair",male,0.7
73775,Richard III,History,Clarence,1,4,54,"Dabbled in blood; and he squeak'd out aloud,",male,0.0
73776,Richard III,History,Clarence,1,4,55,"'Clarence is come; false, fleeting, perjured Clarence,",male,-0.4
73777,Richard III,History,Clarence,1,4,56,That stabb'd me in the field by Tewksbury;,male,0.0
73778,Richard III,History,Clarence,1,4,57,"Seize on him, Furies, take him to your torments!'",male,0.0
73779,Richard III,History,Clarence,1,4,58,"With that, methoughts, a legion of foul fiends",male,0.0
73780,Richard III,History,Clarence,1,4,59,"Environ'd me about, and howled in mine ears",male,0.0
73781,Richard III,History,Clarence,1,4,60,"Such hideous cries, that with the very noise",male,0.1
73782,Richard III,History,Clarence,1,4,61,"I trembling waked, and for a season after",male,0.0
73783,Richard III,History,Clarence,1,4,62,"Could not believe but that I was in hell,",male,0.0
73784,Richard III,History,Clarence,1,4,63,Such terrible impression made the dream.,male,-0.5
73785,Richard III,History,Brakenbury,1,4,64,"No marvel, my lord, though it affrighted you;",male,0.0
73786,Richard III,History,Brakenbury,1,4,65,"I promise, I am afraid to hear you tell it.",male,-0.6
73787,Richard III,History,Clarence,1,4,66,"O Brakenbury, I have done those things,",male,0.0
73788,Richard III,History,Clarence,1,4,67,"Which now bear evidence against my soul,",male,0.0
73789,Richard III,History,Clarence,1,4,68,For Edward's sake; and see how he requites me!,male,0.0
73790,Richard III,History,Clarence,1,4,69,"O God! if my deep prayers cannot appease thee,",male,0.0
73791,Richard III,History,Clarence,1,4,70,"But thou wilt be avenged on my misdeeds,",male,0.0
73792,Richard III,History,Clarence,1,4,71,"Yet execute thy wrath in me alone,",male,0.0
73793,Richard III,History,Clarence,1,4,72,"O, spare my guiltless wife and my poor children!",male,-0.5
73794,Richard III,History,Clarence,1,4,73,"I pray thee, gentle keeper, stay by me;",male,0.2
73795,Richard III,History,Clarence,1,4,74,"My soul is heavy, and I fain would sleep.",male,-0.2
73796,Richard III,History,Brakenbury,1,4,75,"I will, my lord: God give your grace good rest!",male,0.88
73797,Richard III,History,Brakenbury,1,4,76,"Sorrow breaks seasons and reposing hours,",male,0.0
73798,Richard III,History,Brakenbury,1,4,77,"Makes the night morning, and the noon-tide night.",male,0.0
73799,Richard III,History,Brakenbury,1,4,78,"Princes have but their tides for their glories,",male,0.0
73800,Richard III,History,Brakenbury,1,4,79,An outward honour for an inward toil;,male,0.0
73801,Richard III,History,Brakenbury,1,4,80,"And, for unfelt imagination,",male,0.0
73802,Richard III,History,Brakenbury,1,4,81,They often feel a world of restless cares:,male,0.0
73803,Richard III,History,Brakenbury,1,4,82,"So that, betwixt their tides and low names,",male,0.0
73804,Richard III,History,Brakenbury,1,4,83,There's nothing differs but the outward fame.,male,0.0
73805,Richard III,History,First Murderer,1,4,84,Ho! who's here?,male,0.0
73806,Richard III,History,Brakenbury,1,4,85,"In God's name what are you, and how came you hither?",male,0.0
73807,Richard III,History,First Murderer,1,4,86,"I would speak with Clarence, and I came hither on my legs.",male,0.0
73808,Richard III,History,Brakenbury,1,4,87,"Yea, are you so brief?",male,0.0
73809,Richard III,History,Second Murderer,1,4,88,"O sir, it is better to be brief than tedious. Show",male,0.0
73810,Richard III,History,Second Murderer,1,4,89,him our commission; talk no more.,male,-0.25
73811,Richard III,History,Brakenbury,1,4,90,"I am, in this, commanded to deliver",male,0.0
73812,Richard III,History,Brakenbury,1,4,91,The noble Duke of Clarence to your hands:,male,0.6
73813,Richard III,History,Brakenbury,1,4,92,"I will not reason what is meant hereby,",male,0.0
73814,Richard III,History,Brakenbury,1,4,93,Because I will be guiltless of the meaning.,male,0.0
73815,Richard III,History,Brakenbury,1,4,94,"Here are the keys, there sits the duke asleep:",male,0.0
73816,Richard III,History,Brakenbury,1,4,95,I'll to the king; and signify to him,male,0.0
73817,Richard III,History,Brakenbury,1,4,96,That thus I have resign'd my charge to you.,male,0.0
73818,Richard III,History,First Murderer,1,4,97,"Do so, it is a point of wisdom: fare you well.",male,0.0
73819,Richard III,History,Second Murderer,1,4,98,"What, shall we stab him as he sleeps?",male,0.0
73820,Richard III,History,First Murderer,1,4,99,"No; then he will say 'twas done cowardly, when he wakes.",male,0.0
73821,Richard III,History,Second Murderer,1,4,100,"When he wakes! why, fool, he shall never wake till",male,0.0
73822,Richard III,History,Second Murderer,1,4,101,the judgment-day.,male,0.0
73823,Richard III,History,First Murderer,1,4,102,"Why, then he will say we stabbed him sleeping.",male,0.0
73824,Richard III,History,Second Murderer,1,4,103,The urging of that word 'judgment' hath bred a kind,male,0.6
73825,Richard III,History,Second Murderer,1,4,104,of remorse in me.,male,0.0
73826,Richard III,History,First Murderer,1,4,105,"What, art thou afraid?",male,-0.6
73827,Richard III,History,Second Murderer,1,4,106,"Not to kill him, having a warrant for it; but to be",male,0.0
73828,Richard III,History,Second Murderer,1,4,107,"damned for killing him, from which no warrant can defend us.",male,0.0
73829,Richard III,History,First Murderer,1,4,108,I thought thou hadst been resolute.,male,0.0
73830,Richard III,History,Second Murderer,1,4,109,"So I am, to let him live.",male,0.14
73831,Richard III,History,First Murderer,1,4,110,"Back to the Duke of Gloucester, tell him so.",male,0.0
73832,Richard III,History,Second Murderer,1,4,111,"I pray thee, stay a while: I hope my holy humour",male,0.0
73833,Richard III,History,Second Murderer,1,4,112,will change; 'twas wont to hold me but while one,male,0.0
73834,Richard III,History,Second Murderer,1,4,113,would tell twenty.,male,0.0
73835,Richard III,History,First Murderer,1,4,114,How dost thou feel thyself now?,male,0.0
73836,Richard III,History,Second Murderer,1,4,115,"'Faith, some certain dregs of conscience are yet",male,0.21
73837,Richard III,History,Second Murderer,1,4,116,within me.,male,0.0
73838,Richard III,History,First Murderer,1,4,117,"Remember our reward, when the deed is done.",male,0.0
73839,Richard III,History,Second Murderer,1,4,118,"'Zounds, he dies: I had forgot the reward.",male,0.0
73840,Richard III,History,First Murderer,1,4,119,Where is thy conscience now?,male,0.0
73841,Richard III,History,Second Murderer,1,4,120,In the Duke of Gloucester's purse.,male,0.0
73842,Richard III,History,First Murderer,1,4,121,"So when he opens his purse to give us our reward,",male,0.0
73843,Richard III,History,First Murderer,1,4,122,thy conscience flies out.,male,0.0
73844,Richard III,History,Second Murderer,1,4,123,Let it go; there's few or none will entertain it.,male,-0.2
73845,Richard III,History,First Murderer,1,4,124,How if it come to thee again?,male,0.0
73846,Richard III,History,Second Murderer,1,4,125,I'll not meddle with it: it is a dangerous thing: it,male,-0.6
73847,Richard III,History,Second Murderer,1,4,126,"makes a man a coward: a man cannot steal, but it",male,0.0
73848,Richard III,History,Second Murderer,1,4,127,"accuseth him; he cannot swear, but it cheques him;",male,0.0
73849,Richard III,History,Second Murderer,1,4,128,"he cannot lie with his neighbour's wife, but it",male,0.0
73850,Richard III,History,Second Murderer,1,4,129,detects him: 'tis a blushing shamefast spirit that,male,0.0
73851,Richard III,History,Second Murderer,1,4,130,mutinies in a man's bosom; it fills one full of,male,0.35
73852,Richard III,History,Second Murderer,1,4,131,obstacles: it made me once restore a purse of gold,male,-0.05
73853,Richard III,History,Second Murderer,1,4,132,that I found; it beggars any man that keeps it: it,male,0.0
73854,Richard III,History,Second Murderer,1,4,133,is turned out of all towns and cities for a,male,0.0
73855,Richard III,History,Second Murderer,1,4,134,dangerous thing; and every man that means to live,male,-0.23
73856,Richard III,History,Second Murderer,1,4,135,well endeavours to trust to himself and to live,male,0.14
73857,Richard III,History,Second Murderer,1,4,136,without it.,male,0.0
73858,Richard III,History,First Murderer,1,4,137,"'Zounds, it is even now at my elbow, persuading me",male,0.0
73859,Richard III,History,First Murderer,1,4,138,not to kill the duke.,male,0.0
73860,Richard III,History,Second Murderer,1,4,139,"Take the devil in thy mind, and relieve him not: he",male,0.0
73861,Richard III,History,Second Murderer,1,4,140,would insinuate with thee but to make thee sigh.,male,0.0
73862,Richard III,History,First Murderer,1,4,141,"Tut, I am strong-framed, he cannot prevail with me,",male,0.0
73863,Richard III,History,First Murderer,1,4,142,I warrant thee.,male,0.0
73864,Richard III,History,Second Murderer,1,4,143,Spoke like a tail fellow that respects his,male,0.0
73865,Richard III,History,Second Murderer,1,4,144,"reputation. Come, shall we to this gear?",male,0.0
73866,Richard III,History,First Murderer,1,4,145,Take him over the costard with the hilts of thy,male,0.0
73867,Richard III,History,First Murderer,1,4,146,"sword, and then we will chop him in the malmsey-butt",male,0.0
73868,Richard III,History,First Murderer,1,4,147,in the next room.,male,0.0
73869,Richard III,History,Second Murderer,1,4,148,O excellent devise! make a sop of him.,male,1.0
73870,Richard III,History,First Murderer,1,4,149,Hark! he stirs: shall I strike?,male,0.0
73871,Richard III,History,Second Murderer,1,4,150,"No, first let's reason with him.",male,-0.12
73872,Richard III,History,Clarence,1,4,151,"Where art thou, keeper? give me a cup of wine.",male,0.0
73873,Richard III,History,Second Murderer,1,4,152,"You shall have wine enough, my lord, anon.",male,0.0
73874,Richard III,History,Clarence,1,4,153,"In God's name, what art thou?",male,0.0
73875,Richard III,History,Second Murderer,1,4,154,"A man, as you are.",male,0.0
73876,Richard III,History,Clarence,1,4,155,"But not, as I am, royal.",male,0.0
73877,Richard III,History,Second Murderer,1,4,156,"Nor you, as we are, loyal.",male,0.33
73878,Richard III,History,Clarence,1,4,157,"Thy voice is thunder, but thy looks are humble.",male,-0.2
73879,Richard III,History,Second Murderer,1,4,158,"My voice is now the king's, my looks mine own.",male,0.6
73880,Richard III,History,Clarence,1,4,159,How darkly and how deadly dost thou speak!,male,-0.2
73881,Richard III,History,Clarence,1,4,160,Your eyes do menace me: why look you pale?,male,-0.21
73882,Richard III,History,Clarence,1,4,161,Who sent you hither? Wherefore do you come?,male,0.0
73883,Richard III,History,Both,1,4,162,"To, to, to--",male,0.0
73884,Richard III,History,Clarence,1,4,163,To murder me?,male,0.0
73885,Richard III,History,Both,1,4,164,"Ay, ay.",male,0.0
73886,Richard III,History,Clarence,1,4,165,"You scarcely have the hearts to tell me so,",male,0.0
73887,Richard III,History,Clarence,1,4,166,And therefore cannot have the hearts to do it.,male,0.0
73888,Richard III,History,Clarence,1,4,167,"Wherein, my friends, have I offended you?",male,0.0
73889,Richard III,History,First Murderer,1,4,168,"Offended us you have not, but the king.",male,0.0
73890,Richard III,History,Clarence,1,4,169,I shall be reconciled to him again.,male,0.0
73891,Richard III,History,Second Murderer,1,4,170,"Never, my lord; therefore prepare to die.",male,0.0
73892,Richard III,History,Clarence,1,4,171,Are you call'd forth from out a world of men,male,0.0
73893,Richard III,History,Clarence,1,4,172,To slay the innocent? What is my offence?,male,0.5
73894,Richard III,History,Clarence,1,4,173,Where are the evidence that do accuse me?,male,0.0
73895,Richard III,History,Clarence,1,4,174,What lawful quest have given their verdict up,male,0.0
73896,Richard III,History,Clarence,1,4,175,Unto the frowning judge? or who pronounced,male,0.0
73897,Richard III,History,Clarence,1,4,176,The bitter sentence of poor Clarence' death?,male,-0.25
73898,Richard III,History,Clarence,1,4,177,"Before I be convict by course of law,",male,0.0
73899,Richard III,History,Clarence,1,4,178,To threaten me with death is most unlawful.,male,0.5
73900,Richard III,History,Clarence,1,4,179,"I charge you, as you hope to have redemption",male,0.0
73901,Richard III,History,Clarence,1,4,180,"By Christ's dear blood shed for our grievous sins,",male,-0.8
73902,Richard III,History,Clarence,1,4,181,That you depart and lay no hands on me,male,0.0
73903,Richard III,History,Clarence,1,4,182,The deed you undertake is damnable.,male,0.0
73904,Richard III,History,First Murderer,1,4,183,"What we will do, we do upon command.",male,0.0
73905,Richard III,History,Second Murderer,1,4,184,And he that hath commanded is the king.,male,0.0
73906,Richard III,History,Clarence,1,4,185,Erroneous vassal! the great King of kings,male,0.09
73907,Richard III,History,Clarence,1,4,186,Hath in the tables of his law commanded,male,0.0
73908,Richard III,History,Clarence,1,4,187,"That thou shalt do no murder: and wilt thou, then,",male,0.0
73909,Richard III,History,Clarence,1,4,188,Spurn at his edict and fulfil a man's?,male,0.0
73910,Richard III,History,Clarence,1,4,189,"Take heed; for he holds vengeance in his hands,",male,0.0
73911,Richard III,History,Clarence,1,4,190,To hurl upon their heads that break his law.,male,0.0
73912,Richard III,History,Second Murderer,1,4,191,"And that same vengeance doth he hurl on thee,",male,0.0
73913,Richard III,History,Second Murderer,1,4,192,For false forswearing and for murder too:,male,-0.4
73914,Richard III,History,Second Murderer,1,4,193,"Thou didst receive the holy sacrament,",male,0.0
73915,Richard III,History,Second Murderer,1,4,194,To fight in quarrel of the house of Lancaster.,male,0.0
73916,Richard III,History,First Murderer,1,4,195,"And, like a traitor to the name of God,",male,0.0
73917,Richard III,History,First Murderer,1,4,196,Didst break that vow; and with thy treacherous blade,male,0.0
73918,Richard III,History,First Murderer,1,4,197,Unrip'dst the bowels of thy sovereign's son.,male,0.0
73919,Richard III,History,Second Murderer,1,4,198,Whom thou wert sworn to cherish and defend.,male,0.0
73920,Richard III,History,First Murderer,1,4,199,"How canst thou urge God's dreadful law to us,",male,-1.0
73921,Richard III,History,First Murderer,1,4,200,When thou hast broke it in so dear degree?,male,0.0
73922,Richard III,History,Clarence,1,4,201,Alas! for whose sake did I that ill deed?,male,-0.5
73923,Richard III,History,Clarence,1,4,202,"For Edward, for my brother, for his sake: Why, sirs,",male,0.0
73924,Richard III,History,Clarence,1,4,203,He sends ye not to murder me for this,male,0.0
73925,Richard III,History,Clarence,1,4,204,For in this sin he is as deep as I.,male,0.0
73926,Richard III,History,Clarence,1,4,205,If God will be revenged for this deed.,male,0.0
73927,Richard III,History,Clarence,1,4,206,"O, know you yet, he doth it publicly,",male,0.0
73928,Richard III,History,Clarence,1,4,207,Take not the quarrel from his powerful arm;,male,0.3
73929,Richard III,History,Clarence,1,4,208,He needs no indirect nor lawless course,male,0.0
73930,Richard III,History,Clarence,1,4,209,To cut off those that have offended him.,male,0.0
73931,Richard III,History,First Murderer,1,4,210,"Who made thee, then, a bloody minister,",male,-0.8
73932,Richard III,History,First Murderer,1,4,211,"When gallant-springing brave Plantagenet,",male,0.8
73933,Richard III,History,First Murderer,1,4,212,"That princely novice, was struck dead by thee?",male,-0.2
73934,Richard III,History,Clarence,1,4,213,"My brother's love, the devil, and my rage.",male,0.5
73935,Richard III,History,First Murderer,1,4,214,"Thy brother's love, our duty, and thy fault,",male,0.5
73936,Richard III,History,First Murderer,1,4,215,Provoke us hither now to slaughter thee.,male,0.0
73937,Richard III,History,Clarence,1,4,216,"Oh, if you love my brother, hate not me;",male,-0.15
73938,Richard III,History,Clarence,1,4,217,"I am his brother, and I love him well.",male,0.5
73939,Richard III,History,Clarence,1,4,218,"If you be hired for meed, go back again,",male,0.0
73940,Richard III,History,Clarence,1,4,219,"And I will send you to my brother Gloucester,",male,0.0
73941,Richard III,History,Clarence,1,4,220,Who shall reward you better for my life,male,0.5
73942,Richard III,History,Clarence,1,4,221,Than Edward will for tidings of my death.,male,0.0
73943,Richard III,History,Second Murderer,1,4,222,"You are deceived, your brother Gloucester hates you.",male,0.0
73944,Richard III,History,Clarence,1,4,223,"O, no, he loves me, and he holds me dear:",male,0.0
73945,Richard III,History,Clarence,1,4,224,Go you to him from me.,male,0.0
73946,Richard III,History,Both,1,4,225,"Ay, so we will.",male,0.0
73947,Richard III,History,Clarence,1,4,226,"Tell him, when that our princely father York",male,0.0
73948,Richard III,History,Clarence,1,4,227,"Bless'd his three sons with his victorious arm,",male,0.0
73949,Richard III,History,Clarence,1,4,228,"And charged us from his soul to love each other,",male,0.19
73950,Richard III,History,Clarence,1,4,229,He little thought of this divided friendship:,male,-0.19
73951,Richard III,History,Clarence,1,4,230,"Bid Gloucester think of this, and he will weep.",male,0.0
73952,Richard III,History,First Murderer,1,4,231,"Ay, millstones; as be lesson'd us to weep.",male,0.0
73953,Richard III,History,Clarence,1,4,232,"O, do not slander him, for he is kind.",male,0.6
73954,Richard III,History,First Murderer,1,4,233,"Right,",male,0.29
73955,Richard III,History,First Murderer,1,4,234,As snow in harvest. Thou deceivest thyself:,male,0.0
73956,Richard III,History,First Murderer,1,4,235,'Tis he that sent us hither now to slaughter thee.,male,0.0
73957,Richard III,History,Clarence,1,4,236,"It cannot be; for when I parted with him,",male,0.0
73958,Richard III,History,Clarence,1,4,237,"He hugg'd me in his arms, and swore, with sobs,",male,0.0
73959,Richard III,History,Clarence,1,4,238,That he would labour my delivery.,male,0.0
73960,Richard III,History,Second Murderer,1,4,239,"Why, so he doth, now he delivers thee",male,0.0
73961,Richard III,History,Second Murderer,1,4,240,From this world's thraldom to the joys of heaven.,male,0.0
73962,Richard III,History,First Murderer,1,4,241,"Make peace with God, for you must die, my lord.",male,0.0
73963,Richard III,History,Clarence,1,4,242,"Hast thou that holy feeling in thy soul,",male,0.0
73964,Richard III,History,Clarence,1,4,243,"To counsel me to make my peace with God,",male,0.0
73965,Richard III,History,Clarence,1,4,244,"And art thou yet to thy own soul so blind,",male,0.05
73966,Richard III,History,Clarence,1,4,245,That thou wilt war with God by murdering me?,male,0.0
73967,Richard III,History,Clarence,1,4,246,"Ah, sirs, consider, he that set you on",male,0.0
73968,Richard III,History,Clarence,1,4,247,To do this deed will hate you for the deed.,male,-0.8
73969,Richard III,History,Second Murderer,1,4,248,What shall we do?,male,0.0
73970,Richard III,History,Clarence,1,4,249,"Relent, and save your souls.",male,0.0
73971,Richard III,History,First Murderer,1,4,250,Relent! 'tis cowardly and womanish.,male,0.0
73972,Richard III,History,Clarence,1,4,251,"Not to relent is beastly, savage, devilish.",male,0.0
73973,Richard III,History,Clarence,1,4,252,"Which of you, if you were a prince's son,",male,0.0
73974,Richard III,History,Clarence,1,4,253,"Being pent from liberty, as I am now,",male,0.0
73975,Richard III,History,Clarence,1,4,254,"if two such murderers as yourselves came to you,",male,0.0
73976,Richard III,History,Clarence,1,4,255,Would not entreat for life?,male,0.0
73977,Richard III,History,Clarence,1,4,256,"My friend, I spy some pity in thy looks:",male,-0.1
73978,Richard III,History,Clarence,1,4,257,"O, if thine eye be not a flatterer,",male,0.0
73979,Richard III,History,Clarence,1,4,258,"Come thou on my side, and entreat for me,",male,0.0
73980,Richard III,History,Clarence,1,4,259,"As you would beg, were you in my distress",male,0.0
73981,Richard III,History,Clarence,1,4,260,A begging prince what beggar pities not?,male,0.0
73982,Richard III,History,Second Murderer,1,4,261,"Look behind you, my lord.",male,-0.4
