Unnamed: 0,play_name,genre,character,act,scene,sentence,text,sex,sentiment
74513,Richard III,History,Buckingham,3,1,91,"What, my gracious lord?",male,0.0
74514,Richard III,History,Prince Edward,3,1,92,"An if I live until I be a man,",male,0.14
74515,Richard III,History,Prince Edward,3,1,93,"I'll win our ancient right in France again,",male,0.54
74516,Richard III,History,Prince Edward,3,1,94,"Or die a soldier, as I lived a king.",male,0.0
74517,Richard III,History,Gloucester,3,1,95,[Aside]  Short summers lightly have a forward spring.,male,0.2
74518,Richard III,History,Buckingham,3,1,96,"Now, in good time, here comes the Duke of York.",male,0.7
74519,Richard III,History,Prince Edward,3,1,97,Richard of York! how fares our loving brother?,male,0.6
74520,Richard III,History,York,3,1,98,"Well, my dread lord; so must I call you now.",male,0.0
74521,Richard III,History,Prince Edward,3,1,99,"Ay, brother, to our grief, as it is yours:",male,-0.8
74522,Richard III,History,Prince Edward,3,1,100,"Too late he died that might have kept that title,",male,-0.3
74523,Richard III,History,Prince Edward,3,1,101,Which by his death hath lost much majesty.,male,0.2
74524,Richard III,History,Gloucester,3,1,102,"How fares our cousin, noble Lord of York?",male,0.6
74525,Richard III,History,York,3,1,103,"I thank you, gentle uncle. O, my lord,",male,0.2
74526,Richard III,History,York,3,1,104,You said that idle weeds are fast in growth,male,0.2
74527,Richard III,History,York,3,1,105,The prince my brother hath outgrown me far.,male,0.1
74528,Richard III,History,Gloucester,3,1,106,"He hath, my lord.",male,0.0
74529,Richard III,History,York,3,1,107,And therefore is he idle?,male,0.0
74530,Richard III,History,Gloucester,3,1,108,"O, my fair cousin, I must not say so.",male,0.7
74531,Richard III,History,York,3,1,109,Then is he more beholding to you than I.,male,0.5
74532,Richard III,History,Gloucester,3,1,110,He may command me as my sovereign;,male,0.0
74533,Richard III,History,Gloucester,3,1,111,But you have power in me as in a kinsman.,male,0.0
74534,Richard III,History,York,3,1,112,"I pray you, uncle, give me this dagger.",male,0.0
74535,Richard III,History,Gloucester,3,1,113,"My dagger, little cousin? with all my heart.",male,-0.19
74536,Richard III,History,Prince Edward,3,1,114,"A beggar, brother?",male,0.0
74537,Richard III,History,York,3,1,115,"Of my kind uncle, that I know will give;",male,0.6
74538,Richard III,History,York,3,1,116,"And being but a toy, which is no grief to give.",male,0.4
74539,Richard III,History,Gloucester,3,1,117,A greater gift than that I'll give my cousin.,male,0.5
74540,Richard III,History,York,3,1,118,"A greater gift! O, that's the sword to it.",male,0.62
74541,Richard III,History,Gloucester,3,1,119,"A gentle cousin, were it light enough.",male,0.2
74542,Richard III,History,York,3,1,120,"O, then, I see, you will part but with light gifts;",male,0.4
74543,Richard III,History,York,3,1,121,In weightier things you'll say a beggar nay.,male,0.0
74544,Richard III,History,Gloucester,3,1,122,It is too heavy for your grace to wear.,male,-0.2
74545,Richard III,History,York,3,1,123,"I weigh it lightly, were it heavier.",male,0.4
74546,Richard III,History,Gloucester,3,1,124,"What, would you have my weapon, little lord?",male,-0.19
74547,Richard III,History,York,3,1,125,"I would, that I might thank you as you call me.",male,0.0
74548,Richard III,History,Gloucester,3,1,126,How?,male,0.0
74549,Richard III,History,York,3,1,127,Little.,male,-0.19
74550,Richard III,History,Prince Edward,3,1,128,My Lord of York will still be cross in talk:,male,0.0
74551,Richard III,History,Prince Edward,3,1,129,"Uncle, your grace knows how to bear with him.",male,0.0
74552,Richard III,History,York,3,1,130,"You mean, to bear me, not to bear with me:",male,-0.31
74553,Richard III,History,York,3,1,131,"Uncle, my brother mocks both you and me;",male,0.0
74554,Richard III,History,York,3,1,132,"Because that I am little, like an ape,",male,-0.19
74555,Richard III,History,York,3,1,133,He thinks that you should bear me on your shoulders.,male,0.0
74556,Richard III,History,Buckingham,3,1,134,With what a sharp-provided wit he reasons!,male,0.0
74557,Richard III,History,Buckingham,3,1,135,"To mitigate the scorn he gives his uncle,",male,0.0
74558,Richard III,History,Buckingham,3,1,136,He prettily and aptly taunts himself:,male,0.42
74559,Richard III,History,Buckingham,3,1,137,So cunning and so young is wonderful.,male,0.37
74560,Richard III,History,Gloucester,3,1,138,"My lord, will't please you pass along?",male,0.0
74561,Richard III,History,Gloucester,3,1,139,Myself and my good cousin Buckingham,male,0.7
74562,Richard III,History,Gloucester,3,1,140,"Will to your mother, to entreat of her",male,0.0
74563,Richard III,History,Gloucester,3,1,141,To meet you at the Tower and welcome you.,male,0.8
74564,Richard III,History,York,3,1,142,"What, will you go unto the Tower, my lord?",male,0.0
74565,Richard III,History,Prince Edward,3,1,143,My lord protector needs will have it so.,male,0.0
74566,Richard III,History,York,3,1,144,I shall not sleep in quiet at the Tower.,male,0.0
74567,Richard III,History,Gloucester,3,1,145,"Why, what should you fear?",male,0.0
74568,Richard III,History,York,3,1,146,"Marry, my uncle Clarence' angry ghost:",male,-0.5
74569,Richard III,History,York,3,1,147,My grandam told me he was murdered there.,male,0.0
74570,Richard III,History,Prince Edward,3,1,148,I fear no uncles dead.,male,-0.2
74571,Richard III,History,Gloucester,3,1,149,"Nor none that live, I hope.",male,0.14
74572,Richard III,History,Prince Edward,3,1,150,"An if they live, I hope I need not fear.",male,0.14
74573,Richard III,History,Prince Edward,3,1,151,"But come, my lord; and with a heavy heart,",male,-0.2
74574,Richard III,History,Prince Edward,3,1,152,"Thinking on them, go I unto the Tower.",male,0.0
74575,Richard III,History,Buckingham,3,1,153,"Think you, my lord, this little prating York",male,-0.19
74576,Richard III,History,Buckingham,3,1,154,Was not incensed by his subtle mother,male,-0.33
74577,Richard III,History,Buckingham,3,1,155,To taunt and scorn you thus opprobriously?,male,0.0
74578,Richard III,History,Gloucester,3,1,156,"No doubt, no doubt; O, 'tis a parlous boy;",male,0.0
74579,Richard III,History,Gloucester,3,1,157,"Bold, quick, ingenious, forward, capable",male,0.34
74580,Richard III,History,Gloucester,3,1,158,"He is all the mother's, from the top to toe.",male,0.5
74581,Richard III,History,Buckingham,3,1,159,"Well, let them rest. Come hither, Catesby.",male,0.0
74582,Richard III,History,Buckingham,3,1,160,Thou art sworn as deeply to effect what we intend,male,0.0
74583,Richard III,History,Buckingham,3,1,161,As closely to conceal what we impart:,male,0.0
74584,Richard III,History,Buckingham,3,1,162,Thou know'st our reasons urged upon the way;,male,0.0
74585,Richard III,History,Buckingham,3,1,163,What think'st thou? is it not an easy matter,male,0.43
74586,Richard III,History,Buckingham,3,1,164,"To make William Lord Hastings of our mind,",male,0.0
74587,Richard III,History,Buckingham,3,1,165,For the instalment of this noble duke,male,0.6
74588,Richard III,History,Buckingham,3,1,166,In the seat royal of this famous isle?,male,0.5
74589,Richard III,History,Catesby,3,1,167,"He for his father's sake so loves the prince,",male,0.0
74590,Richard III,History,Catesby,3,1,168,That he will not be won to aught against him.,male,0.0
74591,Richard III,History,Buckingham,3,1,169,"What think'st thou, then, of Stanley? what will he?",male,0.0
74592,Richard III,History,Catesby,3,1,170,He will do all in all as Hastings doth.,male,0.0
74593,Richard III,History,Buckingham,3,1,171,"Well, then, no more but this: go, gentle Catesby,",male,-0.02
74594,Richard III,History,Buckingham,3,1,172,"And, as it were far off sound thou Lord Hastings,",male,0.25
74595,Richard III,History,Buckingham,3,1,173,How doth he stand affected to our purpose;,male,0.0
74596,Richard III,History,Buckingham,3,1,174,"And summon him to-morrow to the Tower,",male,0.0
74597,Richard III,History,Buckingham,3,1,175,To sit about the coronation.,male,0.0
74598,Richard III,History,Buckingham,3,1,176,"If thou dost find him tractable to us,",male,0.0
74599,Richard III,History,Buckingham,3,1,177,"Encourage him, and show him all our reasons:",male,0.0
74600,Richard III,History,Buckingham,3,1,178,"If he be leaden, icy-cold, unwilling,",male,-0.2
74601,Richard III,History,Buckingham,3,1,179,"Be thou so too; and so break off your talk,",male,0.0
74602,Richard III,History,Buckingham,3,1,180,And give us notice of his inclination:,male,0.0
74603,Richard III,History,Buckingham,3,1,181,"For we to-morrow hold divided councils,",male,0.0
74604,Richard III,History,Buckingham,3,1,182,Wherein thyself shalt highly be employ'd.,male,0.16
74605,Richard III,History,Gloucester,3,1,183,"Commend me to Lord William: tell him, Catesby,",male,0.0
74606,Richard III,History,Gloucester,3,1,184,His ancient knot of dangerous adversaries,male,-0.6
74607,Richard III,History,Gloucester,3,1,185,To-morrow are let blood at Pomfret-castle;,male,0.0
74608,Richard III,History,Gloucester,3,1,186,"And bid my friend, for joy of this good news,",male,0.75
74609,Richard III,History,Gloucester,3,1,187,Give mistress Shore one gentle kiss the more.,male,0.35
74610,Richard III,History,Buckingham,3,1,188,"Good Catesby, go, effect this business soundly.",male,0.55
74611,Richard III,History,Catesby,3,1,189,"My good lords both, with all the heed I may.",male,0.7
74612,Richard III,History,Gloucester,3,1,190,"Shall we hear from you, Catesby, ere we sleep?",male,0.0
74613,Richard III,History,Catesby,3,1,191,"You shall, my lord.",male,0.0
74614,Richard III,History,Gloucester,3,1,192,"At Crosby Place, there shall you find us both.",male,0.0
74615,Richard III,History,Buckingham,3,1,193,"Now, my lord, what shall we do, if we perceive",male,0.0
74616,Richard III,History,Buckingham,3,1,194,Lord Hastings will not yield to our complots?,male,0.0
74617,Richard III,History,Gloucester,3,1,195,"Chop off his head, man; somewhat we will do:",male,0.0
74618,Richard III,History,Gloucester,3,1,196,"And, look, when I am king, claim thou of me",male,0.0
74619,Richard III,History,Gloucester,3,1,197,"The earldom of Hereford, and the moveables",male,0.0
74620,Richard III,History,Gloucester,3,1,198,Whereof the king my brother stood possess'd.,male,0.0
74621,Richard III,History,Buckingham,3,1,199,I'll claim that promise at your grace's hands.,male,0.0
74622,Richard III,History,Gloucester,3,1,200,And look to have it yielded with all willingness.,male,0.0
74623,Richard III,History,Gloucester,3,1,201,"Come, let us sup betimes, that afterwards",male,0.0
74624,Richard III,History,Gloucester,3,1,202,We may digest our complots in some form.,male,0.0
74625,Richard III,History,Messenger,3,2,1,"What, ho! my lord!",male,0.0
74626,Richard III,History,Hastings,3,2,2,[Within]  Who knocks at the door?,male,0.0
74627,Richard III,History,Messenger,3,2,3,A messenger from the Lord Stanley.,male,0.0
74628,Richard III,History,Hastings,3,2,4,What is't o'clock?,male,0.0
74629,Richard III,History,Messenger,3,2,5,Upon the stroke of four.,male,0.0
74630,Richard III,History,Hastings,3,2,6,Cannot thy master sleep these tedious nights?,male,-0.5
74631,Richard III,History,Messenger,3,2,7,So it should seem by that I have to say.,male,0.0
74632,Richard III,History,Messenger,3,2,8,"First, he commends him to your noble lordship.",male,0.42
74633,Richard III,History,Hastings,3,2,9,And then?,male,0.0
74634,Richard III,History,Messenger,3,2,10,And then he sends you word,male,0.0
74635,Richard III,History,Messenger,3,2,11,He dreamt to-night the boar had razed his helm:,male,0.0
74636,Richard III,History,Messenger,3,2,12,"Besides, he says there are two councils held;",male,0.0
74637,Richard III,History,Messenger,3,2,13,And that may be determined at the one,male,0.0
74638,Richard III,History,Messenger,3,2,14,which may make you and him to rue at the other.,male,-0.12
74639,Richard III,History,Messenger,3,2,15,"Therefore he sends to know your lordship's pleasure,",male,0.0
74640,Richard III,History,Messenger,3,2,16,"If presently you will take horse with him,",male,0.0
74641,Richard III,History,Messenger,3,2,17,"And with all speed post with him toward the north,",male,0.0
74642,Richard III,History,Messenger,3,2,18,To shun the danger that his soul divines.,male,0.0
74643,Richard III,History,Hastings,3,2,19,"Go, fellow, go, return unto thy lord;",male,0.0
74644,Richard III,History,Hastings,3,2,20,Bid him not fear the separated councils,male,0.0
74645,Richard III,History,Hastings,3,2,21,"His honour and myself are at the one,",male,0.0
74646,Richard III,History,Hastings,3,2,22,And at the other is my servant Catesby,male,-0.12
74647,Richard III,History,Hastings,3,2,23,Where nothing can proceed that toucheth us,male,0.0
74648,Richard III,History,Hastings,3,2,24,Whereof I shall not have intelligence.,male,0.0
74649,Richard III,History,Hastings,3,2,25,"Tell him his fears are shallow, wanting instance:",male,-0.33
74650,Richard III,History,Hastings,3,2,26,"And for his dreams, I wonder he is so fond",male,0.0
74651,Richard III,History,Hastings,3,2,27,To trust the mockery of unquiet slumbers,male,0.0
74652,Richard III,History,Hastings,3,2,28,"To fly the boar before the boar pursues,",male,0.8
74653,Richard III,History,Hastings,3,2,29,Were to incense the boar to follow us,male,0.0
74654,Richard III,History,Hastings,3,2,30,And make pursuit where he did mean no chase.,male,-0.31
74655,Richard III,History,Hastings,3,2,31,"Go, bid thy master rise and come to me",male,0.0
74656,Richard III,History,Hastings,3,2,32,"And we will both together to the Tower,",male,0.0
74657,Richard III,History,Hastings,3,2,33,"Where, he shall see, the boar will use us kindly.",male,0.6
74658,Richard III,History,Messenger,3,2,34,"My gracious lord, I'll tell him what you say.",male,0.0
74659,Richard III,History,Catesby,3,2,35,Many good morrows to my noble lord!,male,0.65
74660,Richard III,History,Hastings,3,2,36,"Good morrow, Catesby; you are early stirring",male,0.4
74661,Richard III,History,Hastings,3,2,37,"What news, what news, in this our tottering state?",male,0.0
74662,Richard III,History,Catesby,3,2,38,"It is a reeling world, indeed, my lord;",male,0.0
74663,Richard III,History,Catesby,3,2,39,And I believe twill never stand upright,male,0.0
74664,Richard III,History,Catesby,3,2,40,Till Richard wear the garland of the realm.,male,0.0
74665,Richard III,History,Hastings,3,2,41,How! wear the garland! dost thou mean the crown?,male,-0.31
74666,Richard III,History,Catesby,3,2,42,"Ay, my good lord.",male,0.7
74667,Richard III,History,Hastings,3,2,43,I'll have this crown of mine cut from my shoulders,male,0.0
74668,Richard III,History,Hastings,3,2,44,Ere I will see the crown so foul misplaced.,male,-0.2
74669,Richard III,History,Hastings,3,2,45,But canst thou guess that he doth aim at it?,male,0.0
74670,Richard III,History,Catesby,3,2,46,"Ay, on my life; and hopes to find forward",male,0.0
74671,Richard III,History,Catesby,3,2,47,Upon his party for the gain thereof:,male,0.0
74672,Richard III,History,Catesby,3,2,48,"And thereupon he sends you this good news,",male,0.7
74673,Richard III,History,Catesby,3,2,49,"That this same very day your enemies,",male,0.1
74674,Richard III,History,Catesby,3,2,50,"The kindred of the queen, must die at Pomfret.",male,0.0
74675,Richard III,History,Hastings,3,2,51,"Indeed, I am no mourner for that news,",male,0.0
74676,Richard III,History,Hastings,3,2,52,Because they have been still mine enemies:,male,0.0
74677,Richard III,History,Hastings,3,2,53,"But, that I'll give my voice on Richard's side,",male,0.0
74678,Richard III,History,Hastings,3,2,54,"To bar my master's heirs in true descent,",male,0.35
74679,Richard III,History,Hastings,3,2,55,"God knows I will not do it, to the death.",male,0.0
74680,Richard III,History,Catesby,3,2,56,God keep your lordship in that gracious mind!,male,0.0
74681,Richard III,History,Hastings,3,2,57,"But I shall laugh at this a twelve-month hence,",male,0.3
74682,Richard III,History,Hastings,3,2,58,That they who brought me in my master's hate,male,-0.8
74683,Richard III,History,Hastings,3,2,59,I live to look upon their tragedy.,male,0.14
74684,Richard III,History,Hastings,3,2,60,"I tell thee, Catesby--",male,0.0
74685,Richard III,History,Catesby,3,2,61,"What, my lord?",male,0.0
74686,Richard III,History,Hastings,3,2,62,"Ere a fortnight make me elder,",male,0.0
74687,Richard III,History,Hastings,3,2,63,I'll send some packing that yet think not on it.,male,0.0
74688,Richard III,History,Catesby,3,2,64,"'Tis a vile thing to die, my gracious lord,",male,0.0
74689,Richard III,History,Catesby,3,2,65,When men are unprepared and look not for it.,male,0.0
74690,Richard III,History,Hastings,3,2,66,"O monstrous, monstrous! and so falls it out",male,0.0
74691,Richard III,History,Hastings,3,2,67,"With Rivers, Vaughan, Grey: and so 'twill do",male,-0.05
74692,Richard III,History,Hastings,3,2,68,"With some men else, who think themselves as safe",male,0.5
74693,Richard III,History,Hastings,3,2,69,"As thou and I; who, as thou know'st, are dear",male,0.0
74694,Richard III,History,Hastings,3,2,70,To princely Richard and to Buckingham.,male,0.0
74695,Richard III,History,Catesby,3,2,71,The princes both make high account of you;,male,0.16
74696,Richard III,History,Catesby,3,2,72,For they account his head upon the bridge.,male,0.0
74697,Richard III,History,Hastings,3,2,73,I know they do; and I have well deserved it.,male,0.0
74698,Richard III,History,Hastings,3,2,74,"Come on, come on; where is your boar-spear, man?",male,0.0
74699,Richard III,History,Hastings,3,2,75,"Fear you the boar, and go so unprovided?",male,0.0
74700,Richard III,History,Stanley,3,2,76,"My lord, good morrow; good morrow, Catesby:",male,0.7
74701,Richard III,History,Stanley,3,2,77,"You may jest on, but, by the holy rood,",male,0.0
74702,Richard III,History,Stanley,3,2,78,"I do not like these several councils, I.",male,0.0
74703,Richard III,History,Hastings,3,2,79,"My lord,",male,0.0
74704,Richard III,History,Hastings,3,2,80,I hold my life as dear as you do yours;,male,0.0
74705,Richard III,History,Hastings,3,2,81,"And never in my life, I do protest,",male,0.0
74706,Richard III,History,Hastings,3,2,82,Was it more precious to me than 'tis now:,male,0.5
74707,Richard III,History,Hastings,3,2,83,"Think you, but that I know our state secure,",male,0.4
74708,Richard III,History,Hastings,3,2,84,I would be so triumphant as I am?,male,0.0
74709,Richard III,History,Stanley,3,2,85,"The lords at Pomfret, when they rode from London,",male,0.0
74710,Richard III,History,Stanley,3,2,86,"Were jocund, and supposed their state was sure,",male,0.5
74711,Richard III,History,Stanley,3,2,87,And they indeed had no cause to mistrust;,male,0.0
74712,Richard III,History,Stanley,3,2,88,"But yet, you see how soon the day o'ercast.",male,0.0
74713,Richard III,History,Stanley,3,2,89,This sudden stag of rancour I misdoubt:,male,0.0
74714,Richard III,History,Stanley,3,2,90,"Pray God, I say, I prove a needless coward!",male,-0.62
74715,Richard III,History,Stanley,3,2,91,"What, shall we toward the Tower? the day is spent.",male,-0.1
74716,Richard III,History,Hastings,3,2,92,"Come, come, have with you. Wot you what, my lord?",male,0.0
74717,Richard III,History,Hastings,3,2,93,To-day the lords you talk of are beheaded.,male,0.0
74718,Richard III,History,Lord Stanley,3,2,94,"They, for their truth, might better wear their heads",male,0.5
74719,Richard III,History,Lord Stanley,3,2,95,Than some that have accused them wear their hats.,male,0.0
74720,Richard III,History,Lord Stanley,3,2,96,"But come, my lord, let us away.",male,0.0
74721,Richard III,History,Hastings,3,2,97,Go on before; I'll talk with this good fellow.,male,0.7
74722,Richard III,History,Hastings,3,2,98,"How now, sirrah! how goes the world with thee?",male,0.0
74723,Richard III,History,Pursuivant,3,2,99,The better that your lordship please to ask.,male,0.5
74724,Richard III,History,Hastings,3,2,100,"I tell thee, man, 'tis better with me now",male,0.5
74725,Richard III,History,Hastings,3,2,101,Than when I met thee last where now we meet:,male,0.0
74726,Richard III,History,Hastings,3,2,102,"Then was I going prisoner to the Tower,",male,0.0
74727,Richard III,History,Hastings,3,2,103,By the suggestion of the queen's allies;,male,0.0
74728,Richard III,History,Hastings,3,2,104,"But now, I tell thee--keep it to thyself--",male,0.0
74729,Richard III,History,Hastings,3,2,105,"This day those enemies are put to death,",male,0.0
74730,Richard III,History,Hastings,3,2,106,And I in better state than e'er I was.,male,0.5
74731,Richard III,History,Pursuivant,3,2,107,"God hold it, to your honour's good content!",male,0.88
74732,Richard III,History,Hastings,3,2,108,"Gramercy, fellow: there, drink that for me.",male,0.0
74733,Richard III,History,Pursuivant,3,2,109,God save your lordship!,male,0.0
74734,Richard III,History,Priest,3,2,110,"Well met, my lord; I am glad to see your honour.",male,0.5
74735,Richard III,History,Hastings,3,2,111,"I thank thee, good Sir John, with all my heart.",male,0.7
74736,Richard III,History,Hastings,3,2,112,I am in your debt for your last exercise;,male,0.0
74737,Richard III,History,Hastings,3,2,113,"Come the next Sabbath, and I will content you.",male,0.0
74738,Richard III,History,Buckingham,3,2,114,"What, talking with a priest, lord chamberlain?",male,0.0
74739,Richard III,History,Buckingham,3,2,115,"Your friends at Pomfret, they do need the priest;",male,0.0
74740,Richard III,History,Buckingham,3,2,116,Your honour hath no shriving work in hand.,male,0.0
74741,Richard III,History,Hastings,3,2,117,"Good faith, and when I met this holy man,",male,0.7
74742,Richard III,History,Hastings,3,2,118,Those men you talk of came into my mind.,male,0.0
74743,Richard III,History,Hastings,3,2,119,"What, go you toward the Tower?",male,0.0
74744,Richard III,History,Buckingham,3,2,120,"I do, my lord; but long I shall not stay",male,-0.05
74745,Richard III,History,Buckingham,3,2,121,I shall return before your lordship thence.,male,0.0
74746,Richard III,History,Hastings,3,2,122,"'Tis like enough, for I stay dinner there.",male,0.0
74747,Richard III,History,Buckingham,3,2,123,"[Aside]  And supper too, although thou know'st it not.",male,0.0
74748,Richard III,History,Buckingham,3,2,124,"Come, will you go?",male,0.0
74749,Richard III,History,Hastings,3,2,125,I'll wait upon your lordship.,male,0.0
74750,Richard III,History,Ratcliff,3,3,1,"Come, bring forth the prisoners.",male,0.0
74751,Richard III,History,Rivers,3,3,2,"Sir Richard Ratcliff, let me tell thee this:",male,0.0
74752,Richard III,History,Rivers,3,3,3,To-day shalt thou behold a subject die,male,-0.17
74753,Richard III,History,Rivers,3,3,4,"For truth, for duty, and for loyalty.",male,0.0
74754,Richard III,History,Grey,3,3,5,God keep the prince from all the pack of you!,male,0.0
74755,Richard III,History,Grey,3,3,6,A knot you are of damned blood-suckers!,male,0.0
74756,Richard III,History,Vaughan,3,3,7,You live that shall cry woe for this after.,male,0.14
74757,Richard III,History,Ratcliff,3,3,8,Dispatch; the limit of your lives is out.,male,0.0
74758,Richard III,History,Rivers,3,3,9,"O Pomfret, Pomfret! O thou bloody prison,",male,-0.8
74759,Richard III,History,Rivers,3,3,10,Fatal and ominous to noble peers!,male,0.75
74760,Richard III,History,Rivers,3,3,11,Within the guilty closure of thy walls,male,-0.5
74761,Richard III,History,Rivers,3,3,12,Richard the second here was hack'd to death;,male,0.0
74762,Richard III,History,Rivers,3,3,13,"And, for more slander to thy dismal seat,",male,0.5
74763,Richard III,History,Rivers,3,3,14,We give thee up our guiltless blood to drink.,male,0.0
74764,Richard III,History,Grey,3,3,15,"Now Margaret's curse is fall'n upon our heads,",male,0.0
74765,Richard III,History,Grey,3,3,16,For standing by when Richard stabb'd her son.,male,0.0
74766,Richard III,History,Rivers,3,3,17,"Then cursed she Hastings, then cursed she Buckingham,",male,0.0
74767,Richard III,History,Rivers,3,3,18,"Then cursed she Richard. O, remember, God",male,0.0
74768,Richard III,History,Rivers,3,3,19,"To hear her prayers for them, as now for us",male,0.0
74769,Richard III,History,Rivers,3,3,20,"And for my sister and her princely sons,",male,0.0
74770,Richard III,History,Rivers,3,3,21,"Be satisfied, dear God, with our true blood,",male,0.42
74771,Richard III,History,Rivers,3,3,22,"Which, as thou know'st, unjustly must be spilt.",male,0.0
74772,Richard III,History,Ratcliff,3,3,23,Make haste; the hour of death is expiate.,male,0.0
74773,Richard III,History,Rivers,3,3,24,"Come, Grey, come, Vaughan, let us all embrace:",male,-0.05
74774,Richard III,History,Rivers,3,3,25,"And take our leave, until we meet in heaven.",male,0.0
74775,Richard III,History,Hastings,3,4,1,"My lords, at once: the cause why we are met",male,0.0
74776,Richard III,History,Hastings,3,4,2,"Is, to determine of the coronation.",male,0.0
74777,Richard III,History,Hastings,3,4,3,"In God's name, speak: when is the royal day?",male,0.0
74778,Richard III,History,Buckingham,3,4,4,Are all things fitting for that royal time?,male,0.5
74779,Richard III,History,Derby,3,4,5,"It is, and wants but nomination.",male,0.2
74780,Richard III,History,Bishop Of Ely,3,4,6,"To-morrow, then, I judge a happy day.",male,0.8
74781,Richard III,History,Buckingham,3,4,7,Who knows the lord protector's mind herein?,male,0.0
74782,Richard III,History,Buckingham,3,4,8,Who is most inward with the royal duke?,male,0.5
74783,Richard III,History,Bishop Of Ely,3,4,9,"Your grace, we think, should soonest know his mind.",male,0.0
74784,Richard III,History,Buckingham,3,4,10,"Who, I, my lord I we know each other's faces,",male,-0.12
74785,Richard III,History,Buckingham,3,4,11,"But for our hearts, he knows no more of mine,",male,-0.25
74786,Richard III,History,Buckingham,3,4,12,Than I of yours;,male,0.0
