Unnamed: 0,play_name,genre,character,act,scene,sentence,text,sex,sentiment
106036,Titus Andronicus,Tragedy,Saturninus,1,1,496,"You are my guest, Lavinia, and your friends.",male,0.0
106037,Titus Andronicus,Tragedy,Saturninus,1,1,497,"This day shall be a love-day, Tamora.",male,0.0
106038,Titus Andronicus,Tragedy,Titus Andronicus,1,1,498,"To-morrow, an it please your majesty",male,0.0
106039,Titus Andronicus,Tragedy,Titus Andronicus,1,1,499,"To hunt the panther and the hart with me,",male,0.0
106040,Titus Andronicus,Tragedy,Titus Andronicus,1,1,500,With horn and hound we'll give your grace bonjour.,male,0.0
106041,Titus Andronicus,Tragedy,Saturninus,1,1,501,"Be it so, Titus, and gramercy too.",male,0.0
106042,Titus Andronicus,Tragedy,Aaron,2,1,1,"Now climbeth Tamora Olympus' top,",male,0.5
106043,Titus Andronicus,Tragedy,Aaron,2,1,2,"Safe out of fortune's shot; and sits aloft,",male,0.5
106044,Titus Andronicus,Tragedy,Aaron,2,1,3,Secure of thunder's crack or lightning flash;,male,0.4
106045,Titus Andronicus,Tragedy,Aaron,2,1,4,Advanced above pale envy's threatening reach.,male,0.06
106046,Titus Andronicus,Tragedy,Aaron,2,1,5,"As when the golden sun salutes the morn,",male,0.3
106047,Titus Andronicus,Tragedy,Aaron,2,1,6,"And, having gilt the ocean with his beams,",male,0.0
106048,Titus Andronicus,Tragedy,Aaron,2,1,7,"Gallops the zodiac in his glistering coach,",male,0.0
106049,Titus Andronicus,Tragedy,Aaron,2,1,8,And overlooks the highest-peering hills;,male,0.0
106050,Titus Andronicus,Tragedy,Aaron,2,1,9,So Tamora:,male,0.0
106051,Titus Andronicus,Tragedy,Aaron,2,1,10,"Upon her wit doth earthly honour wait,",male,0.0
106052,Titus Andronicus,Tragedy,Aaron,2,1,11,And virtue stoops and trembles at her frown.,male,0.0
106053,Titus Andronicus,Tragedy,Aaron,2,1,12,"Then, Aaron, arm thy heart, and fit thy thoughts,",male,0.4
106054,Titus Andronicus,Tragedy,Aaron,2,1,13,"To mount aloft with thy imperial mistress,",male,0.0
106055,Titus Andronicus,Tragedy,Aaron,2,1,14,"And mount her pitch, whom thou in triumph long",male,-0.05
106056,Titus Andronicus,Tragedy,Aaron,2,1,15,"Hast prisoner held, fetter'd in amorous chains",male,0.0
106057,Titus Andronicus,Tragedy,Aaron,2,1,16,And faster bound to Aaron's charming eyes,male,0.7
106058,Titus Andronicus,Tragedy,Aaron,2,1,17,Than is Prometheus tied to Caucasus.,male,0.0
106059,Titus Andronicus,Tragedy,Aaron,2,1,18,Away with slavish weeds and servile thoughts!,male,0.0
106060,Titus Andronicus,Tragedy,Aaron,2,1,19,"I will be bright, and shine in pearl and gold,",male,0.7
106061,Titus Andronicus,Tragedy,Aaron,2,1,20,To wait upon this new-made empress.,male,0.0
106062,Titus Andronicus,Tragedy,Aaron,2,1,21,"To wait, said I? to wanton with this queen,",male,0.0
106063,Titus Andronicus,Tragedy,Aaron,2,1,22,"This goddess, this Semiramis, this nymph,",male,0.0
106064,Titus Andronicus,Tragedy,Aaron,2,1,23,"This siren, that will charm Rome's Saturnine,",male,0.0
106065,Titus Andronicus,Tragedy,Aaron,2,1,24,And see his shipwreck and his commonweal's.,male,0.0
106066,Titus Andronicus,Tragedy,Aaron,2,1,25,Holloa! what storm is this?,male,0.0
106067,Titus Andronicus,Tragedy,Demetrius,2,1,26,"Chiron, thy years want wit, thy wit wants edge,",male,0.2
106068,Titus Andronicus,Tragedy,Demetrius,2,1,27,"And manners, to intrude where I am graced;",male,0.0
106069,Titus Andronicus,Tragedy,Demetrius,2,1,28,"And may, for aught thou know'st, affected be.",male,0.0
106070,Titus Andronicus,Tragedy,Chiron,2,1,29,"Demetrius, thou dost over-ween in all;",male,0.0
106071,Titus Andronicus,Tragedy,Chiron,2,1,30,"And so in this, to bear me down with braves.",male,-0.16
106072,Titus Andronicus,Tragedy,Chiron,2,1,31,'Tis not the difference of a year or two,male,0.0
106073,Titus Andronicus,Tragedy,Chiron,2,1,32,Makes me less gracious or thee more fortunate:,male,0.24
106074,Titus Andronicus,Tragedy,Chiron,2,1,33,I am as able and as fit as thou,male,0.45
106075,Titus Andronicus,Tragedy,Chiron,2,1,34,"To serve, and to deserve my mistress' grace;",male,0.0
106076,Titus Andronicus,Tragedy,Chiron,2,1,35,"And that my sword upon thee shall approve,",male,0.0
106077,Titus Andronicus,Tragedy,Chiron,2,1,36,And plead my passions for Lavinia's love.,male,0.5
106078,Titus Andronicus,Tragedy,Aaron,2,1,37,"[Aside]  Clubs, clubs! these lovers will not keep",male,0.0
106079,Titus Andronicus,Tragedy,Aaron,2,1,38,the peace.,male,0.0
106080,Titus Andronicus,Tragedy,Demetrius,2,1,39,"Why, boy, although our mother, unadvised,",male,0.0
106081,Titus Andronicus,Tragedy,Demetrius,2,1,40,"Gave you a dancing-rapier by your side,",male,0.0
106082,Titus Andronicus,Tragedy,Demetrius,2,1,41,"Are you so desperate grown, to threat your friends?",male,-0.6
106083,Titus Andronicus,Tragedy,Demetrius,2,1,42,Go to; have your lath glued within your sheath,male,0.0
106084,Titus Andronicus,Tragedy,Demetrius,2,1,43,Till you know better how to handle it.,male,0.5
106085,Titus Andronicus,Tragedy,Chiron,2,1,44,"Meanwhile, sir, with the little skill I have,",male,-0.19
106086,Titus Andronicus,Tragedy,Chiron,2,1,45,Full well shalt thou perceive how much I dare.,male,0.28
106087,Titus Andronicus,Tragedy,Demetrius,2,1,46,"Ay, boy, grow ye so brave?",male,0.8
106088,Titus Andronicus,Tragedy,Aaron,2,1,47,"[Coming forward]  Why, how now, lords!",male,0.0
106089,Titus Andronicus,Tragedy,Aaron,2,1,48,"So near the emperor's palace dare you draw,",male,0.1
106090,Titus Andronicus,Tragedy,Aaron,2,1,49,And maintain such a quarrel openly?,male,0.0
106091,Titus Andronicus,Tragedy,Aaron,2,1,50,Full well I wot the ground of all this grudge:,male,0.35
106092,Titus Andronicus,Tragedy,Aaron,2,1,51,I would not for a million of gold,male,0.0
106093,Titus Andronicus,Tragedy,Aaron,2,1,52,The cause were known to them it most concerns;,male,0.5
106094,Titus Andronicus,Tragedy,Aaron,2,1,53,Nor would your noble mother for much more,male,0.55
106095,Titus Andronicus,Tragedy,Aaron,2,1,54,Be so dishonour'd in the court of Rome.,male,0.0
106096,Titus Andronicus,Tragedy,Aaron,2,1,55,"For shame, put up.",male,0.0
106097,Titus Andronicus,Tragedy,Demetrius,2,1,56,"Not I, till I have sheathed",male,0.0
106098,Titus Andronicus,Tragedy,Demetrius,2,1,57,My rapier in his bosom and withal,male,0.0
106099,Titus Andronicus,Tragedy,Demetrius,2,1,58,Thrust these reproachful speeches down his throat,male,-0.16
106100,Titus Andronicus,Tragedy,Demetrius,2,1,59,That he hath breathed in my dishonour here.,male,0.0
106101,Titus Andronicus,Tragedy,Chiron,2,1,60,For that I am prepared and full resolved.,male,0.35
106102,Titus Andronicus,Tragedy,Chiron,2,1,61,"Foul-spoken coward, that thunder'st with thy tongue,",male,0.0
106103,Titus Andronicus,Tragedy,Chiron,2,1,62,And with thy weapon nothing darest perform!,male,0.0
106104,Titus Andronicus,Tragedy,Aaron,2,1,63,"Away, I say!",male,0.0
106105,Titus Andronicus,Tragedy,Aaron,2,1,64,"Now, by the gods that warlike Goths adore,",male,0.0
106106,Titus Andronicus,Tragedy,Aaron,2,1,65,This petty brabble will undo us all.,male,0.0
106107,Titus Andronicus,Tragedy,Aaron,2,1,66,"Why, lords, and think you not how dangerous",male,-0.6
106108,Titus Andronicus,Tragedy,Aaron,2,1,67,It is to jet upon a prince's right?,male,0.29
106109,Titus Andronicus,Tragedy,Aaron,2,1,68,"What, is Lavinia then become so loose,",male,-0.08
106110,Titus Andronicus,Tragedy,Aaron,2,1,69,"Or Bassianus so degenerate,",male,0.0
106111,Titus Andronicus,Tragedy,Aaron,2,1,70,That for her love such quarrels may be broach'd,male,0.25
106112,Titus Andronicus,Tragedy,Aaron,2,1,71,"Without controlment, justice, or revenge?",male,0.0
106113,Titus Andronicus,Tragedy,Aaron,2,1,72,"Young lords, beware! and should the empress know",male,0.12
106114,Titus Andronicus,Tragedy,Aaron,2,1,73,"This discord's ground, the music would not please.",male,0.0
106115,Titus Andronicus,Tragedy,Chiron,2,1,74,"I care not, I, knew she and all the world:",male,0.0
106116,Titus Andronicus,Tragedy,Chiron,2,1,75,I love Lavinia more than all the world.,male,0.5
106117,Titus Andronicus,Tragedy,Demetrius,2,1,76,"Youngling, learn thou to make some meaner choice:",male,0.0
106118,Titus Andronicus,Tragedy,Demetrius,2,1,77,Lavinia is thine elder brother's hope.,male,0.0
106119,Titus Andronicus,Tragedy,Aaron,2,1,78,"Why, are ye mad? or know ye not, in Rome",male,-0.62
106120,Titus Andronicus,Tragedy,Aaron,2,1,79,"How furious and impatient they be,",male,-0.2
106121,Titus Andronicus,Tragedy,Aaron,2,1,80,And cannot brook competitors in love?,male,0.5
106122,Titus Andronicus,Tragedy,Aaron,2,1,81,"I tell you, lords, you do but plot your deaths",male,0.0
106123,Titus Andronicus,Tragedy,Aaron,2,1,82,By this device.,male,0.0
106124,Titus Andronicus,Tragedy,Chiron,2,1,83,"Aaron, a thousand deaths",male,0.0
106125,Titus Andronicus,Tragedy,Chiron,2,1,84,Would I propose to achieve her whom I love.,male,0.5
106126,Titus Andronicus,Tragedy,Aaron,2,1,85,To achieve her! how?,male,0.0
106127,Titus Andronicus,Tragedy,Demetrius,2,1,86,Why makest thou it so strange?,male,-0.05
106128,Titus Andronicus,Tragedy,Demetrius,2,1,87,"She is a woman, therefore may be woo'd;",male,0.0
106129,Titus Andronicus,Tragedy,Demetrius,2,1,88,"She is a woman, therefore may be won;",male,0.0
106130,Titus Andronicus,Tragedy,Demetrius,2,1,89,"She is Lavinia, therefore must be loved.",male,0.7
106131,Titus Andronicus,Tragedy,Demetrius,2,1,90,"What, man! more water glideth by the mill",male,0.5
106132,Titus Andronicus,Tragedy,Demetrius,2,1,91,Than wots the miller of; and easy it is,male,0.43
106133,Titus Andronicus,Tragedy,Demetrius,2,1,92,"Of a cut loaf to steal a shive, we know:",male,0.0
106134,Titus Andronicus,Tragedy,Demetrius,2,1,93,Though Bassianus be the emperor's brother.,male,0.0
106135,Titus Andronicus,Tragedy,Demetrius,2,1,94,Better than he have worn Vulcan's badge.,male,0.5
106136,Titus Andronicus,Tragedy,Aaron,2,1,95,"[Aside]  Ay, and as good as Saturninus may.",male,0.7
106137,Titus Andronicus,Tragedy,Demetrius,2,1,96,Then why should he despair that knows to court it,male,0.0
106138,Titus Andronicus,Tragedy,Demetrius,2,1,97,"With words, fair looks and liberality?",male,0.7
106139,Titus Andronicus,Tragedy,Demetrius,2,1,98,"What, hast not thou full often struck a doe,",male,0.35
106140,Titus Andronicus,Tragedy,Demetrius,2,1,99,And borne her cleanly by the keeper's nose?,male,0.37
106141,Titus Andronicus,Tragedy,Aaron,2,1,100,"Why, then, it seems, some certain snatch or so",male,0.21
106142,Titus Andronicus,Tragedy,Aaron,2,1,101,Would serve your turns.,male,0.0
106143,Titus Andronicus,Tragedy,Chiron,2,1,102,"Ay, so the turn were served.",male,0.0
106144,Titus Andronicus,Tragedy,Demetrius,2,1,103,"Aaron, thou hast hit it.",male,0.0
106145,Titus Andronicus,Tragedy,Aaron,2,1,104,Would you had hit it too!,male,0.0
106146,Titus Andronicus,Tragedy,Aaron,2,1,105,Then should not we be tired with this ado.,male,-0.4
106147,Titus Andronicus,Tragedy,Aaron,2,1,106,"Why, hark ye, hark ye! and are you such fools",male,0.0
106148,Titus Andronicus,Tragedy,Aaron,2,1,107,"To square for this? would it offend you, then",male,0.0
106149,Titus Andronicus,Tragedy,Aaron,2,1,108,That both should speed?,male,0.0
106150,Titus Andronicus,Tragedy,Chiron,2,1,109,"Faith, not me.",male,0.0
106151,Titus Andronicus,Tragedy,Demetrius,2,1,110,"Nor me, so I were one.",male,0.0
106152,Titus Andronicus,Tragedy,Aaron,2,1,111,"For shame, be friends, and join for that you jar:",male,0.0
106153,Titus Andronicus,Tragedy,Aaron,2,1,112,'Tis policy and stratagem must do,male,0.0
106154,Titus Andronicus,Tragedy,Aaron,2,1,113,"That you affect; and so must you resolve,",male,0.0
106155,Titus Andronicus,Tragedy,Aaron,2,1,114,"That what you cannot as you would achieve,",male,0.0
106156,Titus Andronicus,Tragedy,Aaron,2,1,115,You must perforce accomplish as you may.,male,0.0
106157,Titus Andronicus,Tragedy,Aaron,2,1,116,Take this of me: Lucrece was not more chaste,male,-0.25
106158,Titus Andronicus,Tragedy,Aaron,2,1,117,"Than this Lavinia, Bassianus' love.",male,0.5
106159,Titus Andronicus,Tragedy,Aaron,2,1,118,A speedier course than lingering languishment,male,0.0
106160,Titus Andronicus,Tragedy,Aaron,2,1,119,"Must we pursue, and I have found the path.",male,0.0
106161,Titus Andronicus,Tragedy,Aaron,2,1,120,"My lords, a solemn hunting is in hand;",male,0.0
106162,Titus Andronicus,Tragedy,Aaron,2,1,121,There will the lovely Roman ladies troop:,male,0.5
106163,Titus Andronicus,Tragedy,Aaron,2,1,122,The forest walks are wide and spacious;,male,-0.1
106164,Titus Andronicus,Tragedy,Aaron,2,1,123,And many unfrequented plots there are,male,0.5
106165,Titus Andronicus,Tragedy,Aaron,2,1,124,Fitted by kind for rape and villany:,male,0.6
106166,Titus Andronicus,Tragedy,Aaron,2,1,125,"Single you thither then this dainty doe,",male,0.41
106167,Titus Andronicus,Tragedy,Aaron,2,1,126,"And strike her home by force, if not by words:",male,0.0
106168,Titus Andronicus,Tragedy,Aaron,2,1,127,"This way, or not at all, stand you in hope.",male,0.0
106169,Titus Andronicus,Tragedy,Aaron,2,1,128,"Come, come, our empress, with her sacred wit",male,0.0
106170,Titus Andronicus,Tragedy,Aaron,2,1,129,"To villany and vengeance consecrate,",male,0.0
106171,Titus Andronicus,Tragedy,Aaron,2,1,130,Will we acquaint with all that we intend;,male,0.0
106172,Titus Andronicus,Tragedy,Aaron,2,1,131,"And she shall file our engines with advice,",male,0.0
106173,Titus Andronicus,Tragedy,Aaron,2,1,132,"That will not suffer you to square yourselves,",male,0.0
106174,Titus Andronicus,Tragedy,Aaron,2,1,133,But to your wishes' height advance you both.,male,0.0
106175,Titus Andronicus,Tragedy,Aaron,2,1,134,"The emperor's court is like the house of Fame,",male,0.0
106176,Titus Andronicus,Tragedy,Aaron,2,1,135,"The palace full of tongues, of eyes, and ears:",male,0.35
106177,Titus Andronicus,Tragedy,Aaron,2,1,136,"The woods are ruthless, dreadful, deaf, and dull;",male,-0.76
106178,Titus Andronicus,Tragedy,Aaron,2,1,137,"There speak, and strike, brave boys, and take",male,0.8
106179,Titus Andronicus,Tragedy,Aaron,2,1,138,your turns;,male,0.0
106180,Titus Andronicus,Tragedy,Aaron,2,1,139,"There serve your lusts, shadow'd from heaven's eye,",male,0.0
106181,Titus Andronicus,Tragedy,Aaron,2,1,140,And revel in Lavinia's treasury.,male,0.0
106182,Titus Andronicus,Tragedy,Chiron,2,1,141,"Thy counsel, lad, smells of no cowardice,",male,0.0
106183,Titus Andronicus,Tragedy,Demetrius,2,1,142,"Sit fas aut nefas, till I find the stream",male,0.0
106184,Titus Andronicus,Tragedy,Demetrius,2,1,143,"To cool this heat, a charm to calm these fits.",male,0.33
106185,Titus Andronicus,Tragedy,Demetrius,2,1,144,"Per Styga, per manes vehor.",male,0.0
106186,Titus Andronicus,Tragedy,Titus Andronicus,2,2,1,"The hunt is up, the morn is bright and grey,",male,0.33
106187,Titus Andronicus,Tragedy,Titus Andronicus,2,2,2,The fields are fragrant and the woods are green:,male,-0.2
106188,Titus Andronicus,Tragedy,Titus Andronicus,2,2,3,Uncouple here and let us make a bay,male,0.0
106189,Titus Andronicus,Tragedy,Titus Andronicus,2,2,4,And wake the emperor and his lovely bride,male,0.5
106190,Titus Andronicus,Tragedy,Titus Andronicus,2,2,5,"And rouse the prince and ring a hunter's peal,",male,0.0
106191,Titus Andronicus,Tragedy,Titus Andronicus,2,2,6,That all the court may echo with the noise.,male,0.0
106192,Titus Andronicus,Tragedy,Titus Andronicus,2,2,7,"Sons, let it be your charge, as it is ours,",male,0.0
106193,Titus Andronicus,Tragedy,Titus Andronicus,2,2,8,To attend the emperor's person carefully:,male,-0.1
106194,Titus Andronicus,Tragedy,Titus Andronicus,2,2,9,"I have been troubled in my sleep this night,",male,-0.5
106195,Titus Andronicus,Tragedy,Titus Andronicus,2,2,10,But dawning day new comfort hath inspired.,male,0.14
106196,Titus Andronicus,Tragedy,Titus Andronicus,2,2,11,Many good morrows to your majesty;,male,0.6
106197,Titus Andronicus,Tragedy,Titus Andronicus,2,2,12,"Madam, to you as many and as good:",male,0.6
106198,Titus Andronicus,Tragedy,Titus Andronicus,2,2,13,I promised your grace a hunter's peal.,male,0.0
106199,Titus Andronicus,Tragedy,Saturninus,2,2,14,"And you have rung it lustily, my lord;",male,0.0
106200,Titus Andronicus,Tragedy,Saturninus,2,2,15,Somewhat too early for new-married ladies.,male,0.1
106201,Titus Andronicus,Tragedy,Bassianus,2,2,16,"Lavinia, how say you?",male,0.0
106202,Titus Andronicus,Tragedy,Lavinia,2,2,17,"I say, no;",female,0.0
106203,Titus Andronicus,Tragedy,Lavinia,2,2,18,I have been broad awake two hours and more.,female,0.28
106204,Titus Andronicus,Tragedy,Saturninus,2,2,19,"Come on, then; horse and chariots let us have,",male,0.0
106205,Titus Andronicus,Tragedy,Saturninus,2,2,20,And to our sport.,male,0.0
106206,Titus Andronicus,Tragedy,Saturninus,2,2,21,"Madam, now shall ye see",male,0.0
106207,Titus Andronicus,Tragedy,Saturninus,2,2,22,Our Roman hunting.,male,0.0
106208,Titus Andronicus,Tragedy,Marcus Andronicus,2,2,23,"I have dogs, my lord,",male,0.0
106209,Titus Andronicus,Tragedy,Marcus Andronicus,2,2,24,"Will rouse the proudest panther in the chase,",male,0.0
106210,Titus Andronicus,Tragedy,Marcus Andronicus,2,2,25,And climb the highest promontory top.,male,0.5
106211,Titus Andronicus,Tragedy,Titus Andronicus,2,2,26,And I have horse will follow where the game,male,-0.4
106212,Titus Andronicus,Tragedy,Titus Andronicus,2,2,27,"Makes way, and run like swallows o'er the plain.",male,-0.21
106213,Titus Andronicus,Tragedy,Demetrius,2,2,28,"Chiron, we hunt not, we, with horse nor hound,",male,0.0
106214,Titus Andronicus,Tragedy,Demetrius,2,2,29,But hope to pluck a dainty doe to ground.,male,0.9
106215,Titus Andronicus,Tragedy,Aaron,2,3,1,"He that had wit would think that I had none,",male,0.0
106216,Titus Andronicus,Tragedy,Aaron,2,3,2,"To bury so much gold under a tree,",male,0.2
106217,Titus Andronicus,Tragedy,Aaron,2,3,3,And never after to inherit it.,male,0.0
106218,Titus Andronicus,Tragedy,Aaron,2,3,4,Let him that thinks of me so abjectly,male,0.0
106219,Titus Andronicus,Tragedy,Aaron,2,3,5,"Know that this gold must coin a stratagem,",male,0.0
106220,Titus Andronicus,Tragedy,Aaron,2,3,6,"Which, cunningly effected, will beget",male,0.0
106221,Titus Andronicus,Tragedy,Aaron,2,3,7,A very excellent piece of villany:,male,1.0
106222,Titus Andronicus,Tragedy,Aaron,2,3,8,"And so repose, sweet gold, for their unrest",male,0.35
106223,Titus Andronicus,Tragedy,Aaron,2,3,9,That have their alms out of the empress' chest.,male,0.0
106224,Titus Andronicus,Tragedy,Tamora,2,3,10,"My lovely Aaron, wherefore look'st thou sad,",female,0.0
106225,Titus Andronicus,Tragedy,Tamora,2,3,11,When every thing doth make a gleeful boast?,female,0.0
106226,Titus Andronicus,Tragedy,Tamora,2,3,12,"The birds chant melody on every bush,",female,0.0
106227,Titus Andronicus,Tragedy,Tamora,2,3,13,"The snake lies rolled in the cheerful sun,",female,0.4
106228,Titus Andronicus,Tragedy,Tamora,2,3,14,The green leaves quiver with the cooling wind,female,-0.2
106229,Titus Andronicus,Tragedy,Tamora,2,3,15,And make a chequer'd shadow on the ground:,female,0.0
106230,Titus Andronicus,Tragedy,Tamora,2,3,16,"Under their sweet shade, Aaron, let us sit,",female,0.35
106231,Titus Andronicus,Tragedy,Tamora,2,3,17,"And, whilst the babbling echo mocks the hounds,",female,0.0
106232,Titus Andronicus,Tragedy,Tamora,2,3,18,"Replying shrilly to the well-tuned horns,",female,0.0
106233,Titus Andronicus,Tragedy,Tamora,2,3,19,"As if a double hunt were heard at once,",female,0.0
106234,Titus Andronicus,Tragedy,Tamora,2,3,20,Let us sit down and mark their yelping noise;,female,-0.16
106235,Titus Andronicus,Tragedy,Tamora,2,3,21,"And, after conflict such as was supposed",female,0.0
106236,Titus Andronicus,Tragedy,Tamora,2,3,22,"The wandering prince and Dido once enjoy'd,",female,0.4
106237,Titus Andronicus,Tragedy,Tamora,2,3,23,When with a happy storm they were surprised,female,0.45
106238,Titus Andronicus,Tragedy,Tamora,2,3,24,"And curtain'd with a counsel-keeping cave,",female,0.0
106239,Titus Andronicus,Tragedy,Tamora,2,3,25,"We may, each wreathed in the other's arms,",female,-0.12
106240,Titus Andronicus,Tragedy,Tamora,2,3,26,"Our pastimes done, possess a golden slumber;",female,0.3
106241,Titus Andronicus,Tragedy,Tamora,2,3,27,Whiles hounds and horns and sweet melodious birds,female,0.35
106242,Titus Andronicus,Tragedy,Tamora,2,3,28,Be unto us as is a nurse's song,female,0.0
106243,Titus Andronicus,Tragedy,Tamora,2,3,29,Of lullaby to bring her babe asleep.,female,0.0
106244,Titus Andronicus,Tragedy,Aaron,2,3,30,"Madam, though Venus govern your desires,",male,0.0
106245,Titus Andronicus,Tragedy,Aaron,2,3,31,Saturn is dominator over mine:,male,0.0
106246,Titus Andronicus,Tragedy,Aaron,2,3,32,"What signifies my deadly-standing eye,",male,0.0
106247,Titus Andronicus,Tragedy,Aaron,2,3,33,"My silence and my cloudy melancholy,",male,0.0
106248,Titus Andronicus,Tragedy,Aaron,2,3,34,My fleece of woolly hair that now uncurls,male,0.0
106249,Titus Andronicus,Tragedy,Aaron,2,3,35,Even as an adder when she doth unroll,male,0.0
106250,Titus Andronicus,Tragedy,Aaron,2,3,36,To do some fatal execution?,male,0.0
106251,Titus Andronicus,Tragedy,Aaron,2,3,37,"No, madam, these are no venereal signs:",male,0.0
106252,Titus Andronicus,Tragedy,Aaron,2,3,38,"Vengeance is in my heart, death in my hand,",male,0.0
106253,Titus Andronicus,Tragedy,Aaron,2,3,39,Blood and revenge are hammering in my head.,male,0.0
106254,Titus Andronicus,Tragedy,Aaron,2,3,40,"Hark Tamora, the empress of my soul,",male,0.0
106255,Titus Andronicus,Tragedy,Aaron,2,3,41,"Which never hopes more heaven than rests in thee,",male,0.5
106256,Titus Andronicus,Tragedy,Aaron,2,3,42,This is the day of doom for Bassianus:,male,0.0
106257,Titus Andronicus,Tragedy,Aaron,2,3,43,"His Philomel must lose her tongue to-day,",male,0.0
106258,Titus Andronicus,Tragedy,Aaron,2,3,44,Thy sons make pillage of her chastity,male,0.0
106259,Titus Andronicus,Tragedy,Aaron,2,3,45,And wash their hands in Bassianus' blood.,male,0.0
106260,Titus Andronicus,Tragedy,Aaron,2,3,46,"Seest thou this letter? take it up, I pray thee,",male,0.0
106261,Titus Andronicus,Tragedy,Aaron,2,3,47,And give the king this fatal plotted scroll.,male,0.0
106262,Titus Andronicus,Tragedy,Aaron,2,3,48,Now question me no more; we are espied;,male,-0.25
106263,Titus Andronicus,Tragedy,Aaron,2,3,49,"Here comes a parcel of our hopeful booty,",male,0.0
106264,Titus Andronicus,Tragedy,Aaron,2,3,50,Which dreads not yet their lives' destruction.,male,0.0
106265,Titus Andronicus,Tragedy,Tamora,2,3,51,"Ah, my sweet Moor, sweeter to me than life!",female,0.44
106266,Titus Andronicus,Tragedy,Aaron,2,3,52,"No more, great empress; Bassianus comes:",male,0.28
106267,Titus Andronicus,Tragedy,Aaron,2,3,53,Be cross with him; and I'll go fetch thy sons,male,0.0
106268,Titus Andronicus,Tragedy,Aaron,2,3,54,"To back thy quarrels, whatsoe'er they be.",male,0.0
106269,Titus Andronicus,Tragedy,Bassianus,2,3,55,"Who have we here? Rome's royal empress,",male,0.0
106270,Titus Andronicus,Tragedy,Bassianus,2,3,56,Unfurnish'd of her well-beseeming troop?,male,0.0
106271,Titus Andronicus,Tragedy,Bassianus,2,3,57,"Or is it Dian, habited like her,",male,0.0
106272,Titus Andronicus,Tragedy,Bassianus,2,3,58,Who hath abandoned her holy groves,male,0.0
106273,Titus Andronicus,Tragedy,Bassianus,2,3,59,To see the general hunting in this forest?,male,0.05
106274,Titus Andronicus,Tragedy,Tamora,2,3,60,Saucy controller of our private steps!,female,0.0
106275,Titus Andronicus,Tragedy,Tamora,2,3,61,"Had I the power that some say Dian had,",female,0.0
106276,Titus Andronicus,Tragedy,Tamora,2,3,62,Thy temples should be planted presently,female,0.0
106277,Titus Andronicus,Tragedy,Tamora,2,3,63,"With horns, as was Actaeon's; and the hounds",female,0.0
106278,Titus Andronicus,Tragedy,Tamora,2,3,64,"Should drive upon thy new-transformed limbs,",female,0.0
106279,Titus Andronicus,Tragedy,Tamora,2,3,65,Unmannerly intruder as thou art!,female,0.0
106280,Titus Andronicus,Tragedy,Lavinia,2,3,66,"Under your patience, gentle empress,",female,0.2
106281,Titus Andronicus,Tragedy,Lavinia,2,3,67,'Tis thought you have a goodly gift in horning;,female,0.7
106282,Titus Andronicus,Tragedy,Lavinia,2,3,68,And to be doubted that your Moor and you,female,0.0
106283,Titus Andronicus,Tragedy,Lavinia,2,3,69,Are singled forth to try experiments:,female,0.0
106284,Titus Andronicus,Tragedy,Lavinia,2,3,70,Jove shield your husband from his hounds to-day!,female,0.0
106285,Titus Andronicus,Tragedy,Lavinia,2,3,71,'Tis pity they should take him for a stag.,female,-0.1
106286,Titus Andronicus,Tragedy,Bassianus,2,3,72,"Believe me, queen, your swarth Cimmerian",male,0.0
106287,Titus Andronicus,Tragedy,Bassianus,2,3,73,"Doth make your honour of his body's hue,",male,0.0
106288,Titus Andronicus,Tragedy,Bassianus,2,3,74,"Spotted, detested, and abominable.",male,0.0
106289,Titus Andronicus,Tragedy,Bassianus,2,3,75,"Why are you sequester'd from all your train,",male,0.0
106290,Titus Andronicus,Tragedy,Bassianus,2,3,76,Dismounted from your snow-white goodly steed.,male,0.7
106291,Titus Andronicus,Tragedy,Bassianus,2,3,77,"And wander'd hither to an obscure plot,",male,0.0
106292,Titus Andronicus,Tragedy,Bassianus,2,3,78,"Accompanied but with a barbarous Moor,",male,0.0
106293,Titus Andronicus,Tragedy,Bassianus,2,3,79,If foul desire had not conducted you?,male,0.0
106294,Titus Andronicus,Tragedy,Lavinia,2,3,80,"And, being intercepted in your sport,",female,0.0
106295,Titus Andronicus,Tragedy,Lavinia,2,3,81,Great reason that my noble lord be rated,female,0.7
106296,Titus Andronicus,Tragedy,Lavinia,2,3,82,"For sauciness. I pray you, let us hence,",female,0.0
106297,Titus Andronicus,Tragedy,Lavinia,2,3,83,And let her joy her raven-colour'd love;,female,0.65
106298,Titus Andronicus,Tragedy,Lavinia,2,3,84,This valley fits the purpose passing well.,female,0.0
106299,Titus Andronicus,Tragedy,Bassianus,2,3,85,The king my brother shall have note of this.,male,0.0
