Unnamed: 0,play_name,genre,character,act,scene,sentence,text,sex,sentiment
107541,Titus Andronicus,Tragedy,Second Goth,5,1,27,"'Peace, tawny slave, half me and half thy dam!",male,-0.19
107542,Titus Andronicus,Tragedy,Second Goth,5,1,28,"Did not thy hue bewray whose brat thou art,",male,0.0
107543,Titus Andronicus,Tragedy,Second Goth,5,1,29,"Had nature lent thee but thy mother's look,",male,0.0
107544,Titus Andronicus,Tragedy,Second Goth,5,1,30,"Villain, thou mightst have been an emperor:",male,0.0
107545,Titus Andronicus,Tragedy,Second Goth,5,1,31,"But where the bull and cow are both milk-white,",male,-0.13
107546,Titus Andronicus,Tragedy,Second Goth,5,1,32,They never do beget a coal-black calf.,male,0.0
107547,Titus Andronicus,Tragedy,Second Goth,5,1,33,"Peace, villain, peace!'--even thus he rates",male,0.0
107548,Titus Andronicus,Tragedy,Second Goth,5,1,34,"the babe,--",male,0.0
107549,Titus Andronicus,Tragedy,Second Goth,5,1,35,'For I must bear thee to a trusty Goth;,male,0.0
107550,Titus Andronicus,Tragedy,Second Goth,5,1,36,"Who, when he knows thou art the empress' babe,",male,0.0
107551,Titus Andronicus,Tragedy,Second Goth,5,1,37,Will hold thee dearly for thy mother's sake.',male,0.0
107552,Titus Andronicus,Tragedy,Second Goth,5,1,38,"With this, my weapon drawn, I rush'd upon him,",male,0.0
107553,Titus Andronicus,Tragedy,Second Goth,5,1,39,"Surprised him suddenly, and brought him hither,",male,0.05
107554,Titus Andronicus,Tragedy,Second Goth,5,1,40,To use as you think needful of the man.,male,0.0
107555,Titus Andronicus,Tragedy,Lucius,5,1,41,"O worthy Goth, this is the incarnate devil",male,0.33
107556,Titus Andronicus,Tragedy,Lucius,5,1,42,That robb'd Andronicus of his good hand;,male,0.7
107557,Titus Andronicus,Tragedy,Lucius,5,1,43,"This is the pearl that pleased your empress' eye,",male,0.5
107558,Titus Andronicus,Tragedy,Lucius,5,1,44,And here's the base fruit of his burning lust.,male,-0.8
107559,Titus Andronicus,Tragedy,Lucius,5,1,45,"Say, wall-eyed slave, whither wouldst thou convey",male,0.0
107560,Titus Andronicus,Tragedy,Lucius,5,1,46,This growing image of thy fiend-like face?,male,0.0
107561,Titus Andronicus,Tragedy,Lucius,5,1,47,"Why dost not speak? what, deaf? not a word?",male,0.0
107562,Titus Andronicus,Tragedy,Lucius,5,1,48,"A halter, soldiers! hang him on this tree.",male,0.0
107563,Titus Andronicus,Tragedy,Lucius,5,1,49,And by his side his fruit of bastardy.,male,0.0
107564,Titus Andronicus,Tragedy,Aaron,5,1,50,Touch not the boy; he is of royal blood.,male,0.0
107565,Titus Andronicus,Tragedy,Lucius,5,1,51,Too like the sire for ever being good.,male,0.7
107566,Titus Andronicus,Tragedy,Lucius,5,1,52,"First hang the child, that he may see it sprawl;",male,0.25
107567,Titus Andronicus,Tragedy,Lucius,5,1,53,A sight to vex the father's soul withal.,male,0.0
107568,Titus Andronicus,Tragedy,Lucius,5,1,54,Get me a ladder.,male,0.0
107569,Titus Andronicus,Tragedy,Aaron,5,1,55,"Lucius, save the child,",male,0.0
107570,Titus Andronicus,Tragedy,Aaron,5,1,56,And bear it from me to the empress.,male,0.0
107571,Titus Andronicus,Tragedy,Aaron,5,1,57,"If thou do this, I'll show thee wondrous things,",male,0.0
107572,Titus Andronicus,Tragedy,Aaron,5,1,58,That highly may advantage thee to hear:,male,0.16
107573,Titus Andronicus,Tragedy,Aaron,5,1,59,"If thou wilt not, befall what may befall,",male,0.0
107574,Titus Andronicus,Tragedy,Aaron,5,1,60,I'll speak no more but 'Vengeance rot you all!',male,-0.31
107575,Titus Andronicus,Tragedy,Lucius,5,1,61,Say on: an if it please me which thou speak'st,male,0.0
107576,Titus Andronicus,Tragedy,Lucius,5,1,62,"Thy child shall live, and I will see it nourish'd.",male,0.14
107577,Titus Andronicus,Tragedy,Aaron,5,1,63,"An if it please thee! why, assure thee, Lucius,",male,0.0
107578,Titus Andronicus,Tragedy,Aaron,5,1,64,'Twill vex thy soul to hear what I shall speak;,male,0.0
107579,Titus Andronicus,Tragedy,Aaron,5,1,65,"For I must talk of murders, rapes and massacres,",male,0.0
107580,Titus Andronicus,Tragedy,Aaron,5,1,66,"Acts of black night, abominable deeds,",male,-0.17
107581,Titus Andronicus,Tragedy,Aaron,5,1,67,"Complots of mischief, treason, villanies",male,0.0
107582,Titus Andronicus,Tragedy,Aaron,5,1,68,"Ruthful to hear, yet piteously perform'd:",male,0.0
107583,Titus Andronicus,Tragedy,Aaron,5,1,69,"And this shall all be buried by my death,",male,0.0
107584,Titus Andronicus,Tragedy,Aaron,5,1,70,Unless thou swear to me my child shall live.,male,0.14
107585,Titus Andronicus,Tragedy,Lucius,5,1,71,Tell on thy mind; I say thy child shall live.,male,0.14
107586,Titus Andronicus,Tragedy,Aaron,5,1,72,"Swear that he shall, and then I will begin.",male,0.0
107587,Titus Andronicus,Tragedy,Lucius,5,1,73,Who should I swear by? thou believest no god:,male,0.0
107588,Titus Andronicus,Tragedy,Lucius,5,1,74,"That granted, how canst thou believe an oath?",male,0.0
107589,Titus Andronicus,Tragedy,Aaron,5,1,75,"What if I do not? as, indeed, I do not;",male,0.0
107590,Titus Andronicus,Tragedy,Aaron,5,1,76,"Yet, for I know thou art religious",male,0.0
107591,Titus Andronicus,Tragedy,Aaron,5,1,77,"And hast a thing within thee called conscience,",male,0.0
107592,Titus Andronicus,Tragedy,Aaron,5,1,78,"With twenty popish tricks and ceremonies,",male,0.0
107593,Titus Andronicus,Tragedy,Aaron,5,1,79,"Which I have seen thee careful to observe,",male,-0.1
107594,Titus Andronicus,Tragedy,Aaron,5,1,80,Therefore I urge thy oath; for that I know,male,0.0
107595,Titus Andronicus,Tragedy,Aaron,5,1,81,An idiot holds his bauble for a god,male,-0.8
107596,Titus Andronicus,Tragedy,Aaron,5,1,82,"And keeps the oath which by that god he swears,",male,0.0
107597,Titus Andronicus,Tragedy,Aaron,5,1,83,To that I'll urge him: therefore thou shalt vow,male,0.0
107598,Titus Andronicus,Tragedy,Aaron,5,1,84,"By that same god, what god soe'er it be,",male,0.0
107599,Titus Andronicus,Tragedy,Aaron,5,1,85,"That thou adorest and hast in reverence,",male,0.0
107600,Titus Andronicus,Tragedy,Aaron,5,1,86,"To save my boy, to nourish and bring him up;",male,0.0
107601,Titus Andronicus,Tragedy,Aaron,5,1,87,Or else I will discover nought to thee.,male,0.0
107602,Titus Andronicus,Tragedy,Lucius,5,1,88,Even by my god I swear to thee I will.,male,0.0
107603,Titus Andronicus,Tragedy,Aaron,5,1,89,"First know thou, I begot him on the empress.",male,0.25
107604,Titus Andronicus,Tragedy,Lucius,5,1,90,O most insatiate and luxurious woman!,male,0.62
107605,Titus Andronicus,Tragedy,Aaron,5,1,91,"Tut, Lucius, this was but a deed of charity",male,0.0
107606,Titus Andronicus,Tragedy,Aaron,5,1,92,To that which thou shalt hear of me anon.,male,0.0
107607,Titus Andronicus,Tragedy,Aaron,5,1,93,'Twas her two sons that murder'd Bassianus;,male,0.0
107608,Titus Andronicus,Tragedy,Aaron,5,1,94,They cut thy sister's tongue and ravish'd her,male,0.0
107609,Titus Andronicus,Tragedy,Aaron,5,1,95,And cut her hands and trimm'd her as thou saw'st.,male,0.0
107610,Titus Andronicus,Tragedy,Lucius,5,1,96,O detestable villain! call'st thou that trimming?,male,0.0
107611,Titus Andronicus,Tragedy,Aaron,5,1,97,"Why, she was wash'd and cut and trimm'd, and 'twas",male,0.0
107612,Titus Andronicus,Tragedy,Aaron,5,1,98,Trim sport for them that had the doing of it.,male,0.0
107613,Titus Andronicus,Tragedy,Lucius,5,1,99,"O barbarous, beastly villains, like thyself!",male,0.0
107614,Titus Andronicus,Tragedy,Aaron,5,1,100,"Indeed, I was their tutor to instruct them:",male,0.0
107615,Titus Andronicus,Tragedy,Aaron,5,1,101,"That codding spirit had they from their mother,",male,0.0
107616,Titus Andronicus,Tragedy,Aaron,5,1,102,As sure a card as ever won the set;,male,0.5
107617,Titus Andronicus,Tragedy,Aaron,5,1,103,"That bloody mind, I think, they learn'd of me,",male,-0.8
107618,Titus Andronicus,Tragedy,Aaron,5,1,104,As true a dog as ever fought at head.,male,0.35
107619,Titus Andronicus,Tragedy,Aaron,5,1,105,"Well, let my deeds be witness of my worth.",male,0.3
107620,Titus Andronicus,Tragedy,Aaron,5,1,106,I train'd thy brethren to that guileful hole,male,0.0
107621,Titus Andronicus,Tragedy,Aaron,5,1,107,Where the dead corpse of Bassianus lay:,male,-0.2
107622,Titus Andronicus,Tragedy,Aaron,5,1,108,I wrote the letter that thy father found,male,0.0
107623,Titus Andronicus,Tragedy,Aaron,5,1,109,"And hid the gold within the letter mention'd,",male,0.0
107624,Titus Andronicus,Tragedy,Aaron,5,1,110,Confederate with the queen and her two sons:,male,0.0
107625,Titus Andronicus,Tragedy,Aaron,5,1,111,"And what not done, that thou hast cause to rue,",male,0.0
107626,Titus Andronicus,Tragedy,Aaron,5,1,112,Wherein I had no stroke of mischief in it?,male,0.0
107627,Titus Andronicus,Tragedy,Aaron,5,1,113,"I play'd the cheater for thy father's hand,",male,0.0
107628,Titus Andronicus,Tragedy,Aaron,5,1,114,"And, when I had it, drew myself apart",male,0.0
107629,Titus Andronicus,Tragedy,Aaron,5,1,115,And almost broke my heart with extreme laughter:,male,-0.12
107630,Titus Andronicus,Tragedy,Aaron,5,1,116,I pry'd me through the crevice of a wall,male,0.0
107631,Titus Andronicus,Tragedy,Aaron,5,1,117,"When, for his hand, he had his two sons' heads;",male,0.0
107632,Titus Andronicus,Tragedy,Aaron,5,1,118,"Beheld his tears, and laugh'd so heartily,",male,0.3
107633,Titus Andronicus,Tragedy,Aaron,5,1,119,That both mine eyes were rainy like to his :,male,0.0
107634,Titus Andronicus,Tragedy,Aaron,5,1,120,"And when I told the empress of this sport,",male,0.0
107635,Titus Andronicus,Tragedy,Aaron,5,1,121,"She swooned almost at my pleasing tale,",male,0.0
107636,Titus Andronicus,Tragedy,Aaron,5,1,122,And for my tidings gave me twenty kisses.,male,0.0
107637,Titus Andronicus,Tragedy,First Goth,5,1,123,"What, canst thou say all this, and never blush?",male,0.0
107638,Titus Andronicus,Tragedy,Aaron,5,1,124,"Ay, like a black dog, as the saying is.",male,-0.17
107639,Titus Andronicus,Tragedy,Lucius,5,1,125,Art thou not sorry for these heinous deeds?,male,0.25
107640,Titus Andronicus,Tragedy,Aaron,5,1,126,"Ay, that I had not done a thousand more.",male,0.5
107641,Titus Andronicus,Tragedy,Aaron,5,1,127,"Even now I curse the day--and yet, I think,",male,0.0
107642,Titus Andronicus,Tragedy,Aaron,5,1,128,"Few come within the compass of my curse,--",male,-0.2
107643,Titus Andronicus,Tragedy,Aaron,5,1,129,"Wherein I did not some notorious ill,",male,-0.5
107644,Titus Andronicus,Tragedy,Aaron,5,1,130,"As kill a man, or else devise his death,",male,0.0
107645,Titus Andronicus,Tragedy,Aaron,5,1,131,"Ravish a maid, or plot the way to do it,",male,0.0
107646,Titus Andronicus,Tragedy,Aaron,5,1,132,"Accuse some innocent and forswear myself,",male,0.5
107647,Titus Andronicus,Tragedy,Aaron,5,1,133,"Set deadly enmity between two friends,",male,-0.2
107648,Titus Andronicus,Tragedy,Aaron,5,1,134,Make poor men's cattle break their necks;,male,-0.4
107649,Titus Andronicus,Tragedy,Aaron,5,1,135,"Set fire on barns and hay-stacks in the night,",male,0.0
107650,Titus Andronicus,Tragedy,Aaron,5,1,136,And bid the owners quench them with their tears.,male,0.0
107651,Titus Andronicus,Tragedy,Aaron,5,1,137,"Oft have I digg'd up dead men from their graves,",male,-0.2
107652,Titus Andronicus,Tragedy,Aaron,5,1,138,"And set them upright at their dear friends' doors,",male,0.0
107653,Titus Andronicus,Tragedy,Aaron,5,1,139,Even when their sorrows almost were forgot;,male,0.0
107654,Titus Andronicus,Tragedy,Aaron,5,1,140,"And on their skins, as on the bark of trees,",male,0.0
107655,Titus Andronicus,Tragedy,Aaron,5,1,141,"Have with my knife carved in Roman letters,",male,0.0
107656,Titus Andronicus,Tragedy,Aaron,5,1,142,"'Let not your sorrow die, though I am dead.'",male,-0.2
107657,Titus Andronicus,Tragedy,Aaron,5,1,143,"Tut, I have done a thousand dreadful things",male,-1.0
107658,Titus Andronicus,Tragedy,Aaron,5,1,144,"As willingly as one would kill a fly,",male,0.53
107659,Titus Andronicus,Tragedy,Aaron,5,1,145,And nothing grieves me heartily indeed,male,0.0
107660,Titus Andronicus,Tragedy,Aaron,5,1,146,But that I cannot do ten thousand more.,male,0.25
107661,Titus Andronicus,Tragedy,Lucius,5,1,147,Bring down the devil; for he must not die,male,-0.16
107662,Titus Andronicus,Tragedy,Lucius,5,1,148,So sweet a death as hanging presently.,male,0.17
107663,Titus Andronicus,Tragedy,Aaron,5,1,149,"If there be devils, would I were a devil,",male,0.0
107664,Titus Andronicus,Tragedy,Aaron,5,1,150,"To live and burn in everlasting fire,",male,0.14
107665,Titus Andronicus,Tragedy,Aaron,5,1,151,"So I might have your company in hell,",male,0.0
107666,Titus Andronicus,Tragedy,Aaron,5,1,152,But to torment you with my bitter tongue!,male,-0.12
107667,Titus Andronicus,Tragedy,Lucius,5,1,153,"Sirs, stop his mouth, and let him speak no more.",male,-0.25
107668,Titus Andronicus,Tragedy,Third Goth,5,1,154,"My lord, there is a messenger from Rome",male,0.0
107669,Titus Andronicus,Tragedy,Third Goth,5,1,155,Desires to be admitted to your presence.,male,0.0
107670,Titus Andronicus,Tragedy,Lucius,5,1,156,Let him come near.,male,0.1
107671,Titus Andronicus,Tragedy,Lucius,5,1,157,"Welcome, AEmilius	what's the news from Rome?",male,0.8
107672,Titus Andronicus,Tragedy,Aemilius,5,1,158,"Lord Lucius, and you princes of the Goths,",male,0.0
107673,Titus Andronicus,Tragedy,Aemilius,5,1,159,The Roman emperor greets you all by me;,male,0.0
107674,Titus Andronicus,Tragedy,Aemilius,5,1,160,"And, for he understands you are in arms,",male,0.0
107675,Titus Andronicus,Tragedy,Aemilius,5,1,161,"He craves a parley at your father's house,",male,0.0
107676,Titus Andronicus,Tragedy,Aemilius,5,1,162,"Willing you to demand your hostages,",male,0.25
107677,Titus Andronicus,Tragedy,Aemilius,5,1,163,And they shall be immediately deliver'd.,male,0.0
107678,Titus Andronicus,Tragedy,First Goth,5,1,164,What says our general?,male,0.05
107679,Titus Andronicus,Tragedy,Lucius,5,1,165,"AEmilius, let the emperor give his pledges",male,0.0
107680,Titus Andronicus,Tragedy,Lucius,5,1,166,"Unto my father and my uncle Marcus,",male,0.0
107681,Titus Andronicus,Tragedy,Lucius,5,1,167,And we will come. March away.,male,0.0
107682,Titus Andronicus,Tragedy,Tamora,5,2,1,"Thus, in this strange and sad habiliment,",female,-0.28
107683,Titus Andronicus,Tragedy,Tamora,5,2,2,"I will encounter with Andronicus,",female,0.0
107684,Titus Andronicus,Tragedy,Tamora,5,2,3,"And say I am Revenge, sent from below",female,0.0
107685,Titus Andronicus,Tragedy,Tamora,5,2,4,To join with him and right his heinous wrongs.,female,0.29
107686,Titus Andronicus,Tragedy,Tamora,5,2,5,"Knock at his study, where, they say, he keeps,",female,0.0
107687,Titus Andronicus,Tragedy,Tamora,5,2,6,To ruminate strange plots of dire revenge;,female,-0.05
107688,Titus Andronicus,Tragedy,Tamora,5,2,7,"Tell him Revenge is come to join with him,",female,0.0
107689,Titus Andronicus,Tragedy,Tamora,5,2,8,And work confusion on his enemies.,female,0.0
107690,Titus Andronicus,Tragedy,Titus Andronicus,5,2,9,Who doth molest my contemplation?,male,0.0
107691,Titus Andronicus,Tragedy,Titus Andronicus,5,2,10,"Is it your trick to make me ope the door,",male,0.0
107692,Titus Andronicus,Tragedy,Titus Andronicus,5,2,11,"That so my sad decrees may fly away,",male,0.15
107693,Titus Andronicus,Tragedy,Titus Andronicus,5,2,12,And all my study be to no effect?,male,0.0
107694,Titus Andronicus,Tragedy,Titus Andronicus,5,2,13,You are deceived: for what I mean to do,male,-0.31
107695,Titus Andronicus,Tragedy,Titus Andronicus,5,2,14,See here in bloody lines I have set down;,male,-0.48
107696,Titus Andronicus,Tragedy,Titus Andronicus,5,2,15,And what is written shall be executed.,male,0.0
107697,Titus Andronicus,Tragedy,Tamora,5,2,16,"Titus, I am come to talk with thee.",female,0.0
107698,Titus Andronicus,Tragedy,Titus Andronicus,5,2,17,"No, not a word; how can I grace my talk,",male,0.0
107699,Titus Andronicus,Tragedy,Titus Andronicus,5,2,18,Wanting a hand to give it action?,male,0.1
107700,Titus Andronicus,Tragedy,Titus Andronicus,5,2,19,Thou hast the odds of me; therefore no more.,male,-0.25
107701,Titus Andronicus,Tragedy,Tamora,5,2,20,"If thou didst know me, thou wouldest talk with me.",female,0.0
107702,Titus Andronicus,Tragedy,Titus Andronicus,5,2,21,I am not mad; I know thee well enough:,male,0.16
107703,Titus Andronicus,Tragedy,Titus Andronicus,5,2,22,"Witness this wretched stump, witness these crimson lines;",male,0.0
107704,Titus Andronicus,Tragedy,Titus Andronicus,5,2,23,"Witness these trenches made by grief and care,",male,-0.8
107705,Titus Andronicus,Tragedy,Titus Andronicus,5,2,24,Witness the tiring day and heavy night;,male,-0.2
107706,Titus Andronicus,Tragedy,Titus Andronicus,5,2,25,"Witness all sorrow, that I know thee well",male,0.0
107707,Titus Andronicus,Tragedy,Titus Andronicus,5,2,26,"For our proud empress, mighty Tamora:",male,0.6
107708,Titus Andronicus,Tragedy,Titus Andronicus,5,2,27,Is not thy coming for my other hand?,male,-0.12
107709,Titus Andronicus,Tragedy,Tamora,5,2,28,"Know, thou sad man, I am not Tamora;",female,-0.5
107710,Titus Andronicus,Tragedy,Tamora,5,2,29,"She is thy enemy, and I thy friend:",female,0.0
107711,Titus Andronicus,Tragedy,Tamora,5,2,30,"I am Revenge: sent from the infernal kingdom,",female,0.0
107712,Titus Andronicus,Tragedy,Tamora,5,2,31,"To ease the gnawing vulture of thy mind,",female,0.0
107713,Titus Andronicus,Tragedy,Tamora,5,2,32,By working wreakful vengeance on thy foes.,female,0.0
107714,Titus Andronicus,Tragedy,Tamora,5,2,33,"Come down, and welcome me to this world's light;",female,0.35
107715,Titus Andronicus,Tragedy,Tamora,5,2,34,Confer with me of murder and of death:,female,0.0
107716,Titus Andronicus,Tragedy,Tamora,5,2,35,"There's not a hollow cave or lurking-place,",female,0.05
107717,Titus Andronicus,Tragedy,Tamora,5,2,36,"No vast obscurity or misty vale,",female,0.0
107718,Titus Andronicus,Tragedy,Tamora,5,2,37,Where bloody murder or detested rape,female,-0.8
107719,Titus Andronicus,Tragedy,Tamora,5,2,38,"Can couch for fear, but I will find them out;",female,0.0
107720,Titus Andronicus,Tragedy,Tamora,5,2,39,"And in their ears tell them my dreadful name,",female,-1.0
107721,Titus Andronicus,Tragedy,Tamora,5,2,40,"Revenge, which makes the foul offender quake.",female,0.0
107722,Titus Andronicus,Tragedy,Titus Andronicus,5,2,41,"Art thou Revenge? and art thou sent to me,",male,0.0
107723,Titus Andronicus,Tragedy,Titus Andronicus,5,2,42,To be a torment to mine enemies?,male,0.0
107724,Titus Andronicus,Tragedy,Tamora,5,2,43,"I am; therefore come down, and welcome me.",female,0.32
107725,Titus Andronicus,Tragedy,Titus Andronicus,5,2,44,"Do me some service, ere I come to thee.",male,0.0
107726,Titus Andronicus,Tragedy,Titus Andronicus,5,2,45,"Lo, by thy side where Rape and Murder stands;",male,0.0
107727,Titus Andronicus,Tragedy,Titus Andronicus,5,2,46,"Now give me some surance that thou art Revenge,",male,0.0
107728,Titus Andronicus,Tragedy,Titus Andronicus,5,2,47,"Stab them, or tear them on thy chariot-wheels;",male,0.0
107729,Titus Andronicus,Tragedy,Titus Andronicus,5,2,48,"And then I'll come and be thy waggoner,",male,0.0
107730,Titus Andronicus,Tragedy,Titus Andronicus,5,2,49,And whirl along with thee about the globe.,male,0.0
107731,Titus Andronicus,Tragedy,Titus Andronicus,5,2,50,"Provide thee two proper palfreys, black as jet,",male,-0.08
107732,Titus Andronicus,Tragedy,Titus Andronicus,5,2,51,"To hale thy vengeful waggon swift away,",male,0.0
107733,Titus Andronicus,Tragedy,Titus Andronicus,5,2,52,And find out murderers in their guilty caves:,male,-0.5
107734,Titus Andronicus,Tragedy,Titus Andronicus,5,2,53,"And when thy car is loaden with their heads,",male,0.0
107735,Titus Andronicus,Tragedy,Titus Andronicus,5,2,54,"I will dismount, and by the waggon-wheel",male,0.0
107736,Titus Andronicus,Tragedy,Titus Andronicus,5,2,55,"Trot, like a servile footman, all day long,",male,-0.05
107737,Titus Andronicus,Tragedy,Titus Andronicus,5,2,56,Even from Hyperion's rising in the east,male,0.0
107738,Titus Andronicus,Tragedy,Titus Andronicus,5,2,57,Until his very downfall in the sea:,male,0.2
107739,Titus Andronicus,Tragedy,Titus Andronicus,5,2,58,"And day by day I'll do this heavy task,",male,-0.2
107740,Titus Andronicus,Tragedy,Titus Andronicus,5,2,59,So thou destroy Rapine and Murder there.,male,-0.2
107741,Titus Andronicus,Tragedy,Tamora,5,2,60,"These are my ministers, and come with me.",female,0.0
107742,Titus Andronicus,Tragedy,Titus Andronicus,5,2,61,Are these thy ministers? what are they call'd?,male,0.0
107743,Titus Andronicus,Tragedy,Tamora,5,2,62,"Rapine and Murder; therefore called so,",female,0.0
107744,Titus Andronicus,Tragedy,Tamora,5,2,63,Cause they take vengeance of such kind of men.,female,0.3
107745,Titus Andronicus,Tragedy,Titus Andronicus,5,2,64,"Good Lord, how like the empress' sons they are!",male,0.88
107746,Titus Andronicus,Tragedy,Titus Andronicus,5,2,65,"And you, the empress! but we worldly men",male,0.0
107747,Titus Andronicus,Tragedy,Titus Andronicus,5,2,66,"Have miserable, mad, mistaking eyes.",male,-0.81
107748,Titus Andronicus,Tragedy,Titus Andronicus,5,2,67,"O sweet Revenge, now do I come to thee;",male,0.35
107749,Titus Andronicus,Tragedy,Titus Andronicus,5,2,68,"And, if one arm's embracement will content thee,",male,0.0
107750,Titus Andronicus,Tragedy,Titus Andronicus,5,2,69,I will embrace thee in it by and by.,male,0.0
107751,Titus Andronicus,Tragedy,Tamora,5,2,70,This closing with him fits his lunacy,female,0.0
107752,Titus Andronicus,Tragedy,Tamora,5,2,71,"Whate'er I forge to feed his brain-sick fits,",female,0.0
107753,Titus Andronicus,Tragedy,Tamora,5,2,72,"Do you uphold and maintain in your speeches,",female,0.0
107754,Titus Andronicus,Tragedy,Tamora,5,2,73,For now he firmly takes me for Revenge;,female,-0.2
107755,Titus Andronicus,Tragedy,Tamora,5,2,74,"And, being credulous in this mad thought,",female,-0.62
107756,Titus Andronicus,Tragedy,Tamora,5,2,75,I'll make him send for Lucius his son;,female,0.0
107757,Titus Andronicus,Tragedy,Tamora,5,2,76,"And, whilst I at a banquet hold him sure,",female,0.5
107758,Titus Andronicus,Tragedy,Tamora,5,2,77,"I'll find some cunning practise out of hand,",female,0.0
107759,Titus Andronicus,Tragedy,Tamora,5,2,78,"To scatter and disperse the giddy Goths,",female,0.0
107760,Titus Andronicus,Tragedy,Tamora,5,2,79,"Or, at the least, make them his enemies.",female,-0.3
107761,Titus Andronicus,Tragedy,Tamora,5,2,80,"See, here he comes, and I must ply my theme.",female,0.0
107762,Titus Andronicus,Tragedy,Titus Andronicus,5,2,81,"Long have I been forlorn, and all for thee:",male,-0.05
107763,Titus Andronicus,Tragedy,Titus Andronicus,5,2,82,"Welcome, dread Fury, to my woful house:",male,0.8
107764,Titus Andronicus,Tragedy,Titus Andronicus,5,2,83,"Rapine and Murder, you are welcome too.",male,0.8
107765,Titus Andronicus,Tragedy,Titus Andronicus,5,2,84,How like the empress and her sons you are!,male,0.0
107766,Titus Andronicus,Tragedy,Titus Andronicus,5,2,85,"Well are you fitted, had you but a Moor:",male,0.0
107767,Titus Andronicus,Tragedy,Titus Andronicus,5,2,86,Could not all hell afford you such a devil?,male,0.0
107768,Titus Andronicus,Tragedy,Titus Andronicus,5,2,87,For well I wot the empress never wags,male,0.0
107769,Titus Andronicus,Tragedy,Titus Andronicus,5,2,88,But in her company there is a Moor;,male,0.0
107770,Titus Andronicus,Tragedy,Titus Andronicus,5,2,89,"And, would you represent our queen aright,",male,0.0
107771,Titus Andronicus,Tragedy,Titus Andronicus,5,2,90,It were convenient you had such a devil:,male,0.0
107772,Titus Andronicus,Tragedy,Titus Andronicus,5,2,91,"But welcome, as you are. What shall we do?",male,0.8
107773,Titus Andronicus,Tragedy,Tamora,5,2,92,"What wouldst thou have us do, Andronicus?",female,0.0
107774,Titus Andronicus,Tragedy,Demetrius,5,2,93,"Show me a murderer, I'll deal with him.",male,0.0
107775,Titus Andronicus,Tragedy,Chiron,5,2,94,"Show me a villain that hath done a rape,",male,0.0
107776,Titus Andronicus,Tragedy,Chiron,5,2,95,And I am sent to be revenged on him.,male,0.0
107777,Titus Andronicus,Tragedy,Tamora,5,2,96,"Show me a thousand that have done thee wrong,",female,-0.5
107778,Titus Andronicus,Tragedy,Tamora,5,2,97,And I will be revenged on them all.,female,0.0
107779,Titus Andronicus,Tragedy,Titus Andronicus,5,2,98,Look round about the wicked streets of Rome;,male,-0.2
107780,Titus Andronicus,Tragedy,Titus Andronicus,5,2,99,And when thou find'st a man that's like thyself.,male,0.0
107781,Titus Andronicus,Tragedy,Titus Andronicus,5,2,100,"Good Murder, stab him; he's a murderer.",male,0.7
107782,Titus Andronicus,Tragedy,Titus Andronicus,5,2,101,Go thou with him; and when it is thy hap,male,0.0
107783,Titus Andronicus,Tragedy,Titus Andronicus,5,2,102,"To find another that is like to thee,",male,0.0
107784,Titus Andronicus,Tragedy,Titus Andronicus,5,2,103,"Good Rapine, stab him; he's a ravisher.",male,0.7
107785,Titus Andronicus,Tragedy,Titus Andronicus,5,2,104,Go thou with them; and in the emperor's court,male,0.0
107786,Titus Andronicus,Tragedy,Titus Andronicus,5,2,105,"There is a queen, attended by a Moor;",male,0.0
107787,Titus Andronicus,Tragedy,Titus Andronicus,5,2,106,"Well mayst thou know her by thy own proportion,",male,0.6
107788,Titus Andronicus,Tragedy,Titus Andronicus,5,2,107,for up and down she doth resemble thee:,male,-0.16
107789,Titus Andronicus,Tragedy,Titus Andronicus,5,2,108,"I pray thee, do on them some violent death;",male,-0.8
107790,Titus Andronicus,Tragedy,Titus Andronicus,5,2,109,They have been violent to me and mine.,male,-0.8
107791,Titus Andronicus,Tragedy,Tamora,5,2,110,Well hast thou lesson'd us; this shall we do.,female,0.0
107792,Titus Andronicus,Tragedy,Tamora,5,2,111,"But would it please thee, good Andronicus,",female,0.7
107793,Titus Andronicus,Tragedy,Tamora,5,2,112,"To send for Lucius, thy thrice-valiant son,",female,0.0
107794,Titus Andronicus,Tragedy,Tamora,5,2,113,"Who leads towards Rome a band of warlike Goths,",female,0.0
