Unnamed: 0,play_name,genre,character,act,scene,sentence,text,sex,sentiment
106795,Titus Andronicus,Tragedy,Marcus Andronicus,3,1,216,"O brother, speak with possibilities,",male,0.0
106796,Titus Andronicus,Tragedy,Marcus Andronicus,3,1,217,And do not break into these deep extremes.,male,0.0
106797,Titus Andronicus,Tragedy,Titus Andronicus,3,1,218,"Is not my sorrow deep, having no bottom?",male,0.0
106798,Titus Andronicus,Tragedy,Titus Andronicus,3,1,219,Then be my passions bottomless with them.,male,0.0
106799,Titus Andronicus,Tragedy,Marcus Andronicus,3,1,220,But yet let reason govern thy lament.,male,0.0
106800,Titus Andronicus,Tragedy,Titus Andronicus,3,1,221,"If there were reason for these miseries,",male,0.0
106801,Titus Andronicus,Tragedy,Titus Andronicus,3,1,222,Then into limits could I bind my woes:,male,0.0
106802,Titus Andronicus,Tragedy,Titus Andronicus,3,1,223,"When heaven doth weep, doth not the earth o'erflow?",male,0.0
106803,Titus Andronicus,Tragedy,Titus Andronicus,3,1,224,"If the winds rage, doth not the sea wax mad,",male,-0.62
106804,Titus Andronicus,Tragedy,Titus Andronicus,3,1,225,Threatening the welkin with his big-swoln face?,male,0.0
106805,Titus Andronicus,Tragedy,Titus Andronicus,3,1,226,And wilt thou have a reason for this coil?,male,0.0
106806,Titus Andronicus,Tragedy,Titus Andronicus,3,1,227,"I am the sea; hark, how her sighs do blow!",male,0.0
106807,Titus Andronicus,Tragedy,Titus Andronicus,3,1,228,"She is the weeping welkin, I the earth:",male,0.0
106808,Titus Andronicus,Tragedy,Titus Andronicus,3,1,229,Then must my sea be moved with her sighs;,male,0.0
106809,Titus Andronicus,Tragedy,Titus Andronicus,3,1,230,Then must my earth with her continual tears,male,0.0
106810,Titus Andronicus,Tragedy,Titus Andronicus,3,1,231,"Become a deluge, overflow'd and drown'd;",male,0.0
106811,Titus Andronicus,Tragedy,Titus Andronicus,3,1,232,"For why my bowels cannot hide her woes,",male,0.0
106812,Titus Andronicus,Tragedy,Titus Andronicus,3,1,233,But like a drunkard must I vomit them.,male,0.0
106813,Titus Andronicus,Tragedy,Titus Andronicus,3,1,234,"Then give me leave, for losers will have leave",male,-0.2
106814,Titus Andronicus,Tragedy,Titus Andronicus,3,1,235,To ease their stomachs with their bitter tongues.,male,-0.1
106815,Titus Andronicus,Tragedy,Messenger,3,1,236,"Worthy Andronicus, ill art thou repaid",male,-0.08
106816,Titus Andronicus,Tragedy,Messenger,3,1,237,For that good hand thou sent'st the emperor.,male,0.7
106817,Titus Andronicus,Tragedy,Messenger,3,1,238,Here are the heads of thy two noble sons;,male,0.6
106818,Titus Andronicus,Tragedy,Messenger,3,1,239,"And here's thy hand, in scorn to thee sent back;",male,0.0
106819,Titus Andronicus,Tragedy,Messenger,3,1,240,"Thy griefs their sports, thy resolution mock'd;",male,0.0
106820,Titus Andronicus,Tragedy,Messenger,3,1,241,That woe is me to think upon thy woes,male,0.0
106821,Titus Andronicus,Tragedy,Messenger,3,1,242,More than remembrance of my father's death.,male,0.5
106822,Titus Andronicus,Tragedy,Marcus Andronicus,3,1,243,"Now let hot AEtna cool in Sicily,",male,0.3
106823,Titus Andronicus,Tragedy,Marcus Andronicus,3,1,244,And be my heart an ever-burning hell!,male,0.0
106824,Titus Andronicus,Tragedy,Marcus Andronicus,3,1,245,These miseries are more than may be borne.,male,0.5
106825,Titus Andronicus,Tragedy,Marcus Andronicus,3,1,246,To weep with them that weep doth ease some deal;,male,0.0
106826,Titus Andronicus,Tragedy,Marcus Andronicus,3,1,247,But sorrow flouted at is double death.,male,0.0
106827,Titus Andronicus,Tragedy,Lucius,3,1,248,"Ah, that this sight should make so deep a wound,",male,0.0
106828,Titus Andronicus,Tragedy,Lucius,3,1,249,And yet detested life not shrink thereat!,male,0.0
106829,Titus Andronicus,Tragedy,Lucius,3,1,250,"That ever death should let life bear his name,",male,0.0
106830,Titus Andronicus,Tragedy,Lucius,3,1,251,Where life hath no more interest but to breathe!,male,-0.31
106831,Titus Andronicus,Tragedy,Marcus Andronicus,3,1,252,"Alas, poor heart, that kiss is comfortless",male,-0.4
106832,Titus Andronicus,Tragedy,Marcus Andronicus,3,1,253,As frozen water to a starved snake.,male,0.0
106833,Titus Andronicus,Tragedy,Titus Andronicus,3,1,254,When will this fearful slumber have an end?,male,-0.9
106834,Titus Andronicus,Tragedy,Marcus Andronicus,3,1,255,"Now, farewell, flattery: die, Andronicus;",male,0.0
106835,Titus Andronicus,Tragedy,Marcus Andronicus,3,1,256,"Thou dost not slumber: see, thy two sons' heads,",male,0.0
106836,Titus Andronicus,Tragedy,Marcus Andronicus,3,1,257,"Thy warlike hand, thy mangled daughter here:",male,0.0
106837,Titus Andronicus,Tragedy,Marcus Andronicus,3,1,258,"Thy other banish'd son, with this dear sight",male,-0.12
106838,Titus Andronicus,Tragedy,Marcus Andronicus,3,1,259,"Struck pale and bloodless; and thy brother, I,",male,-0.21
106839,Titus Andronicus,Tragedy,Marcus Andronicus,3,1,260,"Even like a stony image, cold and numb.",male,-0.6
106840,Titus Andronicus,Tragedy,Marcus Andronicus,3,1,261,"Ah, now no more will I control thy griefs:",male,-0.25
106841,Titus Andronicus,Tragedy,Marcus Andronicus,3,1,262,"Rend off thy silver hair, thy other hand",male,-0.12
106842,Titus Andronicus,Tragedy,Marcus Andronicus,3,1,263,Gnawing with thy teeth; and be this dismal sight,male,0.0
106843,Titus Andronicus,Tragedy,Marcus Andronicus,3,1,264,The closing up of our most wretched eyes;,male,0.5
106844,Titus Andronicus,Tragedy,Marcus Andronicus,3,1,265,Now is a time to storm; why art thou still?,male,0.0
106845,Titus Andronicus,Tragedy,Titus Andronicus,3,1,266,"Ha, ha, ha!",male,0.0
106846,Titus Andronicus,Tragedy,Marcus Andronicus,3,1,267,Why dost thou laugh? it fits not with this hour.,male,0.3
106847,Titus Andronicus,Tragedy,Titus Andronicus,3,1,268,"Why, I have not another tear to shed:",male,0.0
106848,Titus Andronicus,Tragedy,Titus Andronicus,3,1,269,"Besides, this sorrow is an enemy,",male,0.0
106849,Titus Andronicus,Tragedy,Titus Andronicus,3,1,270,And would usurp upon my watery eyes,male,0.0
106850,Titus Andronicus,Tragedy,Titus Andronicus,3,1,271,And make them blind with tributary tears:,male,-0.5
106851,Titus Andronicus,Tragedy,Titus Andronicus,3,1,272,Then which way shall I find Revenge's cave?,male,0.0
106852,Titus Andronicus,Tragedy,Titus Andronicus,3,1,273,"For these two heads do seem to speak to me,",male,0.0
106853,Titus Andronicus,Tragedy,Titus Andronicus,3,1,274,And threat me I shall never come to bliss,male,0.0
106854,Titus Andronicus,Tragedy,Titus Andronicus,3,1,275,Till all these mischiefs be return'd again,male,0.0
106855,Titus Andronicus,Tragedy,Titus Andronicus,3,1,276,Even in their throats that have committed them.,male,0.0
106856,Titus Andronicus,Tragedy,Titus Andronicus,3,1,277,"Come, let me see what task I have to do.",male,0.0
106857,Titus Andronicus,Tragedy,Titus Andronicus,3,1,278,"You heavy people, circle me about,",male,-0.2
106858,Titus Andronicus,Tragedy,Titus Andronicus,3,1,279,"That I may turn me to each one of you,",male,0.0
106859,Titus Andronicus,Tragedy,Titus Andronicus,3,1,280,And swear unto my soul to right your wrongs.,male,0.29
106860,Titus Andronicus,Tragedy,Titus Andronicus,3,1,281,"The vow is made. Come, brother, take a head;",male,0.0
106861,Titus Andronicus,Tragedy,Titus Andronicus,3,1,282,And in this hand the other I will bear.,male,-0.12
106862,Titus Andronicus,Tragedy,Titus Andronicus,3,1,283,"Lavinia, thou shalt be employ'd: these arms!",male,0.0
106863,Titus Andronicus,Tragedy,Titus Andronicus,3,1,284,"Bear thou my hand, sweet wench, between thy teeth.",male,0.35
106864,Titus Andronicus,Tragedy,Titus Andronicus,3,1,285,"As for thee, boy, go get thee from my sight;",male,0.0
106865,Titus Andronicus,Tragedy,Titus Andronicus,3,1,286,"Thou art an exile, and thou must not stay:",male,0.0
106866,Titus Andronicus,Tragedy,Titus Andronicus,3,1,287,"Hie to the Goths, and raise an army there:",male,0.0
106867,Titus Andronicus,Tragedy,Titus Andronicus,3,1,288,"And, if you love me, as I think you do,",male,0.5
106868,Titus Andronicus,Tragedy,Titus Andronicus,3,1,289,"Let's kiss and part, for we have much to do.",male,0.2
106869,Titus Andronicus,Tragedy,Lucius,3,1,290,"Farewell Andronicus, my noble father,",male,0.6
106870,Titus Andronicus,Tragedy,Lucius,3,1,291,The wofull'st man that ever lived in Rome:,male,0.0
106871,Titus Andronicus,Tragedy,Lucius,3,1,292,"Farewell, proud Rome; till Lucius come again,",male,0.8
106872,Titus Andronicus,Tragedy,Lucius,3,1,293,He leaves his pledges dearer than his life:,male,0.0
106873,Titus Andronicus,Tragedy,Lucius,3,1,294,"Farewell, Lavinia, my noble sister;",male,0.6
106874,Titus Andronicus,Tragedy,Lucius,3,1,295,"O, would thou wert as thou tofore hast been!",male,0.0
106875,Titus Andronicus,Tragedy,Lucius,3,1,296,But now nor Lucius nor Lavinia lives,male,0.0
106876,Titus Andronicus,Tragedy,Lucius,3,1,297,But in oblivion and hateful griefs.,male,0.0
106877,Titus Andronicus,Tragedy,Lucius,3,1,298,"If Lucius live, he will requite your wrongs;",male,0.14
106878,Titus Andronicus,Tragedy,Lucius,3,1,299,And make proud Saturnine and his empress,male,0.8
106879,Titus Andronicus,Tragedy,Lucius,3,1,300,"Beg at the gates, like Tarquin and his queen.",male,0.0
106880,Titus Andronicus,Tragedy,Lucius,3,1,301,"Now will I to the Goths, and raise a power,",male,0.0
106881,Titus Andronicus,Tragedy,Lucius,3,1,302,To be revenged on Rome and Saturnine.,male,0.0
106882,Titus Andronicus,Tragedy,Titus Andronicus,3,2,1,"So, so; now sit: and look you eat no more",male,-0.25
106883,Titus Andronicus,Tragedy,Titus Andronicus,3,2,2,Than will preserve just so much strength in us,male,0.2
106884,Titus Andronicus,Tragedy,Titus Andronicus,3,2,3,As will revenge these bitter woes of ours.,male,-0.1
106885,Titus Andronicus,Tragedy,Titus Andronicus,3,2,4,"Marcus, unknit that sorrow-wreathen knot:",male,0.0
106886,Titus Andronicus,Tragedy,Titus Andronicus,3,2,5,"Thy niece and I, poor creatures, want our hands,",male,-0.4
106887,Titus Andronicus,Tragedy,Titus Andronicus,3,2,6,And cannot passionate our tenfold grief,male,-0.43
106888,Titus Andronicus,Tragedy,Titus Andronicus,3,2,7,With folded arms. This poor right hand of mine,male,-0.06
106889,Titus Andronicus,Tragedy,Titus Andronicus,3,2,8,Is left to tyrannize upon my breast;,male,0.0
106890,Titus Andronicus,Tragedy,Titus Andronicus,3,2,9,"Who, when my heart, all mad with misery,",male,-0.62
106891,Titus Andronicus,Tragedy,Titus Andronicus,3,2,10,"Beats in this hollow prison of my flesh,",male,-0.1
106892,Titus Andronicus,Tragedy,Titus Andronicus,3,2,11,Then thus I thump it down.,male,-0.16
106893,Titus Andronicus,Tragedy,Titus Andronicus,3,2,12,"Thou map of woe, that thus dost talk in signs!",male,0.0
106894,Titus Andronicus,Tragedy,Titus Andronicus,3,2,13,"When thy poor heart beats with outrageous beating,",male,-0.7
106895,Titus Andronicus,Tragedy,Titus Andronicus,3,2,14,Thou canst not strike it thus to make it still.,male,0.0
106896,Titus Andronicus,Tragedy,Titus Andronicus,3,2,15,"Wound it with sighing, girl, kill it with groans;",male,0.0
106897,Titus Andronicus,Tragedy,Titus Andronicus,3,2,16,"Or get some little knife between thy teeth,",male,-0.19
106898,Titus Andronicus,Tragedy,Titus Andronicus,3,2,17,And just against thy heart make thou a hole;,male,0.0
106899,Titus Andronicus,Tragedy,Titus Andronicus,3,2,18,That all the tears that thy poor eyes let fall,male,-0.4
106900,Titus Andronicus,Tragedy,Titus Andronicus,3,2,19,"May run into that sink, and soaking in",male,0.0
106901,Titus Andronicus,Tragedy,Titus Andronicus,3,2,20,Drown the lamenting fool in sea-salt tears.,male,0.0
106902,Titus Andronicus,Tragedy,Marcus Andronicus,3,2,21,"Fie, brother, fie! teach her not thus to lay",male,0.0
106903,Titus Andronicus,Tragedy,Marcus Andronicus,3,2,22,Such violent hands upon her tender life.,male,-0.4
106904,Titus Andronicus,Tragedy,Titus Andronicus,3,2,23,How now! has sorrow made thee dote already?,male,0.0
106905,Titus Andronicus,Tragedy,Titus Andronicus,3,2,24,"Why, Marcus, no man should be mad but I.",male,-0.62
106906,Titus Andronicus,Tragedy,Titus Andronicus,3,2,25,What violent hands can she lay on her life?,male,-0.8
106907,Titus Andronicus,Tragedy,Titus Andronicus,3,2,26,"Ah, wherefore dost thou urge the name of hands;",male,0.0
106908,Titus Andronicus,Tragedy,Titus Andronicus,3,2,27,"To bid AEneas tell the tale twice o'er,",male,0.0
106909,Titus Andronicus,Tragedy,Titus Andronicus,3,2,28,How Troy was burnt and he made miserable?,male,-1.0
106910,Titus Andronicus,Tragedy,Titus Andronicus,3,2,29,"O, handle not the theme, to talk of hands,",male,0.0
106911,Titus Andronicus,Tragedy,Titus Andronicus,3,2,30,Lest we remember still that we have none.,male,0.0
106912,Titus Andronicus,Tragedy,Titus Andronicus,3,2,31,"Fie, fie, how franticly I square my talk,",male,0.0
106913,Titus Andronicus,Tragedy,Titus Andronicus,3,2,32,"As if we should forget we had no hands,",male,0.0
106914,Titus Andronicus,Tragedy,Titus Andronicus,3,2,33,If Marcus did not name the word of hands!,male,0.0
106915,Titus Andronicus,Tragedy,Titus Andronicus,3,2,34,"Come, let's fall to; and, gentle girl, eat this:",male,0.2
106916,Titus Andronicus,Tragedy,Titus Andronicus,3,2,35,"Here is no drink! Hark, Marcus, what she says;",male,0.0
106917,Titus Andronicus,Tragedy,Titus Andronicus,3,2,36,I can interpret all her martyr'd signs;,male,0.0
106918,Titus Andronicus,Tragedy,Titus Andronicus,3,2,37,"She says she drinks no other drink but tears,",male,0.06
106919,Titus Andronicus,Tragedy,Titus Andronicus,3,2,38,"Brew'd with her sorrow, mesh'd upon her cheeks:",male,0.0
106920,Titus Andronicus,Tragedy,Titus Andronicus,3,2,39,"Speechless complainer, I will learn thy thought;",male,0.0
106921,Titus Andronicus,Tragedy,Titus Andronicus,3,2,40,In thy dumb action will I be as perfect,male,0.24
106922,Titus Andronicus,Tragedy,Titus Andronicus,3,2,41,As begging hermits in their holy prayers:,male,0.0
106923,Titus Andronicus,Tragedy,Titus Andronicus,3,2,42,"Thou shalt not sigh, nor hold thy stumps to heaven,",male,0.0
106924,Titus Andronicus,Tragedy,Titus Andronicus,3,2,43,"Nor wink, nor nod, nor kneel, nor make a sign,",male,0.0
106925,Titus Andronicus,Tragedy,Titus Andronicus,3,2,44,But I of these will wrest an alphabet,male,0.0
106926,Titus Andronicus,Tragedy,Titus Andronicus,3,2,45,And by still practise learn to know thy meaning.,male,0.0
106927,Titus Andronicus,Tragedy,Young Lucius,3,2,46,"Good grandsire, leave these bitter deep laments:",male,0.2
106928,Titus Andronicus,Tragedy,Young Lucius,3,2,47,Make my aunt merry with some pleasing tale.,male,0.0
106929,Titus Andronicus,Tragedy,Marcus Andronicus,3,2,48,"Alas, the tender boy, in passion moved,",male,-0.4
106930,Titus Andronicus,Tragedy,Marcus Andronicus,3,2,49,Doth weep to see his grandsire's heaviness.,male,0.0
106931,Titus Andronicus,Tragedy,Titus Andronicus,3,2,50,"Peace, tender sapling; thou art made of tears,",male,0.0
106932,Titus Andronicus,Tragedy,Titus Andronicus,3,2,51,And tears will quickly melt thy life away.,male,0.33
106933,Titus Andronicus,Tragedy,Titus Andronicus,3,2,52,"What dost thou strike at, Marcus, with thy knife?",male,0.0
106934,Titus Andronicus,Tragedy,Marcus Andronicus,3,2,53,"At that that I have kill'd, my lord; a fly.",male,0.8
106935,Titus Andronicus,Tragedy,Titus Andronicus,3,2,54,"Out on thee, murderer! thou kill'st my heart;",male,0.0
106936,Titus Andronicus,Tragedy,Titus Andronicus,3,2,55,Mine eyes are cloy'd with view of tyranny:,male,0.0
106937,Titus Andronicus,Tragedy,Titus Andronicus,3,2,56,A deed of death done on the innocent,male,0.5
106938,Titus Andronicus,Tragedy,Titus Andronicus,3,2,57,Becomes not Titus' brother: get thee gone:,male,0.0
106939,Titus Andronicus,Tragedy,Titus Andronicus,3,2,58,I see thou art not for my company.,male,0.0
106940,Titus Andronicus,Tragedy,Marcus Andronicus,3,2,59,"Alas, my lord, I have but kill'd a fly.",male,0.2
106941,Titus Andronicus,Tragedy,Titus Andronicus,3,2,60,"But how, if that fly had a father and mother?",male,0.8
106942,Titus Andronicus,Tragedy,Titus Andronicus,3,2,61,"How would he hang his slender gilded wings,",male,0.0
106943,Titus Andronicus,Tragedy,Titus Andronicus,3,2,62,And buzz lamenting doings in the air!,male,0.0
106944,Titus Andronicus,Tragedy,Titus Andronicus,3,2,63,"Poor harmless fly,",male,0.2
106945,Titus Andronicus,Tragedy,Titus Andronicus,3,2,64,"That, with his pretty buzzing melody,",male,0.25
106946,Titus Andronicus,Tragedy,Titus Andronicus,3,2,65,Came here to make us merry! and thou hast,male,0.0
106947,Titus Andronicus,Tragedy,Titus Andronicus,3,2,66,kill'd him.,male,0.0
106948,Titus Andronicus,Tragedy,Marcus Andronicus,3,2,67,"Pardon me, sir; it was a black ill-favor'd fly,",male,0.32
106949,Titus Andronicus,Tragedy,Marcus Andronicus,3,2,68,Like to the empress' Moor; therefore I kill'd him.,male,0.0
106950,Titus Andronicus,Tragedy,Titus Andronicus,3,2,69,"O, O, O,",male,0.0
106951,Titus Andronicus,Tragedy,Titus Andronicus,3,2,70,"Then pardon me for reprehending thee,",male,0.0
106952,Titus Andronicus,Tragedy,Titus Andronicus,3,2,71,For thou hast done a charitable deed.,male,0.6
106953,Titus Andronicus,Tragedy,Titus Andronicus,3,2,72,"Give me thy knife, I will insult on him;",male,0.0
106954,Titus Andronicus,Tragedy,Titus Andronicus,3,2,73,"Flattering myself, as if it were the Moor",male,0.0
106955,Titus Andronicus,Tragedy,Titus Andronicus,3,2,74,Come hither purposely to poison me.--,male,0.0
106956,Titus Andronicus,Tragedy,Titus Andronicus,3,2,75,"There's for thyself, and that's for Tamora.",male,0.0
106957,Titus Andronicus,Tragedy,Titus Andronicus,3,2,76,"Ah, sirrah!",male,0.0
106958,Titus Andronicus,Tragedy,Titus Andronicus,3,2,77,"Yet, I think, we are not brought so low,",male,0.0
106959,Titus Andronicus,Tragedy,Titus Andronicus,3,2,78,But that between us we can kill a fly,male,0.8
106960,Titus Andronicus,Tragedy,Titus Andronicus,3,2,79,That comes in likeness of a coal-black Moor.,male,0.0
106961,Titus Andronicus,Tragedy,Marcus Andronicus,3,2,80,"Alas, poor man! grief has so wrought on him,",male,-0.57
106962,Titus Andronicus,Tragedy,Marcus Andronicus,3,2,81,He takes false shadows for true substances.,male,-0.03
106963,Titus Andronicus,Tragedy,Titus Andronicus,3,2,82,"Come, take away. Lavinia, go with me:",male,0.0
106964,Titus Andronicus,Tragedy,Titus Andronicus,3,2,83,I'll to thy closet; and go read with thee,male,0.0
106965,Titus Andronicus,Tragedy,Titus Andronicus,3,2,84,Sad stories chanced in the times of old.,male,-0.2
106966,Titus Andronicus,Tragedy,Titus Andronicus,3,2,85,"Come, boy, and go with me: thy sight is young,",male,0.1
106967,Titus Andronicus,Tragedy,Titus Andronicus,3,2,86,And thou shalt read when mine begin to dazzle.,male,0.0
106968,Titus Andronicus,Tragedy,Young Lucius,4,1,1,"Help, grandsire, help! my aunt Lavinia",male,0.0
106969,Titus Andronicus,Tragedy,Young Lucius,4,1,2,"Follows me every where, I know not why:",male,0.0
106970,Titus Andronicus,Tragedy,Young Lucius,4,1,3,"Good uncle Marcus, see how swift she comes.",male,0.7
106971,Titus Andronicus,Tragedy,Young Lucius,4,1,4,"Alas, sweet aunt, I know not what you mean.",male,-0.12
106972,Titus Andronicus,Tragedy,Marcus Andronicus,4,1,5,"Stand by me, Lucius; do not fear thine aunt.",male,0.0
106973,Titus Andronicus,Tragedy,Titus Andronicus,4,1,6,"She loves thee, boy, too well to do thee harm.",male,0.0
106974,Titus Andronicus,Tragedy,Young Lucius,4,1,7,"Ay, when my father was in Rome she did.",male,0.0
106975,Titus Andronicus,Tragedy,Marcus Andronicus,4,1,8,What means my niece Lavinia by these signs?,male,0.0
106976,Titus Andronicus,Tragedy,Titus Andronicus,4,1,9,"Fear her not, Lucius: somewhat doth she mean:",male,-0.31
106977,Titus Andronicus,Tragedy,Titus Andronicus,4,1,10,"See, Lucius, see how much she makes of thee:",male,0.2
106978,Titus Andronicus,Tragedy,Titus Andronicus,4,1,11,Somewhither would she have thee go with her.,male,0.0
106979,Titus Andronicus,Tragedy,Titus Andronicus,4,1,12,"Ah, boy, Cornelia never with more care",male,0.5
106980,Titus Andronicus,Tragedy,Titus Andronicus,4,1,13,Read to her sons than she hath read to thee,male,0.0
106981,Titus Andronicus,Tragedy,Titus Andronicus,4,1,14,Sweet poetry and Tully's Orator.,male,0.35
106982,Titus Andronicus,Tragedy,Marcus Andronicus,4,1,15,Canst thou not guess wherefore she plies thee thus?,male,0.0
106983,Titus Andronicus,Tragedy,Young Lucius,4,1,16,"My lord, I know not, I, nor can I guess,",male,0.0
106984,Titus Andronicus,Tragedy,Young Lucius,4,1,17,Unless some fit or frenzy do possess her:,male,0.4
106985,Titus Andronicus,Tragedy,Young Lucius,4,1,18,"For I have heard my grandsire say full oft,",male,0.35
106986,Titus Andronicus,Tragedy,Young Lucius,4,1,19,Extremity of griefs would make men mad;,male,-0.62
106987,Titus Andronicus,Tragedy,Young Lucius,4,1,20,And I have read that Hecuba of Troy,male,0.0
106988,Titus Andronicus,Tragedy,Young Lucius,4,1,21,Ran mad through sorrow: that made me to fear;,male,-0.62
106989,Titus Andronicus,Tragedy,Young Lucius,4,1,22,"Although, my lord, I know my noble aunt",male,0.6
106990,Titus Andronicus,Tragedy,Young Lucius,4,1,23,"Loves me as dear as e'er my mother did,",male,0.0
106991,Titus Andronicus,Tragedy,Young Lucius,4,1,24,"And would not, but in fury, fright my youth:",male,0.0
106992,Titus Andronicus,Tragedy,Young Lucius,4,1,25,"Which made me down to throw my books, and fly--",male,0.32
106993,Titus Andronicus,Tragedy,Young Lucius,4,1,26,"Causeless, perhaps. But pardon me, sweet aunt:",male,0.35
106994,Titus Andronicus,Tragedy,Young Lucius,4,1,27,"And, madam, if my uncle Marcus go,",male,0.0
106995,Titus Andronicus,Tragedy,Young Lucius,4,1,28,I will most willingly attend your ladyship.,male,0.38
106996,Titus Andronicus,Tragedy,Marcus Andronicus,4,1,29,"Lucius, I will.",male,0.0
106997,Titus Andronicus,Tragedy,Titus Andronicus,4,1,30,"How now, Lavinia! Marcus, what means this?",male,0.0
106998,Titus Andronicus,Tragedy,Titus Andronicus,4,1,31,Some book there is that she desires to see.,male,0.0
106999,Titus Andronicus,Tragedy,Titus Andronicus,4,1,32,"Which is it, girl, of these? Open them, boy.",male,0.0
107000,Titus Andronicus,Tragedy,Titus Andronicus,4,1,33,"But thou art deeper read, and better skill'd",male,0.5
107001,Titus Andronicus,Tragedy,Titus Andronicus,4,1,34,"Come, and take choice of all my library,",male,0.0
107002,Titus Andronicus,Tragedy,Titus Andronicus,4,1,35,"And so beguile thy sorrow, till the heavens",male,0.0
107003,Titus Andronicus,Tragedy,Titus Andronicus,4,1,36,Reveal the damn'd contriver of this deed.,male,0.0
107004,Titus Andronicus,Tragedy,Titus Andronicus,4,1,37,Why lifts she up her arms in sequence thus?,male,0.0
107005,Titus Andronicus,Tragedy,Marcus Andronicus,4,1,38,I think she means that there was more than one,male,0.5
107006,Titus Andronicus,Tragedy,Marcus Andronicus,4,1,39,"Confederate in the fact: ay, more there was;",male,0.5
107007,Titus Andronicus,Tragedy,Marcus Andronicus,4,1,40,Or else to heaven she heaves them for revenge.,male,0.0
107008,Titus Andronicus,Tragedy,Titus Andronicus,4,1,41,"Lucius, what book is that she tosseth so?",male,0.0
107009,Titus Andronicus,Tragedy,Young Lucius,4,1,42,"Grandsire, 'tis Ovid's Metamorphoses;",male,0.0
107010,Titus Andronicus,Tragedy,Young Lucius,4,1,43,My mother gave it me.,male,0.0
107011,Titus Andronicus,Tragedy,Marcus Andronicus,4,1,44,"For love of her that's gone,",male,0.5
107012,Titus Andronicus,Tragedy,Marcus Andronicus,4,1,45,Perhaps she cull'd it from among the rest.,male,0.0
107013,Titus Andronicus,Tragedy,Titus Andronicus,4,1,46,Soft! see how busily she turns the leaves!,male,0.12
107014,Titus Andronicus,Tragedy,Titus Andronicus,4,1,47,"What would she find? Lavinia, shall I read?",male,0.0
107015,Titus Andronicus,Tragedy,Titus Andronicus,4,1,48,"This is the tragic tale of Philomel,",male,-0.75
107016,Titus Andronicus,Tragedy,Titus Andronicus,4,1,49,And treats of Tereus' treason and his rape:,male,0.0
107017,Titus Andronicus,Tragedy,Titus Andronicus,4,1,50,"And rape, I fear, was root of thine annoy.",male,0.0
107018,Titus Andronicus,Tragedy,Marcus Andronicus,4,1,51,"See, brother, see; note how she quotes the leaves.",male,0.0
107019,Titus Andronicus,Tragedy,Titus Andronicus,4,1,52,"Lavinia, wert thou thus surprised, sweet girl,",male,0.22
107020,Titus Andronicus,Tragedy,Titus Andronicus,4,1,53,"Ravish'd and wrong'd, as Philomela was,",male,-0.5
107021,Titus Andronicus,Tragedy,Titus Andronicus,4,1,54,"Forced in the ruthless, vast, and gloomy woods? See, see!",male,-0.43
107022,Titus Andronicus,Tragedy,Titus Andronicus,4,1,55,"Ay, such a place there is, where we did hunt--",male,0.0
107023,Titus Andronicus,Tragedy,Titus Andronicus,4,1,56,"O, had we never, never hunted there!--",male,0.0
107024,Titus Andronicus,Tragedy,Titus Andronicus,4,1,57,"Pattern'd by that the poet here describes,",male,0.0
107025,Titus Andronicus,Tragedy,Titus Andronicus,4,1,58,By nature made for murders and for rapes.,male,0.0
107026,Titus Andronicus,Tragedy,Marcus Andronicus,4,1,59,"O, why should nature build so foul a den,",male,0.0
107027,Titus Andronicus,Tragedy,Marcus Andronicus,4,1,60,Unless the gods delight in tragedies?,male,0.0
107028,Titus Andronicus,Tragedy,Titus Andronicus,4,1,61,"Give signs, sweet girl, for here are none",male,0.35
107029,Titus Andronicus,Tragedy,Titus Andronicus,4,1,62,"but friends,",male,0.0
107030,Titus Andronicus,Tragedy,Titus Andronicus,4,1,63,What Roman lord it was durst do the deed:,male,0.0
107031,Titus Andronicus,Tragedy,Titus Andronicus,4,1,64,"Or slunk not Saturnine, as Tarquin erst,",male,0.0
107032,Titus Andronicus,Tragedy,Titus Andronicus,4,1,65,That left the camp to sin in Lucrece' bed?,male,0.0
107033,Titus Andronicus,Tragedy,Marcus Andronicus,4,1,66,"Sit down, sweet niece: brother, sit down by me.",male,0.01
107034,Titus Andronicus,Tragedy,Marcus Andronicus,4,1,67,"Apollo, Pallas, Jove, or Mercury,",male,0.0
