Unnamed: 0,play_name,genre,character,act,scene,sentence,text,sex
39529,Twelfth Night,Comedy,Sir Toby Belch,3,4,244,"I will do so. Signior Fabian, stay you by this",male
39530,Twelfth Night,Comedy,Sir Toby Belch,3,4,245,gentleman till my return.,male
39531,Twelfth Night,Comedy,Viola,3,4,246,"Pray you, sir, do you know of this matter?",female
39532,Twelfth Night,Comedy,Fabian,3,4,247,"I know the knight is incensed against you, even to a",male
39533,Twelfth Night,Comedy,Fabian,3,4,248,mortal arbitrement; but nothing of the circumstance more.,male
39534,Twelfth Night,Comedy,Viola,3,4,249,"I beseech you, what manner of man is he?",female
39535,Twelfth Night,Comedy,Fabian,3,4,250,"Nothing of that wonderful promise, to read him by",male
39536,Twelfth Night,Comedy,Fabian,3,4,251,"his form, as you are like to find him in the proof",male
39537,Twelfth Night,Comedy,Fabian,3,4,252,"of his valour. He is, indeed, sir, the most skilful,",male
39538,Twelfth Night,Comedy,Fabian,3,4,253,bloody and fatal opposite that you could possibly,male
39539,Twelfth Night,Comedy,Fabian,3,4,254,have found in any part of Illyria. Will you walk,male
39540,Twelfth Night,Comedy,Fabian,3,4,255,towards him? I will make your peace with him if I,male
39541,Twelfth Night,Comedy,Fabian,3,4,256,can.,male
39542,Twelfth Night,Comedy,Viola,3,4,257,I shall be much bound to you for't: I am one that,female
39543,Twelfth Night,Comedy,Viola,3,4,258,had rather go with sir priest than sir knight: I,female
39544,Twelfth Night,Comedy,Viola,3,4,259,care not who knows so much of my mettle.,female
39545,Twelfth Night,Comedy,Sir Toby Belch,3,4,260,"Why, man, he's a very devil; I have not seen such a",male
39546,Twelfth Night,Comedy,Sir Toby Belch,3,4,261,"firago. I had a pass with him, rapier, scabbard and",male
39547,Twelfth Night,Comedy,Sir Toby Belch,3,4,262,"all, and he gives me the stuck in with such a mortal",male
39548,Twelfth Night,Comedy,Sir Toby Belch,3,4,263,"motion, that it is inevitable; and on the answer, he",male
39549,Twelfth Night,Comedy,Sir Toby Belch,3,4,264,pays you as surely as your feet hit the ground they,male
39550,Twelfth Night,Comedy,Sir Toby Belch,3,4,265,step on. They say he has been fencer to the Sophy.,male
39551,Twelfth Night,Comedy,Sir Andrew,3,4,266,"Pox on't, I'll not meddle with him.",male
39552,Twelfth Night,Comedy,Sir Toby Belch,3,4,267,"Ay, but he will not now be pacified: Fabian can",male
39553,Twelfth Night,Comedy,Sir Toby Belch,3,4,268,scarce hold him yonder.,male
39554,Twelfth Night,Comedy,Sir Andrew,3,4,269,"Plague on't, an I thought he had been valiant and so",male
39555,Twelfth Night,Comedy,Sir Andrew,3,4,270,"cunning in fence, I'ld have seen him damned ere I'ld",male
39556,Twelfth Night,Comedy,Sir Andrew,3,4,271,"have challenged him. Let him let the matter slip,",male
39557,Twelfth Night,Comedy,Sir Andrew,3,4,272,"and I'll give him my horse, grey Capilet.",male
39558,Twelfth Night,Comedy,Sir Toby Belch,3,4,273,"I'll make the motion: stand here, make a good show",male
39559,Twelfth Night,Comedy,Sir Toby Belch,3,4,274,on't: this shall end without the perdition of souls.,male
39560,Twelfth Night,Comedy,Sir Toby Belch,3,4,275,"Marry, I'll ride your horse as well as I ride you.",male
39561,Twelfth Night,Comedy,Sir Toby Belch,3,4,276,I have his horse to take up the quarrel:,male
39562,Twelfth Night,Comedy,Sir Toby Belch,3,4,277,I have persuaded him the youth's a devil.,male
39563,Twelfth Night,Comedy,Fabian,3,4,278,He is as horribly conceited of him; and pants and,male
39564,Twelfth Night,Comedy,Fabian,3,4,279,"looks pale, as if a bear were at his heels.",male
39565,Twelfth Night,Comedy,Sir Toby Belch,3,4,280,"[To VIOLA]  There's no remedy, sir; he will fight",male
39566,Twelfth Night,Comedy,Sir Toby Belch,3,4,281,"with you for's oath sake: marry, he hath better",male
39567,Twelfth Night,Comedy,Sir Toby Belch,3,4,282,"bethought him of his quarrel, and he finds that now",male
39568,Twelfth Night,Comedy,Sir Toby Belch,3,4,283,"scarce to be worth talking of: therefore draw, for",male
39569,Twelfth Night,Comedy,Sir Toby Belch,3,4,284,the supportance of his vow; he protests he will not hurt you.,male
39570,Twelfth Night,Comedy,Viola,3,4,285,[Aside]  Pray God defend me! A little thing would,female
39571,Twelfth Night,Comedy,Viola,3,4,286,make me tell them how much I lack of a man.,female
39572,Twelfth Night,Comedy,Fabian,3,4,287,"Give ground, if you see him furious.",male
39573,Twelfth Night,Comedy,Sir Toby Belch,3,4,288,"Come, Sir Andrew, there's no remedy; the gentleman",male
39574,Twelfth Night,Comedy,Sir Toby Belch,3,4,289,"will, for his honour's sake, have one bout with you;",male
39575,Twelfth Night,Comedy,Sir Toby Belch,3,4,290,he cannot by the duello avoid it: but he has,male
39576,Twelfth Night,Comedy,Sir Toby Belch,3,4,291,"promised me, as he is a gentleman and a soldier, he",male
39577,Twelfth Night,Comedy,Sir Toby Belch,3,4,292,will not hurt you. Come on; to't.,male
39578,Twelfth Night,Comedy,Sir Andrew,3,4,293,"Pray God, he keep his oath!",male
39579,Twelfth Night,Comedy,Viola,3,4,294,"I do assure you, 'tis against my will.",female
39580,Twelfth Night,Comedy,Antonio,3,4,295,Put up your sword. If this young gentleman,male
39581,Twelfth Night,Comedy,Antonio,3,4,296,"Have done offence, I take the fault on me:",male
39582,Twelfth Night,Comedy,Antonio,3,4,297,"If you offend him, I for him defy you.",male
39583,Twelfth Night,Comedy,Sir Toby Belch,3,4,298,"You, sir! why, what are you?",male
39584,Twelfth Night,Comedy,Antonio,3,4,299,"One, sir, that for his love dares yet do more",male
39585,Twelfth Night,Comedy,Antonio,3,4,300,Than you have heard him brag to you he will.,male
39586,Twelfth Night,Comedy,Sir Toby Belch,3,4,301,"Nay, if you be an undertaker, I am for you.",male
39587,Twelfth Night,Comedy,Fabian,3,4,302,"O good Sir Toby, hold! here come the officers.",male
39588,Twelfth Night,Comedy,Sir Toby Belch,3,4,303,I'll be with you anon.,male
39589,Twelfth Night,Comedy,Viola,3,4,304,"Pray, sir, put your sword up, if you please.",female
39590,Twelfth Night,Comedy,Sir Andrew,3,4,305,"Marry, will I, sir; and, for that I promised you,",male
39591,Twelfth Night,Comedy,Sir Andrew,3,4,306,I'll be as good as my word: he will bear you easily,male
39592,Twelfth Night,Comedy,Sir Andrew,3,4,307,and reins well.,male
39593,Twelfth Night,Comedy,First Officer,3,4,308,This is the man; do thy office.,male
39594,Twelfth Night,Comedy,Second Officer,3,4,309,"Antonio, I arrest thee at the suit of Count Orsino.",male
39595,Twelfth Night,Comedy,Antonio,3,4,310,"You do mistake me, sir.",male
39596,Twelfth Night,Comedy,First Officer,3,4,311,"No, sir, no jot; I know your favour well,",male
39597,Twelfth Night,Comedy,First Officer,3,4,312,Though now you have no sea-cap on your head.,male
39598,Twelfth Night,Comedy,First Officer,3,4,313,Take him away: he knows I know him well.,male
39599,Twelfth Night,Comedy,Antonio,3,4,314,I must obey.,male
39600,Twelfth Night,Comedy,Antonio,3,4,315,This comes with seeking you:,male
39601,Twelfth Night,Comedy,Antonio,3,4,316,But there's no remedy; I shall answer it.,male
39602,Twelfth Night,Comedy,Antonio,3,4,317,"What will you do, now my necessity",male
39603,Twelfth Night,Comedy,Antonio,3,4,318,Makes me to ask you for my purse? It grieves me,male
39604,Twelfth Night,Comedy,Antonio,3,4,319,Much more for what I cannot do for you,male
39605,Twelfth Night,Comedy,Antonio,3,4,320,Than what befalls myself. You stand amazed;,male
39606,Twelfth Night,Comedy,Antonio,3,4,321,But be of comfort.,male
39607,Twelfth Night,Comedy,Second Officer,3,4,322,"Come, sir, away.",male
39608,Twelfth Night,Comedy,Antonio,3,4,323,I must entreat of you some of that money.,male
39609,Twelfth Night,Comedy,Viola,3,4,324,"What money, sir?",female
39610,Twelfth Night,Comedy,Viola,3,4,325,"For the fair kindness you have show'd me here,",female
39611,Twelfth Night,Comedy,Viola,3,4,326,"And, part, being prompted by your present trouble,",female
39612,Twelfth Night,Comedy,Viola,3,4,327,Out of my lean and low ability,female
39613,Twelfth Night,Comedy,Viola,3,4,328,I'll lend you something: my having is not much;,female
39614,Twelfth Night,Comedy,Viola,3,4,329,I'll make division of my present with you:,female
39615,Twelfth Night,Comedy,Viola,3,4,330,"Hold, there's half my coffer.",female
39616,Twelfth Night,Comedy,Antonio,3,4,331,Will you deny me now?,male
39617,Twelfth Night,Comedy,Antonio,3,4,332,Is't possible that my deserts to you,male
39618,Twelfth Night,Comedy,Antonio,3,4,333,"Can lack persuasion? Do not tempt my misery,",male
39619,Twelfth Night,Comedy,Antonio,3,4,334,Lest that it make me so unsound a man,male
39620,Twelfth Night,Comedy,Antonio,3,4,335,As to upbraid you with those kindnesses,male
39621,Twelfth Night,Comedy,Antonio,3,4,336,That I have done for you.,male
39622,Twelfth Night,Comedy,Viola,3,4,337,I know of none;,female
39623,Twelfth Night,Comedy,Viola,3,4,338,Nor know I you by voice or any feature:,female
39624,Twelfth Night,Comedy,Viola,3,4,339,I hate ingratitude more in a man,female
39625,Twelfth Night,Comedy,Viola,3,4,340,"Than lying, vainness, babbling, drunkenness,",female
39626,Twelfth Night,Comedy,Viola,3,4,341,Or any taint of vice whose strong corruption,female
39627,Twelfth Night,Comedy,Viola,3,4,342,Inhabits our frail blood.,female
39628,Twelfth Night,Comedy,Antonio,3,4,343,O heavens themselves!,male
39629,Twelfth Night,Comedy,Second Officer,3,4,344,"Come, sir, I pray you, go.",male
39630,Twelfth Night,Comedy,Antonio,3,4,345,Let me speak a little. This youth that you see here,male
39631,Twelfth Night,Comedy,Antonio,3,4,346,"I snatch'd one half out of the jaws of death,",male
39632,Twelfth Night,Comedy,Antonio,3,4,347,"Relieved him with such sanctity of love,",male
39633,Twelfth Night,Comedy,Antonio,3,4,348,"And to his image, which methought did promise",male
39634,Twelfth Night,Comedy,Antonio,3,4,349,"Most venerable worth, did I devotion.",male
39635,Twelfth Night,Comedy,First Officer,3,4,350,What's that to us? The time goes by: away!,male
39636,Twelfth Night,Comedy,Antonio,3,4,351,But O how vile an idol proves this god,male
39637,Twelfth Night,Comedy,Antonio,3,4,352,"Thou hast, Sebastian, done good feature shame.",male
39638,Twelfth Night,Comedy,Antonio,3,4,353,In nature there's no blemish but the mind;,male
39639,Twelfth Night,Comedy,Antonio,3,4,354,None can be call'd deform'd but the unkind:,male
39640,Twelfth Night,Comedy,Antonio,3,4,355,"Virtue is beauty, but the beauteous evil",male
39641,Twelfth Night,Comedy,Antonio,3,4,356,Are empty trunks o'erflourish'd by the devil.,male
39642,Twelfth Night,Comedy,First Officer,3,4,357,"The man grows mad: away with him! Come, come, sir.",male
39643,Twelfth Night,Comedy,Antonio,3,4,358,Lead me on.,male
39644,Twelfth Night,Comedy,Viola,3,4,359,"Methinks his words do from such passion fly,",female
39645,Twelfth Night,Comedy,Viola,3,4,360,That he believes himself: so do not I.,female
39646,Twelfth Night,Comedy,Viola,3,4,361,"Prove true, imagination, O, prove true,",female
39647,Twelfth Night,Comedy,Viola,3,4,362,"That I, dear brother, be now ta'en for you!",female
39648,Twelfth Night,Comedy,Sir Toby Belch,3,4,363,"Come hither, knight; come hither, Fabian: we'll",male
39649,Twelfth Night,Comedy,Sir Toby Belch,3,4,364,whisper o'er a couplet or two of most sage saws.,male
39650,Twelfth Night,Comedy,Viola,3,4,365,He named Sebastian: I my brother know,female
39651,Twelfth Night,Comedy,Viola,3,4,366,Yet living in my glass; even such and so,female
39652,Twelfth Night,Comedy,Viola,3,4,367,"In favour was my brother, and he went",female
39653,Twelfth Night,Comedy,Viola,3,4,368,"Still in this fashion, colour, ornament,",female
39654,Twelfth Night,Comedy,Viola,3,4,369,"For him I imitate: O, if it prove,",female
39655,Twelfth Night,Comedy,Viola,3,4,370,Tempests are kind and salt waves fresh in love.,female
39656,Twelfth Night,Comedy,Sir Toby Belch,3,4,371,"A very dishonest paltry boy, and more a coward than",male
39657,Twelfth Night,Comedy,Sir Toby Belch,3,4,372,a hare: his dishonesty appears in leaving his,male
39658,Twelfth Night,Comedy,Sir Toby Belch,3,4,373,friend here in necessity and denying him; and for,male
39659,Twelfth Night,Comedy,Sir Toby Belch,3,4,374,"his cowardship, ask Fabian.",male
39660,Twelfth Night,Comedy,Fabian,3,4,375,"A coward, a most devout coward, religious in it.",male
39661,Twelfth Night,Comedy,Sir Andrew,3,4,376,"'Slid, I'll after him again and beat him.",male
39662,Twelfth Night,Comedy,Sir Toby Belch,3,4,377,"Do; cuff him soundly, but never draw thy sword.",male
39663,Twelfth Night,Comedy,Sir Andrew,3,4,378,"An I do not,--",male
39664,Twelfth Night,Comedy,Fabian,3,4,379,"Come, let's see the event.",male
39665,Twelfth Night,Comedy,Sir Toby Belch,3,4,380,I dare lay any money 'twill be nothing yet.,male
39666,Twelfth Night,Comedy,Clown,4,1,1,Will you make me believe that I am not sent for you?,male
39667,Twelfth Night,Comedy,Sebastian,4,1,2,"Go to, go to, thou art a foolish fellow:",male
39668,Twelfth Night,Comedy,Sebastian,4,1,3,Let me be clear of thee.,male
39669,Twelfth Night,Comedy,Clown,4,1,4,"Well held out, i' faith! No, I do not know you; nor",male
39670,Twelfth Night,Comedy,Clown,4,1,5,"I am not sent to you by my lady, to bid you come",male
39671,Twelfth Night,Comedy,Clown,4,1,6,speak with her; nor your name is not Master Cesario;,male
39672,Twelfth Night,Comedy,Clown,4,1,7,nor this is not my nose neither. Nothing that is so is so.,male
39673,Twelfth Night,Comedy,Sebastian,4,1,8,"I prithee, vent thy folly somewhere else: Thou",male
39674,Twelfth Night,Comedy,Sebastian,4,1,9,know'st not me.,male
39675,Twelfth Night,Comedy,Clown,4,1,10,Vent my folly! he has heard that word of some,male
39676,Twelfth Night,Comedy,Clown,4,1,11,great man and now applies it to a fool. Vent my,male
39677,Twelfth Night,Comedy,Clown,4,1,12,"folly! I am afraid this great lubber, the world,",male
39678,Twelfth Night,Comedy,Clown,4,1,13,"will prove a cockney. I prithee now, ungird thy",male
39679,Twelfth Night,Comedy,Clown,4,1,14,strangeness and tell me what I shall vent to my,male
39680,Twelfth Night,Comedy,Clown,4,1,15,lady: shall I vent to her that thou art coming?,male
39681,Twelfth Night,Comedy,Sebastian,4,1,16,"I prithee, foolish Greek, depart from me: There's",male
39682,Twelfth Night,Comedy,Sebastian,4,1,17,"money for thee: if you tarry longer, I shall give",male
39683,Twelfth Night,Comedy,Sebastian,4,1,18,worse payment.,male
39684,Twelfth Night,Comedy,Clown,4,1,19,"By my troth, thou hast an open hand. These wise men",male
39685,Twelfth Night,Comedy,Clown,4,1,20,that give fools money get themselves a good,male
39686,Twelfth Night,Comedy,Clown,4,1,21,report--after fourteen years' purchase.,male
39687,Twelfth Night,Comedy,Sir Andrew,4,1,22,"Now, sir, have I met you again? there's for you.",male
39688,Twelfth Night,Comedy,Sebastian,4,1,23,"Why, there's for thee, and there, and there. Are all",male
39689,Twelfth Night,Comedy,Sebastian,4,1,24,the people mad?,male
39690,Twelfth Night,Comedy,Sir Toby Belch,4,1,25,"Hold, sir, or I'll throw your dagger o'er the house.",male
39691,Twelfth Night,Comedy,Clown,4,1,26,This will I tell my lady straight: I would not be,male
39692,Twelfth Night,Comedy,Clown,4,1,27,in some of your coats for two pence.,male
39693,Twelfth Night,Comedy,Sir Toby Belch,4,1,28,"Come on, sir; hold.",male
39694,Twelfth Night,Comedy,Sir Andrew,4,1,29,"Nay, let him alone: I'll go another way to work",male
39695,Twelfth Night,Comedy,Sir Andrew,4,1,30,with him; I'll have an action of battery against,male
39696,Twelfth Night,Comedy,Sir Andrew,4,1,31,"him, if there be any law in Illyria: though I",male
39697,Twelfth Night,Comedy,Sir Andrew,4,1,32,"struck him first, yet it's no matter for that.",male
39698,Twelfth Night,Comedy,Sebastian,4,1,33,Let go thy hand.,male
39699,Twelfth Night,Comedy,Sir Toby Belch,4,1,34,"Come, sir, I will not let you go. Come, my young",male
39700,Twelfth Night,Comedy,Sir Toby Belch,4,1,35,"soldier, put up your iron: you are well fleshed; come on.",male
39701,Twelfth Night,Comedy,Sebastian,4,1,36,I will be free from thee. What wouldst thou now? If,male
39702,Twelfth Night,Comedy,Sebastian,4,1,37,"thou darest tempt me further, draw thy sword.",male
39703,Twelfth Night,Comedy,Sir Toby Belch,4,1,38,"What, what? Nay, then I must have an ounce or two",male
39704,Twelfth Night,Comedy,Sir Toby Belch,4,1,39,of this malapert blood from you.,male
39705,Twelfth Night,Comedy,Olivia,4,1,40,"Hold, Toby; on thy life I charge thee, hold!",female
39706,Twelfth Night,Comedy,Sir Toby Belch,4,1,41,Madam!,male
39707,Twelfth Night,Comedy,Olivia,4,1,42,"Will it be ever thus? Ungracious wretch,",female
39708,Twelfth Night,Comedy,Olivia,4,1,43,"Fit for the mountains and the barbarous caves,",female
39709,Twelfth Night,Comedy,Olivia,4,1,44,Where manners ne'er were preach'd! out of my sight!,female
39710,Twelfth Night,Comedy,Olivia,4,1,45,"Be not offended, dear Cesario.",female
39711,Twelfth Night,Comedy,Olivia,4,1,46,"Rudesby, be gone!",female
39712,Twelfth Night,Comedy,Olivia,4,1,47,"I prithee, gentle friend,",female
39713,Twelfth Night,Comedy,Olivia,4,1,48,"Let thy fair wisdom, not thy passion, sway",female
39714,Twelfth Night,Comedy,Olivia,4,1,49,In this uncivil and thou unjust extent,female
39715,Twelfth Night,Comedy,Olivia,4,1,50,"Against thy peace. Go with me to my house,",female
39716,Twelfth Night,Comedy,Olivia,4,1,51,And hear thou there how many fruitless pranks,female
39717,Twelfth Night,Comedy,Olivia,4,1,52,"This ruffian hath botch'd up, that thou thereby",female
39718,Twelfth Night,Comedy,Olivia,4,1,53,Mayst smile at this: thou shalt not choose but go:,female
39719,Twelfth Night,Comedy,Olivia,4,1,54,"Do not deny. Beshrew his soul for me,",female
39720,Twelfth Night,Comedy,Olivia,4,1,55,He started one poor heart of mine in thee.,female
39721,Twelfth Night,Comedy,Sebastian,4,1,56,What relish is in this? how runs the stream?,male
39722,Twelfth Night,Comedy,Sebastian,4,1,57,"Or I am mad, or else this is a dream:",male
39723,Twelfth Night,Comedy,Sebastian,4,1,58,Let fancy still my sense in Lethe steep;,male
39724,Twelfth Night,Comedy,Sebastian,4,1,59,"If it be thus to dream, still let me sleep!",male
39725,Twelfth Night,Comedy,Olivia,4,1,60,"Nay, come, I prithee; would thou'ldst be ruled by me!",female
39726,Twelfth Night,Comedy,Sebastian,4,1,61,"Madam, I will.",male
39727,Twelfth Night,Comedy,Olivia,4,1,62,"O, say so, and so be!",female
39728,Twelfth Night,Comedy,Maria,4,2,1,"Nay, I prithee, put on this gown and this beard;",female
39729,Twelfth Night,Comedy,Maria,4,2,2,make him believe thou art Sir Topas the curate: do,female
39730,Twelfth Night,Comedy,Maria,4,2,3,it quickly; I'll call Sir Toby the whilst.,female
39731,Twelfth Night,Comedy,Clown,4,2,4,"Well, I'll put it on, and I will dissemble myself",male
39732,Twelfth Night,Comedy,Clown,4,2,5,in't; and I would I were the first that ever,male
39733,Twelfth Night,Comedy,Clown,4,2,6,dissembled in such a gown. I am not tall enough to,male
39734,Twelfth Night,Comedy,Clown,4,2,7,"become the function well, nor lean enough to be",male
39735,Twelfth Night,Comedy,Clown,4,2,8,thought a good student; but to be said an honest man,male
39736,Twelfth Night,Comedy,Clown,4,2,9,and a good housekeeper goes as fairly as to say a,male
39737,Twelfth Night,Comedy,Clown,4,2,10,careful man and a great scholar. The competitors enter.,male
39738,Twelfth Night,Comedy,Sir Toby Belch,4,2,11,"Jove bless thee, master Parson.",male
39739,Twelfth Night,Comedy,Clown,4,2,12,"Bonos dies, Sir Toby: for, as the old hermit of",male
39740,Twelfth Night,Comedy,Clown,4,2,13,"Prague, that never saw pen and ink, very wittily",male
39741,Twelfth Night,Comedy,Clown,4,2,14,"said to a niece of King Gorboduc, 'That that is is;'",male
39742,Twelfth Night,Comedy,Clown,4,2,15,"so I, being Master Parson, am Master Parson; for,",male
39743,Twelfth Night,Comedy,Clown,4,2,16,"what is 'that' but 'that,' and 'is' but 'is'?",male
39744,Twelfth Night,Comedy,Sir Toby Belch,4,2,17,"To him, Sir Topas.",male
39745,Twelfth Night,Comedy,Clown,4,2,18,"What, ho, I say! peace in this prison!",male
39746,Twelfth Night,Comedy,Sir Toby Belch,4,2,19,The knave counterfeits well; a good knave.,male
39747,Twelfth Night,Comedy,Malvolio,4,2,20,[Within]  Who calls there?,male
39748,Twelfth Night,Comedy,Clown,4,2,21,"Sir Topas the curate, who comes to visit Malvolio",male
39749,Twelfth Night,Comedy,Clown,4,2,22,the lunatic.,male
39750,Twelfth Night,Comedy,Malvolio,4,2,23,"Sir Topas, Sir Topas, good Sir Topas, go to my lady.",male
39751,Twelfth Night,Comedy,Clown,4,2,24,"Out, hyperbolical fiend! how vexest thou this man!",male
39752,Twelfth Night,Comedy,Clown,4,2,25,talkest thou nothing but of ladies?,male
39753,Twelfth Night,Comedy,Sir Toby Belch,4,2,26,"Well said, Master Parson.",male
39754,Twelfth Night,Comedy,Malvolio,4,2,27,"Sir Topas, never was man thus wronged: good Sir",male
39755,Twelfth Night,Comedy,Malvolio,4,2,28,"Topas, do not think I am mad: they have laid me",male
39756,Twelfth Night,Comedy,Malvolio,4,2,29,here in hideous darkness.,male
39757,Twelfth Night,Comedy,Clown,4,2,30,"Fie, thou dishonest Satan! I call thee by the most",male
39758,Twelfth Night,Comedy,Clown,4,2,31,modest terms; for I am one of those gentle ones,male
39759,Twelfth Night,Comedy,Clown,4,2,32,that will use the devil himself with courtesy:,male
39760,Twelfth Night,Comedy,Clown,4,2,33,sayest thou that house is dark?,male
39761,Twelfth Night,Comedy,Malvolio,4,2,34,"As hell, Sir Topas.",male
39762,Twelfth Night,Comedy,Clown,4,2,35,"Why it hath bay windows transparent as barricadoes,",male
39763,Twelfth Night,Comedy,Clown,4,2,36,and the clearstores toward the south north are as,male
39764,Twelfth Night,Comedy,Clown,4,2,37,lustrous as ebony; and yet complainest thou of,male
39765,Twelfth Night,Comedy,Clown,4,2,38,obstruction?,male
39766,Twelfth Night,Comedy,Malvolio,4,2,39,"I am not mad, Sir Topas: I say to you, this house is dark.",male
39767,Twelfth Night,Comedy,Clown,4,2,40,"Madman, thou errest: I say, there is no darkness",male
39768,Twelfth Night,Comedy,Clown,4,2,41,but ignorance; in which thou art more puzzled than,male
39769,Twelfth Night,Comedy,Clown,4,2,42,the Egyptians in their fog.,male
39770,Twelfth Night,Comedy,Malvolio,4,2,43,"I say, this house is as dark as ignorance, though",male
39771,Twelfth Night,Comedy,Malvolio,4,2,44,"ignorance were as dark as hell; and I say, there",male
39772,Twelfth Night,Comedy,Malvolio,4,2,45,was never man thus abused. I am no more mad than you,male
39773,Twelfth Night,Comedy,Malvolio,4,2,46,are: make the trial of it in any constant question.,male
39774,Twelfth Night,Comedy,Clown,4,2,47,What is the opinion of Pythagoras concerning wild fowl?,male
39775,Twelfth Night,Comedy,Malvolio,4,2,48,That the soul of our grandam might haply inhabit a bird.,male
39776,Twelfth Night,Comedy,Clown,4,2,49,What thinkest thou of his opinion?,male
39777,Twelfth Night,Comedy,Malvolio,4,2,50,"I think nobly of the soul, and no way approve his opinion.",male
39778,Twelfth Night,Comedy,Clown,4,2,51,Fare thee well. Remain thou still in darkness:,male
39779,Twelfth Night,Comedy,Clown,4,2,52,thou shalt hold the opinion of Pythagoras ere I will,male
39780,Twelfth Night,Comedy,Clown,4,2,53,"allow of thy wits, and fear to kill a woodcock, lest",male
39781,Twelfth Night,Comedy,Clown,4,2,54,thou dispossess the soul of thy grandam. Fare thee well.,male
39782,Twelfth Night,Comedy,Malvolio,4,2,55,"Sir Topas, Sir Topas!",male
39783,Twelfth Night,Comedy,Sir Toby Belch,4,2,56,My most exquisite Sir Topas!,male
39784,Twelfth Night,Comedy,Clown,4,2,57,"Nay, I am for all waters.",male
39785,Twelfth Night,Comedy,Maria,4,2,58,Thou mightst have done this without thy beard and,female
39786,Twelfth Night,Comedy,Maria,4,2,59,gown: he sees thee not.,female
39787,Twelfth Night,Comedy,Sir Toby Belch,4,2,60,"To him in thine own voice, and bring me word how",male
39788,Twelfth Night,Comedy,Sir Toby Belch,4,2,61,thou findest him: I would we were well rid of this,male
39789,Twelfth Night,Comedy,Sir Toby Belch,4,2,62,"knavery. If he may be conveniently delivered, I",male
39790,Twelfth Night,Comedy,Sir Toby Belch,4,2,63,"would he were, for I am now so far in offence with",male
39791,Twelfth Night,Comedy,Sir Toby Belch,4,2,64,my niece that I cannot pursue with any safety this,male
39792,Twelfth Night,Comedy,Sir Toby Belch,4,2,65,sport to the upshot. Come by and by to my chamber.,male
39793,Twelfth Night,Comedy,Clown,4,2,66,[Singing],male
39794,Twelfth Night,Comedy,Clown,4,2,67,"'Hey, Robin, jolly Robin,",male
39795,Twelfth Night,Comedy,Clown,4,2,68,Tell me how thy lady does.',male
39796,Twelfth Night,Comedy,Malvolio,4,2,69,Fool!,male
39797,Twelfth Night,Comedy,Clown,4,2,70,"'My lady is unkind, perdy.'",male
39798,Twelfth Night,Comedy,Malvolio,4,2,71,Fool!,male
39799,Twelfth Night,Comedy,Clown,4,2,72,"'Alas, why is she so?'",male
39800,Twelfth Night,Comedy,Malvolio,4,2,73,"Fool, I say!",male
39801,Twelfth Night,Comedy,Clown,4,2,74,"'She loves another'--Who calls, ha?",male
39802,Twelfth Night,Comedy,Malvolio,4,2,75,"Good fool, as ever thou wilt deserve well at my",male
39803,Twelfth Night,Comedy,Malvolio,4,2,76,"hand, help me to a candle, and pen, ink and paper:",male
39804,Twelfth Night,Comedy,Malvolio,4,2,77,"as I am a gentleman, I will live to be thankful to",male
39805,Twelfth Night,Comedy,Malvolio,4,2,78,thee for't.,male
39806,Twelfth Night,Comedy,Clown,4,2,79,Master Malvolio?,male
39807,Twelfth Night,Comedy,Malvolio,4,2,80,"Ay, good fool.",male
39808,Twelfth Night,Comedy,Clown,4,2,81,"Alas, sir, how fell you besides your five wits?",male
39809,Twelfth Night,Comedy,Malvolio,4,2,82,"Fool, there was never a man so notoriously abused: I",male
39810,Twelfth Night,Comedy,Malvolio,4,2,83,"am as well in my wits, fool, as thou art.",male
39811,Twelfth Night,Comedy,Clown,4,2,84,"But as well? then you are mad indeed, if you be no",male
39812,Twelfth Night,Comedy,Clown,4,2,85,better in your wits than a fool.,male
