Unnamed: 0,play_name,genre,character,act,scene,sentence,text,sex
38964,Twelfth Night,Comedy,Fabian,2,5,170,I will not give my part of this sport for a pension,male
38965,Twelfth Night,Comedy,Fabian,2,5,171,of thousands to be paid from the Sophy.,male
38966,Twelfth Night,Comedy,Sir Toby Belch,2,5,172,I could marry this wench for this device.,male
38967,Twelfth Night,Comedy,Sir Andrew,2,5,173,So could I too.,male
38968,Twelfth Night,Comedy,Sir Toby Belch,2,5,174,And ask no other dowry with her but such another jest.,male
38969,Twelfth Night,Comedy,Sir Andrew,2,5,175,Nor I neither.,male
38970,Twelfth Night,Comedy,Fabian,2,5,176,Here comes my noble gull-catcher.,male
38971,Twelfth Night,Comedy,Sir Toby Belch,2,5,177,Wilt thou set thy foot o' my neck?,male
38972,Twelfth Night,Comedy,Sir Andrew,2,5,178,Or o' mine either?,male
38973,Twelfth Night,Comedy,Sir Toby Belch,2,5,179,"Shall I play my freedom at traytrip, and become thy",male
38974,Twelfth Night,Comedy,Sir Toby Belch,2,5,180,bond-slave?,male
38975,Twelfth Night,Comedy,Sir Andrew,2,5,181,"I' faith, or I either?",male
38976,Twelfth Night,Comedy,Sir Toby Belch,2,5,182,"Why, thou hast put him in such a dream, that when",male
38977,Twelfth Night,Comedy,Sir Toby Belch,2,5,183,the image of it leaves him he must run mad.,male
38978,Twelfth Night,Comedy,Maria,2,5,184,"Nay, but say true; does it work upon him?",female
38979,Twelfth Night,Comedy,Sir Toby Belch,2,5,185,Like aqua-vitae with a midwife.,male
38980,Twelfth Night,Comedy,Maria,2,5,186,"If you will then see the fruits of the sport, mark",female
38981,Twelfth Night,Comedy,Maria,2,5,187,his first approach before my lady: he will come to,female
38982,Twelfth Night,Comedy,Maria,2,5,188,"her in yellow stockings, and 'tis a colour she",female
38983,Twelfth Night,Comedy,Maria,2,5,189,"abhors, and cross-gartered, a fashion she detests;",female
38984,Twelfth Night,Comedy,Maria,2,5,190,"and he will smile upon her, which will now be so",female
38985,Twelfth Night,Comedy,Maria,2,5,191,"unsuitable to her disposition, being addicted to a",female
38986,Twelfth Night,Comedy,Maria,2,5,192,"melancholy as she is, that it cannot but turn him",female
38987,Twelfth Night,Comedy,Maria,2,5,193,"into a notable contempt. If you will see it, follow",female
38988,Twelfth Night,Comedy,Maria,2,5,194,me.,female
38989,Twelfth Night,Comedy,Sir Toby Belch,2,5,195,"To the gates of Tartar, thou most excellent devil of wit!",male
38990,Twelfth Night,Comedy,Sir Andrew,2,5,196,I'll make one too.,male
38991,Twelfth Night,Comedy,Viola,3,1,1,"Save thee, friend, and thy music: dost thou live by",female
38992,Twelfth Night,Comedy,Viola,3,1,2,thy tabour?,female
38993,Twelfth Night,Comedy,Clown,3,1,3,"No, sir, I live by the church.",male
38994,Twelfth Night,Comedy,Viola,3,1,4,Art thou a churchman?,female
38995,Twelfth Night,Comedy,Clown,3,1,5,"No such matter, sir: I do live by the church; for",male
38996,Twelfth Night,Comedy,Clown,3,1,6,"I do live at my house, and my house doth stand by",male
38997,Twelfth Night,Comedy,Clown,3,1,7,the church.,male
38998,Twelfth Night,Comedy,Viola,3,1,8,"So thou mayst say, the king lies by a beggar, if a",female
38999,Twelfth Night,Comedy,Viola,3,1,9,"beggar dwell near him; or, the church stands by thy",female
39000,Twelfth Night,Comedy,Viola,3,1,10,"tabour, if thy tabour stand by the church.",female
39001,Twelfth Night,Comedy,Clown,3,1,11,"You have said, sir. To see this age! A sentence is",male
39002,Twelfth Night,Comedy,Clown,3,1,12,but a cheveril glove to a good wit: how quickly the,male
39003,Twelfth Night,Comedy,Clown,3,1,13,wrong side may be turned outward!,male
39004,Twelfth Night,Comedy,Viola,3,1,14,"Nay, that's certain; they that dally nicely with",female
39005,Twelfth Night,Comedy,Viola,3,1,15,words may quickly make them wanton.,female
39006,Twelfth Night,Comedy,Clown,3,1,16,"I would, therefore, my sister had had no name, sir.",male
39007,Twelfth Night,Comedy,Viola,3,1,17,"Why, man?",female
39008,Twelfth Night,Comedy,Clown,3,1,18,"Why, sir, her name's a word; and to dally with that",male
39009,Twelfth Night,Comedy,Clown,3,1,19,word might make my sister wanton. But indeed words,male
39010,Twelfth Night,Comedy,Clown,3,1,20,are very rascals since bonds disgraced them.,male
39011,Twelfth Night,Comedy,Viola,3,1,21,"Thy reason, man?",female
39012,Twelfth Night,Comedy,Clown,3,1,22,"Troth, sir, I can yield you none without words; and",male
39013,Twelfth Night,Comedy,Clown,3,1,23,"words are grown so false, I am loath to prove",male
39014,Twelfth Night,Comedy,Clown,3,1,24,reason with them.,male
39015,Twelfth Night,Comedy,Viola,3,1,25,I warrant thou art a merry fellow and carest for nothing.,female
39016,Twelfth Night,Comedy,Clown,3,1,26,"Not so, sir, I do care for something; but in my",male
39017,Twelfth Night,Comedy,Clown,3,1,27,"conscience, sir, I do not care for you: if that be",male
39018,Twelfth Night,Comedy,Clown,3,1,28,"to care for nothing, sir, I would it would make you invisible.",male
39019,Twelfth Night,Comedy,Viola,3,1,29,Art not thou the Lady Olivia's fool?,female
39020,Twelfth Night,Comedy,Clown,3,1,30,"No, indeed, sir; the Lady Olivia has no folly: she",male
39021,Twelfth Night,Comedy,Clown,3,1,31,"will keep no fool, sir, till she be married; and",male
39022,Twelfth Night,Comedy,Clown,3,1,32,fools are as like husbands as pilchards are to,male
39023,Twelfth Night,Comedy,Clown,3,1,33,herrings; the husband's the bigger: I am indeed not,male
39024,Twelfth Night,Comedy,Clown,3,1,34,"her fool, but her corrupter of words.",male
39025,Twelfth Night,Comedy,Viola,3,1,35,I saw thee late at the Count Orsino's.,female
39026,Twelfth Night,Comedy,Clown,3,1,36,"Foolery, sir, does walk about the orb like the sun,",male
39027,Twelfth Night,Comedy,Clown,3,1,37,"it shines every where. I would be sorry, sir, but",male
39028,Twelfth Night,Comedy,Clown,3,1,38,the fool should be as oft with your master as with,male
39029,Twelfth Night,Comedy,Clown,3,1,39,my mistress: I think I saw your wisdom there.,male
39030,Twelfth Night,Comedy,Viola,3,1,40,"Nay, an thou pass upon me, I'll no more with thee.",female
39031,Twelfth Night,Comedy,Viola,3,1,41,"Hold, there's expenses for thee.",female
39032,Twelfth Night,Comedy,Clown,3,1,42,"Now Jove, in his next commodity of hair, send thee a beard!",male
39033,Twelfth Night,Comedy,Viola,3,1,43,"By my troth, I'll tell thee, I am almost sick for",female
39034,Twelfth Night,Comedy,Viola,3,1,44,one;,female
39035,Twelfth Night,Comedy,Viola,3,1,45,though I would not have it grow on my chin. Is thy,female
39036,Twelfth Night,Comedy,Viola,3,1,46,lady within?,female
39037,Twelfth Night,Comedy,Clown,3,1,47,"Would not a pair of these have bred, sir?",male
39038,Twelfth Night,Comedy,Viola,3,1,48,"Yes, being kept together and put to use.",female
39039,Twelfth Night,Comedy,Clown,3,1,49,"I would play Lord Pandarus of Phrygia, sir, to bring",male
39040,Twelfth Night,Comedy,Clown,3,1,50,a Cressida to this Troilus.,male
39041,Twelfth Night,Comedy,Viola,3,1,51,"I understand you, sir; 'tis well begged.",female
39042,Twelfth Night,Comedy,Clown,3,1,52,"The matter, I hope, is not great, sir, begging but",male
39043,Twelfth Night,Comedy,Clown,3,1,53,a beggar: Cressida was a beggar. My lady is,male
39044,Twelfth Night,Comedy,Clown,3,1,54,"within, sir. I will construe to them whence you",male
39045,Twelfth Night,Comedy,Clown,3,1,55,come; who you are and what you would are out of my,male
39046,Twelfth Night,Comedy,Clown,3,1,56,"welkin, I might say 'element,' but the word is over-worn.",male
39047,Twelfth Night,Comedy,Viola,3,1,57,This fellow is wise enough to play the fool;,female
39048,Twelfth Night,Comedy,Viola,3,1,58,And to do that well craves a kind of wit:,female
39049,Twelfth Night,Comedy,Viola,3,1,59,"He must observe their mood on whom he jests,",female
39050,Twelfth Night,Comedy,Viola,3,1,60,"The quality of persons, and the time,",female
39051,Twelfth Night,Comedy,Viola,3,1,61,"And, like the haggard, cheque at every feather",female
39052,Twelfth Night,Comedy,Viola,3,1,62,That comes before his eye. This is a practise,female
39053,Twelfth Night,Comedy,Viola,3,1,63,As full of labour as a wise man's art,female
39054,Twelfth Night,Comedy,Viola,3,1,64,For folly that he wisely shows is fit;,female
39055,Twelfth Night,Comedy,Viola,3,1,65,"But wise men, folly-fall'n, quite taint their wit.",female
39056,Twelfth Night,Comedy,Sir Toby Belch,3,1,66,"Save you, gentleman.",male
39057,Twelfth Night,Comedy,Viola,3,1,67,"And you, sir.",female
39058,Twelfth Night,Comedy,Sir Andrew,3,1,68,"Dieu vous garde, monsieur.",male
39059,Twelfth Night,Comedy,Viola,3,1,69,Et vous aussi; votre serviteur.,female
39060,Twelfth Night,Comedy,Sir Andrew,3,1,70,"I hope, sir, you are; and I am yours.",male
39061,Twelfth Night,Comedy,Sir Toby Belch,3,1,71,Will you encounter the house? my niece is desirous,male
39062,Twelfth Night,Comedy,Sir Toby Belch,3,1,72,"you should enter, if your trade be to her.",male
39063,Twelfth Night,Comedy,Viola,3,1,73,"I am bound to your niece, sir; I mean, she is the",female
39064,Twelfth Night,Comedy,Viola,3,1,74,list of my voyage.,female
39065,Twelfth Night,Comedy,Sir Toby Belch,3,1,75,"Taste your legs, sir; put them to motion.",male
39066,Twelfth Night,Comedy,Viola,3,1,76,"My legs do better understand me, sir, than I",female
39067,Twelfth Night,Comedy,Viola,3,1,77,understand what you mean by bidding me taste my legs.,female
39068,Twelfth Night,Comedy,Sir Toby Belch,3,1,78,"I mean, to go, sir, to enter.",male
39069,Twelfth Night,Comedy,Viola,3,1,79,I will answer you with gait and entrance. But we,female
39070,Twelfth Night,Comedy,Viola,3,1,80,are prevented.,female
39071,Twelfth Night,Comedy,Viola,3,1,81,"Most excellent accomplished lady, the heavens rain",female
39072,Twelfth Night,Comedy,Viola,3,1,82,odours on you!,female
39073,Twelfth Night,Comedy,Sir Andrew,3,1,83,That youth's a rare courtier: 'Rain odours;' well.,male
39074,Twelfth Night,Comedy,Viola,3,1,84,"My matter hath no voice, to your own most pregnant",female
39075,Twelfth Night,Comedy,Viola,3,1,85,and vouchsafed ear.,female
39076,Twelfth Night,Comedy,Sir Andrew,3,1,86,"'Odours,' 'pregnant' and 'vouchsafed:' I'll get 'em",male
39077,Twelfth Night,Comedy,Sir Andrew,3,1,87,all three all ready.,male
39078,Twelfth Night,Comedy,Olivia,3,1,88,"Let the garden door be shut, and leave me to my hearing.",female
39079,Twelfth Night,Comedy,Olivia,3,1,89,"Give me your hand, sir.",female
39080,Twelfth Night,Comedy,Viola,3,1,90,"My duty, madam, and most humble service.",female
39081,Twelfth Night,Comedy,Olivia,3,1,91,What is your name?,female
39082,Twelfth Night,Comedy,Viola,3,1,92,"Cesario is your servant's name, fair princess.",female
39083,Twelfth Night,Comedy,Olivia,3,1,93,"My servant, sir! 'Twas never merry world",female
39084,Twelfth Night,Comedy,Olivia,3,1,94,Since lowly feigning was call'd compliment:,female
39085,Twelfth Night,Comedy,Olivia,3,1,95,"You're servant to the Count Orsino, youth.",female
39086,Twelfth Night,Comedy,Viola,3,1,96,"And he is yours, and his must needs be yours:",female
39087,Twelfth Night,Comedy,Viola,3,1,97,"Your servant's servant is your servant, madam.",female
39088,Twelfth Night,Comedy,Olivia,3,1,98,"For him, I think not on him: for his thoughts,",female
39089,Twelfth Night,Comedy,Olivia,3,1,99,"Would they were blanks, rather than fill'd with me!",female
39090,Twelfth Night,Comedy,Viola,3,1,100,"Madam, I come to whet your gentle thoughts",female
39091,Twelfth Night,Comedy,Viola,3,1,101,On his behalf.,female
39092,Twelfth Night,Comedy,Olivia,3,1,102,"O, by your leave, I pray you,",female
39093,Twelfth Night,Comedy,Olivia,3,1,103,I bade you never speak again of him:,female
39094,Twelfth Night,Comedy,Olivia,3,1,104,"But, would you undertake another suit,",female
39095,Twelfth Night,Comedy,Olivia,3,1,105,I had rather hear you to solicit that,female
39096,Twelfth Night,Comedy,Olivia,3,1,106,Than music from the spheres.,female
39097,Twelfth Night,Comedy,Viola,3,1,107,"Dear lady,--",female
39098,Twelfth Night,Comedy,Olivia,3,1,108,"Give me leave, beseech you. I did send,",female
39099,Twelfth Night,Comedy,Olivia,3,1,109,"After the last enchantment you did here,",female
39100,Twelfth Night,Comedy,Olivia,3,1,110,A ring in chase of you: so did I abuse,female
39101,Twelfth Night,Comedy,Olivia,3,1,111,"Myself, my servant and, I fear me, you:",female
39102,Twelfth Night,Comedy,Olivia,3,1,112,"Under your hard construction must I sit,",female
39103,Twelfth Night,Comedy,Olivia,3,1,113,"To force that on you, in a shameful cunning,",female
39104,Twelfth Night,Comedy,Olivia,3,1,114,Which you knew none of yours: what might you think?,female
39105,Twelfth Night,Comedy,Olivia,3,1,115,Have you not set mine honour at the stake,female
39106,Twelfth Night,Comedy,Olivia,3,1,116,And baited it with all the unmuzzled thoughts,female
39107,Twelfth Night,Comedy,Olivia,3,1,117,That tyrannous heart can think? To one of your receiving,female
39108,Twelfth Night,Comedy,Olivia,3,1,118,"Enough is shown: a cypress, not a bosom,",female
39109,Twelfth Night,Comedy,Olivia,3,1,119,"Hideth my heart. So, let me hear you speak.",female
39110,Twelfth Night,Comedy,Viola,3,1,120,I pity you.,female
39111,Twelfth Night,Comedy,Olivia,3,1,121,That's a degree to love.,female
39112,Twelfth Night,Comedy,Viola,3,1,122,"No, not a grize; for 'tis a vulgar proof,",female
39113,Twelfth Night,Comedy,Viola,3,1,123,That very oft we pity enemies.,female
39114,Twelfth Night,Comedy,Olivia,3,1,124,"Why, then, methinks 'tis time to smile again.",female
39115,Twelfth Night,Comedy,Olivia,3,1,125,"O, world, how apt the poor are to be proud!",female
39116,Twelfth Night,Comedy,Olivia,3,1,126,"If one should be a prey, how much the better",female
39117,Twelfth Night,Comedy,Olivia,3,1,127,To fall before the lion than the wolf!,female
39118,Twelfth Night,Comedy,Olivia,3,1,128,The clock upbraids me with the waste of time.,female
39119,Twelfth Night,Comedy,Olivia,3,1,129,"Be not afraid, good youth, I will not have you:",female
39120,Twelfth Night,Comedy,Olivia,3,1,130,"And yet, when wit and youth is come to harvest,",female
39121,Twelfth Night,Comedy,Olivia,3,1,131,Your were is alike to reap a proper man:,female
39122,Twelfth Night,Comedy,Olivia,3,1,132,"There lies your way, due west.",female
39123,Twelfth Night,Comedy,Viola,3,1,133,Then westward-ho! Grace and good disposition,female
39124,Twelfth Night,Comedy,Viola,3,1,134,Attend your ladyship!,female
39125,Twelfth Night,Comedy,Viola,3,1,135,"You'll nothing, madam, to my lord by me?",female
39126,Twelfth Night,Comedy,Olivia,3,1,136,Stay:,female
39127,Twelfth Night,Comedy,Olivia,3,1,137,"I prithee, tell me what thou thinkest of me.",female
39128,Twelfth Night,Comedy,Viola,3,1,138,That you do think you are not what you are.,female
39129,Twelfth Night,Comedy,Olivia,3,1,139,"If I think so, I think the same of you.",female
39130,Twelfth Night,Comedy,Viola,3,1,140,Then think you right: I am not what I am.,female
39131,Twelfth Night,Comedy,Olivia,3,1,141,I would you were as I would have you be!,female
39132,Twelfth Night,Comedy,Viola,3,1,142,"Would it be better, madam, than I am?",female
39133,Twelfth Night,Comedy,Viola,3,1,143,"I wish it might, for now I am your fool.",female
39134,Twelfth Night,Comedy,Olivia,3,1,144,"O, what a deal of scorn looks beautiful",female
39135,Twelfth Night,Comedy,Olivia,3,1,145,In the contempt and anger of his lip!,female
39136,Twelfth Night,Comedy,Olivia,3,1,146,A murderous guilt shows not itself more soon,female
39137,Twelfth Night,Comedy,Olivia,3,1,147,Than love that would seem hid: love's night is noon.,female
39138,Twelfth Night,Comedy,Olivia,3,1,148,"Cesario, by the roses of the spring,",female
39139,Twelfth Night,Comedy,Olivia,3,1,149,"By maidhood, honour, truth and every thing,",female
39140,Twelfth Night,Comedy,Olivia,3,1,150,"I love thee so, that, maugre all thy pride,",female
39141,Twelfth Night,Comedy,Olivia,3,1,151,Nor wit nor reason can my passion hide.,female
39142,Twelfth Night,Comedy,Olivia,3,1,152,"Do not extort thy reasons from this clause,",female
39143,Twelfth Night,Comedy,Olivia,3,1,153,"For that I woo, thou therefore hast no cause,",female
39144,Twelfth Night,Comedy,Olivia,3,1,154,"But rather reason thus with reason fetter,",female
39145,Twelfth Night,Comedy,Olivia,3,1,155,"Love sought is good, but given unsought better.",female
39146,Twelfth Night,Comedy,Viola,3,1,156,"By innocence I swear, and by my youth",female
39147,Twelfth Night,Comedy,Viola,3,1,157,"I have one heart, one bosom and one truth,",female
39148,Twelfth Night,Comedy,Viola,3,1,158,And that no woman has; nor never none,female
39149,Twelfth Night,Comedy,Viola,3,1,159,"Shall mistress be of it, save I alone.",female
39150,Twelfth Night,Comedy,Viola,3,1,160,"And so adieu, good madam: never more",female
39151,Twelfth Night,Comedy,Viola,3,1,161,Will I my master's tears to you deplore.,female
39152,Twelfth Night,Comedy,Olivia,3,1,162,Yet come again; for thou perhaps mayst move,female
39153,Twelfth Night,Comedy,Olivia,3,1,163,"That heart, which now abhors, to like his love.",female
39154,Twelfth Night,Comedy,Sir Andrew,3,2,1,"No, faith, I'll not stay a jot longer.",male
39155,Twelfth Night,Comedy,Sir Toby Belch,3,2,2,"Thy reason, dear venom, give thy reason.",male
39156,Twelfth Night,Comedy,Fabian,3,2,3,"You must needs yield your reason, Sir Andrew.",male
39157,Twelfth Night,Comedy,Sir Andrew,3,2,4,"Marry, I saw your niece do more favours to the",male
39158,Twelfth Night,Comedy,Sir Andrew,3,2,5,count's serving-man than ever she bestowed upon me;,male
39159,Twelfth Night,Comedy,Sir Andrew,3,2,6,I saw't i' the orchard.,male
39160,Twelfth Night,Comedy,Sir Toby Belch,3,2,7,"Did she see thee the while, old boy? tell me that.",male
39161,Twelfth Night,Comedy,Sir Andrew,3,2,8,As plain as I see you now.,male
39162,Twelfth Night,Comedy,Fabian,3,2,9,This was a great argument of love in her toward you.,male
39163,Twelfth Night,Comedy,Sir Andrew,3,2,10,"'Slight, will you make an ass o' me?",male
39164,Twelfth Night,Comedy,Fabian,3,2,11,"I will prove it legitimate, sir, upon the oaths of",male
39165,Twelfth Night,Comedy,Fabian,3,2,12,judgment and reason.,male
39166,Twelfth Night,Comedy,Sir Toby Belch,3,2,13,And they have been grand-jury-men since before Noah,male
39167,Twelfth Night,Comedy,Sir Toby Belch,3,2,14,was a sailor.,male
39168,Twelfth Night,Comedy,Fabian,3,2,15,She did show favour to the youth in your sight only,male
39169,Twelfth Night,Comedy,Fabian,3,2,16,"to exasperate you, to awake your dormouse valour, to",male
39170,Twelfth Night,Comedy,Fabian,3,2,17,put fire in your heart and brimstone in your liver.,male
39171,Twelfth Night,Comedy,Fabian,3,2,18,You should then have accosted her; and with some,male
39172,Twelfth Night,Comedy,Fabian,3,2,19,"excellent jests, fire-new from the mint, you should",male
39173,Twelfth Night,Comedy,Fabian,3,2,20,have banged the youth into dumbness. This was,male
39174,Twelfth Night,Comedy,Fabian,3,2,21,"looked for at your hand, and this was balked: the",male
39175,Twelfth Night,Comedy,Fabian,3,2,22,double gilt of this opportunity you let time wash,male
39176,Twelfth Night,Comedy,Fabian,3,2,23,"off, and you are now sailed into the north of my",male
39177,Twelfth Night,Comedy,Fabian,3,2,24,lady's opinion; where you will hang like an icicle,male
39178,Twelfth Night,Comedy,Fabian,3,2,25,"on a Dutchman's beard, unless you do redeem it by",male
39179,Twelfth Night,Comedy,Fabian,3,2,26,some laudable attempt either of valour or policy.,male
39180,Twelfth Night,Comedy,Sir Andrew,3,2,27,"An't be any way, it must be with valour; for policy",male
39181,Twelfth Night,Comedy,Sir Andrew,3,2,28,I hate: I had as lief be a Brownist as a,male
39182,Twelfth Night,Comedy,Sir Andrew,3,2,29,politician.,male
39183,Twelfth Night,Comedy,Sir Toby Belch,3,2,30,"Why, then, build me thy fortunes upon the basis of",male
39184,Twelfth Night,Comedy,Sir Toby Belch,3,2,31,valour. Challenge me the count's youth to fight,male
39185,Twelfth Night,Comedy,Sir Toby Belch,3,2,32,with him; hurt him in eleven places: my niece shall,male
39186,Twelfth Night,Comedy,Sir Toby Belch,3,2,33,"take note of it; and assure thyself, there is no",male
39187,Twelfth Night,Comedy,Sir Toby Belch,3,2,34,love-broker in the world can more prevail in man's,male
39188,Twelfth Night,Comedy,Sir Toby Belch,3,2,35,commendation with woman than report of valour.,male
39189,Twelfth Night,Comedy,Fabian,3,2,36,"There is no way but this, Sir Andrew.",male
39190,Twelfth Night,Comedy,Sir Andrew,3,2,37,Will either of you bear me a challenge to him?,male
39191,Twelfth Night,Comedy,Sir Toby Belch,3,2,38,"Go, write it in a martial hand; be curst and brief;",male
39192,Twelfth Night,Comedy,Sir Toby Belch,3,2,39,"it is no matter how witty, so it be eloquent and fun",male
39193,Twelfth Night,Comedy,Sir Toby Belch,3,2,40,of invention: taunt him with the licence of ink:,male
39194,Twelfth Night,Comedy,Sir Toby Belch,3,2,41,"if thou thou'st him some thrice, it shall not be",male
39195,Twelfth Night,Comedy,Sir Toby Belch,3,2,42,amiss; and as many lies as will lie in thy sheet of,male
39196,Twelfth Night,Comedy,Sir Toby Belch,3,2,43,"paper, although the sheet were big enough for the",male
39197,Twelfth Night,Comedy,Sir Toby Belch,3,2,44,"bed of Ware in England, set 'em down: go, about it.",male
39198,Twelfth Night,Comedy,Sir Toby Belch,3,2,45,"Let there be gall enough in thy ink, though thou",male
39199,Twelfth Night,Comedy,Sir Toby Belch,3,2,46,"write with a goose-pen, no matter: about it.",male
39200,Twelfth Night,Comedy,Sir Andrew,3,2,47,Where shall I find you?,male
39201,Twelfth Night,Comedy,Sir Toby Belch,3,2,48,We'll call thee at the cubiculo: go.,male
39202,Twelfth Night,Comedy,Fabian,3,2,49,"This is a dear manikin to you, Sir Toby.",male
39203,Twelfth Night,Comedy,Sir Toby Belch,3,2,50,"I have been dear to him, lad, some two thousand",male
39204,Twelfth Night,Comedy,Sir Toby Belch,3,2,51,"strong, or so.",male
39205,Twelfth Night,Comedy,Fabian,3,2,52,We shall have a rare letter from him: but you'll,male
39206,Twelfth Night,Comedy,Fabian,3,2,53,not deliver't?,male
39207,Twelfth Night,Comedy,Sir Toby Belch,3,2,54,"Never trust me, then; and by all means stir on the",male
39208,Twelfth Night,Comedy,Sir Toby Belch,3,2,55,youth to an answer. I think oxen and wainropes,male
39209,Twelfth Night,Comedy,Sir Toby Belch,3,2,56,"cannot hale them together. For Andrew, if he were",male
39210,Twelfth Night,Comedy,Sir Toby Belch,3,2,57,"opened, and you find so much blood in his liver as",male
39211,Twelfth Night,Comedy,Sir Toby Belch,3,2,58,"will clog the foot of a flea, I'll eat the rest of",male
39212,Twelfth Night,Comedy,Sir Toby Belch,3,2,59,the anatomy.,male
39213,Twelfth Night,Comedy,Fabian,3,2,60,"And his opposite, the youth, bears in his visage no",male
39214,Twelfth Night,Comedy,Fabian,3,2,61,great presage of cruelty.,male
39215,Twelfth Night,Comedy,Sir Toby Belch,3,2,62,"Look, where the youngest wren of nine comes.",male
39216,Twelfth Night,Comedy,Maria,3,2,63,"If you desire the spleen, and will laugh yourself",female
39217,Twelfth Night,Comedy,Maria,3,2,64,"into stitches, follow me. Yond gull Malvolio is",female
39218,Twelfth Night,Comedy,Maria,3,2,65,"turned heathen, a very renegado; for there is no",female
39219,Twelfth Night,Comedy,Maria,3,2,66,"Christian, that means to be saved by believing",female
39220,Twelfth Night,Comedy,Maria,3,2,67,"rightly, can ever believe such impossible passages",female
39221,Twelfth Night,Comedy,Maria,3,2,68,of grossness. He's in yellow stockings.,female
39222,Twelfth Night,Comedy,Sir Toby Belch,3,2,69,And cross-gartered?,male
39223,Twelfth Night,Comedy,Maria,3,2,70,Most villanously; like a pedant that keeps a school,female
39224,Twelfth Night,Comedy,Maria,3,2,71,"i' the church. I have dogged him, like his",female
39225,Twelfth Night,Comedy,Maria,3,2,72,murderer. He does obey every point of the letter,female
39226,Twelfth Night,Comedy,Maria,3,2,73,that I dropped to betray him: he does smile his,female
39227,Twelfth Night,Comedy,Maria,3,2,74,face into more lines than is in the new map with the,female
39228,Twelfth Night,Comedy,Maria,3,2,75,augmentation of the Indies: you have not seen such,female
39229,Twelfth Night,Comedy,Maria,3,2,76,a thing as 'tis. I can hardly forbear hurling things,female
39230,Twelfth Night,Comedy,Maria,3,2,77,"at him. I know my lady will strike him: if she do,",female
39231,Twelfth Night,Comedy,Maria,3,2,78,he'll smile and take't for a great favour.,female
39232,Twelfth Night,Comedy,Sir Toby Belch,3,2,79,"Come, bring us, bring us where he is.",male
39233,Twelfth Night,Comedy,Sebastian,3,3,1,I would not by my will have troubled you;,male
39234,Twelfth Night,Comedy,Sebastian,3,3,2,"But, since you make your pleasure of your pains,",male
39235,Twelfth Night,Comedy,Sebastian,3,3,3,I will no further chide you.,male
39236,Twelfth Night,Comedy,Antonio,3,3,4,"I could not stay behind you: my desire,",male
39237,Twelfth Night,Comedy,Antonio,3,3,5,"More sharp than filed steel, did spur me forth;",male
39238,Twelfth Night,Comedy,Antonio,3,3,6,"And not all love to see you, though so much",male
39239,Twelfth Night,Comedy,Antonio,3,3,7,"As might have drawn one to a longer voyage,",male
39240,Twelfth Night,Comedy,Antonio,3,3,8,"But jealousy what might befall your travel,",male
39241,Twelfth Night,Comedy,Antonio,3,3,9,"Being skilless in these parts; which to a stranger,",male
39242,Twelfth Night,Comedy,Antonio,3,3,10,"Unguided and unfriended, often prove",male
39243,Twelfth Night,Comedy,Antonio,3,3,11,"Rough and unhospitable: my willing love,",male
39244,Twelfth Night,Comedy,Antonio,3,3,12,"The rather by these arguments of fear,",male
39245,Twelfth Night,Comedy,Antonio,3,3,13,Set forth in your pursuit.,male
39246,Twelfth Night,Comedy,Sebastian,3,3,14,"My kind Antonio,",male
39247,Twelfth Night,Comedy,Sebastian,3,3,15,"I can no other answer make but thanks,",male
39248,Twelfth Night,Comedy,Sebastian,3,3,16,And thanks; and ever [         ] oft good turns,male
